"0500000US56007","Carbon County, Wyoming","007","2017","44719","Other gasoline stations","3","143","3050","56","007",
"0500000US56007","Carbon County, Wyoming","007","2017","447190","Other gasoline stations","3","143","3050","56","007",
"0500000US56007","Carbon County, Wyoming","007","2017","448","Clothing and clothing accessories stores","4","4","152","56","007",
"0500000US56007","Carbon County, Wyoming","007","2017","4481","Clothing stores","4","4","152","56","007",
"0500000US56007","Carbon County, Wyoming","007","2017","44814","Family clothing stores","3","3","144","56","007",
"0500000US56007","Carbon County, Wyoming","007","2017","448140","Family clothing stores","3","3","144","56","007",
"0500000US56007","Carbon County, Wyoming","007","2017","452","General merchandise stores","6","177","4554","56","007",
"0500000US56007","Carbon County, Wyoming","007","2017","4523","General merchandise stores, including warehouse clubs and supercenters","6","177","4554","56","007",
"0500000US56007","Carbon County, Wyoming","007","2017","45231","General merchandise stores, including warehouse clubs and supercenters","6","177","4554","56","007",
"0500000US56007","Carbon County, Wyoming","007","2017","452319","All other general merchandise stores","5","33","708","56","007",
"0500000US56007","Carbon County, Wyoming","007","2017","453","Miscellaneous store retailers","6","14","192","56","007",
"0500000US56007","Carbon County, Wyoming","007","2017","4532","Office supplies, stationery, and gift stores","3","5","64","56","007",
"0500000US56007","Carbon County, Wyoming","007","2017","45322","Gift, novelty, and souvenir stores","3","5","64","56","007",
"0500000US56007","Carbon County, Wyoming","007","2017","453220","Gift, novelty, and souvenir stores","3","5","64","56","007",
"0500000US56007","Carbon County, Wyoming","007","2017","454","Nonstore retailers","8","17","473","56","007",
"0500000US56007","Carbon County, Wyoming","007","2017","4543","Direct selling establishments","6","15","465","56","007",
"0500000US56007","Carbon County, Wyoming","007","2017","45439","Other direct selling establishments","4","7","96","56","007",
"0500000US56007","Carbon County, Wyoming","007","2017","454390","Other direct selling establishments","4","7","96","56","007",
"0500000US56007","Carbon County, Wyoming","007","2017","48-49","Transportation and warehousing","34","158","8753","56","007",
"0500000US56007","Carbon County, Wyoming","007","2017","484","Truck transportation","23","78","3065","56","007",
"0500000US56007","Carbon County, Wyoming","007","2017","4841","General freight trucking","8","20","1038","56","007",
"0500000US56007","Carbon County, Wyoming","007","2017","48411","General freight trucking, local","4","13","661","56","007",
"0500000US56007","Carbon County, Wyoming","007","2017","484110","General freight trucking, local","4","13","661","56","007",
"0500000US56007","Carbon County, Wyoming","007","2017","48412","General freight trucking, long-distance","4","7","377","56","007",
"0500000US56007","Carbon County, Wyoming","007","2017","4842","Specialized freight trucking","15","58","2027","56","007",
"0500000US56007","Carbon County, Wyoming","007","2017","48422","Specialized freight (except used goods) trucking, local","14","56","2013","56","007",
"0500000US56007","Carbon County, Wyoming","007","2017","484220","Specialized freight (except used goods) trucking, local","14","56","2013","56","007",
"0500000US56007","Carbon County, Wyoming","007","2017","486","Pipeline transportation","7","43","4392","56","007",
"0500000US56007","Carbon County, Wyoming","007","2017","4862","Pipeline transportation of natural gas","5","34","3577","56","007",
"0500000US56007","Carbon County, Wyoming","007","2017","48621","Pipeline transportation of natural gas","5","34","3577","56","007",
"0500000US56007","Carbon County, Wyoming","007","2017","486210","Pipeline transportation of natural gas","5","34","3577","56","007",
"0500000US56007","Carbon County, Wyoming","007","2017","51","Information","10","62","1762","56","007",
"0500000US56007","Carbon County, Wyoming","007","2017","517","Telecommunications","5","21","1050","56","007",
"0500000US56007","Carbon County, Wyoming","007","2017","5173","Wired and wireless telecommunications carriers","5","21","1050","56","007",
"0500000US56007","Carbon County, Wyoming","007","2017","51731","Wired and wireless telecommunications carriers","5","21","1050","56","007",
"0500000US56007","Carbon County, Wyoming","007","2017","517312","Wireless telecommunications carriers (except satellite)","3","0","0","56","007",
"0500000US56007","Carbon County, Wyoming","007","2017","52","Finance and insurance","24","169","9062","56","007",
"0500000US56007","Carbon County, Wyoming","007","2017","522","Credit intermediation and related activities","9","97","4370","56","007",
"0500000US56007","Carbon County, Wyoming","007","2017","5221","Depository credit intermediation","8","94","4332","56","007",
"0500000US56007","Carbon County, Wyoming","007","2017","52211","Commercial banking","7","82","3645","56","007",
"0500000US56007","Carbon County, Wyoming","007","2017","522110","Commercial banking","7","82","3645","56","007",
"0500000US56007","Carbon County, Wyoming","007","2017","523","Securities, commodity contracts, and other financial investments and related activities","5","0","0","56","007",
"0500000US56007","Carbon County, Wyoming","007","2017","5239","Other financial investment activities","5","0","0","56","007",
"0500000US56007","Carbon County, Wyoming","007","2017","52392","Portfolio management","5","0","0","56","007",
"0500000US56007","Carbon County, Wyoming","007","2017","523920","Portfolio management","5","0","0","56","007",
"0500000US56007","Carbon County, Wyoming","007","2017","524","Insurance carriers and related activities","10","20","778","56","007",
"0500000US56007","Carbon County, Wyoming","007","2017","5242","Agencies, brokerages, and other insurance related activities","9","17","638","56","007",
"0500000US56007","Carbon County, Wyoming","007","2017","52421","Insurance agencies and brokerages","9","17","638","56","007",
"0500000US56007","Carbon County, Wyoming","007","2017","524210","Insurance agencies and brokerages","9","17","638","56","007",
"0500000US56007","Carbon County, Wyoming","007","2017","53","Real estate and rental and leasing","31","118","5000","56","007",
"0500000US56007","Carbon County, Wyoming","007","2017","531","Real estate","27","53","1071","56","007",
"0500000US56007","Carbon County, Wyoming","007","2017","5311","Lessors of real estate","18","37","622","56","007",
"0500000US56007","Carbon County, Wyoming","007","2017","53111","Lessors of residential buildings and dwellings","8","20","449","56","007",
"0500000US56007","Carbon County, Wyoming","007","2017","531110","Lessors of residential buildings and dwellings","8","20","449","56","007",
"0500000US56007","Carbon County, Wyoming","007","2017","53119","Lessors of other real estate property","7","0","0","56","007",
"0500000US56007","Carbon County, Wyoming","007","2017","531190","Lessors of other real estate property","7","0","0","56","007",
"0500000US56007","Carbon County, Wyoming","007","2017","5312","Offices of real estate agents and brokers","9","16","449","56","007",
"0500000US56007","Carbon County, Wyoming","007","2017","53121","Offices of real estate agents and brokers","9","16","449","56","007",
"0500000US56007","Carbon County, Wyoming","007","2017","531210","Offices of real estate agents and brokers","9","16","449","56","007",
"0500000US56007","Carbon County, Wyoming","007","2017","532","Rental and leasing services","4","65","3929","56","007",
"0500000US56007","Carbon County, Wyoming","007","2017","5324","Commercial and industrial machinery and equipment rental and leasing","3","62","3807","56","007",
"0500000US56007","Carbon County, Wyoming","007","2017","54","Professional, scientific, and technical services","36","82","3353","56","007",
"0500000US56007","Carbon County, Wyoming","007","2017","541","Professional, scientific, and technical services","36","82","3353","56","007",
"0500000US56007","Carbon County, Wyoming","007","2017","5411","Legal services","10","14","753","56","007",
"0500000US56007","Carbon County, Wyoming","007","2017","54111","Offices of lawyers","10","14","753","56","007",
"0500000US56007","Carbon County, Wyoming","007","2017","541110","Offices of lawyers","10","14","753","56","007",
"0500000US56007","Carbon County, Wyoming","007","2017","5412","Accounting, tax preparation, bookkeeping, and payroll services","5","22","357","56","007",
"0500000US56007","Carbon County, Wyoming","007","2017","54121","Accounting, tax preparation, bookkeeping, and payroll services","5","22","357","56","007",
"0500000US56007","Carbon County, Wyoming","007","2017","541211","Offices of certified public accountants","3","8","211","56","007",
"0500000US56007","Carbon County, Wyoming","007","2017","5413","Architectural, engineering, and related services","6","11","608","56","007",
"0500000US56007","Carbon County, Wyoming","007","2017","54133","Engineering services","5","10","584","56","007",
"0500000US56007","Carbon County, Wyoming","007","2017","541330","Engineering services","5","10","584","56","007",
"0500000US56007","Carbon County, Wyoming","007","2017","5416","Management, scientific, and technical consulting services","11","22","895","56","007",
"0500000US56007","Carbon County, Wyoming","007","2017","54161","Management consulting services","5","5","154","56","007",
"0500000US56007","Carbon County, Wyoming","007","2017","54162","Environmental consulting services","4","0","0","56","007",
"0500000US56007","Carbon County, Wyoming","007","2017","541620","Environmental consulting services","4","0","0","56","007",
"0500000US56007","Carbon County, Wyoming","007","2017","55","Management of companies and enterprises","3","5","330","56","007",
"0500000US56007","Carbon County, Wyoming","007","2017","551","Management of companies and enterprises","3","5","330","56","007",
"0500000US56007","Carbon County, Wyoming","007","2017","5511","Management of companies and enterprises","3","5","330","56","007",
"0500000US56007","Carbon County, Wyoming","007","2017","55111","Management of companies and enterprises","3","5","330","56","007",
"0500000US56007","Carbon County, Wyoming","007","2017","56","Administrative and support and waste management and remediation services","19","130","7367","56","007",
"0500000US56007","Carbon County, Wyoming","007","2017","561","Administrative and support services","12","66","2634","56","007",
"0500000US56007","Carbon County, Wyoming","007","2017","5617","Services to buildings and dwellings","9","31","608","56","007",
"0500000US56007","Carbon County, Wyoming","007","2017","56173","Landscaping services","7","6","350","56","007",
"0500000US56007","Carbon County, Wyoming","007","2017","561730","Landscaping services","7","6","350","56","007",
"0500000US56007","Carbon County, Wyoming","007","2017","562","Waste management and remediation services","7","64","4733","56","007",
"0500000US56007","Carbon County, Wyoming","007","2017","5621","Waste collection","5","55","4070","56","007",
"0500000US56007","Carbon County, Wyoming","007","2017","56211","Waste collection","5","55","4070","56","007",
"0500000US56007","Carbon County, Wyoming","007","2017","562111","Solid waste collection","4","23","906","56","007",
"0500000US56007","Carbon County, Wyoming","007","2017","62","Health care and social assistance","43","602","22764","56","007",
"0500000US56007","Carbon County, Wyoming","007","2017","621","Ambulatory health care services","19","159","6472","56","007",
"0500000US56007","Carbon County, Wyoming","007","2017","6211","Offices of physicians","3","0","0","56","007",
"0500000US56007","Carbon County, Wyoming","007","2017","62111","Offices of physicians","3","0","0","56","007",
"0500000US56007","Carbon County, Wyoming","007","2017","621111","Offices of physicians (except mental health specialists)","3","0","0","56","007",
"0500000US56007","Carbon County, Wyoming","007","2017","6212","Offices of dentists","5","22","857","56","007",
"0500000US56007","Carbon County, Wyoming","007","2017","62121","Offices of dentists","5","22","857","56","007",
"0500000US56007","Carbon County, Wyoming","007","2017","621210","Offices of dentists","5","22","857","56","007",
"0500000US56007","Carbon County, Wyoming","007","2017","6213","Offices of other health practitioners","5","23","1078","56","007",
"0500000US56007","Carbon County, Wyoming","007","2017","6214","Outpatient care centers","3","44","3246","56","007",
"0500000US56007","Carbon County, Wyoming","007","2017","62149","Other outpatient care centers","3","44","3246","56","007",
"0500000US56007","Carbon County, Wyoming","007","2017","621498","All other outpatient care centers","3","44","3246","56","007",
"0500000US56007","Carbon County, Wyoming","007","2017","624","Social assistance","21","154","2115","56","007",
"0500000US56007","Carbon County, Wyoming","007","2017","6242","Community food and housing, and emergency and other relief services","9","0","0","56","007",
"0500000US56007","Carbon County, Wyoming","007","2017","62421","Community food services","8","0","0","56","007",
"0500000US56007","Carbon County, Wyoming","007","2017","624210","Community food services","8","0","0","56","007",
"0500000US56007","Carbon County, Wyoming","007","2017","6244","Child day care services","10","103","1331","56","007",
"0500000US56007","Carbon County, Wyoming","007","2017","62441","Child day care services","10","103","1331","56","007",
"0500000US56007","Carbon County, Wyoming","007","2017","624410","Child day care services","10","103","1331","56","007",
"0500000US56007","Carbon County, Wyoming","007","2017","71","Arts, entertainment, and recreation","17","40","2385","56","007",
"0500000US56007","Carbon County, Wyoming","007","2017","711","Performing arts, spectator sports, and related industries","5","10","529","56","007",
"0500000US56007","Carbon County, Wyoming","007","2017","7115","Independent artists, writers, and performers","5","10","529","56","007",
"0500000US56007","Carbon County, Wyoming","007","2017","71151","Independent artists, writers, and performers","5","10","529","56","007",
"0500000US56007","Carbon County, Wyoming","007","2017","711510","Independent artists, writers, and performers","5","10","529","56","007",
"0500000US56007","Carbon County, Wyoming","007","2017","712","Museums, historical sites, and similar institutions","3","4","90","56","007",
"0500000US56007","Carbon County, Wyoming","007","2017","7121","Museums, historical sites, and similar institutions","3","4","90","56","007",
"0500000US56007","Carbon County, Wyoming","007","2017","71211","Museums","3","4","90","56","007",
"0500000US56007","Carbon County, Wyoming","007","2017","712110","Museums","3","4","90","56","007",
"0500000US56007","Carbon County, Wyoming","007","2017","713","Amusement, gambling, and recreation industries","9","26","1766","56","007",
"0500000US56007","Carbon County, Wyoming","007","2017","7139","Other amusement and recreation industries","9","26","1766","56","007",
"0500000US56007","Carbon County, Wyoming","007","2017","71399","All other amusement and recreation industries","8","8","189","56","007",
"0500000US56007","Carbon County, Wyoming","007","2017","713990","All other amusement and recreation industries","8","8","189","56","007",
"0500000US56007","Carbon County, Wyoming","007","2017","72","Accommodation and food services","81","845","19594","56","007",
"0500000US56007","Carbon County, Wyoming","007","2017","721","Accommodation","30","395","12599","56","007",
"0500000US56007","Carbon County, Wyoming","007","2017","7211","Traveler accommodation","27","381","10908","56","007",
"0500000US56007","Carbon County, Wyoming","007","2017","72111","Hotels (except casino hotels) and motels","25","376","10875","56","007",
"0500000US56007","Carbon County, Wyoming","007","2017","721110","Hotels (except casino hotels) and motels","25","376","10875","56","007",
"0500000US56007","Carbon County, Wyoming","007","2017","7212","RV (recreational vehicle) parks and recreational camps","3","0","0","56","007",
"0500000US56007","Carbon County, Wyoming","007","2017","72121","RV (recreational vehicle) parks and recreational camps","3","0","0","56","007",
"0500000US56007","Carbon County, Wyoming","007","2017","722","Food services and drinking places","51","450","6995","56","007",
"0500000US56007","Carbon County, Wyoming","007","2017","7224","Drinking places (alcoholic beverages)","9","33","369","56","007",
"0500000US56007","Carbon County, Wyoming","007","2017","72241","Drinking places (alcoholic beverages)","9","33","369","56","007",
"0500000US56007","Carbon County, Wyoming","007","2017","722410","Drinking places (alcoholic beverages)","9","33","369","56","007",
"0500000US56007","Carbon County, Wyoming","007","2017","7225","Restaurants and other eating places","42","417","6626","56","007",
"0500000US56007","Carbon County, Wyoming","007","2017","72251","Restaurants and other eating places","42","417","6626","56","007",
"0500000US56007","Carbon County, Wyoming","007","2017","722511","Full-service restaurants","30","273","4374","56","007",
"0500000US56007","Carbon County, Wyoming","007","2017","722513","Limited-service restaurants","9","135","2150","56","007",
"0500000US56007","Carbon County, Wyoming","007","2017","722515","Snack and nonalcoholic beverage bars","3","9","102","56","007",
"0500000US56007","Carbon County, Wyoming","007","2017","81","Other services (except public administration)","42","161","4643","56","007",
"0500000US56007","Carbon County, Wyoming","007","2017","811","Repair and maintenance","16","84","3428","56","007",
"0500000US56007","Carbon County, Wyoming","007","2017","8111","Automotive repair and maintenance","12","61","2190","56","007",
"0500000US56007","Carbon County, Wyoming","007","2017","81111","Automotive mechanical and electrical repair and maintenance","7","47","1718","56","007",
"0500000US56007","Carbon County, Wyoming","007","2017","811111","General automotive repair","6","35","1288","56","007",
"0500000US56007","Carbon County, Wyoming","007","2017","81112","Automotive body, paint, interior, and glass repair","4","11","446","56","007",
"0500000US56007","Carbon County, Wyoming","007","2017","811121","Automotive body, paint, and interior repair and maintenance","3","11","442","56","007",
"0500000US56007","Carbon County, Wyoming","007","2017","8113","Commercial and industrial machinery and equipment (except automotive and electronic) repair and maintenance","3","0","0","56","007",
"0500000US56007","Carbon County, Wyoming","007","2017","81131","Commercial and industrial machinery and equipment (except automotive and electronic) repair and maintenance","3","0","0","56","007",
"0500000US56007","Carbon County, Wyoming","007","2017","811310","Commercial and industrial machinery and equipment (except automotive and electronic) repair and maintenance","3","0","0","56","007",
"0500000US56007","Carbon County, Wyoming","007","2017","812","Personal and laundry services","4","11","103","56","007",
"0500000US56007","Carbon County, Wyoming","007","2017","813","Religious, grantmaking, civic, professional, and similar organizations","22","66","1112","56","007",
"0500000US56007","Carbon County, Wyoming","007","2017","8131","Religious organizations","10","29","472","56","007",
"0500000US56007","Carbon County, Wyoming","007","2017","81311","Religious organizations","10","29","472","56","007",
"0500000US56007","Carbon County, Wyoming","007","2017","813110","Religious organizations","10","29","472","56","007",
"0500000US56007","Carbon County, Wyoming","007","2017","8134","Civic and social organizations","5","20","127","56","007",
"0500000US56007","Carbon County, Wyoming","007","2017","81341","Civic and social organizations","5","20","127","56","007",
"0500000US56007","Carbon County, Wyoming","007","2017","813410","Civic and social organizations","5","20","127","56","007",
"0500000US56007","Carbon County, Wyoming","007","2017","8139","Business, professional, labor, political, and similar organizations","4","7","96","56","007",
"0500000US56015","Goshen County, Wyoming","015","2017","00","Total for all sectors","334","2876","95432","56","015",
"0500000US56015","Goshen County, Wyoming","015","2017","11","Agriculture, forestry, fishing and hunting","4","11","482","56","015",
"0500000US56015","Goshen County, Wyoming","015","2017","115","Support activities for agriculture and forestry","4","11","482","56","015",
"0500000US56015","Goshen County, Wyoming","015","2017","1152","Support activities for animal production","3","9","293","56","015",
"0500000US56015","Goshen County, Wyoming","015","2017","11521","Support activities for animal production","3","9","293","56","015",
"0500000US56015","Goshen County, Wyoming","015","2017","115210","Support activities for animal production","3","9","293","56","015",
"0500000US56015","Goshen County, Wyoming","015","2017","22","Utilities","3","0","0","56","015",
"0500000US56015","Goshen County, Wyoming","015","2017","221","Utilities","3","0","0","56","015",
"0500000US56015","Goshen County, Wyoming","015","2017","23","Construction","44","197","9046","56","015",
"0500000US56015","Goshen County, Wyoming","015","2017","236","Construction of buildings","13","38","1289","56","015",
"0500000US56015","Goshen County, Wyoming","015","2017","2361","Residential building construction","10","30","1025","56","015",
"0500000US56015","Goshen County, Wyoming","015","2017","23611","Residential building construction","10","30","1025","56","015",
"0500000US56015","Goshen County, Wyoming","015","2017","236115","New single-family housing construction (except for-sale builders)","5","25","870","56","015",
"0500000US56015","Goshen County, Wyoming","015","2017","236118","Residential remodelers","3","4","140","56","015",
"0500000US56015","Goshen County, Wyoming","015","2017","2362","Nonresidential building construction","3","8","264","56","015",
"0500000US56015","Goshen County, Wyoming","015","2017","23622","Commercial and institutional building construction","3","8","264","56","015",
"0500000US56015","Goshen County, Wyoming","015","2017","236220","Commercial and institutional building construction","3","8","264","56","015",
"0500000US56015","Goshen County, Wyoming","015","2017","238","Specialty trade contractors","29","159","7732","56","015",
"0500000US56015","Goshen County, Wyoming","015","2017","2381","Foundation, structure, and building exterior contractors","7","11","644","56","015",
"0500000US56015","Goshen County, Wyoming","015","2017","23816","Roofing contractors","3","0","0","56","015",
"0500000US56015","Goshen County, Wyoming","015","2017","238160","Roofing contractors","3","0","0","56","015",
"0500000US56015","Goshen County, Wyoming","015","2017","2382","Building equipment contractors","11","121","5879","56","015",
"0500000US56015","Goshen County, Wyoming","015","2017","23821","Electrical contractors and other wiring installation contractors","5","20","421","56","015",
"0500000US56015","Goshen County, Wyoming","015","2017","238210","Electrical contractors and other wiring installation contractors","5","20","421","56","015",
"0500000US56015","Goshen County, Wyoming","015","2017","23822","Plumbing, heating, and air-conditioning contractors","6","101","5458","56","015",
"0500000US56015","Goshen County, Wyoming","015","2017","238220","Plumbing, heating, and air-conditioning contractors","6","101","5458","56","015",
"0500000US56015","Goshen County, Wyoming","015","2017","2389","Other specialty trade contractors","9","23","994","56","015",
"0500000US56015","Goshen County, Wyoming","015","2017","23891","Site preparation contractors","6","20","887","56","015",
"0500000US56015","Goshen County, Wyoming","015","2017","238910","Site preparation contractors","6","20","887","56","015",
"0500000US56015","Goshen County, Wyoming","015","2017","23899","All other specialty trade contractors","3","0","0","56","015",
"0500000US56015","Goshen County, Wyoming","015","2017","238990","All other specialty trade contractors","3","0","0","56","015",
"0500000US56015","Goshen County, Wyoming","015","2017","31-33","Manufacturing","7","273","9593","56","015",
"0500000US56015","Goshen County, Wyoming","015","2017","42","Wholesale trade","22","209","8179","56","015",
"0500000US56015","Goshen County, Wyoming","015","2017","423","Merchant wholesalers, durable goods","7","60","2694","56","015",
"0500000US56015","Goshen County, Wyoming","015","2017","4238","Machinery, equipment, and supplies merchant wholesalers","4","40","2089","56","015",
"0500000US56015","Goshen County, Wyoming","015","2017","42382","Farm and garden machinery and equipment merchant wholesalers","4","40","2089","56","015",
"0500000US56015","Goshen County, Wyoming","015","2017","423820","Farm and garden machinery and equipment merchant wholesalers","4","40","2089","56","015",
"0500000US56015","Goshen County, Wyoming","015","2017","424","Merchant wholesalers, nondurable goods","14","84","3561","56","015",
"0500000US56015","Goshen County, Wyoming","015","2017","4244","Grocery and related product merchant wholesalers","3","22","697","56","015",
"0500000US56015","Goshen County, Wyoming","015","2017","4249","Miscellaneous nondurable goods merchant wholesalers","6","45","2149","56","015",
"0500000US56015","Goshen County, Wyoming","015","2017","42491","Farm supplies merchant wholesalers","5","44","2142","56","015",
"0500000US56015","Goshen County, Wyoming","015","2017","424910","Farm supplies merchant wholesalers","5","44","2142","56","015",
"0500000US56015","Goshen County, Wyoming","015","2017","44-45","Retail trade","42","382","9292","56","015",
"0500000US56015","Goshen County, Wyoming","015","2017","441","Motor vehicle and parts dealers","7","42","1296","56","015",
"0500000US56015","Goshen County, Wyoming","015","2017","4411","Automobile dealers","4","0","0","56","015",
