"0500000US56037","Sweetwater County, Wyoming","037","2017","3327","Machine shops; turned product; and screw, nut, and bolt manufacturing","4","0","0","56","037",
"0500000US56037","Sweetwater County, Wyoming","037","2017","33271","Machine shops","4","0","0","56","037",
"0500000US56037","Sweetwater County, Wyoming","037","2017","332710","Machine shops","4","0","0","56","037",
"0500000US56037","Sweetwater County, Wyoming","037","2017","333","Machinery manufacturing","4","0","0","56","037",
"0500000US56037","Sweetwater County, Wyoming","037","2017","339","Miscellaneous manufacturing","4","20","972","56","037",
"0500000US56037","Sweetwater County, Wyoming","037","2017","3399","Other miscellaneous manufacturing","3","18","880","56","037",
"0500000US56037","Sweetwater County, Wyoming","037","2017","42","Wholesale trade","77","616","41516","56","037",
"0500000US56037","Sweetwater County, Wyoming","037","2017","423","Merchant wholesalers, durable goods","55","358","28653","56","037",
"0500000US56037","Sweetwater County, Wyoming","037","2017","4231","Motor vehicle and motor vehicle parts and supplies merchant wholesalers","4","38","2806","56","037",
"0500000US56037","Sweetwater County, Wyoming","037","2017","42312","Motor vehicle supplies and new parts merchant wholesalers","3","25","1572","56","037",
"0500000US56037","Sweetwater County, Wyoming","037","2017","423120","Motor vehicle supplies and new parts merchant wholesalers","3","25","1572","56","037",
"0500000US56037","Sweetwater County, Wyoming","037","2017","4236","Household appliances and electrical and electronic goods merchant wholesalers","4","20","1700","56","037",
"0500000US56037","Sweetwater County, Wyoming","037","2017","42361","Electrical apparatus and equipment, wiring supplies, and related equipment merchant wholesalers","4","20","1700","56","037",
"0500000US56037","Sweetwater County, Wyoming","037","2017","423610","Electrical apparatus and equipment, wiring supplies, and related equipment merchant wholesalers","4","20","1700","56","037",
"0500000US56037","Sweetwater County, Wyoming","037","2017","54192","Photographic services","3","3","20","56","037",
"0500000US56037","Sweetwater County, Wyoming","037","2017","541921","Photography studios, portrait","3","3","20","56","037",
"0500000US56037","Sweetwater County, Wyoming","037","2017","54194","Veterinary services","4","47","1546","56","037",
"0500000US56037","Sweetwater County, Wyoming","037","2017","541940","Veterinary services","4","47","1546","56","037",
"0500000US56037","Sweetwater County, Wyoming","037","2017","54199","All other professional, scientific, and technical services","5","4","197","56","037",
"0500000US56037","Sweetwater County, Wyoming","037","2017","541990","All other professional, scientific, and technical services","5","4","197","56","037",
"0500000US56037","Sweetwater County, Wyoming","037","2017","55","Management of companies and enterprises","9","164","19473","56","037",
"0500000US56037","Sweetwater County, Wyoming","037","2017","551","Management of companies and enterprises","9","164","19473","56","037",
"0500000US56037","Sweetwater County, Wyoming","037","2017","5511","Management of companies and enterprises","9","164","19473","56","037",
"0500000US56037","Sweetwater County, Wyoming","037","2017","55111","Management of companies and enterprises","9","164","19473","56","037",
"0500000US56037","Sweetwater County, Wyoming","037","2017","551114","Corporate, subsidiary, and regional managing offices","9","164","19473","56","037",
"0500000US56037","Sweetwater County, Wyoming","037","2017","56","Administrative and support and waste management and remediation services","45","342","18281","56","037",
"0500000US56037","Sweetwater County, Wyoming","037","2017","561","Administrative and support services","39","278","14738","56","037",
"0500000US56037","Sweetwater County, Wyoming","037","2017","4237","Hardware, plumbing and heating equipment and supplies merchant wholesalers","4","0","0","56","037",
"0500000US56037","Sweetwater County, Wyoming","037","2017","4238","Machinery, equipment, and supplies merchant wholesalers","35","234","19988","56","037",
"0500000US56037","Sweetwater County, Wyoming","037","2017","42381","Construction and mining (except oil well) machinery and equipment merchant wholesalers","8","84","5926","56","037",
"0500000US56037","Sweetwater County, Wyoming","037","2017","423810","Construction and mining (except oil well) machinery and equipment merchant wholesalers","8","84","5926","56","037",
"0500000US56037","Sweetwater County, Wyoming","037","2017","42383","Industrial machinery and equipment merchant wholesalers","20","119","12409","56","037",
"0500000US56037","Sweetwater County, Wyoming","037","2017","423830","Industrial machinery and equipment merchant wholesalers","20","119","12409","56","037",
"0500000US56037","Sweetwater County, Wyoming","037","2017","42384","Industrial supplies merchant wholesalers","7","31","1653","56","037",
"0500000US56037","Sweetwater County, Wyoming","037","2017","423840","Industrial supplies merchant wholesalers","7","31","1653","56","037",
"0500000US56037","Sweetwater County, Wyoming","037","2017","4239","Miscellaneous durable goods merchant wholesalers","3","0","0","56","037",
"0500000US56037","Sweetwater County, Wyoming","037","2017","424","Merchant wholesalers, nondurable goods","19","257","12773","56","037",
"0500000US56037","Sweetwater County, Wyoming","037","2017","4244","Grocery and related product merchant wholesalers","3","0","0","56","037",
"0500000US56037","Sweetwater County, Wyoming","037","2017","4246","Chemical and allied products merchant wholesalers","6","34","2736","56","037",
"0500000US56037","Sweetwater County, Wyoming","037","2017","5611","Office administrative services","5","10","695","56","037",
"0500000US56037","Sweetwater County, Wyoming","037","2017","56111","Office administrative services","5","10","695","56","037",
"0500000US56037","Sweetwater County, Wyoming","037","2017","561110","Office administrative services","5","10","695","56","037",
"0500000US56037","Sweetwater County, Wyoming","037","2017","5616","Investigation and security services","3","10","372","56","037",
"0500000US56037","Sweetwater County, Wyoming","037","2017","5617","Services to buildings and dwellings","24","99","3506","56","037",
"0500000US56037","Sweetwater County, Wyoming","037","2017","56172","Janitorial services","18","87","3312","56","037",
"0500000US56037","Sweetwater County, Wyoming","037","2017","561720","Janitorial services","18","87","3312","56","037",
"0500000US56037","Sweetwater County, Wyoming","037","2017","56173","Landscaping services","5","11","149","56","037",
"0500000US56037","Sweetwater County, Wyoming","037","2017","561730","Landscaping services","5","11","149","56","037",
"0500000US56037","Sweetwater County, Wyoming","037","2017","562","Waste management and remediation services","6","64","3543","56","037",
"0500000US56037","Sweetwater County, Wyoming","037","2017","5629","Remediation and other waste management services","4","16","850","56","037",
"0500000US56037","Sweetwater County, Wyoming","037","2017","61","Educational services","9","46","553","56","037",
"0500000US56037","Sweetwater County, Wyoming","037","2017","611","Educational services","9","46","553","56","037",
"0500000US56037","Sweetwater County, Wyoming","037","2017","6116","Other schools and instruction","6","33","237","56","037",
"0500000US56037","Sweetwater County, Wyoming","037","2017","42469","Other chemical and allied products merchant wholesalers","6","34","2736","56","037",
"0500000US56037","Sweetwater County, Wyoming","037","2017","424690","Other chemical and allied products merchant wholesalers","6","34","2736","56","037",
"0500000US56037","Sweetwater County, Wyoming","037","2017","4247","Petroleum and petroleum products merchant wholesalers","7","87","5167","56","037",
"0500000US56037","Sweetwater County, Wyoming","037","2017","42471","Petroleum bulk stations and terminals ","7","87","5167","56","037",
"0500000US56037","Sweetwater County, Wyoming","037","2017","424710","Petroleum bulk stations and terminals ","7","87","5167","56","037",
"0500000US56037","Sweetwater County, Wyoming","037","2017","425","Wholesale electronic markets and agents and brokers","3","1","90","56","037",
"0500000US56037","Sweetwater County, Wyoming","037","2017","4251","Wholesale electronic markets and agents and brokers","3","1","90","56","037",
"0500000US56037","Sweetwater County, Wyoming","037","2017","42512","Wholesale trade agents and brokers","3","1","90","56","037",
"0500000US56037","Sweetwater County, Wyoming","037","2017","425120","Wholesale trade agents and brokers","3","1","90","56","037",
"0500000US56037","Sweetwater County, Wyoming","037","2017","44-45","Retail trade","172","2433","71023","56","037",
"0500000US56037","Sweetwater County, Wyoming","037","2017","441","Motor vehicle and parts dealers","31","420","20599","56","037",
"0500000US56037","Sweetwater County, Wyoming","037","2017","4411","Automobile dealers","10","238","13713","56","037",
"0500000US56037","Sweetwater County, Wyoming","037","2017","61161","Fine arts schools","3","17","164","56","037",
"0500000US56037","Sweetwater County, Wyoming","037","2017","611610","Fine arts schools","3","17","164","56","037",
"0500000US56037","Sweetwater County, Wyoming","037","2017","61162","Sports and recreation instruction","3","16","73","56","037",
"0500000US56037","Sweetwater County, Wyoming","037","2017","611620","Sports and recreation instruction","3","16","73","56","037",
"0500000US56037","Sweetwater County, Wyoming","037","2017","62","Health care and social assistance","102","1545","64553","56","037",
"0500000US56037","Sweetwater County, Wyoming","037","2017","621","Ambulatory health care services","78","580","24574","56","037",
"0500000US56037","Sweetwater County, Wyoming","037","2017","6211","Offices of physicians","16","79","4318","56","037",
"0500000US56037","Sweetwater County, Wyoming","037","2017","62111","Offices of physicians","16","79","4318","56","037",
"0500000US56037","Sweetwater County, Wyoming","037","2017","621111","Offices of physicians (except mental health specialists)","15","79","4274","56","037",
"0500000US56037","Sweetwater County, Wyoming","037","2017","6212","Offices of dentists","17","126","5334","56","037",
"0500000US56037","Sweetwater County, Wyoming","037","2017","62121","Offices of dentists","17","126","5334","56","037",
"0500000US56037","Sweetwater County, Wyoming","037","2017","44111","New car dealers","7","212","12544","56","037",
"0500000US56037","Sweetwater County, Wyoming","037","2017","441110","New car dealers","7","212","12544","56","037",
"0500000US56037","Sweetwater County, Wyoming","037","2017","44112","Used car dealers","3","26","1169","56","037",
"0500000US56037","Sweetwater County, Wyoming","037","2017","441120","Used car dealers","3","26","1169","56","037",
"0500000US56037","Sweetwater County, Wyoming","037","2017","4412","Other motor vehicle dealers","6","29","812","56","037",
"0500000US56037","Sweetwater County, Wyoming","037","2017","44122","Motorcycle, boat, and other motor vehicle dealers","4","20","647","56","037",
"0500000US56037","Sweetwater County, Wyoming","037","2017","441228","Motorcycle, ATV, and all other motor vehicle dealers","3","20","637","56","037",
"0500000US56037","Sweetwater County, Wyoming","037","2017","4413","Automotive parts, accessories, and tire stores","15","153","6074","56","037",
"0500000US56037","Sweetwater County, Wyoming","037","2017","44131","Automotive parts and accessories stores","8","68","2179","56","037",
"0500000US56037","Sweetwater County, Wyoming","037","2017","441310","Automotive parts and accessories stores","8","68","2179","56","037",
"0500000US56037","Sweetwater County, Wyoming","037","2017","44132","Tire dealers","7","85","3895","56","037",
"0500000US56037","Sweetwater County, Wyoming","037","2017","441320","Tire dealers","7","85","3895","56","037",
"0500000US56037","Sweetwater County, Wyoming","037","2017","442","Furniture and home furnishings stores","7","40","1512","56","037",
"0500000US56037","Sweetwater County, Wyoming","037","2017","4422","Home furnishings stores","5","22","892","56","037",
"0500000US56037","Sweetwater County, Wyoming","037","2017","44221","Floor covering stores","5","22","892","56","037",
"0500000US56037","Sweetwater County, Wyoming","037","2017","442210","Floor covering stores","5","22","892","56","037",
"0500000US56037","Sweetwater County, Wyoming","037","2017","443","Electronics and appliance stores","7","32","1026","56","037",
"0500000US56037","Sweetwater County, Wyoming","037","2017","4431","Electronics and appliance stores","7","32","1026","56","037",
"0500000US56037","Sweetwater County, Wyoming","037","2017","621210","Offices of dentists","17","126","5334","56","037",
"0500000US56037","Sweetwater County, Wyoming","037","2017","6213","Offices of other health practitioners","31","203","6784","56","037",
"0500000US56037","Sweetwater County, Wyoming","037","2017","62131","Offices of chiropractors","8","38","1662","56","037",
"0500000US56037","Sweetwater County, Wyoming","037","2017","621310","Offices of chiropractors","8","38","1662","56","037",
"0500000US56037","Sweetwater County, Wyoming","037","2017","62132","Offices of optometrists","9","45","1797","56","037",
"0500000US56037","Sweetwater County, Wyoming","037","2017","621320","Offices of optometrists","9","45","1797","56","037",
"0500000US56037","Sweetwater County, Wyoming","037","2017","62133","Offices of mental health practitioners (except physicians)","4","76","1498","56","037",
"0500000US56037","Sweetwater County, Wyoming","037","2017","621330","Offices of mental health practitioners (except physicians)","4","76","1498","56","037",
"0500000US56037","Sweetwater County, Wyoming","037","2017","62134","Offices of physical, occupational and speech therapists, and audiologists","8","38","1525","56","037",
"0500000US56037","Sweetwater County, Wyoming","037","2017","621340","Offices of physical, occupational and speech therapists, and audiologists","8","38","1525","56","037",
"0500000US56037","Sweetwater County, Wyoming","037","2017","6214","Outpatient care centers","4","33","1663","56","037",
"0500000US56037","Sweetwater County, Wyoming","037","2017","6216","Home health care services","4","82","3668","56","037",
"0500000US56037","Sweetwater County, Wyoming","037","2017","62161","Home health care services","4","82","3668","56","037",
"0500000US56037","Sweetwater County, Wyoming","037","2017","621610","Home health care services","4","82","3668","56","037",
"0500000US56037","Sweetwater County, Wyoming","037","2017","6219","Other ambulatory health care services","4","40","1724","56","037",
"0500000US56037","Sweetwater County, Wyoming","037","2017","623","Nursing and residential care facilities","6","223","6447","56","037",
"0500000US56037","Sweetwater County, Wyoming","037","2017","6239","Other residential care facilities","3","0","0","56","037",
"0500000US56037","Sweetwater County, Wyoming","037","2017","44314","Electronics and appliance stores","7","32","1026","56","037",
"0500000US56037","Sweetwater County, Wyoming","037","2017","443142","Electronics stores","6","28","994","56","037",
"0500000US56037","Sweetwater County, Wyoming","037","2017","444","Building material and garden equipment and supplies dealers","20","268","8549","56","037",
"0500000US56037","Sweetwater County, Wyoming","037","2017","4441","Building material and supplies dealers","17","243","7984","56","037",
"0500000US56037","Sweetwater County, Wyoming","037","2017","44413","Hardware stores","5","61","1909","56","037",
"0500000US56037","Sweetwater County, Wyoming","037","2017","444130","Hardware stores","5","61","1909","56","037",
"0500000US56037","Sweetwater County, Wyoming","037","2017","44419","Other building material dealers","10","64","3234","56","037",
"0500000US56037","Sweetwater County, Wyoming","037","2017","444190","Other building material dealers","10","64","3234","56","037",
"0500000US56037","Sweetwater County, Wyoming","037","2017","4442","Lawn and garden equipment and supplies stores","3","25","565","56","037",
"0500000US56037","Sweetwater County, Wyoming","037","2017","44422","Nursery, garden center, and farm supply stores","3","25","565","56","037",
"0500000US56037","Sweetwater County, Wyoming","037","2017","444220","Nursery, garden center, and farm supply stores","3","25","565","56","037",
"0500000US56037","Sweetwater County, Wyoming","037","2017","445","Food and beverage stores","12","306","9841","56","037",
"0500000US56037","Sweetwater County, Wyoming","037","2017","4451","Grocery stores","6","273","9335","56","037",
"0500000US56037","Sweetwater County, Wyoming","037","2017","44511","Supermarkets and other grocery (except convenience) stores","6","273","9335","56","037",
"0500000US56037","Sweetwater County, Wyoming","037","2017","445110","Supermarkets and other grocery (except convenience) stores","6","273","9335","56","037",
"0500000US56037","Sweetwater County, Wyoming","037","2017","4453","Beer, wine, and liquor stores","5","17","315","56","037",
"0500000US56037","Sweetwater County, Wyoming","037","2017","62399","Other residential care facilities","3","0","0","56","037",
"0500000US56037","Sweetwater County, Wyoming","037","2017","623990","Other residential care facilities","3","0","0","56","037",
"0500000US56037","Sweetwater County, Wyoming","037","2017","624","Social assistance","17","268","6631","56","037",
"0500000US56037","Sweetwater County, Wyoming","037","2017","6241","Individual and family services","11","243","6273","56","037",
"0500000US56037","Sweetwater County, Wyoming","037","2017","62412","Services for the elderly and persons with disabilities","4","210","5684","56","037",
"0500000US56037","Sweetwater County, Wyoming","037","2017","624120","Services for the elderly and persons with disabilities","4","210","5684","56","037",
"0500000US56037","Sweetwater County, Wyoming","037","2017","62419","Other individual and family services","6","30","545","56","037",
"0500000US56037","Sweetwater County, Wyoming","037","2017","624190","Other individual and family services","6","30","545","56","037",
"0500000US56037","Sweetwater County, Wyoming","037","2017","6244","Child day care services","5","20","234","56","037",
"0500000US56037","Sweetwater County, Wyoming","037","2017","62441","Child day care services","5","20","234","56","037",
"0500000US56037","Sweetwater County, Wyoming","037","2017","624410","Child day care services","5","20","234","56","037",
"0500000US56037","Sweetwater County, Wyoming","037","2017","71","Arts, entertainment, and recreation","14","63","851","56","037",
"0500000US56037","Sweetwater County, Wyoming","037","2017","713","Amusement, gambling, and recreation industries","13","62","849","56","037",
"0500000US56037","Sweetwater County, Wyoming","037","2017","7139","Other amusement and recreation industries","12","59","843","56","037",
"0500000US56037","Sweetwater County, Wyoming","037","2017","71394","Fitness and recreational sports centers","7","28","145","56","037",
"0500000US56037","Sweetwater County, Wyoming","037","2017","713940","Fitness and recreational sports centers","7","28","145","56","037",
"0500000US56037","Sweetwater County, Wyoming","037","2017","44531","Beer, wine, and liquor stores","5","17","315","56","037",
"0500000US56037","Sweetwater County, Wyoming","037","2017","445310","Beer, wine, and liquor stores","5","17","315","56","037",
"0500000US56037","Sweetwater County, Wyoming","037","2017","446","Health and personal care stores","5","41","1683","56","037",
"0500000US56037","Sweetwater County, Wyoming","037","2017","4461","Health and personal care stores","5","41","1683","56","037",
"0500000US56037","Sweetwater County, Wyoming","037","2017","44611","Pharmacies and drug stores","3","36","1534","56","037",
"0500000US56037","Sweetwater County, Wyoming","037","2017","446110","Pharmacies and drug stores","3","36","1534","56","037",
"0500000US56037","Sweetwater County, Wyoming","037","2017","447","Gasoline stations","31","485","10234","56","037",
"0500000US56037","Sweetwater County, Wyoming","037","2017","4471","Gasoline stations","31","485","10234","56","037",
"0500000US56037","Sweetwater County, Wyoming","037","2017","44711","Gasoline stations with convenience stores","24","329","7208","56","037",
"0500000US56037","Sweetwater County, Wyoming","037","2017","447110","Gasoline stations with convenience stores","24","329","7208","56","037",
"0500000US56037","Sweetwater County, Wyoming","037","2017","44719","Other gasoline stations","7","156","3026","56","037",
"0500000US56037","Sweetwater County, Wyoming","037","2017","447190","Other gasoline stations","7","156","3026","56","037",
"0500000US56037","Sweetwater County, Wyoming","037","2017","448","Clothing and clothing accessories stores","16","184","2762","56","037",
"0500000US56037","Sweetwater County, Wyoming","037","2017","71399","All other amusement and recreation industries","3","0","0","56","037",
"0500000US56037","Sweetwater County, Wyoming","037","2017","713990","All other amusement and recreation industries","3","0","0","56","037",
"0500000US56037","Sweetwater County, Wyoming","037","2017","72","Accommodation and food services","119","1755","28397","56","037",
"0500000US56037","Sweetwater County, Wyoming","037","2017","721","Accommodation","22","314","5556","56","037",
"0500000US56037","Sweetwater County, Wyoming","037","2017","7211","Traveler accommodation","21","310","5522","56","037",
"0500000US56037","Sweetwater County, Wyoming","037","2017","72111","Hotels (except casino hotels) and motels","21","310","5522","56","037",
"0500000US56037","Sweetwater County, Wyoming","037","2017","721110","Hotels (except casino hotels) and motels","21","310","5522","56","037",
"0500000US56037","Sweetwater County, Wyoming","037","2017","722","Food services and drinking places","97","1441","22841","56","037",
"0500000US56037","Sweetwater County, Wyoming","037","2017","4481","Clothing stores","8","147","1247","56","037",
"0500000US56037","Sweetwater County, Wyoming","037","2017","44814","Family clothing stores","4","110","818","56","037",
"0500000US56037","Sweetwater County, Wyoming","037","2017","448140","Family clothing stores","4","110","818","56","037",
"0500000US56037","Sweetwater County, Wyoming","037","2017","4482","Shoe stores","3","9","141","56","037",
"0500000US56037","Sweetwater County, Wyoming","037","2017","44821","Shoe stores","3","9","141","56","037",
"0500000US56037","Sweetwater County, Wyoming","037","2017","448210","Shoe stores","3","9","141","56","037",
"0500000US56037","Sweetwater County, Wyoming","037","2017","4483","Jewelry, luggage, and leather goods stores","5","28","1374","56","037",
"0500000US56037","Sweetwater County, Wyoming","037","2017","44831","Jewelry stores","5","28","1374","56","037",
"0500000US56037","Sweetwater County, Wyoming","037","2017","448310","Jewelry stores","5","28","1374","56","037",
"0500000US56037","Sweetwater County, Wyoming","037","2017","451","Sporting goods, hobby, musical instrument, and book stores","11","66","883","56","037",
"0500000US56037","Sweetwater County, Wyoming","037","2017","4511","Sporting goods, hobby, and musical instrument stores","10","63","862","56","037",
"0500000US56037","Sweetwater County, Wyoming","037","2017","45111","Sporting goods stores","4","45","683","56","037",
"0500000US56037","Sweetwater County, Wyoming","037","2017","451110","Sporting goods stores","4","45","683","56","037",
"0500000US56037","Sweetwater County, Wyoming","037","2017","45113","Sewing, needlework, and piece goods stores","4","17","155","56","037",
"0500000US56037","Sweetwater County, Wyoming","037","2017","451130","Sewing, needlework, and piece goods stores","4","17","155","56","037",
"0500000US56037","Sweetwater County, Wyoming","037","2017","452","General merchandise stores","7","472","11313","56","037",
"0500000US56037","Sweetwater County, Wyoming","037","2017","4523","General merchandise stores, including warehouse clubs and supercenters","6","400","10534","56","037",
"0500000US56037","Sweetwater County, Wyoming","037","2017","45231","General merchandise stores, including warehouse clubs and supercenters","6","400","10534","56","037",
"0500000US56037","Sweetwater County, Wyoming","037","2017","452319","All other general merchandise stores","4","0","0","56","037",
"0500000US56037","Sweetwater County, Wyoming","037","2017","453","Miscellaneous store retailers","17","92","1328","56","037",
"0500000US56037","Sweetwater County, Wyoming","037","2017","7224","Drinking places (alcoholic beverages)","21","153","1740","56","037",
"0500000US56037","Sweetwater County, Wyoming","037","2017","72241","Drinking places (alcoholic beverages)","21","153","1740","56","037",
"0500000US56037","Sweetwater County, Wyoming","037","2017","722410","Drinking places (alcoholic beverages)","21","153","1740","56","037",
"0500000US56037","Sweetwater County, Wyoming","037","2017","7225","Restaurants and other eating places","74","1258","20595","56","037",
"0500000US56037","Sweetwater County, Wyoming","037","2017","72251","Restaurants and other eating places","74","1258","20595","56","037",
"0500000US56037","Sweetwater County, Wyoming","037","2017","722511","Full-service restaurants","30","512","8875","56","037",
"0500000US56037","Sweetwater County, Wyoming","037","2017","722513","Limited-service restaurants","32","667","10613","56","037",
"0500000US56037","Sweetwater County, Wyoming","037","2017","4531","Florists","3","8","97","56","037",
"0500000US56037","Sweetwater County, Wyoming","037","2017","45311","Florists","3","8","97","56","037",
"0500000US56037","Sweetwater County, Wyoming","037","2017","453110","Florists","3","8","97","56","037",
"0500000US56037","Sweetwater County, Wyoming","037","2017","4532","Office supplies, stationery, and gift stores","4","24","348","56","037",
