"GEO_ID","NAME","COUNTY","YEAR","NAICS2017","NAICS2017_LABEL","ESTAB","EMP","PAYANN","state","county",
"0500000US56005","Campbell County, Wyoming","005","2017","213111","Drilling oil and gas wells","10","147","10077","56","005",
"0500000US56005","Campbell County, Wyoming","005","2017","213112","Support activities for oil and gas operations","84","757","51563","56","005",
"0500000US56005","Campbell County, Wyoming","005","2017","22","Utilities","16","402","36369","56","005",
"0500000US56005","Campbell County, Wyoming","005","2017","221","Utilities","16","402","36369","56","005",
"0500000US56005","Campbell County, Wyoming","005","2017","2211","Electric power generation, transmission and distribution","12","363","34232","56","005",
"0500000US56005","Campbell County, Wyoming","005","2017","22111","Electric power generation","4","0","0","56","005",
"0500000US56005","Campbell County, Wyoming","005","2017","221112","Fossil fuel electric power generation","3","0","0","56","005",
"0500000US56005","Campbell County, Wyoming","005","2017","22112","Electric power transmission, control, and distribution","8","192","18203","56","005",
"0500000US56005","Campbell County, Wyoming","005","2017","221122","Electric power distribution","7","0","0","56","005",
"0500000US56005","Campbell County, Wyoming","005","2017","2212","Natural gas distribution","3","0","0","56","005",
"0500000US56005","Campbell County, Wyoming","005","2017","22121","Natural gas distribution","3","0","0","56","005",
"0500000US56005","Campbell County, Wyoming","005","2017","221210","Natural gas distribution","3","0","0","56","005",
"0500000US56005","Campbell County, Wyoming","005","2017","23","Construction","178","1761","104359","56","005",
"0500000US56005","Campbell County, Wyoming","005","2017","52","Finance and insurance","48","345","19729","56","005",
"0500000US56005","Campbell County, Wyoming","005","2017","522","Credit intermediation and related activities","20","244","13355","56","005",
"0500000US56005","Campbell County, Wyoming","005","2017","5221","Depository credit intermediation","13","210","11638","56","005",
"0500000US56005","Campbell County, Wyoming","005","2017","52211","Commercial banking","11","182","10228","56","005",
"0500000US56005","Campbell County, Wyoming","005","2017","522110","Commercial banking","11","182","10228","56","005",
"0500000US56005","Campbell County, Wyoming","005","2017","5222","Nondepository credit intermediation","4","12","1120","56","005",
"0500000US56005","Campbell County, Wyoming","005","2017","52229","Other nondepository credit intermediation","4","12","1120","56","005",
"0500000US56005","Campbell County, Wyoming","005","2017","5223","Activities related to credit intermediation","3","22","597","56","005",
"0500000US56005","Campbell County, Wyoming","005","2017","52239","Other activities related to credit intermediation","3","22","597","56","005",
"0500000US56005","Campbell County, Wyoming","005","2017","522390","Other activities related to credit intermediation","3","22","597","56","005",
"0500000US56005","Campbell County, Wyoming","005","2017","523","Securities, commodity contracts, and other financial investments and related activities","10","12","2217","56","005",
"0500000US56005","Campbell County, Wyoming","005","2017","5231","Securities and commodity contracts intermediation and brokerage","3","6","1125","56","005",
"0500000US56005","Campbell County, Wyoming","005","2017","52312","Securities brokerage","3","6","1125","56","005",
"0500000US56005","Campbell County, Wyoming","005","2017","523120","Securities brokerage","3","6","1125","56","005",
"0500000US56005","Campbell County, Wyoming","005","2017","81341","Civic and social organizations","10","22","584","56","005",
"0500000US56005","Campbell County, Wyoming","005","2017","813410","Civic and social organizations","10","22","584","56","005",
"0500000US56005","Campbell County, Wyoming","005","2017","8139","Business, professional, labor, political, and similar organizations","8","22","491","56","005",
"0500000US56005","Campbell County, Wyoming","005","2017","81393","Labor unions and similar labor organizations","3","0","0","56","005",
"0500000US56005","Campbell County, Wyoming","005","2017","813930","Labor unions and similar labor organizations","3","0","0","56","005",
"0500000US56005","Campbell County, Wyoming","005","2017","236","Construction of buildings","28","297","16945","56","005",
"0500000US56005","Campbell County, Wyoming","005","2017","2361","Residential building construction","16","70","2468","56","005",
"0500000US56005","Campbell County, Wyoming","005","2017","23611","Residential building construction","16","70","2468","56","005",
"0500000US56005","Campbell County, Wyoming","005","2017","236117","New housing for-sale builders","5","31","1338","56","005",
"0500000US56005","Campbell County, Wyoming","005","2017","236118","Residential remodelers","9","31","795","56","005",
"0500000US56005","Campbell County, Wyoming","005","2017","2362","Nonresidential building construction","12","227","14477","56","005",
"0500000US56005","Campbell County, Wyoming","005","2017","23621","Industrial building construction","3","37","1585","56","005",
"0500000US56005","Campbell County, Wyoming","005","2017","236210","Industrial building construction","3","37","1585","56","005",
"0500000US56005","Campbell County, Wyoming","005","2017","23622","Commercial and institutional building construction","9","190","12892","56","005",
"0500000US56005","Campbell County, Wyoming","005","2017","236220","Commercial and institutional building construction","9","190","12892","56","005",
"0500000US56005","Campbell County, Wyoming","005","2017","237","Heavy and civil engineering construction","31","515","33604","56","005",
"0500000US56005","Campbell County, Wyoming","005","2017","2371","Utility system construction","26","427","27662","56","005",
"0500000US56005","Campbell County, Wyoming","005","2017","5239","Other financial investment activities","7","0","0","56","005",
"0500000US56005","Campbell County, Wyoming","005","2017","52392","Portfolio management","6","0","0","56","005",
"0500000US56005","Campbell County, Wyoming","005","2017","523920","Portfolio management","6","0","0","56","005",
"0500000US56005","Campbell County, Wyoming","005","2017","524","Insurance carriers and related activities","18","89","4157","56","005",
"0500000US56005","Campbell County, Wyoming","005","2017","5241","Insurance carriers","4","20","761","56","005",
"0500000US56005","Campbell County, Wyoming","005","2017","52412","Direct insurance (except life, health, and medical) carriers","3","0","0","56","005",
"0500000US56005","Campbell County, Wyoming","005","2017","5242","Agencies, brokerages, and other insurance related activities","14","69","3396","56","005",
"0500000US56005","Campbell County, Wyoming","005","2017","52421","Insurance agencies and brokerages","14","69","3396","56","005",
"0500000US56005","Campbell County, Wyoming","005","2017","524210","Insurance agencies and brokerages","14","69","3396","56","005",
"0500000US56005","Campbell County, Wyoming","005","2017","53","Real estate and rental and leasing","81","361","22268","56","005",
"0500000US56005","Campbell County, Wyoming","005","2017","531","Real estate","64","155","4678","56","005",
"0500000US56005","Campbell County, Wyoming","005","2017","5311","Lessors of real estate","26","68","1932","56","005",
"0500000US56005","Campbell County, Wyoming","005","2017","53111","Lessors of residential buildings and dwellings","14","34","1167","56","005",
"0500000US56005","Campbell County, Wyoming","005","2017","23711","Water and sewer line and related structures construction","10","174","10680","56","005",
"0500000US56005","Campbell County, Wyoming","005","2017","237110","Water and sewer line and related structures construction","10","174","10680","56","005",
"0500000US56005","Campbell County, Wyoming","005","2017","23712","Oil and gas pipeline and related structures construction","14","219","14820","56","005",
"0500000US56005","Campbell County, Wyoming","005","2017","237120","Oil and gas pipeline and related structures construction","14","219","14820","56","005",
"0500000US56005","Campbell County, Wyoming","005","2017","2373","Highway, street, and bridge construction","4","87","5890","56","005",
"0500000US56005","Campbell County, Wyoming","005","2017","23731","Highway, street, and bridge construction","4","87","5890","56","005",
"0500000US56005","Campbell County, Wyoming","005","2017","237310","Highway, street, and bridge construction","4","87","5890","56","005",
"0500000US56005","Campbell County, Wyoming","005","2017","238","Specialty trade contractors","119","949","53810","56","005",
"0500000US56005","Campbell County, Wyoming","005","2017","2381","Foundation, structure, and building exterior contractors","28","166","6002","56","005",
"0500000US56005","Campbell County, Wyoming","005","2017","23811","Poured concrete foundation and structure contractors","10","98","3448","56","005",
"0500000US56005","Campbell County, Wyoming","005","2017","238110","Poured concrete foundation and structure contractors","10","98","3448","56","005",
"0500000US56005","Campbell County, Wyoming","005","2017","23816","Roofing contractors","5","27","962","56","005",
"0500000US56005","Campbell County, Wyoming","005","2017","238160","Roofing contractors","5","27","962","56","005",
"0500000US56005","Campbell County, Wyoming","005","2017","531110","Lessors of residential buildings and dwellings","14","34","1167","56","005",
"0500000US56005","Campbell County, Wyoming","005","2017","53112","Lessors of nonresidential buildings (except miniwarehouses)","4","17","438","56","005",
"0500000US56005","Campbell County, Wyoming","005","2017","531120","Lessors of nonresidential buildings (except miniwarehouses)","4","17","438","56","005",
"0500000US56005","Campbell County, Wyoming","005","2017","53113","Lessors of miniwarehouses and self-storage units","4","6","172","56","005",
"0500000US56005","Campbell County, Wyoming","005","2017","531130","Lessors of miniwarehouses and self-storage units","4","6","172","56","005",
"0500000US56005","Campbell County, Wyoming","005","2017","53119","Lessors of other real estate property","4","11","155","56","005",
"0500000US56005","Campbell County, Wyoming","005","2017","531190","Lessors of other real estate property","4","11","155","56","005",
"0500000US56005","Campbell County, Wyoming","005","2017","5312","Offices of real estate agents and brokers","28","29","1327","56","005",
"0500000US56005","Campbell County, Wyoming","005","2017","53121","Offices of real estate agents and brokers","28","29","1327","56","005",
"0500000US56005","Campbell County, Wyoming","005","2017","531210","Offices of real estate agents and brokers","28","29","1327","56","005",
"0500000US56005","Campbell County, Wyoming","005","2017","5313","Activities related to real estate","10","58","1419","56","005",
"0500000US56005","Campbell County, Wyoming","005","2017","53132","Offices of real estate appraisers","3","7","390","56","005",
"0500000US56005","Campbell County, Wyoming","005","2017","531320","Offices of real estate appraisers","3","7","390","56","005",
"0500000US56005","Campbell County, Wyoming","005","2017","53139","Other activities related to real estate","5","49","846","56","005",
"0500000US56005","Campbell County, Wyoming","005","2017","531390","Other activities related to real estate","5","49","846","56","005",
"0500000US56005","Campbell County, Wyoming","005","2017","532","Rental and leasing services","17","206","17590","56","005",
"0500000US56005","Campbell County, Wyoming","005","2017","5321","Automotive equipment rental and leasing","4","22","529","56","005",
"0500000US56005","Campbell County, Wyoming","005","2017","23817","Siding contractors","3","0","0","56","005",
"0500000US56005","Campbell County, Wyoming","005","2017","238170","Siding contractors","3","0","0","56","005",
"0500000US56005","Campbell County, Wyoming","005","2017","23819","Other foundation, structure, and building exterior contractors","6","10","280","56","005",
"0500000US56005","Campbell County, Wyoming","005","2017","238190","Other foundation, structure, and building exterior contractors","6","10","280","56","005",
"0500000US56005","Campbell County, Wyoming","005","2017","2382","Building equipment contractors","44","344","21631","56","005",
"0500000US56005","Campbell County, Wyoming","005","2017","23821","Electrical contractors and other wiring installation contractors","26","201","12909","56","005",
"0500000US56005","Campbell County, Wyoming","005","2017","238210","Electrical contractors and other wiring installation contractors","26","201","12909","56","005",
"0500000US56005","Campbell County, Wyoming","005","2017","23822","Plumbing, heating, and air-conditioning contractors","17","143","8716","56","005",
"0500000US56005","Campbell County, Wyoming","005","2017","238220","Plumbing, heating, and air-conditioning contractors","17","143","8716","56","005",
"0500000US56005","Campbell County, Wyoming","005","2017","2383","Building finishing contractors","10","42","1876","56","005",
"0500000US56005","Campbell County, Wyoming","005","2017","23831","Drywall and insulation contractors","3","0","0","56","005",
"0500000US56005","Campbell County, Wyoming","005","2017","53211","Passenger car rental and leasing","4","22","529","56","005",
"0500000US56005","Campbell County, Wyoming","005","2017","532111","Passenger car rental","4","22","529","56","005",
"0500000US56005","Campbell County, Wyoming","005","2017","5322","Consumer goods rental","3","0","0","56","005",
"0500000US56005","Campbell County, Wyoming","005","2017","5324","Commercial and industrial machinery and equipment rental and leasing","8","156","16175","56","005",
"0500000US56005","Campbell County, Wyoming","005","2017","53241","Construction, transportation, mining, and forestry machinery and equipment rental and leasing","4","0","0","56","005",
"0500000US56005","Campbell County, Wyoming","005","2017","532412","Construction, mining, and forestry machinery and equipment rental and leasing","3","0","0","56","005",
"0500000US56005","Campbell County, Wyoming","005","2017","53249","Other commercial and industrial machinery and equipment rental and leasing","4","50","4266","56","005",
"0500000US56005","Campbell County, Wyoming","005","2017","532490","Other commercial and industrial machinery and equipment rental and leasing","4","50","4266","56","005",
"0500000US56005","Campbell County, Wyoming","005","2017","54","Professional, scientific, and technical services","120","550","26891","56","005",
"0500000US56005","Campbell County, Wyoming","005","2017","541","Professional, scientific, and technical services","120","550","26891","56","005",
"0500000US56005","Campbell County, Wyoming","005","2017","5411","Legal services","33","117","5659","56","005",
"0500000US56005","Campbell County, Wyoming","005","2017","54111","Offices of lawyers","30","104","4973","56","005",
"0500000US56005","Campbell County, Wyoming","005","2017","541110","Offices of lawyers","30","104","4973","56","005",
"0500000US56005","Campbell County, Wyoming","005","2017","54119","Other legal services","3","0","0","56","005",
"0500000US56005","Campbell County, Wyoming","005","2017","238310","Drywall and insulation contractors","3","0","0","56","005",
"0500000US56005","Campbell County, Wyoming","005","2017","23832","Painting and wall covering contractors","3","12","570","56","005",
"0500000US56005","Campbell County, Wyoming","005","2017","238320","Painting and wall covering contractors","3","12","570","56","005",
"0500000US56005","Campbell County, Wyoming","005","2017","2389","Other specialty trade contractors","37","397","24301","56","005",
"0500000US56005","Campbell County, Wyoming","005","2017","23891","Site preparation contractors","30","347","22152","56","005",
"0500000US56005","Campbell County, Wyoming","005","2017","238910","Site preparation contractors","30","347","22152","56","005",
"0500000US56005","Campbell County, Wyoming","005","2017","23899","All other specialty trade contractors","7","50","2149","56","005",
"0500000US56005","Campbell County, Wyoming","005","2017","238990","All other specialty trade contractors","7","50","2149","56","005",
"0500000US56005","Campbell County, Wyoming","005","2017","31-33","Manufacturing","44","488","33707","56","005",
"0500000US56005","Campbell County, Wyoming","005","2017","311","Food manufacturing","3","0","0","56","005",
"0500000US56005","Campbell County, Wyoming","005","2017","312","Beverage and tobacco product manufacturing","3","0","0","56","005",
"0500000US56005","Campbell County, Wyoming","005","2017","3121","Beverage manufacturing","3","0","0","56","005",
"0500000US56005","Campbell County, Wyoming","005","2017","323","Printing and related support activities","6","16","569","56","005",
"0500000US56005","Campbell County, Wyoming","005","2017","3231","Printing and related support activities","6","16","569","56","005",
"0500000US56005","Campbell County, Wyoming","005","2017","32311","Printing","6","16","569","56","005",
"0500000US56005","Campbell County, Wyoming","005","2017","541191","Title abstract and settlement offices","3","0","0","56","005",
"0500000US56005","Campbell County, Wyoming","005","2017","5412","Accounting, tax preparation, bookkeeping, and payroll services","24","112","4194","56","005",
"0500000US56005","Campbell County, Wyoming","005","2017","54121","Accounting, tax preparation, bookkeeping, and payroll services","24","112","4194","56","005",
"0500000US56005","Campbell County, Wyoming","005","2017","541211","Offices of certified public accountants","9","57","3120","56","005",
"0500000US56005","Campbell County, Wyoming","005","2017","541213","Tax preparation services","3","0","0","56","005",
"0500000US56005","Campbell County, Wyoming","005","2017","541219","Other accounting services","12","22","530","56","005",
"0500000US56005","Campbell County, Wyoming","005","2017","5413","Architectural, engineering, and related services","27","159","9492","56","005",
"0500000US56005","Campbell County, Wyoming","005","2017","54133","Engineering services","12","44","3789","56","005",
"0500000US56005","Campbell County, Wyoming","005","2017","541330","Engineering services","12","44","3789","56","005",
"0500000US56005","Campbell County, Wyoming","005","2017","54138","Testing laboratories","13","97","4563","56","005",
"0500000US56005","Campbell County, Wyoming","005","2017","541380","Testing laboratories","13","97","4563","56","005",
"0500000US56005","Campbell County, Wyoming","005","2017","5415","Computer systems design and related services","5","29","1373","56","005",
"0500000US56005","Campbell County, Wyoming","005","2017","54151","Computer systems design and related services","5","29","1373","56","005",
"0500000US56005","Campbell County, Wyoming","005","2017","5416","Management, scientific, and technical consulting services","15","37","2212","56","005",
"0500000US56005","Campbell County, Wyoming","005","2017","323111","Commercial printing (except screen and books)","6","16","569","56","005",
"0500000US56005","Campbell County, Wyoming","005","2017","325","Chemical manufacturing","3","0","0","56","005",
"0500000US56005","Campbell County, Wyoming","005","2017","327","Nonmetallic mineral product manufacturing","3","0","0","56","005",
"0500000US56005","Campbell County, Wyoming","005","2017","3273","Cement and concrete product manufacturing","3","0","0","56","005",
"0500000US56005","Campbell County, Wyoming","005","2017","32732","Ready-mix concrete manufacturing","3","0","0","56","005",
"0500000US56005","Campbell County, Wyoming","005","2017","327320","Ready-mix concrete manufacturing","3","0","0","56","005",
"0500000US56005","Campbell County, Wyoming","005","2017","332","Fabricated metal product manufacturing","11","234","18049","56","005",
"0500000US56005","Campbell County, Wyoming","005","2017","3323","Architectural and structural metals manufacturing","3","0","0","56","005",
"0500000US56005","Campbell County, Wyoming","005","2017","33231","Plate work and fabricated structural product manufacturing","3","0","0","56","005",
"0500000US56005","Campbell County, Wyoming","005","2017","3327","Machine shops; turned product; and screw, nut, and bolt manufacturing","7","0","0","56","005",
"0500000US56005","Campbell County, Wyoming","005","2017","33271","Machine shops","7","0","0","56","005",
"0500000US56005","Campbell County, Wyoming","005","2017","332710","Machine shops","7","0","0","56","005",
"0500000US56005","Campbell County, Wyoming","005","2017","333","Machinery manufacturing","7","58","3266","56","005",
"0500000US56005","Campbell County, Wyoming","005","2017","3331","Agriculture, construction, and mining machinery manufacturing","4","46","2545","56","005",
"0500000US56005","Campbell County, Wyoming","005","2017","33313","Mining and oil and gas field machinery manufacturing","3","0","0","56","005",
"0500000US56005","Campbell County, Wyoming","005","2017","339","Miscellaneous manufacturing","5","13","605","56","005",
"0500000US56005","Campbell County, Wyoming","005","2017","3399","Other miscellaneous manufacturing","4","12","586","56","005",
"0500000US56005","Campbell County, Wyoming","005","2017","42","Wholesale trade","95","1177","80895","56","005",
"0500000US56005","Campbell County, Wyoming","005","2017","54161","Management consulting services","4","4","81","56","005",
"0500000US56005","Campbell County, Wyoming","005","2017","541611","Administrative management and general management consulting services","4","4","81","56","005",
"0500000US56005","Campbell County, Wyoming","005","2017","54162","Environmental consulting services","4","19","937","56","005",
"0500000US56005","Campbell County, Wyoming","005","2017","541620","Environmental consulting services","4","19","937","56","005",
"0500000US56005","Campbell County, Wyoming","005","2017","54169","Other scientific and technical consulting services","7","14","1194","56","005",
"0500000US56005","Campbell County, Wyoming","005","2017","541690","Other scientific and technical consulting services","7","14","1194","56","005",
"0500000US56005","Campbell County, Wyoming","005","2017","5419","Other professional, scientific, and technical services","13","91","3636","56","005",
"0500000US56005","Campbell County, Wyoming","005","2017","54192","Photographic services","3","4","95","56","005",
"0500000US56005","Campbell County, Wyoming","005","2017","541921","Photography studios, portrait","3","4","95","56","005",
"0500000US56005","Campbell County, Wyoming","005","2017","54194","Veterinary services","6","69","2712","56","005",
"0500000US56005","Campbell County, Wyoming","005","2017","541940","Veterinary services","6","69","2712","56","005",
"0500000US56005","Campbell County, Wyoming","005","2017","54199","All other professional, scientific, and technical services","4","18","829","56","005",
"0500000US56005","Campbell County, Wyoming","005","2017","541990","All other professional, scientific, and technical services","4","18","829","56","005",
"0500000US56005","Campbell County, Wyoming","005","2017","55","Management of companies and enterprises","7","0","0","56","005",
"0500000US56005","Campbell County, Wyoming","005","2017","551","Management of companies and enterprises","7","0","0","56","005",
"0500000US56005","Campbell County, Wyoming","005","2017","5511","Management of companies and enterprises","7","0","0","56","005",
"0500000US56005","Campbell County, Wyoming","005","2017","423","Merchant wholesalers, durable goods","70","905","65502","56","005",
"0500000US56005","Campbell County, Wyoming","005","2017","4231","Motor vehicle and motor vehicle parts and supplies merchant wholesalers","4","177","11777","56","005",
"0500000US56005","Campbell County, Wyoming","005","2017","42312","Motor vehicle supplies and new parts merchant wholesalers","4","177","11777","56","005",
"0500000US56005","Campbell County, Wyoming","005","2017","423120","Motor vehicle supplies and new parts merchant wholesalers","4","177","11777","56","005",
"0500000US56005","Campbell County, Wyoming","005","2017","4234","Professional and commercial equipment and supplies merchant wholesalers","3","8","454","56","005",
"0500000US56005","Campbell County, Wyoming","005","2017","4235","Metal and mineral (except petroleum) merchant wholesalers","3","41","2427","56","005",
"0500000US56005","Campbell County, Wyoming","005","2017","42351","Metal service centers and other metal merchant wholesalers","3","41","2427","56","005",
"0500000US56005","Campbell County, Wyoming","005","2017","423510","Metal service centers and other metal merchant wholesalers","3","41","2427","56","005",
"0500000US56005","Campbell County, Wyoming","005","2017","4236","Household appliances and electrical and electronic goods merchant wholesalers","7","50","4252","56","005",
"0500000US56005","Campbell County, Wyoming","005","2017","42361","Electrical apparatus and equipment, wiring supplies, and related equipment merchant wholesalers","6","36","2998","56","005",
"0500000US56005","Campbell County, Wyoming","005","2017","423610","Electrical apparatus and equipment, wiring supplies, and related equipment merchant wholesalers","6","36","2998","56","005",
"0500000US56005","Campbell County, Wyoming","005","2017","4237","Hardware, plumbing and heating equipment and supplies merchant wholesalers","3","14","878","56","005",
"0500000US56005","Campbell County, Wyoming","005","2017","4238","Machinery, equipment, and supplies merchant wholesalers","45","587","44557","56","005",
"0500000US56005","Campbell County, Wyoming","005","2017","42381","Construction and mining (except oil well) machinery and equipment merchant wholesalers","9","264","21516","56","005",
"0500000US56005","Campbell County, Wyoming","005","2017","423810","Construction and mining (except oil well) machinery and equipment merchant wholesalers","9","264","21516","56","005",
