"0500000US56025","Natrona County, Wyoming","025","2017","238150","Glass and glazing contractors","3","12","343","56","025",
"0500000US56025","Natrona County, Wyoming","025","2017","23816","Roofing contractors","14","42","1940","56","025",
"0500000US56025","Natrona County, Wyoming","025","2017","238160","Roofing contractors","14","42","1940","56","025",
"0500000US56025","Natrona County, Wyoming","025","2017","23817","Siding contractors","3","10","310","56","025",
"0500000US56025","Natrona County, Wyoming","025","2017","238170","Siding contractors","3","10","310","56","025",
"0500000US56025","Natrona County, Wyoming","025","2017","23819","Other foundation, structure, and building exterior contractors","13","49","2066","56","025",
"0500000US56025","Natrona County, Wyoming","025","2017","238190","Other foundation, structure, and building exterior contractors","13","49","2066","56","025",
"0500000US56025","Natrona County, Wyoming","025","2017","2382","Building equipment contractors","90","1092","68893","56","025",
"0500000US56025","Natrona County, Wyoming","025","2017","23821","Electrical contractors and other wiring installation contractors","43","531","34336","56","025",
"0500000US56025","Natrona County, Wyoming","025","2017","44831","Jewelry stores","6","35","1010","56","025",
"0500000US56025","Natrona County, Wyoming","025","2017","448310","Jewelry stores","6","35","1010","56","025",
"0500000US56025","Natrona County, Wyoming","025","2017","451","Sporting goods, hobby, musical instrument, and book stores","25","209","4892","56","025",
"0500000US56025","Natrona County, Wyoming","025","2017","4511","Sporting goods, hobby, and musical instrument stores","23","197","4744","56","025",
"0500000US56025","Natrona County, Wyoming","025","2017","45111","Sporting goods stores","17","147","3495","56","025",
"0500000US56025","Natrona County, Wyoming","025","2017","451110","Sporting goods stores","17","147","3495","56","025",
"0500000US56025","Natrona County, Wyoming","025","2017","45112","Hobby, toy, and game stores","3","40","995","56","025",
"0500000US56025","Natrona County, Wyoming","025","2017","451120","Hobby, toy, and game stores","3","40","995","56","025",
"0500000US56025","Natrona County, Wyoming","025","2017","452","General merchandise stores","15","1122","28825","56","025",
"0500000US56025","Natrona County, Wyoming","025","2017","4522","Department stores","4","200","3632","56","025",
"0500000US56025","Natrona County, Wyoming","025","2017","45221","Department stores","4","200","3632","56","025",
"0500000US56025","Natrona County, Wyoming","025","2017","452210","Department stores","4","200","3632","56","025",
"0500000US56025","Natrona County, Wyoming","025","2017","4523","General merchandise stores, including warehouse clubs and supercenters","11","922","25193","56","025",
"0500000US56025","Natrona County, Wyoming","025","2017","45231","General merchandise stores, including warehouse clubs and supercenters","11","922","25193","56","025",
"0500000US56025","Natrona County, Wyoming","025","2017","452311","Warehouse clubs and supercenters","5","862","24169","56","025",
"0500000US56025","Natrona County, Wyoming","025","2017","452319","All other general merchandise stores","6","60","1024","56","025",
"0500000US56025","Natrona County, Wyoming","025","2017","5416","Management, scientific, and technical consulting services","61","337","27009","56","025",
"0500000US56025","Natrona County, Wyoming","025","2017","54161","Management consulting services","27","215","19956","56","025",
"0500000US56025","Natrona County, Wyoming","025","2017","541611","Administrative management and general management consulting services","17","29","1485","56","025",
"0500000US56025","Natrona County, Wyoming","025","2017","541613","Marketing consulting services","6","4","340","56","025",
"0500000US56025","Natrona County, Wyoming","025","2017","541614","Process, physical distribution, and logistics consulting services","3","0","0","56","025",
"0500000US56025","Natrona County, Wyoming","025","2017","54162","Environmental consulting services","10","14","929","56","025",
"0500000US56025","Natrona County, Wyoming","025","2017","541620","Environmental consulting services","10","14","929","56","025",
"0500000US56025","Natrona County, Wyoming","025","2017","54169","Other scientific and technical consulting services","24","108","6124","56","025",
"0500000US56025","Natrona County, Wyoming","025","2017","541690","Other scientific and technical consulting services","24","108","6124","56","025",
"0500000US56025","Natrona County, Wyoming","025","2017","5418","Advertising, public relations, and related services","8","51","2661","56","025",
"0500000US56025","Natrona County, Wyoming","025","2017","54181","Advertising agencies","4","20","1166","56","025",
"0500000US56025","Natrona County, Wyoming","025","2017","541810","Advertising agencies","4","20","1166","56","025",
"0500000US56025","Natrona County, Wyoming","025","2017","5419","Other professional, scientific, and technical services","23","142","6227","56","025",
"0500000US56025","Natrona County, Wyoming","025","2017","54194","Veterinary services","9","107","4112","56","025",
"0500000US56025","Natrona County, Wyoming","025","2017","541940","Veterinary services","9","107","4112","56","025",
"0500000US56025","Natrona County, Wyoming","025","2017","811191","Automotive oil change and lubrication shops","4","28","853","56","025",
"0500000US56025","Natrona County, Wyoming","025","2017","811192","Car washes","10","48","743","56","025",
"0500000US56025","Natrona County, Wyoming","025","2017","8112","Electronic and precision equipment repair and maintenance","4","4","153","56","025",
"0500000US56025","Natrona County, Wyoming","025","2017","81121","Electronic and precision equipment repair and maintenance","4","4","153","56","025",
"0500000US56025","Natrona County, Wyoming","025","2017","8113","Commercial and industrial machinery and equipment (except automotive and electronic) repair and maintenance","26","102","7532","56","025",
"0500000US56025","Natrona County, Wyoming","025","2017","81131","Commercial and industrial machinery and equipment (except automotive and electronic) repair and maintenance","26","102","7532","56","025",
"0500000US56025","Natrona County, Wyoming","025","2017","811310","Commercial and industrial machinery and equipment (except automotive and electronic) repair and maintenance","26","102","7532","56","025",
"0500000US56025","Natrona County, Wyoming","025","2017","8114","Personal and household goods repair and maintenance","5","10","237","56","025",
"0500000US56025","Natrona County, Wyoming","025","2017","81149","Other personal and household goods repair and maintenance","3","8","167","56","025",
"0500000US56025","Natrona County, Wyoming","025","2017","811490","Other personal and household goods repair and maintenance","3","8","167","56","025",
"0500000US56025","Natrona County, Wyoming","025","2017","238210","Electrical contractors and other wiring installation contractors","43","531","34336","56","025",
"0500000US56025","Natrona County, Wyoming","025","2017","23822","Plumbing, heating, and air-conditioning contractors","41","420","26993","56","025",
"0500000US56025","Natrona County, Wyoming","025","2017","238220","Plumbing, heating, and air-conditioning contractors","41","420","26993","56","025",
"0500000US56025","Natrona County, Wyoming","025","2017","23829","Other building equipment contractors","6","141","7564","56","025",
"0500000US56025","Natrona County, Wyoming","025","2017","238290","Other building equipment contractors","6","141","7564","56","025",
"0500000US56025","Natrona County, Wyoming","025","2017","2383","Building finishing contractors","37","144","5440","56","025",
"0500000US56025","Natrona County, Wyoming","025","2017","23831","Drywall and insulation contractors","11","78","2697","56","025",
"0500000US56025","Natrona County, Wyoming","025","2017","238310","Drywall and insulation contractors","11","78","2697","56","025",
"0500000US56025","Natrona County, Wyoming","025","2017","23832","Painting and wall covering contractors","9","14","578","56","025",
"0500000US56025","Natrona County, Wyoming","025","2017","238320","Painting and wall covering contractors","9","14","578","56","025",
"0500000US56025","Natrona County, Wyoming","025","2017","23833","Flooring contractors","5","14","419","56","025",
"0500000US56025","Natrona County, Wyoming","025","2017","453","Miscellaneous store retailers","32","207","4087","56","025",
"0500000US56025","Natrona County, Wyoming","025","2017","4531","Florists","5","26","679","56","025",
"0500000US56025","Natrona County, Wyoming","025","2017","45311","Florists","5","26","679","56","025",
"0500000US56025","Natrona County, Wyoming","025","2017","453110","Florists","5","26","679","56","025",
"0500000US56025","Natrona County, Wyoming","025","2017","4532","Office supplies, stationery, and gift stores","9","81","1423","56","025",
"0500000US56025","Natrona County, Wyoming","025","2017","45322","Gift, novelty, and souvenir stores","7","47","920","56","025",
"0500000US56025","Natrona County, Wyoming","025","2017","453220","Gift, novelty, and souvenir stores","7","47","920","56","025",
"0500000US56025","Natrona County, Wyoming","025","2017","4533","Used merchandise stores","8","40","700","56","025",
"0500000US56025","Natrona County, Wyoming","025","2017","45331","Used merchandise stores","8","40","700","56","025",
"0500000US56025","Natrona County, Wyoming","025","2017","453310","Used merchandise stores","8","40","700","56","025",
"0500000US56025","Natrona County, Wyoming","025","2017","4539","Other miscellaneous store retailers","10","60","1285","56","025",
"0500000US56025","Natrona County, Wyoming","025","2017","45399","All other miscellaneous store retailers","6","28","473","56","025",
"0500000US56025","Natrona County, Wyoming","025","2017","453998","All other miscellaneous store retailers (except tobacco stores)","5","23","420","56","025",
"0500000US56025","Natrona County, Wyoming","025","2017","454","Nonstore retailers","23","127","6404","56","025",
"0500000US56025","Natrona County, Wyoming","025","2017","4541","Electronic shopping and mail-order houses","5","0","0","56","025",
"0500000US56025","Natrona County, Wyoming","025","2017","45411","Electronic shopping and mail-order houses","5","0","0","56","025",
"0500000US56025","Natrona County, Wyoming","025","2017","54199","All other professional, scientific, and technical services","12","29","1961","56","025",
"0500000US56025","Natrona County, Wyoming","025","2017","541990","All other professional, scientific, and technical services","12","29","1961","56","025",
"0500000US56025","Natrona County, Wyoming","025","2017","55","Management of companies and enterprises","21","209","13039","56","025",
"0500000US56025","Natrona County, Wyoming","025","2017","551","Management of companies and enterprises","21","209","13039","56","025",
"0500000US56025","Natrona County, Wyoming","025","2017","5511","Management of companies and enterprises","21","209","13039","56","025",
"0500000US56025","Natrona County, Wyoming","025","2017","55111","Management of companies and enterprises","21","209","13039","56","025",
"0500000US56025","Natrona County, Wyoming","025","2017","551114","Corporate, subsidiary, and regional managing offices","19","199","12139","56","025",
"0500000US56025","Natrona County, Wyoming","025","2017","56","Administrative and support and waste management and remediation services","179","1294","42862","56","025",
"0500000US56025","Natrona County, Wyoming","025","2017","812","Personal and laundry services","46","293","7845","56","025",
"0500000US56025","Natrona County, Wyoming","025","2017","8121","Personal care services","31","140","2964","56","025",
"0500000US56025","Natrona County, Wyoming","025","2017","81211","Hair, nail, and skin care services","21","108","2489","56","025",
"0500000US56025","Natrona County, Wyoming","025","2017","812112","Beauty salons","18","99","2340","56","025",
"0500000US56025","Natrona County, Wyoming","025","2017","812113","Nail salons","3","9","149","56","025",
"0500000US56025","Natrona County, Wyoming","025","2017","81219","Other personal care services","10","32","475","56","025",
"0500000US56025","Natrona County, Wyoming","025","2017","812199","Other personal care services","10","32","475","56","025",
"0500000US56025","Natrona County, Wyoming","025","2017","8122","Death care services","4","28","1079","56","025",
"0500000US56025","Natrona County, Wyoming","025","2017","81221","Funeral homes and funeral services","3","27","967","56","025",
"0500000US56025","Natrona County, Wyoming","025","2017","812210","Funeral homes and funeral services","3","27","967","56","025",
"0500000US56025","Natrona County, Wyoming","025","2017","8123","Drycleaning and laundry services","6","111","3493","56","025",
"0500000US56025","Natrona County, Wyoming","025","2017","81232","Drycleaning and laundry services (except coin-operated)","5","39","964","56","025",
"0500000US56025","Natrona County, Wyoming","025","2017","812320","Drycleaning and laundry services (except coin-operated)","5","39","964","56","025",
"0500000US56025","Natrona County, Wyoming","025","2017","8129","Other personal services","5","14","309","56","025",
"0500000US56025","Natrona County, Wyoming","025","2017","81291","Pet care (except veterinary) services","3","12","240","56","025",
"0500000US56025","Natrona County, Wyoming","025","2017","812910","Pet care (except veterinary) services","3","12","240","56","025",
"0500000US56021","Laramie County, Wyoming","021","2017","00","Total for all sectors","3243","32827","1397671","56","021",
"0500000US56021","Laramie County, Wyoming","021","2017","11","Agriculture, forestry, fishing and hunting","6","15","629","56","021",
"0500000US56021","Laramie County, Wyoming","021","2017","115","Support activities for agriculture and forestry","5","15","622","56","021",
"0500000US56021","Laramie County, Wyoming","021","2017","1151","Support activities for crop production","3","0","0","56","021",
"0500000US56021","Laramie County, Wyoming","021","2017","11511","Support activities for crop production","3","0","0","56","021",
"0500000US56021","Laramie County, Wyoming","021","2017","21","Mining, quarrying, and oil and gas extraction","20","243","21398","56","021",
"0500000US56021","Laramie County, Wyoming","021","2017","211","Oil and gas extraction","9","30","3391","56","021",
"0500000US56021","Laramie County, Wyoming","021","2017","2111","Oil and gas extraction","9","30","3391","56","021",
"0500000US56021","Laramie County, Wyoming","021","2017","21112","Crude petroleum extraction","8","30","3389","56","021",
"0500000US56021","Laramie County, Wyoming","021","2017","211120","Crude petroleum extraction","8","30","3389","56","021",
"0500000US56021","Laramie County, Wyoming","021","2017","213","Support activities for mining","10","173","15696","56","021",
"0500000US56021","Laramie County, Wyoming","021","2017","2131","Support activities for mining","10","173","15696","56","021",
"0500000US56021","Laramie County, Wyoming","021","2017","446191","Food (health) supplement stores","5","10","400","56","021",
"0500000US56021","Laramie County, Wyoming","021","2017","447","Gasoline stations","40","529","13478","56","021",
"0500000US56021","Laramie County, Wyoming","021","2017","4471","Gasoline stations","40","529","13478","56","021",
"0500000US56021","Laramie County, Wyoming","021","2017","44711","Gasoline stations with convenience stores","28","239","5373","56","021",
"0500000US56021","Laramie County, Wyoming","021","2017","447110","Gasoline stations with convenience stores","28","239","5373","56","021",
"0500000US56021","Laramie County, Wyoming","021","2017","44719","Other gasoline stations","12","290","8105","56","021",
"0500000US56021","Laramie County, Wyoming","021","2017","447190","Other gasoline stations","12","290","8105","56","021",
"0500000US56021","Laramie County, Wyoming","021","2017","448","Clothing and clothing accessories stores","38","476","5769","56","021",
"0500000US56021","Laramie County, Wyoming","021","2017","4481","Clothing stores","23","382","3894","56","021",
"0500000US56021","Laramie County, Wyoming","021","2017","532412","Construction, mining, and forestry machinery and equipment rental and leasing","10","71","4602","56","021",
"0500000US56021","Laramie County, Wyoming","021","2017","53249","Other commercial and industrial machinery and equipment rental and leasing","5","74","1432","56","021",
"0500000US56021","Laramie County, Wyoming","021","2017","532490","Other commercial and industrial machinery and equipment rental and leasing","5","74","1432","56","021",
"0500000US56021","Laramie County, Wyoming","021","2017","54","Professional, scientific, and technical services","543","2235","129025","56","021",
"0500000US56021","Laramie County, Wyoming","021","2017","541","Professional, scientific, and technical services","543","2235","129025","56","021",
"0500000US56021","Laramie County, Wyoming","021","2017","5411","Legal services","149","482","30448","56","021",
"0500000US56021","Laramie County, Wyoming","021","2017","54111","Offices of lawyers","145","441","28747","56","021",
"0500000US56021","Laramie County, Wyoming","021","2017","541110","Offices of lawyers","145","441","28747","56","021",
"0500000US56021","Laramie County, Wyoming","021","2017","7121","Museums, historical sites, and similar institutions","4","28","685","56","021",
"0500000US56021","Laramie County, Wyoming","021","2017","71211","Museums","3","0","0","56","021",
"0500000US56021","Laramie County, Wyoming","021","2017","712110","Museums","3","0","0","56","021",
"0500000US56021","Laramie County, Wyoming","021","2017","713","Amusement, gambling, and recreation industries","22","383","4896","56","021",
"0500000US56021","Laramie County, Wyoming","021","2017","7139","Other amusement and recreation industries","20","372","4592","56","021",
"0500000US56021","Laramie County, Wyoming","021","2017","71391","Golf courses and country clubs","4","62","1654","56","021",
"0500000US56021","Laramie County, Wyoming","021","2017","713910","Golf courses and country clubs","4","62","1654","56","021",
"0500000US56021","Laramie County, Wyoming","021","2017","71394","Fitness and recreational sports centers","9","249","2072","56","021",
"0500000US56021","Laramie County, Wyoming","021","2017","713940","Fitness and recreational sports centers","9","249","2072","56","021",
"0500000US56021","Laramie County, Wyoming","021","2017","71399","All other amusement and recreation industries","6","22","213","56","021",
"0500000US56021","Laramie County, Wyoming","021","2017","713990","All other amusement and recreation industries","6","22","213","56","021",
"0500000US56021","Laramie County, Wyoming","021","2017","72","Accommodation and food services","219","3961","68982","56","021",
"0500000US56021","Laramie County, Wyoming","021","2017","721","Accommodation","48","803","16151","56","021",
"0500000US56021","Laramie County, Wyoming","021","2017","21311","Support activities for mining","10","173","15696","56","021",
"0500000US56021","Laramie County, Wyoming","021","2017","213112","Support activities for oil and gas operations","9","170","15685","56","021",
"0500000US56021","Laramie County, Wyoming","021","2017","22","Utilities","13","193","15412","56","021",
"0500000US56021","Laramie County, Wyoming","021","2017","221","Utilities","13","193","15412","56","021",
"0500000US56021","Laramie County, Wyoming","021","2017","2211","Electric power generation, transmission and distribution","12","193","15410","56","021",
"0500000US56021","Laramie County, Wyoming","021","2017","22112","Electric power transmission, control, and distribution","11","166","12246","56","021",
"0500000US56021","Laramie County, Wyoming","021","2017","221122","Electric power distribution","11","166","12246","56","021",
"0500000US56021","Laramie County, Wyoming","021","2017","23","Construction","335","2414","115823","56","021",
"0500000US56021","Laramie County, Wyoming","021","2017","236","Construction of buildings","107","501","22573","56","021",
"0500000US56021","Laramie County, Wyoming","021","2017","2361","Residential building construction","82","249","9496","56","021",
"0500000US56021","Laramie County, Wyoming","021","2017","23611","Residential building construction","82","249","9496","56","021",
"0500000US56021","Laramie County, Wyoming","021","2017","44812","Women's clothing stores","6","60","580","56","021",
"0500000US56021","Laramie County, Wyoming","021","2017","448120","Women's clothing stores","6","60","580","56","021",
"0500000US56021","Laramie County, Wyoming","021","2017","44813","Children's and infants' clothing stores","4","31","413","56","021",
"0500000US56021","Laramie County, Wyoming","021","2017","448130","Children's and infants' clothing stores","4","31","413","56","021",
"0500000US56021","Laramie County, Wyoming","021","2017","44814","Family clothing stores","9","255","2277","56","021",
"0500000US56021","Laramie County, Wyoming","021","2017","448140","Family clothing stores","9","255","2277","56","021",
"0500000US56021","Laramie County, Wyoming","021","2017","4482","Shoe stores","8","56","842","56","021",
"0500000US56021","Laramie County, Wyoming","021","2017","44821","Shoe stores","8","56","842","56","021",
"0500000US56021","Laramie County, Wyoming","021","2017","448210","Shoe stores","8","56","842","56","021",
"0500000US56021","Laramie County, Wyoming","021","2017","4483","Jewelry, luggage, and leather goods stores","7","38","1033","56","021",
"0500000US56021","Laramie County, Wyoming","021","2017","44831","Jewelry stores","7","38","1033","56","021",
"0500000US56021","Laramie County, Wyoming","021","2017","448310","Jewelry stores","7","38","1033","56","021",
"0500000US56021","Laramie County, Wyoming","021","2017","451","Sporting goods, hobby, musical instrument, and book stores","23","234","3458","56","021",
"0500000US56021","Laramie County, Wyoming","021","2017","54119","Other legal services","4","41","1701","56","021",
"0500000US56021","Laramie County, Wyoming","021","2017","5412","Accounting, tax preparation, bookkeeping, and payroll services","50","207","10612","56","021",
"0500000US56021","Laramie County, Wyoming","021","2017","54121","Accounting, tax preparation, bookkeeping, and payroll services","50","207","10612","56","021",
"0500000US56021","Laramie County, Wyoming","021","2017","541211","Offices of certified public accountants","26","132","7536","56","021",
"0500000US56021","Laramie County, Wyoming","021","2017","541213","Tax preparation services","7","22","166","56","021",
"0500000US56021","Laramie County, Wyoming","021","2017","541219","Other accounting services","15","44","2838","56","021",
"0500000US56021","Laramie County, Wyoming","021","2017","5413","Architectural, engineering, and related services","53","232","14406","56","021",
"0500000US56021","Laramie County, Wyoming","021","2017","54131","Architectural services","10","41","2356","56","021",
"0500000US56021","Laramie County, Wyoming","021","2017","541310","Architectural services","10","41","2356","56","021",
"0500000US56021","Laramie County, Wyoming","021","2017","54133","Engineering services","36","156","9845","56","021",
"0500000US56021","Laramie County, Wyoming","021","2017","541330","Engineering services","36","156","9845","56","021",
"0500000US56021","Laramie County, Wyoming","021","2017","7211","Traveler accommodation","42","747","14556","56","021",
"0500000US56021","Laramie County, Wyoming","021","2017","72111","Hotels (except casino hotels) and motels","40","738","14473","56","021",
"0500000US56021","Laramie County, Wyoming","021","2017","721110","Hotels (except casino hotels) and motels","40","738","14473","56","021",
"0500000US56021","Laramie County, Wyoming","021","2017","7212","RV (recreational vehicle) parks and recreational camps","5","52","1272","56","021",
"0500000US56021","Laramie County, Wyoming","021","2017","72121","RV (recreational vehicle) parks and recreational camps","5","52","1272","56","021",
"0500000US56021","Laramie County, Wyoming","021","2017","721211","RV (recreational vehicle) parks and campgrounds","4","48","1143","56","021",
"0500000US56021","Laramie County, Wyoming","021","2017","722","Food services and drinking places","171","3158","52831","56","021",
"0500000US56021","Laramie County, Wyoming","021","2017","7223","Special food services","11","84","1818","56","021",
"0500000US56021","Laramie County, Wyoming","021","2017","72231","Food service contractors","6","0","0","56","021",
"0500000US56021","Laramie County, Wyoming","021","2017","722310","Food service contractors","6","0","0","56","021",
"0500000US56021","Laramie County, Wyoming","021","2017","72232","Caterers","3","0","0","56","021",
"0500000US56021","Laramie County, Wyoming","021","2017","722320","Caterers","3","0","0","56","021",
"0500000US56021","Laramie County, Wyoming","021","2017","7224","Drinking places (alcoholic beverages)","19","154","2304","56","021",
"0500000US56021","Laramie County, Wyoming","021","2017","236115","New single-family housing construction (except for-sale builders)","23","66","3017","56","021",
"0500000US56021","Laramie County, Wyoming","021","2017","236117","New housing for-sale builders","19","81","3073","56","021",
"0500000US56021","Laramie County, Wyoming","021","2017","236118","Residential remodelers","40","102","3406","56","021",
"0500000US56021","Laramie County, Wyoming","021","2017","2362","Nonresidential building construction","25","252","13077","56","021",
"0500000US56021","Laramie County, Wyoming","021","2017","23622","Commercial and institutional building construction","25","252","13077","56","021",
"0500000US56021","Laramie County, Wyoming","021","2017","236220","Commercial and institutional building construction","25","252","13077","56","021",
"0500000US56021","Laramie County, Wyoming","021","2017","237","Heavy and civil engineering construction","27","504","25172","56","021",
