	id	state	COUNTY	GEO_TTL	relevant_naics	NAICS_TTL	NAICS_Sector	GEO_ID	estab	emp	payann
1429	08	8	0	Colorado	1131	Timber tract operations	11	0400000US08	4.375	25.0	1503.5
1430	08	8	0	Colorado	1132	Forest nurseries and gathering of forest products	11	0400000US08	1.2	0.0	0.0
1431	08	8	0	Colorado	1133	Logging	11	0400000US08	38.111111111111114	76.88888888888889	4549.0
1432	08	8	0	Colorado	1141	Fishing	11	0400000US08	3.0	0.0	56.0
1433	08	8	0	Colorado	1142	Hunting and trapping	11	0400000US08	4.444444444444445	2.111111111111111	107.88888888888889
1434	08	8	0	Colorado	1151	Support activities for crop production	11	0400000US08	95.55555555555556	1001.1111111111111	38588.333333333336
1435	08	8	0	Colorado	1152	Support activities for animal production	11	0400000US08	155.66666666666666	415.44444444444446	11194.555555555555
1436	08	8	0	Colorado	1153	Support activities for forestry	11	0400000US08	25.444444444444443	115.11111111111111	9021.0
1437	08	8	0	Colorado	2111	Oil and gas extraction	21	0400000US08	396.0	7347.0	1186690.111111111
1438	08	8	0	Colorado	2121	Coal mining	21	0400000US08	10.777777777777779	1591.7777777777778	133912.77777777778
1439	08	8	0	Colorado	2122	Metal ore mining	21	0400000US08	37.666666666666664	1627.6666666666667	151105.88888888888
1440	08	8	0	Colorado	2123	Nonmetallic mineral mining and quarrying	21	0400000US08	107.22222222222223	1185.5555555555557	74318.77777777778
1441	08	8	0	Colorado	2131	Support activities for mining	21	0400000US08	698.6666666666666	13103.444444444445	1078383.888888889
1442	08	8	0	Colorado	2211	Electric power generation, transmission and distribution	22	0400000US08	195.33333333333334	6074.222222222223	756459.1111111111
1443	08	8	0	Colorado	2212	Natural gas distribution	22	0400000US08	61.55555555555556	596.8888888888889	79923.33333333333
1444	08	8	0	Colorado	2213	Water, sewage and other systems	22	0400000US08	136.33333333333334	657.6666666666666	30192.222222222223
1445	08	8	0	Colorado	2361	Residential building construction	23	0400000US08	3951.222222222222	13740.0	856305.4444444445
1446	08	8	0	Colorado	2362	Nonresidential building construction	23	0400000US08	840.2222222222222	14384.111111111111	1079667.5555555555
1447	08	8	0	Colorado	2371	Utility system construction	23	0400000US08	506.6666666666667	16341.888888888889	1101634.7777777778
1448	08	8	0	Colorado	2372	Land subdivision	23	0400000US08	120.88888888888889	523.2222222222222	42828.0
1449	08	8	0	Colorado	2373	Highway, street, and bridge construction	23	0400000US08	216.33333333333334	7272.888888888889	498565.8888888889
1450	08	8	0	Colorado	2379	Other heavy and civil engineering construction	23	0400000US08	69.0	1141.6666666666667	76602.88888888889
1451	08	8	0	Colorado	2381	Foundation, structure, and building exterior contractors	23	0400000US08	2684.777777777778	21966.222222222223	1063633.888888889
1452	08	8	0	Colorado	2382	Building equipment contractors	23	0400000US08	4240.555555555556	39787.666666666664	2232329.4444444445
1453	08	8	0	Colorado	2383	Building finishing contractors	23	0400000US08	3188.222222222222	16307.555555555555	715307.7777777778
1454	08	8	0	Colorado	2389	Other specialty trade contractors	23	0400000US08	1622.888888888889	14673.222222222223	814292.5555555555
1455	08	8	0	Colorado	3111	Animal food manufacturing	31	0400000US08	42.55555555555556	1048.7777777777778	65535.22222222222
1456	08	8	0	Colorado	3112	Grain and oilseed milling	31	0400000US08	14.222222222222221	271.0	18354.11111111111
1457	08	8	0	Colorado	3113	Sugar and confectionery product manufacturing	31	0400000US08	58.333333333333336	1547.3333333333333	55835.11111111111
1458	08	8	0	Colorado	3114	Fruit and vegetable preserving and specialty food manufacturing	31	0400000US08	39.333333333333336	789.8888888888889	30018.333333333332
1459	08	8	0	Colorado	3115	Dairy product manufacturing	31	0400000US08	24.77777777777778	1913.2222222222222	106916.77777777778
1460	08	8	0	Colorado	3116	Animal slaughtering and processing	31	0400000US08	76.44444444444444	7543.555555555556	291761.8888888889
1461	08	8	0	Colorado	3117	Seafood product preparation and packaging	31	0400000US08	2.6	0.0	0.0
1462	08	8	0	Colorado	3118	Bakeries and tortilla manufacturing	31	0400000US08	197.44444444444446	4786.222222222223	184933.33333333334
1463	08	8	0	Colorado	3119	Other food manufacturing	31	0400000US08	88.66666666666667	2237.8888888888887	100840.88888888889
1464	08	8	0	Colorado	3121	Beverage manufacturing	31	0400000US08	282.44444444444446	5913.777777777777	300578.44444444444
1465	08	8	0	Colorado	3122	Tobacco manufacturing	31	0400000US08	2.6	20.8	677.6
1466	08	8	0	Colorado	3131	Fiber, yarn, and thread mills	31	0400000US08	2.5	1.5	29.0
1467	08	8	0	Colorado	3132	Fabric mills	31	0400000US08	6.666666666666667	103.55555555555556	3459.3333333333335
1468	08	8	0	Colorado	3133	Textile and fabric finishing and fabric coating mills	31	0400000US08	7.555555555555555	58.111111111111114	2197.3333333333335
1469	08	8	0	Colorado	3141	Textile furnishings mills	31	0400000US08	29.11111111111111	114.11111111111111	3721.777777777778
1470	08	8	0	Colorado	3149	Other textile product mills	31	0400000US08	89.88888888888889	1255.2222222222222	52737.11111111111
1471	08	8	0	Colorado	3151	Apparel knitting mills	31	0400000US08	2.2	0.0	0.0
1472	08	8	0	Colorado	3152	Cut and sew apparel manufacturing	31	0400000US08	41.44444444444444	249.77777777777777	6553.444444444444
1473	08	8	0	Colorado	3159	Apparel accessories and other apparel manufacturing	31	0400000US08	11.777777777777779	85.33333333333333	1977.6666666666667
1474	08	8	0	Colorado	3161	Leather and hide tanning and finishing	31	0400000US08	3.2222222222222223	4.111111111111111	133.0
1475	08	8	0	Colorado	3162	Footwear manufacturing	31	0400000US08	6.222222222222222	17.11111111111111	350.1111111111111
1476	08	8	0	Colorado	3169	Other leather and allied product manufacturing	31	0400000US08	13.0	100.44444444444444	3575.1111111111113
1477	08	8	0	Colorado	3211	Sawmills and wood preservation	32	0400000US08	37.44444444444444	518.6666666666666	21442.88888888889
1478	08	8	0	Colorado	3212	Veneer, plywood, and engineered wood product manufacturing	32	0400000US08	32.77777777777778	735.5555555555555	37942.22222222222
1479	08	8	0	Colorado	3219	Other wood product manufacturing	32	0400000US08	153.88888888888889	2199.3333333333335	94404.77777777778
1480	08	8	0	Colorado	3222	Converted paper product manufacturing	32	0400000US08	31.666666666666668	1085.6666666666667	65561.66666666667
1481	08	8	0	Colorado	3231	Printing and related support activities	32	0400000US08	480.8888888888889	5712.666666666667	250230.11111111112
1482	08	8	0	Colorado	3241	Petroleum and coal products manufacturing	32	0400000US08	17.11111111111111	828.7777777777778	86532.11111111111
1483	08	8	0	Colorado	3251	Basic chemical manufacturing	32	0400000US08	24.555555555555557	630.0	43750.333333333336
1484	08	8	0	Colorado	3252	Resin, synthetic rubber, and artificial synthetic fibers and filaments manufacturing	32	0400000US08	9.444444444444445	108.77777777777777	5649.444444444444
1485	08	8	0	Colorado	3253	Pesticide, fertilizer, and other agricultural chemical manufacturing	32	0400000US08	18.0	172.55555555555554	7890.0
1486	08	8	0	Colorado	3254	Pharmaceutical and medicine manufacturing	32	0400000US08	69.22222222222223	2988.222222222222	237859.22222222222
1487	08	8	0	Colorado	3255	Paint, coating, and adhesive manufacturing	32	0400000US08	14.444444444444445	282.6666666666667	16855.0
1488	08	8	0	Colorado	3256	Soap, cleaning compound, and toilet preparation manufacturing	32	0400000US08	42.333333333333336	889.1111111111111	41493.666666666664
1489	08	8	0	Colorado	3259	Other chemical product and preparation manufacturing	32	0400000US08	32.888888888888886	1196.0	71510.33333333333
1490	08	8	0	Colorado	3261	Plastics product manufacturing	32	0400000US08	164.22222222222223	4768.888888888889	238897.44444444444
1491	08	8	0	Colorado	3262	Rubber product manufacturing	32	0400000US08	12.222222222222221	143.22222222222223	5825.333333333333
1492	08	8	0	Colorado	3271	Clay product and refractory manufacturing	32	0400000US08	30.444444444444443	924.5555555555555	54290.666666666664
1493	08	8	0	Colorado	3272	Glass and glass product manufacturing	32	0400000US08	31.0	887.3333333333334	58767.555555555555
1494	08	8	0	Colorado	3273	Cement and concrete product manufacturing	32	0400000US08	145.55555555555554	3546.5555555555557	196218.33333333334
1495	08	8	0	Colorado	3274	Lime and gypsum product manufacturing	32	0400000US08	3.888888888888889	0.0	0.0
1496	08	8	0	Colorado	3279	Other nonmetallic mineral product manufacturing	32	0400000US08	60.22222222222222	1047.2222222222222	46738.77777777778
1497	08	8	0	Colorado	3311	Iron and steel mills and ferroalloy manufacturing	33	0400000US08	8.666666666666666	525.6666666666666	35730.22222222222
1498	08	8	0	Colorado	3312	Steel product manufacturing from purchased steel	33	0400000US08	6.222222222222222	124.0	7217.222222222223
1499	08	8	0	Colorado	3313	Alumina and aluminum production and processing	33	0400000US08	3.6666666666666665	185.88888888888889	10942.555555555555
1500	08	8	0	Colorado	3314	Nonferrous metal (except aluminum) production and processing	33	0400000US08	6.888888888888889	72.0	2819.5555555555557
1501	08	8	0	Colorado	3315	Foundries	33	0400000US08	15.0	226.22222222222223	9216.333333333334
1502	08	8	0	Colorado	3321	Forging and stamping	33	0400000US08	17.0	279.0	14017.333333333334
1503	08	8	0	Colorado	3322	Cutlery and handtool manufacturing	33	0400000US08	11.88888888888889	201.0	8831.555555555555
1504	08	8	0	Colorado	3323	Architectural and structural metals manufacturing	33	0400000US08	205.77777777777777	4513.333333333333	229114.44444444444
1505	08	8	0	Colorado	3324	Boiler, tank, and shipping container manufacturing	33	0400000US08	19.77777777777778	1065.6666666666667	80702.77777777778
1506	08	8	0	Colorado	3325	Hardware manufacturing	33	0400000US08	7.444444444444445	426.77777777777777	20164.11111111111
1507	08	8	0	Colorado	3326	Spring and wire product manufacturing	33	0400000US08	18.88888888888889	589.1111111111111	30428.11111111111
1508	08	8	0	Colorado	3327	Machine shops; turned product; and screw, nut, and bolt manufacturing	33	0400000US08	327.44444444444446	4021.777777777778	189225.77777777778
1509	08	8	0	Colorado	3328	Coating, engraving, heat treating, and allied activities	33	0400000US08	66.0	821.0	31196.444444444445
1510	08	8	0	Colorado	3329	Other fabricated metal product manufacturing	33	0400000US08	94.88888888888889	1388.111111111111	79606.88888888889
1511	08	8	0	Colorado	3331	Agriculture, construction, and mining machinery manufacturing	33	0400000US08	44.44444444444444	1024.5555555555557	53922.555555555555
1512	08	8	0	Colorado	3332	Industrial machinery manufacturing	33	0400000US08	48.111111111111114	839.5555555555555	54740.444444444445
1513	08	8	0	Colorado	3333	Commercial and service industry machinery manufacturing	33	0400000US08	46.666666666666664	2020.2222222222222	116535.22222222222
1514	08	8	0	Colorado	3334	Ventilation, heating, air-conditioning, and commercial refrigeration equipment manufacturing	33	0400000US08	26.11111111111111	1064.3333333333333	58859.333333333336
1515	08	8	0	Colorado	3335	Metalworking machinery manufacturing	33	0400000US08	55.22222222222222	815.6666666666666	42229.88888888889
1516	08	8	0	Colorado	3336	Engine, turbine, and power transmission equipment manufacturing	33	0400000US08	16.333333333333332	2714.222222222222	165478.44444444444
1517	08	8	0	Colorado	3339	Other general purpose machinery manufacturing	33	0400000US08	85.88888888888889	2559.6666666666665	177308.66666666666
1518	08	8	0	Colorado	3341	Computer and peripheral equipment manufacturing	33	0400000US08	23.77777777777778	491.8888888888889	38603.555555555555
1519	08	8	0	Colorado	3342	Communications equipment manufacturing	33	0400000US08	27.22222222222222	917.0	85754.44444444444
1520	08	8	0	Colorado	3343	Audio and video equipment manufacturing	33	0400000US08	16.11111111111111	80.33333333333333	6036.666666666667
1521	08	8	0	Colorado	3344	Semiconductor and other electronic component manufacturing	33	0400000US08	90.33333333333333	4671.111111111111	363935.22222222225
1522	08	8	0	Colorado	3345	Navigational, measuring, electromedical, and control instruments manufacturing	33	0400000US08	128.88888888888889	6116.666666666667	537542.8888888889
1523	08	8	0	Colorado	3346	Manufacturing and reproducing magnetic and optical media	33	0400000US08	11.777777777777779	69.11111111111111	3424.3333333333335
1524	08	8	0	Colorado	3351	Electric lighting equipment manufacturing	33	0400000US08	12.333333333333334	690.4444444444445	31616.0
1525	08	8	0	Colorado	3352	Household appliance manufacturing	33	0400000US08	3.7777777777777777	11.333333333333334	860.6666666666666
1526	08	8	0	Colorado	3353	Electrical equipment manufacturing	33	0400000US08	30.11111111111111	442.6666666666667	28168.11111111111
1527	08	8	0	Colorado	3359	Other electrical equipment and component manufacturing	33	0400000US08	30.77777777777778	708.5555555555555	45946.444444444445
1528	08	8	0	Colorado	3361	Motor vehicle manufacturing	33	0400000US08	5.0	5.333333333333333	341.1111111111111
1529	08	8	0	Colorado	3362	Motor vehicle body and trailer manufacturing	33	0400000US08	33.888888888888886	766.7777777777778	38902.77777777778
1530	08	8	0	Colorado	3363	Motor vehicle parts manufacturing	33	0400000US08	52.55555555555556	1114.0	69209.11111111111
1531	08	8	0	Colorado	3364	Aerospace product and parts manufacturing	33	0400000US08	26.666666666666668	0.0	0.0
1532	08	8	0	Colorado	3365	Railroad rolling stock manufacturing	33	0400000US08	2.8	15.0	738.6
1533	08	8	0	Colorado	3366	Ship and boat building	33	0400000US08	3.111111111111111	7.111111111111111	701.6666666666666
1534	08	8	0	Colorado	3369	Other transportation equipment manufacturing	33	0400000US08	31.444444444444443	228.22222222222223	10849.555555555555
1535	08	8	0	Colorado	3371	Household and institutional furniture and kitchen cabinet manufacturing	33	0400000US08	197.55555555555554	1557.4444444444443	59234.666666666664
1536	08	8	0	Colorado	3372	Office furniture (including fixtures) manufacturing	33	0400000US08	71.0	1141.2222222222222	51183.333333333336
1537	08	8	0	Colorado	3379	Other furniture related product manufacturing	33	0400000US08	16.22222222222222	917.4444444444445	49460.333333333336
1538	08	8	0	Colorado	3391	Medical equipment and supplies manufacturing	33	0400000US08	251.11111111111111	4049.5555555555557	348670.3333333333
1539	08	8	0	Colorado	3399	Other miscellaneous manufacturing	33	0400000US08	376.3333333333333	3845.5555555555557	174977.22222222222
1540	08	8	0	Colorado	4231	Motor vehicle and motor vehicle parts and supplies merchant wholesalers	42	0400000US08	361.77777777777777	5366.0	293479.22222222225
1541	08	8	0	Colorado	4232	Furniture and home furnishing merchant wholesalers	42	0400000US08	237.44444444444446	2875.5555555555557	170328.55555555556
1542	08	8	0	Colorado	4233	Lumber and other construction materials merchant wholesalers	42	0400000US08	364.22222222222223	4811.444444444444	284090.22222222225
1543	08	8	0	Colorado	4234	Professional and commercial equipment and supplies merchant wholesalers	42	0400000US08	722.2222222222222	15521.888888888889	1538188.4444444445
1544	08	8	0	Colorado	4235	Metal and mineral (except petroleum) merchant wholesalers	42	0400000US08	180.0	2402.777777777778	171848.0
1545	08	8	0	Colorado	4236	Household appliances and electrical and electronic goods merchant wholesalers	42	0400000US08	552.1111111111111	8793.444444444445	1067071.0
1546	08	8	0	Colorado	4237	Hardware, plumbing and heating equipment and supplies merchant wholesalers	42	0400000US08	324.77777777777777	4473.666666666667	265184.3333333333
1547	08	8	0	Colorado	4238	Machinery, equipment, and supplies merchant wholesalers	42	0400000US08	937.5555555555555	11601.111111111111	810898.7777777778
1548	08	8	0	Colorado	4239	Miscellaneous durable goods merchant wholesalers	42	0400000US08	504.44444444444446	4759.111111111111	261291.22222222222
1549	08	8	0	Colorado	4241	Paper and paper product merchant wholesalers	42	0400000US08	173.44444444444446	2335.0	141658.22222222222
1550	08	8	0	Colorado	4242	Drugs and druggists' sundries merchant wholesalers	42	0400000US08	192.22222222222223	3844.6666666666665	400072.77777777775
1551	08	8	0	Colorado	4243	Apparel, piece goods, and notions merchant wholesalers	42	0400000US08	170.11111111111111	2230.1111111111113	137360.88888888888
1552	08	8	0	Colorado	4244	Grocery and related product merchant wholesalers	42	0400000US08	559.6666666666666	12275.222222222223	683417.0
1553	08	8	0	Colorado	4245	Farm product raw material merchant wholesalers	42	0400000US08	112.33333333333333	771.7777777777778	38500.444444444445
1554	08	8	0	Colorado	4246	Chemical and allied products merchant wholesalers	42	0400000US08	213.11111111111111	2328.0	165314.0
1555	08	8	0	Colorado	4247	Petroleum and petroleum products merchant wholesalers	42	0400000US08	112.88888888888889	1497.0	104016.88888888889
1556	08	8	0	Colorado	4248	Beer, wine, and distilled alcoholic beverage merchant wholesalers	42	0400000US08	101.11111111111111	3113.777777777778	187985.66666666666
1557	08	8	0	Colorado	4249	Miscellaneous nondurable goods merchant wholesalers	42	0400000US08	452.44444444444446	4586.555555555556	263218.8888888889
1558	08	8	0	Colorado	4251	Wholesale electronic markets and agents and brokers	42	0400000US08	964.6666666666666	4960.888888888889	275101.55555555556
1559	08	8	0	Colorado	4411	Automobile dealers	44	0400000US08	683.4444444444445	21509.777777777777	1217709.6666666667
1560	08	8	0	Colorado	4412	Other motor vehicle dealers	44	0400000US08	233.88888888888889	3024.777777777778	141824.77777777778
1561	08	8	0	Colorado	4413	Automotive parts, accessories, and tire stores	44	0400000US08	1016.8888888888889	9608.777777777777	311403.77777777775
1562	08	8	0	Colorado	4421	Furniture stores	44	0400000US08	320.3333333333333	4016.777777777778	178266.66666666666
1563	08	8	0	Colorado	4422	Home furnishings stores	44	0400000US08	569.2222222222222	4842.444444444444	135954.11111111112
1564	08	8	0	Colorado	4431	Electronics and appliance stores	44	0400000US08	712.2222222222222	7096.444444444444	221559.66666666666
1565	08	8	0	Colorado	4441	Building material and supplies dealers	44	0400000US08	1034.3333333333333	21009.222222222223	663873.0
1566	08	8	0	Colorado	4442	Lawn and garden equipment and supplies stores	44	0400000US08	328.0	3250.4444444444443	107650.44444444444
1567	08	8	0	Colorado	4451	Grocery stores	44	0400000US08	1011.6666666666666	43732.333333333336	1257366.5555555555
1568	08	8	0	Colorado	4452	Specialty food stores	44	0400000US08	379.22222222222223	2472.8888888888887	43358.333333333336
1569	08	8	0	Colorado	4453	Beer, wine, and liquor stores	44	0400000US08	1303.3333333333333	6385.0	147670.0
1570	08	8	0	Colorado	4461	Health and personal care stores	44	0400000US08	1263.6666666666667	13293.888888888889	425693.77777777775
1571	08	8	0	Colorado	4471	Gasoline stations	44	0400000US08	1591.111111111111	13576.222222222223	284224.8888888889
1572	08	8	0	Colorado	4481	Clothing stores	44	0400000US08	1669.7777777777778	20953.444444444445	363762.1111111111
1573	08	8	0	Colorado	4482	Shoe stores	44	0400000US08	348.1111111111111	2941.0	53849.11111111111
1574	08	8	0	Colorado	4483	Jewelry, luggage, and leather goods stores	44	0400000US08	342.8888888888889	1861.888888888889	61805.0
1575	08	8	0	Colorado	4511	Sporting goods, hobby, and musical instrument stores	45	0400000US08	1170.888888888889	13933.0	265598.1111111111
1576	08	8	0	Colorado	4512	Book stores and news dealers	45	0400000US08	126.22222222222223	1568.6666666666667	25672.11111111111
1577	08	8	0	Colorado	4521	Department stores	45	0400000US08	124.2	12640.8	240207.2
1578	08	8	0	Colorado	4522	Department stores	45	0400000US08	75.0	6797.0	134098.0
1579	08	8	0	Colorado	4523	General merchandise stores, including warehouse clubs and supercenters	45	0400000US08	518.0	36959.0	1024018.0
1580	08	8	0	Colorado	4529	Other general merchandise stores	45	0400000US08	503.4	13958.6	877298.0
1581	08	8	0	Colorado	4531	Florists	45	0400000US08	189.77777777777777	1000.0	18001.444444444445
1582	08	8	0	Colorado	4532	Office supplies, stationery, and gift stores	45	0400000US08	635.5555555555555	4024.4444444444443	81344.22222222222
1583	08	8	0	Colorado	4533	Used merchandise stores	45	0400000US08	452.3333333333333	5049.666666666667	94345.77777777778
1584	08	8	0	Colorado	4539	Other miscellaneous store retailers	45	0400000US08	1111.5555555555557	8495.666666666666	241747.55555555556
1585	08	8	0	Colorado	4541	Electronic shopping and mail-order houses	45	0400000US08	913.4444444444445	6289.888888888889	279932.55555555556
1586	08	8	0	Colorado	4542	Vending machine operators	45	0400000US08	51.22222222222222	281.55555555555554	9855.777777777777
1587	08	8	0	Colorado	4543	Direct selling establishments	45	0400000US08	686.0	3024.777777777778	116092.66666666667
1588	08	8	0	Colorado	4811	Scheduled air transportation	48	0400000US08	44.888888888888886	15059.666666666666	1080299.6666666667
1589	08	8	0	Colorado	4812	Nonscheduled air transportation	48	0400000US08	51.22222222222222	591.7777777777778	40804.11111111111
1590	08	8	0	Colorado	4831	Deep sea, coastal, and great lakes water transportation	48	0400000US08	1.5	0.0	0.0
1591	08	8	0	Colorado	4832	Inland water transportation	48	0400000US08	1.8	0.0	0.0
1592	08	8	0	Colorado	4841	General freight trucking	48	0400000US08	1012.5555555555555	10848.0	546371.8888888889
1593	08	8	0	Colorado	4842	Specialized freight trucking	48	0400000US08	1063.111111111111	9380.0	451632.3333333333
1594	08	8	0	Colorado	4851	Urban transit systems	48	0400000US08	11.11111111111111	765.5555555555555	42172.444444444445
1595	08	8	0	Colorado	4852	Interurban and rural bus transportation	48	0400000US08	5.111111111111111	5.555555555555555	262.6666666666667
1596	08	8	0	Colorado	4853	Taxi and limousine service	48	0400000US08	109.0	842.8888888888889	37496.333333333336
1597	08	8	0	Colorado	4854	School and employee bus transportation	48	0400000US08	15.555555555555555	820.4444444444445	22816.555555555555
1598	08	8	0	Colorado	4855	Charter bus industry	48	0400000US08	15.777777777777779	480.0	15856.555555555555
1599	08	8	0	Colorado	4859	Other transit and ground passenger transportation	48	0400000US08	82.33333333333333	1954.2222222222222	51285.444444444445
1600	08	8	0	Colorado	4861	Pipeline transportation of crude oil	48	0400000US08	18.333333333333332	115.22222222222223	11946.0
1601	08	8	0	Colorado	4862	Pipeline transportation of natural gas	48	0400000US08	70.88888888888889	836.8888888888889	114284.66666666667
1602	08	8	0	Colorado	4869	Other pipeline transportation	48	0400000US08	11.0	75.0	10595.777777777777
1603	08	8	0	Colorado	4871	Scenic and sightseeing transportation, land	48	0400000US08	24.11111111111111	445.1111111111111	17733.666666666668
1604	08	8	0	Colorado	4872	Scenic and sightseeing transportation, water	48	0400000US08	3.0	5.333333333333333	232.66666666666666
1605	08	8	0	Colorado	4879	Scenic and sightseeing transportation, other	48	0400000US08	12.666666666666666	84.77777777777777	3224.222222222222
1606	08	8	0	Colorado	4881	Support activities for air transportation	48	0400000US08	118.33333333333333	2901.5555555555557	118229.33333333333
1607	08	8	0	Colorado	4882	Support activities for rail transportation	48	0400000US08	21.555555555555557	318.0	12326.555555555555
1608	08	8	0	Colorado	4883	Support activities for water transportation	48	0400000US08	1.5	0.0	0.0
1609	08	8	0	Colorado	4884	Support activities for road transportation	48	0400000US08	213.55555555555554	1563.7777777777778	59226.11111111111
1610	08	8	0	Colorado	4885	Freight transportation arrangement	48	0400000US08	217.44444444444446	1745.0	92197.0
1611	08	8	0	Colorado	4889	Other support activities for transportation	48	0400000US08	20.22222222222222	149.0	5346.666666666667
1612	08	8	0	Colorado	4921	Couriers and express delivery services	49	0400000US08	214.44444444444446	9231.555555555555	387431.8888888889
1613	08	8	0	Colorado	4922	Local messengers and local delivery	49	0400000US08	93.88888888888889	766.2222222222222	22821.777777777777
1614	08	8	0	Colorado	4931	Warehousing and storage	49	0400000US08	229.11111111111111	7188.222222222223	330644.77777777775
1615	08	8	0	Colorado	5111	Newspaper, periodical, book, and directory publishers	51	0400000US08	420.1111111111111	6656.555555555556	402591.3333333333
1616	08	8	0	Colorado	5112	Software publishers	51	0400000US08	357.1111111111111	13019.777777777777	1605182.7777777778
1617	08	8	0	Colorado	5121	Motion picture and video industries	51	0400000US08	387.8888888888889	4331.777777777777	109512.0
1618	08	8	0	Colorado	5122	Sound recording industries	51	0400000US08	49.0	267.44444444444446	16829.555555555555
1619	08	8	0	Colorado	5151	Radio and television broadcasting	51	0400000US08	159.55555555555554	3072.3333333333335	185105.11111111112
1620	08	8	0	Colorado	5152	Cable and other subscription programming	51	0400000US08	11.333333333333334	649.6666666666666	104999.88888888889
1621	08	8	0	Colorado	5171	Wired telecommunications carriers	51	0400000US08	775.8	32968.6	2975973.8
1622	08	8	0	Colorado	5172	Wireless telecommunications carriers (except satellite)	51	0400000US08	207.0	4562.4	334593.6
1623	08	8	0	Colorado	5173	Wired and wireless telecommunications carriers	51	0400000US08	1127.0	39386.0	3244496.0
1624	08	8	0	Colorado	5174	Satellite telecommunications	51	0400000US08	8.88888888888889	182.22222222222223	19741.333333333332
1625	08	8	0	Colorado	5179	Other telecommunications	51	0400000US08	137.11111111111111	973.2222222222222	71982.22222222222
1626	08	8	0	Colorado	5182	Data processing, hosting, and related services	51	0400000US08	485.0	14915.777777777777	1228493.0
1627	08	8	0	Colorado	5191	Other information services	51	0400000US08	280.44444444444446	4158.555555555556	471381.55555555556
1628	08	8	0	Colorado	5211	Monetary authorities - central bank	52	0400000US08	1.0	0.0	0.0
1629	08	8	0	Colorado	5221	Depository credit intermediation	52	0400000US08	1994.2222222222222	26210.88888888889	1708600.2222222222
