"GEO_ID","GEO_TTL","COUNTY","YEAR","NAICS2012","NAICS2012_TTL","ESTAB","EMP","PAYANN","state",
"0400000US06","California",null,"2016","00","Total for all sectors","922477","14600349","886643923","06",
"0400000US06","California",null,"2016","11","Agriculture, forestry, fishing and hunting","1912","27481","1084357","06",
"0400000US06","California",null,"2016","113","Forestry and logging","234","1668","105613","06",
"0400000US06","California",null,"2016","238","Specialty trade contractors","44724","488930","28561169","06",
"0400000US06","California",null,"2016","1131","Timber tract operations","14","346","21541","06",
"0400000US06","California",null,"2016","11311","Timber tract operations","14","346","21541","06",
"0400000US06","California",null,"2016","113110","Timber tract operations","14","346","21541","06",
"0400000US06","California",null,"2016","1132","Forest nurseries and gathering of forest products","9","70","2532","06",
"0400000US06","California",null,"2016","11321","Forest nurseries and gathering of forest products","9","70","2532","06",
"0400000US06","California",null,"2016","113210","Forest nurseries and gathering of forest products","9","70","2532","06",
"0400000US06","California",null,"2016","1133","Logging","211","1252","81540","06",
"0400000US06","California",null,"2016","11331","Logging","211","1252","81540","06",
"0400000US06","California",null,"2016","113310","Logging","211","1252","81540","06",
"0400000US06","California",null,"2016","114","Fishing, hunting and trapping","144","299","17590","06",
"0400000US06","California",null,"2016","1141","Fishing","126","233","16171","06",
"0400000US06","California",null,"2016","11411","Fishing","126","233","16171","06",
"0400000US06","California",null,"2016","114111","Finfish fishing","83","194","13653","06",
"0400000US06","California",null,"2016","114112","Shellfish fishing","39","31","2442","06",
"0400000US06","California",null,"2016","114119","Other marine fishing","4","8","76","06",
"0400000US06","California",null,"2016","1142","Hunting and trapping","18","66","1419","06",
"0400000US06","California",null,"2016","11421","Hunting and trapping","18","66","1419","06",
"0400000US06","California",null,"2016","114210","Hunting and trapping","18","66","1419","06",
"0400000US06","California",null,"2016","115","Support activities for agriculture and forestry","1534","25514","961154","06",
"0400000US06","California",null,"2016","1151","Support activities for crop production","928","22933","865530","06",
"0400000US06","California",null,"2016","11511","Support activities for crop production","928","22933","865530","06",
"0400000US06","California",null,"2016","115111","Cotton ginning","19","117","8317","06",
"0400000US06","California",null,"2016","115112","Soil preparation, planting, and cultivating","301","2322","96523","06",
"0400000US06","California",null,"2016","115113","Crop harvesting, primarily by machine","63","657","38749","06",
"0400000US06","California",null,"2016","115114","Postharvest crop activities (except cotton ginning)","240","10832","455519","06",
"0400000US06","California",null,"2016","115115","Farm labor contractors and crew leaders","187","7112","184327","06",
"0400000US06","California",null,"2016","115116","Farm management services","118","1893","82095","06",
"0400000US06","California",null,"2016","1152","Support activities for animal production","525","1980","63983","06",
"0400000US06","California",null,"2016","11521","Support activities for animal production","525","1980","63983","06",
"0400000US06","California",null,"2016","115210","Support activities for animal production","525","1980","63983","06",
"0400000US06","California",null,"2016","1153","Support activities for forestry","81","601","31641","06",
"0400000US06","California",null,"2016","11531","Support activities for forestry","81","601","31641","06",
"0400000US06","California",null,"2016","115310","Support activities for forestry","81","601","31641","06",
"0400000US06","California",null,"2016","21","Mining, quarrying, and oil and gas extraction","765","20933","1765735","06",
"0400000US06","California",null,"2016","211","Oil and gas extraction","209","5640","729101","06",
"0400000US06","California",null,"2016","2111","Oil and gas extraction","209","5640","729101","06",
"0400000US06","California",null,"2016","21111","Oil and gas extraction","209","5640","729101","06",
"0400000US06","California",null,"2016","211111","Crude petroleum and natural gas extraction","201","5317","694788","06",
"0400000US06","California",null,"2016","211112","Natural gas liquid extraction","8","323","34313","06",
"0400000US06","California",null,"2016","212","Mining (except oil and gas)","262","5324","388041","06",
"0400000US06","California",null,"2016","2121","Coal mining","3","18","1740","06",
"0400000US06","California",null,"2016","21211","Coal mining","3","18","1740","06",
"0400000US06","California",null,"2016","212111","Bituminous coal and lignite surface mining","2","0","0","06",
"0400000US06","California",null,"2016","212112","Bituminous coal underground mining","1","0","0","06",
"0400000US06","California",null,"2016","2122","Metal ore mining","16","558","41516","06",
"0400000US06","California",null,"2016","21221","Iron ore mining","1","0","0","06",
"0400000US06","California",null,"2016","212210","Iron ore mining","1","0","0","06",
"0400000US06","California",null,"2016","21222","Gold ore and silver ore mining","14","508","38264","06",
"0400000US06","California",null,"2016","212221","Gold ore mining","14","508","38264","06",
"0400000US06","California",null,"2016","21229","Other metal ore mining","1","0","0","06",
"0400000US06","California",null,"2016","212299","All other metal ore mining","1","0","0","06",
"0400000US06","California",null,"2016","2123","Nonmetallic mineral mining and quarrying","243","4748","344785","06",
"0400000US06","California",null,"2016","21231","Stone mining and quarrying","78","1327","92683","06",
"0400000US06","California",null,"2016","212311","Dimension stone mining and quarrying","8","140","12412","06",
"0400000US06","California",null,"2016","212312","Crushed and broken limestone mining and quarrying","25","572","41096","06",
"0400000US06","California",null,"2016","212313","Crushed and broken granite mining and quarrying","19","211","14612","06",
"0400000US06","California",null,"2016","212319","Other crushed and broken stone mining and quarrying","26","404","24563","06",
"0400000US06","California",null,"2016","21232","Sand, gravel, clay, and ceramic and refractory minerals mining and quarrying","137","1924","148826","06",
"0400000US06","California",null,"2016","212321","Construction sand and gravel mining","124","1743","138395","06",
"0400000US06","California",null,"2016","212322","Industrial sand mining","7","96","5980","06",
"0400000US06","California",null,"2016","212324","Kaolin and ball clay mining","1","0","0","06",
"0400000US06","California",null,"2016","212325","Clay and ceramic and refractory minerals mining","5","78","4071","06",
"0400000US06","California",null,"2016","21239","Other nonmetallic mineral mining and quarrying","28","1497","103276","06",
"0400000US06","California",null,"2016","212391","Potash, soda, and borate mineral mining","4","0","0","06",
"0400000US06","California",null,"2016","212393","Other chemical and fertilizer mineral mining","1","0","0","06",
"0400000US06","California",null,"2016","212399","All other nonmetallic mineral mining","23","536","28366","06",
"0400000US06","California",null,"2016","213","Support activities for mining","294","9969","648593","06",
"0400000US06","California",null,"2016","2131","Support activities for mining","294","9969","648593","06",
"0400000US06","California",null,"2016","21311","Support activities for mining","294","9969","648593","06",
"0400000US06","California",null,"2016","213111","Drilling oil and gas wells","60","1369","79582","06",
"0400000US06","California",null,"2016","213112","Support activities for oil and gas operations","216","8469","558422","06",
"0400000US06","California",null,"2016","213113","Support activities for coal mining","2","0","0","06",
"0400000US06","California",null,"2016","213114","Support activities for metal mining","9","41","4088","06",
"0400000US06","California",null,"2016","213115","Support activities for nonmetallic minerals (except fuels) mining","7","55","4007","06",
"0400000US06","California",null,"2016","22","Utilities","1260","59601","7131984","06",
"0400000US06","California",null,"2016","221","Utilities","1260","59601","7131984","06",
"0400000US06","California",null,"2016","2211","Electric power generation, transmission and distribution","555","44260","5818760","06",
"0400000US06","California",null,"2016","22111","Electric power generation","256","4774","535426","06",
"0400000US06","California",null,"2016","221111","Hydroelectric power generation","34","305","33719","06",
"0400000US06","California",null,"2016","221112","Fossil fuel electric power generation","72","1219","166626","06",
"0400000US06","California",null,"2016","221113","Nuclear electric power generation","1","0","0","06",
"0400000US06","California",null,"2016","221114","Solar electric power generation","40","413","47169","06",
"0400000US06","California",null,"2016","221115","Wind electric power generation","35","750","77919","06",
"0400000US06","California",null,"2016","221116","Geothermal electric power generation","13","760","80288","06",
"0400000US06","California",null,"2016","221117","Biomass electric power generation","10","77","6666","06",
"0400000US06","California",null,"2016","221118","Other electric power generation","51","763","68110","06",
"0400000US06","California",null,"2016","22112","Electric power transmission, control, and distribution","299","39486","5283334","06",
"0400000US06","California",null,"2016","221121","Electric bulk power transmission and control","4","0","0","06",
"0400000US06","California",null,"2016","221122","Electric power distribution","295","38932","5197030","06",
"0400000US06","California",null,"2016","2212","Natural gas distribution","221","0","0","06",
"0400000US06","California",null,"2016","22121","Natural gas distribution","221","0","0","06",
"0400000US06","California",null,"2016","221210","Natural gas distribution","221","0","0","06",
"0400000US06","California",null,"2016","2213","Water, sewage and other systems","484","4889","383296","06",
"0400000US06","California",null,"2016","22131","Water supply and irrigation systems","429","4445","347727","06",
"0400000US06","California",null,"2016","221310","Water supply and irrigation systems","429","4445","347727","06",
"0400000US06","California",null,"2016","22132","Sewage treatment facilities","42","340","23609","06",
"0400000US06","California",null,"2016","221320","Sewage treatment facilities","42","340","23609","06",
"0400000US06","California",null,"2016","22133","Steam and air-conditioning supply","13","104","11960","06",
"0400000US06","California",null,"2016","221330","Steam and air-conditioning supply","13","104","11960","06",
"0400000US06","California",null,"2016","23","Construction","71981","723574","45542694","06",
"0400000US06","California",null,"2016","236","Construction of buildings","23977","163563","11057923","06",
"0400000US06","California",null,"2016","2361","Residential building construction","19402","93955","5264828","06",
"0400000US06","California",null,"2016","23611","Residential building construction","19402","93955","5264828","06",
"0400000US06","California",null,"2016","236115","New single-family housing construction (except for-sale builders)","5486","24717","1401114","06",
"0400000US06","California",null,"2016","236116","New multifamily housing construction (except for-sale builders)","304","5684","446622","06",
"0400000US06","California",null,"2016","236117","New housing for-sale builders","826","10241","985094","06",
"0400000US06","California",null,"2016","236118","Residential remodelers","12786","53313","2431998","06",
"0400000US06","California",null,"2016","2362","Nonresidential building construction","4575","69608","5793095","06",
"0400000US06","California",null,"2016","23621","Industrial building construction","364","5249","405474","06",
"0400000US06","California",null,"2016","236210","Industrial building construction","364","5249","405474","06",
"0400000US06","California",null,"2016","23622","Commercial and institutional building construction","4211","64359","5387621","06",
"0400000US06","California",null,"2016","236220","Commercial and institutional building construction","4211","64359","5387621","06",
"0400000US06","California",null,"2016","237","Heavy and civil engineering construction","3280","71081","5923602","06",
"0400000US06","California",null,"2016","2371","Utility system construction","1459","39227","3078668","06",
"0400000US06","California",null,"2016","23711","Water and sewer line and related structures construction","886","17484","1365784","06",
"0400000US06","California",null,"2016","237110","Water and sewer line and related structures construction","886","17484","1365784","06",
"0400000US06","California",null,"2016","23712","Oil and gas pipeline and related structures construction","112","6421","417585","06",
"0400000US06","California",null,"2016","237120","Oil and gas pipeline and related structures construction","112","6421","417585","06",
"0400000US06","California",null,"2016","23713","Power and communication line and related structures construction","461","15322","1295299","06",
"0400000US06","California",null,"2016","237130","Power and communication line and related structures construction","461","15322","1295299","06",
"0400000US06","California",null,"2016","2372","Land subdivision","717","3671","309975","06",
"0400000US06","California",null,"2016","23721","Land subdivision","717","3671","309975","06",
"0400000US06","California",null,"2016","237210","Land subdivision","717","3671","309975","06",
"0400000US06","California",null,"2016","2373","Highway, street, and bridge construction","770","22914","2093428","06",
"0400000US06","California",null,"2016","23731","Highway, street, and bridge construction","770","22914","2093428","06",
"0400000US06","California",null,"2016","237310","Highway, street, and bridge construction","770","22914","2093428","06",
"0400000US06","California",null,"2016","2379","Other heavy and civil engineering construction","334","5269","441531","06",
"0400000US06","California",null,"2016","23799","Other heavy and civil engineering construction","334","5269","441531","06",
"0400000US06","California",null,"2016","237990","Other heavy and civil engineering construction","334","5269","441531","06",
"0400000US06","California",null,"2016","312130","Wineries","1461","30048","1882137","06",
"0400000US06","California",null,"2016","2381","Foundation, structure, and building exterior contractors","7991","103660","5425554","06",
"0400000US06","California",null,"2016","23811","Poured concrete foundation and structure contractors","1768","28470","1701429","06",
"0400000US06","California",null,"2016","238110","Poured concrete foundation and structure contractors","1768","28470","1701429","06",
"0400000US06","California",null,"2016","23812","Structural steel and precast concrete contractors","425","10782","655908","06",
"0400000US06","California",null,"2016","238120","Structural steel and precast concrete contractors","425","10782","655908","06",
"0400000US06","California",null,"2016","23813","Framing contractors","816","18780","744159","06",
"0400000US06","California",null,"2016","238130","Framing contractors","816","18780","744159","06",
"0400000US06","California",null,"2016","23814","Masonry contractors","1226","12330","525285","06",
"0400000US06","California",null,"2016","238140","Masonry contractors","1226","12330","525285","06",
"0400000US06","California",null,"2016","23815","Glass and glazing contractors","782","7301","478161","06",
"0400000US06","California",null,"2016","238150","Glass and glazing contractors","782","7301","478161","06",
"0400000US06","California",null,"2016","23816","Roofing contractors","2169","19056","928938","06",
"0400000US06","California",null,"2016","238160","Roofing contractors","2169","19056","928938","06",
"0400000US06","California",null,"2016","23817","Siding contractors","244","2065","99785","06",
"0400000US06","California",null,"2016","238170","Siding contractors","244","2065","99785","06",
"0400000US06","California",null,"2016","23819","Other foundation, structure, and building exterior contractors","561","4876","291889","06",
"0400000US06","California",null,"2016","238190","Other foundation, structure, and building exterior contractors","561","4876","291889","06",
"0400000US06","California",null,"2016","2382","Building equipment contractors","18563","207527","13757744","06",
"0400000US06","California",null,"2016","23821","Electrical contractors and other wiring installation contractors","8210","89934","6057025","06",
"0400000US06","California",null,"2016","238210","Electrical contractors and other wiring installation contractors","8210","89934","6057025","06",
"0400000US06","California",null,"2016","23822","Plumbing, heating, and air-conditioning contractors","9735","107221","6839897","06",
"0400000US06","California",null,"2016","238220","Plumbing, heating, and air-conditioning contractors","9735","107221","6839897","06",
"0400000US06","California",null,"2016","23829","Other building equipment contractors","618","10372","860822","06",
"0400000US06","California",null,"2016","238290","Other building equipment contractors","618","10372","860822","06",
"0400000US06","California",null,"2016","2383","Building finishing contractors","12765","119670","5830862","06",
"0400000US06","California",null,"2016","23831","Drywall and insulation contractors","2104","42043","2268169","06",
"0400000US06","California",null,"2016","238310","Drywall and insulation contractors","2104","42043","2268169","06",
"0400000US06","California",null,"2016","23832","Painting and wall covering contractors","4168","28415","1211532","06",
"0400000US06","California",null,"2016","238320","Painting and wall covering contractors","4168","28415","1211532","06",
"0400000US06","California",null,"2016","23833","Flooring contractors","1755","11033","520523","06",
"0400000US06","California",null,"2016","238330","Flooring contractors","1755","11033","520523","06",
"0400000US06","California",null,"2016","23834","Tile and terrazzo contractors","1538","11633","502277","06",
"0400000US06","California",null,"2016","238340","Tile and terrazzo contractors","1538","11633","502277","06",
"0400000US06","California",null,"2016","23835","Finish carpentry contractors","2390","17329","854405","06",
"0400000US06","California",null,"2016","238350","Finish carpentry contractors","2390","17329","854405","06",
"0400000US06","California",null,"2016","23839","Other building finishing contractors","810","9217","473956","06",
"0400000US06","California",null,"2016","238390","Other building finishing contractors","810","9217","473956","06",
"0400000US06","California",null,"2016","2389","Other specialty trade contractors","5405","58073","3547009","06",
"0400000US06","California",null,"2016","23891","Site preparation contractors","2304","27056","1828202","06",
"0400000US06","California",null,"2016","238910","Site preparation contractors","2304","27056","1828202","06",
"0400000US06","California",null,"2016","23899","All other specialty trade contractors","3101","31017","1718807","06",
"0400000US06","California",null,"2016","238990","All other specialty trade contractors","3101","31017","1718807","06",
"0400000US06","California",null,"2016","31-33","Manufacturing","38103","1154342","77025732","06",
"0400000US06","California",null,"2016","311","Food manufacturing","3607","163490","7607613","06",
"0400000US06","California",null,"2016","3111","Animal food manufacturing","133","6645","275410","06",
"0400000US06","California",null,"2016","31111","Animal food manufacturing","133","6645","275410","06",
"0400000US06","California",null,"2016","311111","Dog and cat food manufacturing","45","4560","156294","06",
"0400000US06","California",null,"2016","311119","Other animal food manufacturing","88","2085","119116","06",
"0400000US06","California",null,"2016","3112","Grain and oilseed milling","95","3874","224952","06",
"0400000US06","California",null,"2016","31121","Flour milling and malt manufacturing","41","2111","121721","06",
"0400000US06","California",null,"2016","311211","Flour milling","23","624","36860","06",
"0400000US06","California",null,"2016","311212","Rice milling","16","1463","83249","06",
"0400000US06","California",null,"2016","311213","Malt manufacturing","2","0","0","06",
"0400000US06","California",null,"2016","31122","Starch and vegetable fats and oils manufacturing","45","1532","87784","06",
"0400000US06","California",null,"2016","311221","Wet corn milling","3","125","8959","06",
"0400000US06","California",null,"2016","311224","Soybean and other oilseed processing","19","301","14250","06",
"0400000US06","California",null,"2016","311225","Fats and oils refining and blending","23","1106","64575","06",
"0400000US06","California",null,"2016","31123","Breakfast cereal manufacturing","9","231","15447","06",
"0400000US06","California",null,"2016","311230","Breakfast cereal manufacturing","9","231","15447","06",
"0400000US06","California",null,"2016","3113","Sugar and confectionery product manufacturing","198","11566","529080","06",
"0400000US06","California",null,"2016","31131","Sugar manufacturing","9","1346","115578","06",
"0400000US06","California",null,"2016","311313","Beet sugar manufacturing","4","0","0","06",
"0400000US06","California",null,"2016","311314","Cane sugar manufacturing","5","0","0","06",
"0400000US06","California",null,"2016","31134","Nonchocolate confectionery manufacturing","55","2665","138647","06",
"0400000US06","California",null,"2016","311340","Nonchocolate confectionery manufacturing","55","2665","138647","06",
"0400000US06","California",null,"2016","31135","Chocolate and chocolate confectionery manufacturing","134","7555","274855","06",
"0400000US06","California",null,"2016","311351","Chocolate and confectionery manufacturing from cacao beans","32","1218","59944","06",
"0400000US06","California",null,"2016","311352","Confectionery manufacturing from purchased chocolate","102","6337","214911","06",
"0400000US06","California",null,"2016","3114","Fruit and vegetable preserving and specialty food manufacturing","328","25767","1338768","06",
"0400000US06","California",null,"2016","31141","Frozen food manufacturing","101","11274","472494","06",
"0400000US06","California",null,"2016","311411","Frozen fruit, juice, and vegetable manufacturing","41","3588","161688","06",
"0400000US06","California",null,"2016","311412","Frozen specialty food manufacturing","60","7686","310806","06",
"0400000US06","California",null,"2016","31142","Fruit and vegetable canning, pickling, and drying","227","14493","866274","06",
"0400000US06","California",null,"2016","311421","Fruit and vegetable canning","136","9816","630104","06",
"0400000US06","California",null,"2016","311422","Specialty canning","22","378","19633","06",
"0400000US06","California",null,"2016","311423","Dried and dehydrated food manufacturing","69","4299","216537","06",
"0400000US06","California",null,"2016","3115","Dairy product manufacturing","233","17492","1069770","06",
"0400000US06","California",null,"2016","31151","Dairy product (except frozen) manufacturing","141","13992","915703","06",
"0400000US06","California",null,"2016","311511","Fluid milk manufacturing","54","5475","368095","06",
"0400000US06","California",null,"2016","311512","Creamery butter manufacturing","9","0","0","06",
"0400000US06","California",null,"2016","311513","Cheese manufacturing","54","6561","414094","06",
"0400000US06","California",null,"2016","311514","Dry, condensed, and evaporated dairy product manufacturing","24","1256","83712","06",
"0400000US06","California",null,"2016","31152","Ice cream and frozen dessert manufacturing","92","3500","154067","06",
"0400000US06","California",null,"2016","311520","Ice cream and frozen dessert manufacturing","92","3500","154067","06",
"0400000US06","California",null,"2016","3116","Animal slaughtering and processing","228","21501","850212","06",
"0400000US06","California",null,"2016","31161","Animal slaughtering and processing","228","21501","850212","06",
"0400000US06","California",null,"2016","311611","Animal (except poultry) slaughtering","52","6436","255428","06",
"0400000US06","California",null,"2016","311612","Meat processed from carcasses","114","4833","232586","06",
"0400000US06","California",null,"2016","311613","Rendering and meat byproduct processing","15","750","47317","06",
"0400000US06","California",null,"2016","311615","Poultry processing","47","9482","314881","06",
"0400000US06","California",null,"2016","3117","Seafood product preparation and packaging","41","1549","64374","06",
"0400000US06","California",null,"2016","31171","Seafood product preparation and packaging","41","1549","64374","06",
"0400000US06","California",null,"2016","311710","Seafood product preparation and packaging","41","1549","64374","06",
"0400000US06","California",null,"2016","3118","Bakeries and tortilla manufacturing","1731","41351","1435303","06",
"0400000US06","California",null,"2016","31181","Bread and bakery product manufacturing","1534","31149","1031201","06",
"0400000US06","California",null,"2016","311811","Retail bakeries","1020","11346","254036","06",
"0400000US06","California",null,"2016","311812","Commercial bakeries","489","16919","666609","06",
"0400000US06","California",null,"2016","311813","Frozen cakes, pies, and other pastries manufacturing","25","2884","110556","06",
"0400000US06","California",null,"2016","31182","Cookie, cracker, and pasta manufacturing","116","4290","194294","06",
"0400000US06","California",null,"2016","311821","Cookie and cracker manufacturing","46","1556","59152","06",
