"0400000US26","Michigan",null,"2014","524","Insurance carriers and related activities","5118","66253","4395923","26",
"0400000US26","Michigan",null,"2014","5241","Insurance carriers","827","36328","2842773","26",
"0400000US26","Michigan",null,"2014","52411","Direct life, health, and medical insurance carriers","324","18927","1559983","26",
"0400000US26","Michigan",null,"2014","524113","Direct life insurance carriers","197","5246","468329","26",
"0400000US26","Michigan",null,"2014","524114","Direct health and medical insurance carriers","127","13681","1091654","26",
"0400000US26","Michigan",null,"2014","52412","Direct insurance (except life, health, and medical) carriers","497","17287","1271580","26",
"0400000US26","Michigan",null,"2014","524126","Direct property and casualty insurance carriers","362","16034","1191910","26",
"0400000US26","Michigan",null,"2014","524127","Direct title insurance carriers","119","0","0","26",
"0400000US26","Michigan",null,"2014","524128","Other direct insurance (except life, health, and medical) carriers","16","0","0","26",
"0400000US26","Michigan",null,"2014","52413","Reinsurance carriers","6","114","11210","26",
"0400000US26","Michigan",null,"2014","524130","Reinsurance carriers","6","114","11210","26",
"0400000US26","Michigan",null,"2014","5242","Agencies, brokerages, and other insurance related activities","4291","29925","1553150","26",
"0400000US26","Michigan",null,"2014","52421","Insurance agencies and brokerages","3972","22402","1260371","26",
"0400000US26","Michigan",null,"2014","524210","Insurance agencies and brokerages","3972","22402","1260371","26",
"0400000US26","Michigan",null,"2014","52429","Other insurance related activities","319","7523","292779","26",
"0400000US26","Michigan",null,"2014","524291","Claims adjusting","76","671","38576","26",
"0400000US26","Michigan",null,"2014","524292","Third party administration of insurance and pension funds","137","6168","221184","26",
"0400000US26","Michigan",null,"2014","524298","All other insurance related activities","106","684","33019","26",
"0400000US26","Michigan",null,"2014","525","Funds, trusts, and other financial vehicles","37","68","3061","26",
"0400000US26","Michigan",null,"2014","5259","Other investment pools and funds","37","68","3061","26",
"0400000US26","Michigan",null,"2014","52591","Open-end investment funds","5","5","313","26",
"0400000US26","Michigan",null,"2014","541830","Media buying agencies","19","0","0","26",
"0400000US26","Michigan",null,"2014","52599","Other financial vehicles","32","63","2748","26",
"0400000US26","Michigan",null,"2014","525990","Other financial vehicles","32","63","2748","26",
"0400000US26","Michigan",null,"2014","53","Real estate and rental and leasing","7652","50996","2053455","26",
"0400000US26","Michigan",null,"2014","531","Real estate","6084","39200","1540798","26",
"0400000US26","Michigan",null,"2014","5311","Lessors of real estate","2503","15828","566586","26",
"0400000US26","Michigan",null,"2014","53111","Lessors of residential buildings and dwellings","1267","8846","255728","26",
"0400000US26","Michigan",null,"2014","531110","Lessors of residential buildings and dwellings","1267","8846","255728","26",
"0400000US26","Michigan",null,"2014","53112","Lessors of nonresidential buildings (except miniwarehouses)","678","3694","191100","26",
"0400000US26","Michigan",null,"2014","531120","Lessors of nonresidential buildings (except miniwarehouses)","678","3694","191100","26",
"0400000US26","Michigan",null,"2014","53113","Lessors of miniwarehouses and self-storage units","271","577","13826","26",
"0400000US26","Michigan",null,"2014","531130","Lessors of miniwarehouses and self-storage units","271","577","13826","26",
"0400000US26","Michigan",null,"2014","53119","Lessors of other real estate property","287","2711","105932","26",
"0400000US26","Michigan",null,"2014","531190","Lessors of other real estate property","287","2711","105932","26",
"0400000US26","Michigan",null,"2014","5312","Offices of real estate agents and brokers","1705","5555","255306","26",
"0400000US26","Michigan",null,"2014","53121","Offices of real estate agents and brokers","1705","5555","255306","26",
"0400000US26","Michigan",null,"2014","531210","Offices of real estate agents and brokers","1705","5555","255306","26",
"0400000US26","Michigan",null,"2014","5313","Activities related to real estate","1876","17817","718906","26",
"0400000US26","Michigan",null,"2014","53131","Real estate property managers","1217","16070","633458","26",
"0400000US26","Michigan",null,"2014","531311","Residential property managers","802","12782","448052","26",
"0400000US26","Michigan",null,"2014","531312","Nonresidential property managers","415","3288","185406","26",
"0400000US26","Michigan",null,"2014","53132","Offices of real estate appraisers","378","867","39085","26",
"0400000US26","Michigan",null,"2014","531320","Offices of real estate appraisers","378","867","39085","26",
"0400000US26","Michigan",null,"2014","53139","Other activities related to real estate","281","880","46363","26",
"0400000US26","Michigan",null,"2014","531390","Other activities related to real estate","281","880","46363","26",
"0400000US26","Michigan",null,"2014","532","Rental and leasing services","1499","10972","447346","26",
"0400000US26","Michigan",null,"2014","5321","Automotive equipment rental and leasing","412","3570","140089","26",
"0400000US26","Michigan",null,"2014","53211","Passenger car rental and leasing","253","0","82267","26",
"0400000US26","Michigan",null,"2014","532111","Passenger car rental","240","0","71272","26",
"0400000US26","Michigan",null,"2014","532112","Passenger car leasing","13","124","10995","26",
"0400000US26","Michigan",null,"2014","53212","Truck, utility trailer, and RV (recreational vehicle) rental and leasing","159","0","57822","26",
"0400000US26","Michigan",null,"2014","532120","Truck, utility trailer, and RV (recreational vehicle) rental and leasing","159","0","57822","26",
"0400000US26","Michigan",null,"2014","5322","Consumer goods rental","713","4055","108201","26",
"0400000US26","Michigan",null,"2014","53221","Consumer electronics and appliances rental","178","0","0","26",
"0400000US26","Michigan",null,"2014","532210","Consumer electronics and appliances rental","178","0","0","26",
"0400000US26","Michigan",null,"2014","53222","Formal wear and costume rental","39","0","4228","26",
"0400000US26","Michigan",null,"2014","532220","Formal wear and costume rental","39","0","4228","26",
"0400000US26","Michigan",null,"2014","53223","Video tape and disc rental","188","0","0","26",
"0400000US26","Michigan",null,"2014","532230","Video tape and disc rental","188","0","0","26",
"0400000US26","Michigan",null,"2014","53229","Other consumer goods rental","308","1447","55745","26",
"0400000US26","Michigan",null,"2014","532291","Home health equipment rental","82","547","24511","26",
"0400000US26","Michigan",null,"2014","532292","Recreational goods rental","72","59","4209","26",
"0400000US26","Michigan",null,"2014","532299","All other consumer goods rental","154","841","27025","26",
"0400000US26","Michigan",null,"2014","5323","General rental centers","122","480","16165","26",
"0400000US26","Michigan",null,"2014","53231","General rental centers","122","480","16165","26",
"0400000US26","Michigan",null,"2014","532310","General rental centers","122","480","16165","26",
"0400000US26","Michigan",null,"2014","5324","Commercial and industrial machinery and equipment rental and leasing","252","2867","182891","26",
"0400000US26","Michigan",null,"2014","53241","Construction, transportation, mining, and forestry machinery and equipment rental and leasing","57","447","31379","26",
"0400000US26","Michigan",null,"2014","532411","Commercial air, rail, and water transportation equipment rental and leasing","9","0","1615","26",
"0400000US26","Michigan",null,"2014","532412","Construction, mining, and forestry machinery and equipment rental and leasing","48","423","29764","26",
"0400000US26","Michigan",null,"2014","53242","Office machinery and equipment rental and leasing","15","0","0","26",
"0400000US26","Michigan",null,"2014","532420","Office machinery and equipment rental and leasing","15","0","0","26",
"0400000US26","Michigan",null,"2014","53249","Other commercial and industrial machinery and equipment rental and leasing","180","2342","147369","26",
"0400000US26","Michigan",null,"2014","532490","Other commercial and industrial machinery and equipment rental and leasing","180","2342","147369","26",
"0400000US26","Michigan",null,"2014","533","Lessors of nonfinancial intangible assets (except copyrighted works)","69","824","65311","26",
"0400000US26","Michigan",null,"2014","5331","Lessors of nonfinancial intangible assets (except copyrighted works)","69","824","65311","26",
"0400000US26","Michigan",null,"2014","53311","Lessors of nonfinancial intangible assets (except copyrighted works)","69","824","65311","26",
"0400000US26","Michigan",null,"2014","533110","Lessors of nonfinancial intangible assets (except copyrighted works)","69","824","65311","26",
"0400000US26","Michigan",null,"2014","54","Professional, scientific, and technical services","21468","249224","18161657","26",
"0400000US26","Michigan",null,"2014","541","Professional, scientific, and technical services","21468","249224","18161657","26",
"0400000US26","Michigan",null,"2014","5411","Legal services","4681","26914","1956501","26",
"0400000US26","Michigan",null,"2014","54111","Offices of lawyers","4344","24369","1844607","26",
"0400000US26","Michigan",null,"2014","541110","Offices of lawyers","4344","24369","1844607","26",
"0400000US26","Michigan",null,"2014","54119","Other legal services","337","2545","111894","26",
"0400000US26","Michigan",null,"2014","541191","Title abstract and settlement offices","240","2098","92081","26",
"0400000US26","Michigan",null,"2014","541199","All other legal services","97","447","19813","26",
"0400000US26","Michigan",null,"2014","5412","Accounting, tax preparation, bookkeeping, and payroll services","3846","37128","1773152","26",
"0400000US26","Michigan",null,"2014","54121","Accounting, tax preparation, bookkeeping, and payroll services","3846","37128","1773152","26",
"0400000US26","Michigan",null,"2014","541211","Offices of certified public accountants","1546","12407","838338","26",
"0400000US26","Michigan",null,"2014","541213","Tax preparation services","931","5893","59521","26",
"0400000US26","Michigan",null,"2014","541214","Payroll services","188","11110","613589","26",
"0400000US26","Michigan",null,"2014","541219","Other accounting services","1181","7718","261704","26",
"0400000US26","Michigan",null,"2014","5413","Architectural, engineering, and related services","2911","61358","5318774","26",
"0400000US26","Michigan",null,"2014","54131","Architectural services","401","2820","205504","26",
"0400000US26","Michigan",null,"2014","541310","Architectural services","401","2820","205504","26",
"0400000US26","Michigan",null,"2014","54132","Landscape architectural services","117","278","19727","26",
"0400000US26","Michigan",null,"2014","541320","Landscape architectural services","117","278","19727","26",
"0400000US26","Michigan",null,"2014","54133","Engineering services","1817","48289","4170734","26",
"0400000US26","Michigan",null,"2014","541330","Engineering services","1817","48289","4170734","26",
"0400000US26","Michigan",null,"2014","54134","Drafting services","58","430","32926","26",
"0400000US26","Michigan",null,"2014","541340","Drafting services","58","430","32926","26",
"0400000US26","Michigan",null,"2014","54135","Building inspection services","146","357","13877","26",
"0400000US26","Michigan",null,"2014","541350","Building inspection services","146","357","13877","26",
"0400000US26","Michigan",null,"2014","54136","Geophysical surveying and mapping services","8","97","4041","26",
"0400000US26","Michigan",null,"2014","541360","Geophysical surveying and mapping services","8","97","4041","26",
"0400000US26","Michigan",null,"2014","54137","Surveying and mapping (except geophysical) services","173","686","39518","26",
"0400000US26","Michigan",null,"2014","541370","Surveying and mapping (except geophysical) services","173","686","39518","26",
"0400000US26","Michigan",null,"2014","54138","Testing laboratories","191","0","0","26",
"0400000US26","Michigan",null,"2014","541380","Testing laboratories","191","0","0","26",
"0400000US26","Michigan",null,"2014","5414","Specialized design services","696","3808","252676","26",
"0400000US26","Michigan",null,"2014","54141","Interior design services","218","594","23313","26",
"0400000US26","Michigan",null,"2014","541410","Interior design services","218","594","23313","26",
"0400000US26","Michigan",null,"2014","54142","Industrial design services","85","0","0","26",
"0400000US26","Michigan",null,"2014","541420","Industrial design services","85","0","0","26",
"0400000US26","Michigan",null,"2014","54143","Graphic design services","349","1617","90380","26",
"0400000US26","Michigan",null,"2014","541430","Graphic design services","349","1617","90380","26",
"0400000US26","Michigan",null,"2014","54149","Other specialized design services","44","95","3279","26",
"0400000US26","Michigan",null,"2014","541490","Other specialized design services","44","95","3279","26",
"0400000US26","Michigan",null,"2014","5415","Computer systems design and related services","2782","36821","3037371","26",
"0400000US26","Michigan",null,"2014","54151","Computer systems design and related services","2782","36821","3037371","26",
"0400000US26","Michigan",null,"2014","541511","Custom computer programming services","1393","18597","1469818","26",
"0400000US26","Michigan",null,"2014","541512","Computer systems design services","952","13772","1238880","26",
"0400000US26","Michigan",null,"2014","541513","Computer facilities management services","161","2909","212958","26",
"0400000US26","Michigan",null,"2014","541519","Other computer related services","276","1543","115715","26",
"0400000US26","Michigan",null,"2014","5416","Management, scientific, and technical consulting services","3197","29637","2004285","26",
"0400000US26","Michigan",null,"2014","54161","Management consulting services","2712","26947","1835450","26",
"0400000US26","Michigan",null,"2014","541611","Administrative management and general management consulting services","1351","9448","872808","26",
"0400000US26","Michigan",null,"2014","541612","Human resources consulting services","217","7207","367779","26",
"0400000US26","Michigan",null,"2014","541613","Marketing consulting services","695","4155","283481","26",
"0400000US26","Michigan",null,"2014","541614","Process, physical distribution, and logistics consulting services","272","5560","280601","26",
"0400000US26","Michigan",null,"2014","541618","Other management consulting services","177","577","30781","26",
"0400000US26","Michigan",null,"2014","54162","Environmental consulting services","203","1560","86321","26",
"0400000US26","Michigan",null,"2014","541620","Environmental consulting services","203","1560","86321","26",
"0400000US26","Michigan",null,"2014","54169","Other scientific and technical consulting services","282","1130","82514","26",
"0400000US26","Michigan",null,"2014","541690","Other scientific and technical consulting services","282","1130","82514","26",
"0400000US26","Michigan",null,"2014","5417","Scientific research and development services","386","23470","2292982","26",
"0400000US26","Michigan",null,"2014","54171","Research and development in the physical, engineering, and life sciences","355","23103","2262694","26",
"0400000US26","Michigan",null,"2014","541711","Research and development in biotechnology","61","629","65050","26",
"0400000US26","Michigan",null,"2014","541712","Research and development in the physical, engineering, and life sciences (except biotechnology)","294","22474","2197644","26",
"0400000US26","Michigan",null,"2014","54172","Research and development in the social sciences and humanities","31","367","30288","26",
"0400000US26","Michigan",null,"2014","541720","Research and development in the social sciences and humanities","31","367","30288","26",
"0400000US26","Michigan",null,"2014","5418","Advertising, public relations, and related services","854","12739","865234","26",
"0400000US26","Michigan",null,"2014","54181","Advertising agencies","287","6545","506993","26",
"0400000US26","Michigan",null,"2014","541810","Advertising agencies","287","6545","506993","26",
"0400000US26","Michigan",null,"2014","54182","Public relations agencies","161","1014","76583","26",
"0400000US26","Michigan",null,"2014","541820","Public relations agencies","161","1014","76583","26",
"0400000US26","Michigan",null,"2014","54183","Media buying agencies","19","0","0","26",
"0400000US26","Michigan",null,"2014","611310","Colleges, universities, and professional schools","107","29355","780775","26",
"0400000US26","Michigan",null,"2014","54184","Media representatives","34","279","22158","26",
"0400000US26","Michigan",null,"2014","541840","Media representatives","34","279","22158","26",
"0400000US26","Michigan",null,"2014","54185","Outdoor advertising","67","465","29142","26",
"0400000US26","Michigan",null,"2014","541850","Outdoor advertising","67","465","29142","26",
"0400000US26","Michigan",null,"2014","54186","Direct mail advertising","55","1365","65887","26",
"0400000US26","Michigan",null,"2014","541860","Direct mail advertising","55","1365","65887","26",
"0400000US26","Michigan",null,"2014","54187","Advertising material distribution services","28","269","24029","26",
"0400000US26","Michigan",null,"2014","541870","Advertising material distribution services","28","269","24029","26",
"0400000US26","Michigan",null,"2014","54189","Other services related to advertising","203","2263","101829","26",
"0400000US26","Michigan",null,"2014","541890","Other services related to advertising","203","2263","101829","26",
"0400000US26","Michigan",null,"2014","5419","Other professional, scientific, and technical services","2115","17349","660682","26",
"0400000US26","Michigan",null,"2014","54191","Marketing research and public opinion polling","129","2650","182865","26",
"0400000US26","Michigan",null,"2014","541910","Marketing research and public opinion polling","129","2650","182865","26",
"0400000US26","Michigan",null,"2014","54192","Photographic services","365","1155","34458","26",
"0400000US26","Michigan",null,"2014","541921","Photography studios, portrait","281","932","19995","26",
"0400000US26","Michigan",null,"2014","541922","Commercial photography","84","223","14463","26",
"0400000US26","Michigan",null,"2014","54193","Translation and interpretation services","56","170","5639","26",
"0400000US26","Michigan",null,"2014","541930","Translation and interpretation services","56","170","5639","26",
"0400000US26","Michigan",null,"2014","54194","Veterinary services","957","9064","289723","26",
"0400000US26","Michigan",null,"2014","541940","Veterinary services","957","9064","289723","26",
"0400000US26","Michigan",null,"2014","54199","All other professional, scientific, and technical services","608","4310","147997","26",
"0400000US26","Michigan",null,"2014","541990","All other professional, scientific, and technical services","608","4310","147997","26",
"0400000US26","Michigan",null,"2014","55","Management of companies and enterprises","1592","112294","11987427","26",
"0400000US26","Michigan",null,"2014","551","Management of companies and enterprises","1592","112294","11987427","26",
"0400000US26","Michigan",null,"2014","5511","Management of companies and enterprises","1592","112294","11987427","26",
"0400000US26","Michigan",null,"2014","55111","Management of companies and enterprises","1592","112294","11987427","26",
"0400000US26","Michigan",null,"2014","551111","Offices of bank holding companies","19","0","0","26",
"0400000US26","Michigan",null,"2014","551112","Offices of other holding companies","179","4268","265937","26",
"0400000US26","Michigan",null,"2014","551114","Corporate, subsidiary, and regional managing offices","1394","107773","11708825","26",
"0400000US26","Michigan",null,"2014","56","Administrative and support and waste management and remediation services","11767","320662","9988645","26",
"0400000US26","Michigan",null,"2014","561","Administrative and support services","11025","309767","9412505","26",
"0400000US26","Michigan",null,"2014","5611","Office administrative services","753","15178","774915","26",
"0400000US26","Michigan",null,"2014","56111","Office administrative services","753","15178","774915","26",
"0400000US26","Michigan",null,"2014","561110","Office administrative services","753","15178","774915","26",
"0400000US26","Michigan",null,"2014","5612","Facilities support services","168","5431","237546","26",
"0400000US26","Michigan",null,"2014","56121","Facilities support services","168","5431","237546","26",
"0400000US26","Michigan",null,"2014","561210","Facilities support services","168","5431","237546","26",
"0400000US26","Michigan",null,"2014","5613","Employment services","1805","196273","5667753","26",
"0400000US26","Michigan",null,"2014","56131","Employment placement agencies and executive search services","250","6689","174179","26",
"0400000US26","Michigan",null,"2014","561311","Employment placement agencies","135","6147","136730","26",
"0400000US26","Michigan",null,"2014","561312","Executive search services","115","542","37449","26",
"0400000US26","Michigan",null,"2014","56132","Temporary help services","1266","150205","4098974","26",
"0400000US26","Michigan",null,"2014","561320","Temporary help services","1266","150205","4098974","26",
"0400000US26","Michigan",null,"2014","56133","Professional employer organizations","289","39379","1394600","26",
"0400000US26","Michigan",null,"2014","561330","Professional employer organizations","289","39379","1394600","26",
"0400000US26","Michigan",null,"2014","5614","Business support services","1215","13100","382103","26",
"0400000US26","Michigan",null,"2014","56141","Document preparation services","100","1034","31418","26",
"0400000US26","Michigan",null,"2014","561410","Document preparation services","100","1034","31418","26",
"0400000US26","Michigan",null,"2014","56142","Telephone call centers","107","6459","154537","26",
"0400000US26","Michigan",null,"2014","561421","Telephone answering services","32","324","9954","26",
"0400000US26","Michigan",null,"2014","561422","Telemarketing bureaus and other contact centers","75","6135","144583","26",
"0400000US26","Michigan",null,"2014","56143","Business service centers","198","1098","35797","26",
"0400000US26","Michigan",null,"2014","561431","Private mail centers","94","430","11083","26",
"0400000US26","Michigan",null,"2014","561439","Other business service centers (including copy shops)","104","668","24714","26",
"0400000US26","Michigan",null,"2014","56144","Collection agencies","94","1462","57760","26",
"0400000US26","Michigan",null,"2014","561440","Collection agencies","94","1462","57760","26",
"0400000US26","Michigan",null,"2014","56145","Credit bureaus","13","167","12782","26",
"0400000US26","Michigan",null,"2014","561450","Credit bureaus","13","167","12782","26",
"0400000US26","Michigan",null,"2014","56149","Other business support services","703","2880","89809","26",
"0400000US26","Michigan",null,"2014","561491","Repossession services","27","179","5974","26",
"0400000US26","Michigan",null,"2014","561492","Court reporting and stenotype services","80","0","8962","26",
"0400000US26","Michigan",null,"2014","561499","All other business support services","596","2466","74873","26",
"0400000US26","Michigan",null,"2014","5615","Travel arrangement and reservation services","641","4980","190532","26",
"0400000US26","Michigan",null,"2014","56151","Travel agencies","526","0","134182","26",
"0400000US26","Michigan",null,"2014","561510","Travel agencies","526","0","134182","26",
"0400000US26","Michigan",null,"2014","56152","Tour operators","41","239","13341","26",
"0400000US26","Michigan",null,"2014","561520","Tour operators","41","239","13341","26",
"0400000US26","Michigan",null,"2014","56159","Other travel arrangement and reservation services","74","1060","43009","26",
"0400000US26","Michigan",null,"2014","561591","Convention and visitors bureaus","44","263","13571","26",
"0400000US26","Michigan",null,"2014","561599","All other travel arrangement and reservation services","30","797","29438","26",
"0400000US26","Michigan",null,"2014","5616","Investigation and security services","617","19679","487556","26",
"0400000US26","Michigan",null,"2014","56161","Investigation, guard, and armored car services","366","16811","360045","26",
"0400000US26","Michigan",null,"2014","561611","Investigation services","112","727","25538","26",
"0400000US26","Michigan",null,"2014","561612","Security guards and patrol services","233","15385","312191","26",
"0400000US26","Michigan",null,"2014","561613","Armored car services","21","699","22316","26",
"0400000US26","Michigan",null,"2014","56162","Security systems services","251","2868","127511","26",
"0400000US26","Michigan",null,"2014","561621","Security systems services (except locksmiths)","156","2587","118384","26",
"0400000US26","Michigan",null,"2014","561622","Locksmiths","95","281","9127","26",
"0400000US26","Michigan",null,"2014","5617","Services to buildings and dwellings","5313","46542","1253396","26",
"0400000US26","Michigan",null,"2014","56171","Exterminating and pest control services","209","1252","55115","26",
"0400000US26","Michigan",null,"2014","561710","Exterminating and pest control services","209","1252","55115","26",
"0400000US26","Michigan",null,"2014","56172","Janitorial services","1482","29051","540544","26",
"0400000US26","Michigan",null,"2014","561720","Janitorial services","1482","29051","540544","26",
"0400000US26","Michigan",null,"2014","56173","Landscaping services","3081","13380","555078","26",
"0400000US26","Michigan",null,"2014","561730","Landscaping services","3081","13380","555078","26",
