"GEO_ID","GEO_TTL","COUNTY","YEAR","NAICS2012","NAICS2012_TTL","ESTAB","EMP","PAYANN","state",
"0400000US15","Hawaii",null,"2016","00","Total for all sectors","32350","528415","22892445","15",
"0400000US15","Hawaii",null,"2016","11","Agriculture, forestry, fishing and hunting","33","151","4783","15",
"0400000US15","Hawaii",null,"2016","113","Forestry and logging","1","0","0","15",
"0400000US15","Hawaii",null,"2016","3111","Animal food manufacturing","2","0","0","15",
"0400000US15","Hawaii",null,"2016","1131","Timber tract operations","1","0","0","15",
"0400000US15","Hawaii",null,"2016","11311","Timber tract operations","1","0","0","15",
"0400000US15","Hawaii",null,"2016","113110","Timber tract operations","1","0","0","15",
"0400000US15","Hawaii",null,"2016","114","Fishing, hunting and trapping","19","69","2350","15",
"0400000US15","Hawaii",null,"2016","1141","Fishing","19","69","2350","15",
"0400000US15","Hawaii",null,"2016","11411","Fishing","19","69","2350","15",
"0400000US15","Hawaii",null,"2016","114111","Finfish fishing","18","27","1015","15",
"0400000US15","Hawaii",null,"2016","114112","Shellfish fishing","1","0","0","15",
"0400000US15","Hawaii",null,"2016","115","Support activities for agriculture and forestry","13","81","2420","15",
"0400000US15","Hawaii",null,"2016","1151","Support activities for crop production","5","51","1235","15",
"0400000US15","Hawaii",null,"2016","11511","Support activities for crop production","5","51","1235","15",
"0400000US15","Hawaii",null,"2016","115112","Soil preparation, planting, and cultivating","1","0","0","15",
"0400000US15","Hawaii",null,"2016","115114","Postharvest crop activities (except cotton ginning)","2","0","0","15",
"0400000US15","Hawaii",null,"2016","115115","Farm labor contractors and crew leaders","1","0","0","15",
"0400000US15","Hawaii",null,"2016","115116","Farm management services","1","0","0","15",
"0400000US15","Hawaii",null,"2016","1152","Support activities for animal production","7","10","183","15",
"0400000US15","Hawaii",null,"2016","11521","Support activities for animal production","7","10","183","15",
"0400000US15","Hawaii",null,"2016","115210","Support activities for animal production","7","10","183","15",
"0400000US15","Hawaii",null,"2016","1153","Support activities for forestry","1","0","0","15",
"0400000US15","Hawaii",null,"2016","11531","Support activities for forestry","1","0","0","15",
"0400000US15","Hawaii",null,"2016","115310","Support activities for forestry","1","0","0","15",
"0400000US15","Hawaii",null,"2016","21","Mining, quarrying, and oil and gas extraction","7","176","13315","15",
"0400000US15","Hawaii",null,"2016","212","Mining (except oil and gas)","5","146","12004","15",
"0400000US15","Hawaii",null,"2016","2123","Nonmetallic mineral mining and quarrying","5","146","12004","15",
"0400000US15","Hawaii",null,"2016","21231","Stone mining and quarrying","3","135","10736","15",
"0400000US15","Hawaii",null,"2016","212312","Crushed and broken limestone mining and quarrying","1","0","0","15",
"0400000US15","Hawaii",null,"2016","212319","Other crushed and broken stone mining and quarrying","2","0","0","15",
"0400000US15","Hawaii",null,"2016","21232","Sand, gravel, clay, and ceramic and refractory minerals mining and quarrying","1","0","0","15",
"0400000US15","Hawaii",null,"2016","212321","Construction sand and gravel mining","1","0","0","15",
"0400000US15","Hawaii",null,"2016","21239","Other nonmetallic mineral mining and quarrying","1","0","0","15",
"0400000US15","Hawaii",null,"2016","212399","All other nonmetallic mineral mining","1","0","0","15",
"0400000US15","Hawaii",null,"2016","213","Support activities for mining","2","0","0","15",
"0400000US15","Hawaii",null,"2016","2131","Support activities for mining","2","0","0","15",
"0400000US15","Hawaii",null,"2016","21311","Support activities for mining","2","0","0","15",
"0400000US15","Hawaii",null,"2016","213111","Drilling oil and gas wells","1","0","0","15",
"0400000US15","Hawaii",null,"2016","213112","Support activities for oil and gas operations","1","0","0","15",
"0400000US15","Hawaii",null,"2016","22","Utilities","65","3664","360964","15",
"0400000US15","Hawaii",null,"2016","221","Utilities","65","3664","360964","15",
"0400000US15","Hawaii",null,"2016","2211","Electric power generation, transmission and distribution","26","0","0","15",
"0400000US15","Hawaii",null,"2016","22111","Electric power generation","18","0","0","15",
"0400000US15","Hawaii",null,"2016","221112","Fossil fuel electric power generation","12","0","0","15",
"0400000US15","Hawaii",null,"2016","221114","Solar electric power generation","1","0","0","15",
"0400000US15","Hawaii",null,"2016","221115","Wind electric power generation","1","0","0","15",
"0400000US15","Hawaii",null,"2016","221116","Geothermal electric power generation","2","0","0","15",
"0400000US15","Hawaii",null,"2016","221117","Biomass electric power generation","2","0","0","15",
"0400000US15","Hawaii",null,"2016","22112","Electric power transmission, control, and distribution","8","0","0","15",
"0400000US15","Hawaii",null,"2016","221122","Electric power distribution","8","0","0","15",
"0400000US15","Hawaii",null,"2016","2212","Natural gas distribution","5","0","0","15",
"0400000US15","Hawaii",null,"2016","22121","Natural gas distribution","5","0","0","15",
"0400000US15","Hawaii",null,"2016","221210","Natural gas distribution","5","0","0","15",
"0400000US15","Hawaii",null,"2016","2213","Water, sewage and other systems","34","259","16663","15",
"0400000US15","Hawaii",null,"2016","22131","Water supply and irrigation systems","15","165","9609","15",
"0400000US15","Hawaii",null,"2016","221310","Water supply and irrigation systems","15","165","9609","15",
"0400000US15","Hawaii",null,"2016","22132","Sewage treatment facilities","19","94","7054","15",
"0400000US15","Hawaii",null,"2016","221320","Sewage treatment facilities","19","94","7054","15",
"0400000US15","Hawaii",null,"2016","23","Construction","2869","33488","2326823","15",
"0400000US15","Hawaii",null,"2016","236","Construction of buildings","936","9267","665594","15",
"0400000US15","Hawaii",null,"2016","2361","Residential building construction","716","3482","192028","15",
"0400000US15","Hawaii",null,"2016","23611","Residential building construction","716","3482","192028","15",
"0400000US15","Hawaii",null,"2016","236115","New single-family housing construction (except for-sale builders)","269","1698","88960","15",
"0400000US15","Hawaii",null,"2016","236116","New multifamily housing construction (except for-sale builders)","8","147","12358","15",
"0400000US15","Hawaii",null,"2016","236117","New housing for-sale builders","19","289","31024","15",
"0400000US15","Hawaii",null,"2016","236118","Residential remodelers","420","1348","59686","15",
"0400000US15","Hawaii",null,"2016","2362","Nonresidential building construction","220","5785","473566","15",
"0400000US15","Hawaii",null,"2016","23621","Industrial building construction","4","27","1282","15",
"0400000US15","Hawaii",null,"2016","236210","Industrial building construction","4","27","1282","15",
"0400000US15","Hawaii",null,"2016","23622","Commercial and institutional building construction","216","5758","472284","15",
"0400000US15","Hawaii",null,"2016","236220","Commercial and institutional building construction","216","5758","472284","15",
"0400000US15","Hawaii",null,"2016","237","Heavy and civil engineering construction","140","2652","219671","15",
"0400000US15","Hawaii",null,"2016","2371","Utility system construction","62","896","68719","15",
"0400000US15","Hawaii",null,"2016","23711","Water and sewer line and related structures construction","40","596","43150","15",
"0400000US15","Hawaii",null,"2016","237110","Water and sewer line and related structures construction","40","596","43150","15",
"0400000US15","Hawaii",null,"2016","23712","Oil and gas pipeline and related structures construction","4","62","4343","15",
"0400000US15","Hawaii",null,"2016","237120","Oil and gas pipeline and related structures construction","4","62","4343","15",
"0400000US15","Hawaii",null,"2016","23713","Power and communication line and related structures construction","18","238","21226","15",
"0400000US15","Hawaii",null,"2016","237130","Power and communication line and related structures construction","18","238","21226","15",
"0400000US15","Hawaii",null,"2016","2372","Land subdivision","27","152","14224","15",
"0400000US15","Hawaii",null,"2016","23721","Land subdivision","27","152","14224","15",
"0400000US15","Hawaii",null,"2016","237210","Land subdivision","27","152","14224","15",
"0400000US15","Hawaii",null,"2016","2373","Highway, street, and bridge construction","40","1277","110382","15",
"0400000US15","Hawaii",null,"2016","23731","Highway, street, and bridge construction","40","1277","110382","15",
"0400000US15","Hawaii",null,"2016","237310","Highway, street, and bridge construction","40","1277","110382","15",
"0400000US15","Hawaii",null,"2016","2379","Other heavy and civil engineering construction","11","327","26346","15",
"0400000US15","Hawaii",null,"2016","23799","Other heavy and civil engineering construction","11","327","26346","15",
"0400000US15","Hawaii",null,"2016","237990","Other heavy and civil engineering construction","11","327","26346","15",
"0400000US15","Hawaii",null,"2016","238","Specialty trade contractors","1793","21569","1441558","15",
"0400000US15","Hawaii",null,"2016","2381","Foundation, structure, and building exterior contractors","333","4320","243537","15",
"0400000US15","Hawaii",null,"2016","23811","Poured concrete foundation and structure contractors","49","670","39516","15",
"0400000US15","Hawaii",null,"2016","238110","Poured concrete foundation and structure contractors","49","670","39516","15",
"0400000US15","Hawaii",null,"2016","23812","Structural steel and precast concrete contractors","23","657","45055","15",
"0400000US15","Hawaii",null,"2016","238120","Structural steel and precast concrete contractors","23","657","45055","15",
"0400000US15","Hawaii",null,"2016","23813","Framing contractors","19","724","43187","15",
"0400000US15","Hawaii",null,"2016","238130","Framing contractors","19","724","43187","15",
"0400000US15","Hawaii",null,"2016","23814","Masonry contractors","65","445","18279","15",
"0400000US15","Hawaii",null,"2016","238140","Masonry contractors","65","445","18279","15",
"0400000US15","Hawaii",null,"2016","23815","Glass and glazing contractors","43","461","29343","15",
"0400000US15","Hawaii",null,"2016","238150","Glass and glazing contractors","43","461","29343","15",
"0400000US15","Hawaii",null,"2016","23816","Roofing contractors","99","1198","58769","15",
"0400000US15","Hawaii",null,"2016","238160","Roofing contractors","99","1198","58769","15",
"0400000US15","Hawaii",null,"2016","23817","Siding contractors","16","96","5657","15",
"0400000US15","Hawaii",null,"2016","238170","Siding contractors","16","96","5657","15",
"0400000US15","Hawaii",null,"2016","23819","Other foundation, structure, and building exterior contractors","19","69","3731","15",
"0400000US15","Hawaii",null,"2016","238190","Other foundation, structure, and building exterior contractors","19","69","3731","15",
"0400000US15","Hawaii",null,"2016","2382","Building equipment contractors","752","9395","685380","15",
"0400000US15","Hawaii",null,"2016","23821","Electrical contractors and other wiring installation contractors","350","3671","271681","15",
"0400000US15","Hawaii",null,"2016","238210","Electrical contractors and other wiring installation contractors","350","3671","271681","15",
"0400000US15","Hawaii",null,"2016","23822","Plumbing, heating, and air-conditioning contractors","376","4823","336817","15",
"0400000US15","Hawaii",null,"2016","238220","Plumbing, heating, and air-conditioning contractors","376","4823","336817","15",
"0400000US15","Hawaii",null,"2016","23829","Other building equipment contractors","26","901","76882","15",
"0400000US15","Hawaii",null,"2016","238290","Other building equipment contractors","26","901","76882","15",
"0400000US15","Hawaii",null,"2016","2383","Building finishing contractors","504","5431","353544","15",
"0400000US15","Hawaii",null,"2016","23831","Drywall and insulation contractors","66","1876","126209","15",
"0400000US15","Hawaii",null,"2016","238310","Drywall and insulation contractors","66","1876","126209","15",
"0400000US15","Hawaii",null,"2016","23832","Painting and wall covering contractors","156","1456","89366","15",
"0400000US15","Hawaii",null,"2016","238320","Painting and wall covering contractors","156","1456","89366","15",
"0400000US15","Hawaii",null,"2016","23833","Flooring contractors","72","494","23533","15",
"0400000US15","Hawaii",null,"2016","238330","Flooring contractors","72","494","23533","15",
"0400000US15","Hawaii",null,"2016","23834","Tile and terrazzo contractors","68","598","53044","15",
"0400000US15","Hawaii",null,"2016","238340","Tile and terrazzo contractors","68","598","53044","15",
"0400000US15","Hawaii",null,"2016","23835","Finish carpentry contractors","109","757","47557","15",
"0400000US15","Hawaii",null,"2016","238350","Finish carpentry contractors","109","757","47557","15",
"0400000US15","Hawaii",null,"2016","23839","Other building finishing contractors","33","250","13835","15",
"0400000US15","Hawaii",null,"2016","238390","Other building finishing contractors","33","250","13835","15",
"0400000US15","Hawaii",null,"2016","2389","Other specialty trade contractors","204","2423","159097","15",
"0400000US15","Hawaii",null,"2016","23891","Site preparation contractors","103","1424","98613","15",
"0400000US15","Hawaii",null,"2016","238910","Site preparation contractors","103","1424","98613","15",
"0400000US15","Hawaii",null,"2016","23899","All other specialty trade contractors","101","999","60484","15",
"0400000US15","Hawaii",null,"2016","238990","All other specialty trade contractors","101","999","60484","15",
"0400000US15","Hawaii",null,"2016","31-33","Manufacturing","779","13040","565822","15",
"0400000US15","Hawaii",null,"2016","311","Food manufacturing","252","5660","173658","15",
"0400000US15","Hawaii",null,"2016","324121","Asphalt paving mixture and block manufacturing","2","0","0","15",
"0400000US15","Hawaii",null,"2016","31111","Animal food manufacturing","2","0","0","15",
"0400000US15","Hawaii",null,"2016","311111","Dog and cat food manufacturing","1","0","0","15",
"0400000US15","Hawaii",null,"2016","311119","Other animal food manufacturing","1","0","0","15",
"0400000US15","Hawaii",null,"2016","3112","Grain and oilseed milling","4","41","858","15",
"0400000US15","Hawaii",null,"2016","31121","Flour milling and malt manufacturing","1","0","0","15",
"0400000US15","Hawaii",null,"2016","311212","Rice milling","1","0","0","15",
"0400000US15","Hawaii",null,"2016","31122","Starch and vegetable fats and oils manufacturing","2","0","0","15",
"0400000US15","Hawaii",null,"2016","311224","Soybean and other oilseed processing","2","0","0","15",
"0400000US15","Hawaii",null,"2016","31123","Breakfast cereal manufacturing","1","0","0","15",
"0400000US15","Hawaii",null,"2016","311230","Breakfast cereal manufacturing","1","0","0","15",
"0400000US15","Hawaii",null,"2016","3113","Sugar and confectionery product manufacturing","18","881","33907","15",
"0400000US15","Hawaii",null,"2016","31131","Sugar manufacturing","1","0","0","15",
"0400000US15","Hawaii",null,"2016","311314","Cane sugar manufacturing","1","0","0","15",
"0400000US15","Hawaii",null,"2016","31134","Nonchocolate confectionery manufacturing","5","50","1142","15",
"0400000US15","Hawaii",null,"2016","311340","Nonchocolate confectionery manufacturing","5","50","1142","15",
"0400000US15","Hawaii",null,"2016","31135","Chocolate and chocolate confectionery manufacturing","12","530","21219","15",
"0400000US15","Hawaii",null,"2016","311351","Chocolate and confectionery manufacturing from cacao beans","1","0","0","15",
"0400000US15","Hawaii",null,"2016","311352","Confectionery manufacturing from purchased chocolate","11","521","21058","15",
"0400000US15","Hawaii",null,"2016","3114","Fruit and vegetable preserving and specialty food manufacturing","21","267","6795","15",
"0400000US15","Hawaii",null,"2016","31141","Frozen food manufacturing","2","0","0","15",
"0400000US15","Hawaii",null,"2016","311412","Frozen specialty food manufacturing","2","0","0","15",
"0400000US15","Hawaii",null,"2016","31142","Fruit and vegetable canning, pickling, and drying","19","243","6318","15",
"0400000US15","Hawaii",null,"2016","311421","Fruit and vegetable canning","17","212","5515","15",
"0400000US15","Hawaii",null,"2016","311422","Specialty canning","1","0","0","15",
"0400000US15","Hawaii",null,"2016","311423","Dried and dehydrated food manufacturing","1","0","0","15",
"0400000US15","Hawaii",null,"2016","3115","Dairy product manufacturing","8","408","23190","15",
"0400000US15","Hawaii",null,"2016","31151","Dairy product (except frozen) manufacturing","3","0","0","15",
"0400000US15","Hawaii",null,"2016","311511","Fluid milk manufacturing","2","0","0","15",
"0400000US15","Hawaii",null,"2016","311513","Cheese manufacturing","1","0","0","15",
"0400000US15","Hawaii",null,"2016","31152","Ice cream and frozen dessert manufacturing","5","69","2558","15",
"0400000US15","Hawaii",null,"2016","311520","Ice cream and frozen dessert manufacturing","5","69","2558","15",
"0400000US15","Hawaii",null,"2016","3116","Animal slaughtering and processing","18","310","11311","15",
"0400000US15","Hawaii",null,"2016","31161","Animal slaughtering and processing","18","310","11311","15",
"0400000US15","Hawaii",null,"2016","311611","Animal (except poultry) slaughtering","8","70","2391","15",
"0400000US15","Hawaii",null,"2016","311612","Meat processed from carcasses","9","238","8750","15",
"0400000US15","Hawaii",null,"2016","311615","Poultry processing","1","0","0","15",
"0400000US15","Hawaii",null,"2016","3117","Seafood product preparation and packaging","2","0","0","15",
"0400000US15","Hawaii",null,"2016","31171","Seafood product preparation and packaging","2","0","0","15",
"0400000US15","Hawaii",null,"2016","311710","Seafood product preparation and packaging","2","0","0","15",
"0400000US15","Hawaii",null,"2016","3118","Bakeries and tortilla manufacturing","114","2262","56352","15",
"0400000US15","Hawaii",null,"2016","31181","Bread and bakery product manufacturing","95","1832","41989","15",
"0400000US15","Hawaii",null,"2016","311811","Retail bakeries","67","764","14948","15",
"0400000US15","Hawaii",null,"2016","311812","Commercial bakeries","28","1068","27041","15",
"0400000US15","Hawaii",null,"2016","31182","Cookie, cracker, and pasta manufacturing","17","398","13369","15",
"0400000US15","Hawaii",null,"2016","311821","Cookie and cracker manufacturing","12","346","12600","15",
"0400000US15","Hawaii",null,"2016","311824","Dry pasta, dough, and flour mixes manufacturing from purchased flour","5","52","769","15",
"0400000US15","Hawaii",null,"2016","31183","Tortilla manufacturing","2","0","0","15",
"0400000US15","Hawaii",null,"2016","311830","Tortilla manufacturing","2","0","0","15",
"0400000US15","Hawaii",null,"2016","3119","Other food manufacturing","65","1449","40057","15",
"0400000US15","Hawaii",null,"2016","31191","Snack food manufacturing","12","314","10298","15",
"0400000US15","Hawaii",null,"2016","311911","Roasted nuts and peanut butter manufacturing","5","255","8810","15",
"0400000US15","Hawaii",null,"2016","311919","Other snack food manufacturing","7","59","1488","15",
"0400000US15","Hawaii",null,"2016","31192","Coffee and tea manufacturing","16","204","7086","15",
"0400000US15","Hawaii",null,"2016","311920","Coffee and tea manufacturing","16","204","7086","15",
"0400000US15","Hawaii",null,"2016","31193","Flavoring syrup and concentrate manufacturing","2","0","0","15",
"0400000US15","Hawaii",null,"2016","311930","Flavoring syrup and concentrate manufacturing","2","0","0","15",
"0400000US15","Hawaii",null,"2016","31194","Seasoning and dressing manufacturing","11","75","2598","15",
"0400000US15","Hawaii",null,"2016","311941","Mayonnaise, dressing, and other prepared sauce manufacturing","7","62","2338","15",
"0400000US15","Hawaii",null,"2016","311942","Spice and extract manufacturing","4","13","260","15",
"0400000US15","Hawaii",null,"2016","31199","All other food manufacturing","24","842","19476","15",
"0400000US15","Hawaii",null,"2016","311991","Perishable prepared food manufacturing","19","650","17229","15",
"0400000US15","Hawaii",null,"2016","311999","All other miscellaneous food manufacturing","5","192","2247","15",
"0400000US15","Hawaii",null,"2016","312","Beverage and tobacco product manufacturing","35","944","42823","15",
"0400000US15","Hawaii",null,"2016","3121","Beverage manufacturing","35","944","42823","15",
"0400000US15","Hawaii",null,"2016","31211","Soft drink and ice manufacturing","20","775","36702","15",
"0400000US15","Hawaii",null,"2016","312111","Soft drink manufacturing","8","475","22351","15",
"0400000US15","Hawaii",null,"2016","312112","Bottled water manufacturing","8","240","11340","15",
"0400000US15","Hawaii",null,"2016","312113","Ice manufacturing","4","60","3011","15",
"0400000US15","Hawaii",null,"2016","31212","Breweries","6","61","2104","15",
"0400000US15","Hawaii",null,"2016","312120","Breweries","6","61","2104","15",
"0400000US15","Hawaii",null,"2016","31213","Wineries","3","50","1590","15",
"0400000US15","Hawaii",null,"2016","312130","Wineries","3","50","1590","15",
"0400000US15","Hawaii",null,"2016","31214","Distilleries","6","58","2427","15",
"0400000US15","Hawaii",null,"2016","312140","Distilleries","6","58","2427","15",
"0400000US15","Hawaii",null,"2016","314","Textile product mills","20","124","4006","15",
"0400000US15","Hawaii",null,"2016","3141","Textile furnishings mills","5","53","1543","15",
"0400000US15","Hawaii",null,"2016","31412","Curtain and linen mills","5","53","1543","15",
"0400000US15","Hawaii",null,"2016","314120","Curtain and linen mills","5","53","1543","15",
"0400000US15","Hawaii",null,"2016","3149","Other textile product mills","15","71","2463","15",
"0400000US15","Hawaii",null,"2016","31491","Textile bag and canvas mills","6","40","1820","15",
"0400000US15","Hawaii",null,"2016","314910","Textile bag and canvas mills","6","40","1820","15",
"0400000US15","Hawaii",null,"2016","31499","All other textile product mills","9","31","643","15",
"0400000US15","Hawaii",null,"2016","314999","All other miscellaneous textile product mills","9","31","643","15",
"0400000US15","Hawaii",null,"2016","315","Apparel manufacturing","41","384","8804","15",
"0400000US15","Hawaii",null,"2016","3152","Cut and sew apparel manufacturing","40","382","8801","15",
"0400000US15","Hawaii",null,"2016","31521","Cut and sew apparel contractors","23","157","2665","15",
"0400000US15","Hawaii",null,"2016","315210","Cut and sew apparel contractors","23","157","2665","15",
"0400000US15","Hawaii",null,"2016","31522","Men's and boys' cut and sew apparel manufacturing","1","0","0","15",
"0400000US15","Hawaii",null,"2016","315220","Men's and boys' cut and sew apparel manufacturing","1","0","0","15",
"0400000US15","Hawaii",null,"2016","31524","Women's, girls', and infants' cut and sew apparel manufacturing","16","219","6079","15",
"0400000US15","Hawaii",null,"2016","315240","Women's, girls', and infants' cut and sew apparel manufacturing","16","219","6079","15",
"0400000US15","Hawaii",null,"2016","3159","Apparel accessories and other apparel manufacturing","1","0","0","15",
"0400000US15","Hawaii",null,"2016","31599","Apparel accessories and other apparel manufacturing","1","0","0","15",
"0400000US15","Hawaii",null,"2016","315990","Apparel accessories and other apparel manufacturing","1","0","0","15",
"0400000US15","Hawaii",null,"2016","316","Leather and allied product manufacturing","1","0","0","15",
"0400000US15","Hawaii",null,"2016","3162","Footwear manufacturing","1","0","0","15",
"0400000US15","Hawaii",null,"2016","31621","Footwear manufacturing","1","0","0","15",
"0400000US15","Hawaii",null,"2016","316210","Footwear manufacturing","1","0","0","15",
"0400000US15","Hawaii",null,"2016","321","Wood product manufacturing","21","181","7239","15",
"0400000US15","Hawaii",null,"2016","3211","Sawmills and wood preservation","3","0","0","15",
"0400000US15","Hawaii",null,"2016","32111","Sawmills and wood preservation","3","0","0","15",
"0400000US15","Hawaii",null,"2016","321113","Sawmills","2","0","0","15",
"0400000US15","Hawaii",null,"2016","321114","Wood preservation","1","0","0","15",
"0400000US15","Hawaii",null,"2016","3212","Veneer, plywood, and engineered wood product manufacturing","5","74","2729","15",
"0400000US15","Hawaii",null,"2016","32121","Veneer, plywood, and engineered wood product manufacturing","5","74","2729","15",
"0400000US15","Hawaii",null,"2016","321214","Truss manufacturing","5","74","2729","15",
"0400000US15","Hawaii",null,"2016","3219","Other wood product manufacturing","13","60","2629","15",
"0400000US15","Hawaii",null,"2016","32191","Millwork","8","54","2378","15",
"0400000US15","Hawaii",null,"2016","321911","Wood window and door manufacturing","4","52","2218","15",
"0400000US15","Hawaii",null,"2016","321912","Cut stock, resawing lumber, and planing","1","0","0","15",
"0400000US15","Hawaii",null,"2016","321918","Other millwork (including flooring)","3","2","139","15",
"0400000US15","Hawaii",null,"2016","32192","Wood container and pallet manufacturing","2","0","0","15",
"0400000US15","Hawaii",null,"2016","321920","Wood container and pallet manufacturing","2","0","0","15",
"0400000US15","Hawaii",null,"2016","32199","All other wood product manufacturing","3","5","79","15",
"0400000US15","Hawaii",null,"2016","321999","All other miscellaneous wood product manufacturing","3","5","79","15",
"0400000US15","Hawaii",null,"2016","322","Paper manufacturing","3","0","0","15",
"0400000US15","Hawaii",null,"2016","3222","Converted paper product manufacturing","3","0","0","15",
"0400000US15","Hawaii",null,"2016","32221","Paperboard container manufacturing","1","0","0","15",
