"0400000US05","Arkansas",null,"2013","332111","Iron and steel forging","2","0","0","05",
"0400000US05","Arkansas",null,"2013","332114","Custom roll forming","6","0","0","05",
"0400000US05","Arkansas",null,"2013","332117","Powder metallurgy part manufacturing","1","0","0","05",
"0400000US05","Arkansas",null,"2013","332119","Metal crown, closure, and other metal stamping (except automotive)","8","379","12756","05",
"0400000US05","Arkansas",null,"2013","3322","Cutlery and handtool manufacturing","7","634","27035","05",
"0400000US05","Arkansas",null,"2013","33221","Cutlery and handtool manufacturing","7","634","27035","05",
"0400000US05","Arkansas",null,"2013","332215","Metal kitchen cookware, utensil, cutlery, and flatware (except precious) manufacturing","2","0","0","05",
"0400000US05","Arkansas",null,"2013","332216","Saw blade and handtool manufacturing","5","595","25487","05",
"0400000US05","Arkansas",null,"2013","3323","Architectural and structural metals manufacturing","126","3964","197076","05",
"0400000US05","Arkansas",null,"2013","33231","Plate work and fabricated structural product manufacturing","57","2564","131176","05",
"0400000US05","Arkansas",null,"2013","332311","Prefabricated metal building and component manufacturing","14","592","31448","05",
"0400000US05","Arkansas",null,"2013","332312","Fabricated structural metal manufacturing","37","1780","91220","05",
"0400000US05","Arkansas",null,"2013","332313","Plate work manufacturing","6","0","8508","05",
"0400000US05","Arkansas",null,"2013","33232","Ornamental and architectural metal products manufacturing","69","1400","65900","05",
"0400000US05","Arkansas",null,"2013","332321","Metal window and door manufacturing","12","0","0","05",
"0400000US05","Arkansas",null,"2013","332322","Sheet metal work manufacturing","34","528","28117","05",
"0400000US05","Arkansas",null,"2013","332323","Ornamental and architectural metal work manufacturing","23","143","4819","05",
"0400000US05","Arkansas",null,"2013","3324","Boiler, tank, and shipping container manufacturing","12","605","27527","05",
"0400000US05","Arkansas",null,"2013","33242","Metal tank (heavy gauge) manufacturing","7","216","8378","05",
"0400000US05","Arkansas",null,"2013","332420","Metal tank (heavy gauge) manufacturing","7","216","8378","05",
"0400000US05","Arkansas",null,"2013","33243","Metal can, box, and other metal container (light gauge) manufacturing","5","389","19149","05",
"0400000US05","Arkansas",null,"2013","332431","Metal can manufacturing","2","0","0","05",
"0400000US05","Arkansas",null,"2013","332439","Other metal container manufacturing","3","0","0","05",
"0400000US05","Arkansas",null,"2013","3325","Hardware manufacturing","5","0","0","05",
"0400000US05","Arkansas",null,"2013","33251","Hardware manufacturing","5","0","0","05",
"0400000US05","Arkansas",null,"2013","332510","Hardware manufacturing","5","0","0","05",
"0400000US05","Arkansas",null,"2013","3326","Spring and wire product manufacturing","9","401","17137","05",
"0400000US05","Arkansas",null,"2013","33261","Spring and wire product manufacturing","9","401","17137","05",
"0400000US05","Arkansas",null,"2013","332618","Other fabricated wire product manufacturing","9","401","17137","05",
"0400000US05","Arkansas",null,"2013","3327","Machine shops; turned product; and screw, nut, and bolt manufacturing","197","2187","85487","05",
"0400000US05","Arkansas",null,"2013","33271","Machine shops","176","1741","66841","05",
"0400000US05","Arkansas",null,"2013","332710","Machine shops","176","1741","66841","05",
"0400000US05","Arkansas",null,"2013","33272","Turned product and screw, nut, and bolt manufacturing","21","446","18646","05",
"0400000US05","Arkansas",null,"2013","332721","Precision turned product manufacturing","15","310","13367","05",
"0400000US05","Arkansas",null,"2013","332722","Bolt, nut, screw, rivet, and washer manufacturing","6","136","5279","05",
"0400000US05","Arkansas",null,"2013","3328","Coating, engraving, heat treating, and allied activities","29","448","18361","05",
"0400000US05","Arkansas",null,"2013","33281","Coating, engraving, heat treating, and allied activities","29","448","18361","05",
"0400000US05","Arkansas",null,"2013","332811","Metal heat treating","4","0","0","05",
"0400000US05","Arkansas",null,"2013","332812","Metal coating, engraving (except jewelry and silverware), and allied services to manufacturers","15","278","11411","05",
"0400000US05","Arkansas",null,"2013","332813","Electroplating, plating, polishing, anodizing, and coloring","10","86","3445","05",
"0400000US05","Arkansas",null,"2013","3329","Other fabricated metal product manufacturing","61","5254","248320","05",
"0400000US05","Arkansas",null,"2013","33291","Metal valve manufacturing","7","1868","73421","05",
"0400000US05","Arkansas",null,"2013","332911","Industrial valve manufacturing","2","0","0","05",
"0400000US05","Arkansas",null,"2013","332912","Fluid power valve and hose fitting manufacturing","1","0","0","05",
"0400000US05","Arkansas",null,"2013","332913","Plumbing fixture fitting and trim manufacturing","1","0","0","05",
"0400000US05","Arkansas",null,"2013","332919","Other metal valve and pipe fitting manufacturing","3","0","0","05",
"0400000US05","Arkansas",null,"2013","336350","Motor vehicle transmission and power train parts manufacturing","5","0","0","05",
"0400000US05","Arkansas",null,"2013","332992","Small arms ammunition manufacturing","3","0","0","05",
"0400000US05","Arkansas",null,"2013","332993","Ammunition (except small arms) manufacturing","2","0","0","05",
"0400000US05","Arkansas",null,"2013","332994","Small arms, ordnance, and ordnance accessories manufacturing","6","178","8855","05",
"0400000US05","Arkansas",null,"2013","332996","Fabricated pipe and pipe fitting manufacturing","15","1572","79284","05",
"0400000US05","Arkansas",null,"2013","332999","All other miscellaneous fabricated metal product manufacturing","28","0","0","05",
"0400000US05","Arkansas",null,"2013","333","Machinery manufacturing","200","12648","519005","05",
"0400000US05","Arkansas",null,"2013","3331","Agriculture, construction, and mining machinery manufacturing","28","2689","89854","05",
"0400000US05","Arkansas",null,"2013","33311","Agricultural implement manufacturing","20","2016","59192","05",
"0400000US05","Arkansas",null,"2013","333111","Farm machinery and equipment manufacturing","19","748","30274","05",
"0400000US05","Arkansas",null,"2013","333112","Lawn and garden tractor and home lawn and garden equipment manufacturing","1","0","0","05",
"0400000US05","Arkansas",null,"2013","33312","Construction machinery manufacturing","6","503","22510","05",
"0400000US05","Arkansas",null,"2013","333120","Construction machinery manufacturing","6","503","22510","05",
"0400000US05","Arkansas",null,"2013","33313","Mining and oil and gas field machinery manufacturing","2","0","0","05",
"0400000US05","Arkansas",null,"2013","333131","Mining machinery and equipment manufacturing","1","0","0","05",
"0400000US05","Arkansas",null,"2013","333132","Oil and gas field machinery and equipment manufacturing","1","0","0","05",
"0400000US05","Arkansas",null,"2013","3332","Industrial machinery manufacturing","28","1018","41463","05",
"0400000US05","Arkansas",null,"2013","33324","Industrial machinery manufacturing","28","1018","41463","05",
"0400000US05","Arkansas",null,"2013","333241","Food product machinery manufacturing","4","0","9933","05",
"0400000US05","Arkansas",null,"2013","333243","Sawmill, woodworking, and paper machinery manufacturing","9","350","16402","05",
"0400000US05","Arkansas",null,"2013","333249","Other industrial machinery manufacturing","15","474","15128","05",
"0400000US05","Arkansas",null,"2013","3333","Commercial and service industry machinery manufacturing","19","0","0","05",
"0400000US05","Arkansas",null,"2013","33331","Commercial and service industry machinery manufacturing","19","0","0","05",
"0400000US05","Arkansas",null,"2013","333314","Optical instrument and lens manufacturing","4","0","0","05",
"0400000US05","Arkansas",null,"2013","333318","Other commercial and service industry machinery manufacturing","15","0","0","05",
"0400000US05","Arkansas",null,"2013","3334","Ventilation, heating, air-conditioning, and commercial refrigeration equipment manufacturing","19","3966","151298","05",
"0400000US05","Arkansas",null,"2013","33341","Ventilation, heating, air-conditioning, and commercial refrigeration equipment manufacturing","19","3966","151298","05",
"0400000US05","Arkansas",null,"2013","333413","Industrial and commercial fan and blower and air purification equipment manufacturing","8","509","26438","05",
"0400000US05","Arkansas",null,"2013","333415","Air-conditioning and warm air heating equipment and commercial and industrial refrigeration equipment manufacturing","11","3457","124860","05",
"0400000US05","Arkansas",null,"2013","3335","Metalworking machinery manufacturing","44","872","38822","05",
"0400000US05","Arkansas",null,"2013","33351","Metalworking machinery manufacturing","44","872","38822","05",
"0400000US05","Arkansas",null,"2013","333511","Industrial mold manufacturing","13","0","2288","05",
"0400000US05","Arkansas",null,"2013","333514","Special die and tool, die set, jig, and fixture manufacturing","16","156","6309","05",
"0400000US05","Arkansas",null,"2013","333515","Cutting tool and machine tool accessory manufacturing","8","444","20482","05",
"0400000US05","Arkansas",null,"2013","333517","Machine tool manufacturing","5","0","0","05",
"0400000US05","Arkansas",null,"2013","333519","Rolling mill and other metalworking machinery manufacturing","2","0","0","05",
"0400000US05","Arkansas",null,"2013","3336","Engine, turbine, and power transmission equipment manufacturing","9","602","24373","05",
"0400000US05","Arkansas",null,"2013","33361","Engine, turbine, and power transmission equipment manufacturing","9","602","24373","05",
"0400000US05","Arkansas",null,"2013","333611","Turbine and turbine generator set units manufacturing","2","0","0","05",
"0400000US05","Arkansas",null,"2013","333612","Speed changer, industrial high-speed drive, and gear manufacturing","1","0","0","05",
"0400000US05","Arkansas",null,"2013","333613","Mechanical power transmission equipment manufacturing","3","137","4774","05",
"0400000US05","Arkansas",null,"2013","333618","Other engine equipment manufacturing","3","0","0","05",
"0400000US05","Arkansas",null,"2013","3339","Other general purpose machinery manufacturing","53","2538","117640","05",
"0400000US05","Arkansas",null,"2013","33391","Pump and compressor manufacturing","6","51","1807","05",
"0400000US05","Arkansas",null,"2013","333911","Pump and pumping equipment manufacturing","3","0","613","05",
"0400000US05","Arkansas",null,"2013","333912","Air and gas compressor manufacturing","3","31","1194","05",
"0400000US05","Arkansas",null,"2013","33392","Material handling equipment manufacturing","25","1774","80897","05",
"0400000US05","Arkansas",null,"2013","333921","Elevator and moving stairway manufacturing","1","0","0","05",
"0400000US05","Arkansas",null,"2013","333922","Conveyor and conveying equipment manufacturing","16","1356","58925","05",
"0400000US05","Arkansas",null,"2013","333923","Overhead traveling crane, hoist, and monorail system manufacturing","1","0","0","05",
"0400000US05","Arkansas",null,"2013","333924","Industrial truck, trailer, and stacker machinery manufacturing","7","292","14308","05",
"0400000US05","Arkansas",null,"2013","33399","All other general purpose machinery manufacturing","22","713","34936","05",
"0400000US05","Arkansas",null,"2013","333992","Welding and soldering equipment manufacturing","1","0","0","05",
"0400000US05","Arkansas",null,"2013","333993","Packaging machinery manufacturing","4","142","8876","05",
"0400000US05","Arkansas",null,"2013","333995","Fluid power cylinder and actuator manufacturing","2","0","0","05",
"0400000US05","Arkansas",null,"2013","333996","Fluid power pump and motor manufacturing","1","0","0","05",
"0400000US05","Arkansas",null,"2013","333997","Scale and balance manufacturing","1","0","0","05",
"0400000US05","Arkansas",null,"2013","333999","All other miscellaneous general purpose machinery manufacturing","13","441","19957","05",
"0400000US05","Arkansas",null,"2013","334","Computer and electronic product manufacturing","34","2648","109289","05",
"0400000US05","Arkansas",null,"2013","3341","Computer and peripheral equipment manufacturing","4","0","0","05",
"0400000US05","Arkansas",null,"2013","33411","Computer and peripheral equipment manufacturing","4","0","0","05",
"0400000US05","Arkansas",null,"2013","334111","Electronic computer manufacturing","1","0","0","05",
"0400000US05","Arkansas",null,"2013","334118","Computer terminal and other computer peripheral equipment manufacturing","3","0","0","05",
"0400000US05","Arkansas",null,"2013","3343","Audio and video equipment manufacturing","1","0","0","05",
"0400000US05","Arkansas",null,"2013","33431","Audio and video equipment manufacturing","1","0","0","05",
"0400000US05","Arkansas",null,"2013","334310","Audio and video equipment manufacturing","1","0","0","05",
"0400000US05","Arkansas",null,"2013","3344","Semiconductor and other electronic component manufacturing","16","1019","32292","05",
"0400000US05","Arkansas",null,"2013","33441","Semiconductor and other electronic component manufacturing","16","1019","32292","05",
"0400000US05","Arkansas",null,"2013","334412","Bare printed circuit board manufacturing","5","32","1008","05",
"0400000US05","Arkansas",null,"2013","334416","Capacitor, resistor, coil, transformer, and other inductor manufacturing","3","114","3784","05",
"0400000US05","Arkansas",null,"2013","334418","Printed circuit assembly (electronic assembly) manufacturing","3","0","0","05",
"0400000US05","Arkansas",null,"2013","334419","Other electronic component manufacturing","5","0","0","05",
"0400000US05","Arkansas",null,"2013","3345","Navigational, measuring, electromedical, and control instruments manufacturing","11","1544","73807","05",
"0400000US05","Arkansas",null,"2013","33451","Navigational, measuring, electromedical, and control instruments manufacturing","11","1544","73807","05",
"0400000US05","Arkansas",null,"2013","334510","Electromedical and electrotherapeutic apparatus manufacturing","2","0","0","05",
"0400000US05","Arkansas",null,"2013","334511","Search, detection, navigation, guidance, aeronautical, and nautical system and instrument manufacturing","2","0","0","05",
"0400000US05","Arkansas",null,"2013","334512","Automatic environmental control manufacturing for residential, commercial, and appliance use","1","0","0","05",
"0400000US05","Arkansas",null,"2013","334513","Instruments and related products manufacturing for measuring, displaying, and controlling industrial process variables","1","0","0","05",
"0400000US05","Arkansas",null,"2013","334514","Totalizing fluid meter and counting device manufacturing","2","0","0","05",
"0400000US05","Arkansas",null,"2013","334515","Instrument manufacturing for measuring and testing electricity and electrical systems","1","0","0","05",
"0400000US05","Arkansas",null,"2013","334516","Analytical laboratory instrument manufacturing","1","0","0","05",
"0400000US05","Arkansas",null,"2013","334519","Other measuring and controlling device manufacturing","1","0","0","05",
"0400000US05","Arkansas",null,"2013","3346","Manufacturing and reproducing magnetic and optical media","2","0","0","05",
"0400000US05","Arkansas",null,"2013","33461","Manufacturing and reproducing magnetic and optical media","2","0","0","05",
"0400000US05","Arkansas",null,"2013","334614","Software and other prerecorded compact disc, tape, and record reproducing","2","0","0","05",
"0400000US05","Arkansas",null,"2013","335","Electrical equipment, appliance, and component manufacturing","50","5804","251551","05",
"0400000US05","Arkansas",null,"2013","3351","Electric lighting equipment manufacturing","10","386","16182","05",
"0400000US05","Arkansas",null,"2013","33512","Lighting fixture manufacturing","10","386","16182","05",
"0400000US05","Arkansas",null,"2013","335121","Residential electric lighting fixture manufacturing","3","0","0","05",
"0400000US05","Arkansas",null,"2013","335122","Commercial, industrial, and institutional electric lighting fixture manufacturing","4","0","0","05",
"0400000US05","Arkansas",null,"2013","335129","Other lighting equipment manufacturing","3","176","7455","05",
"0400000US05","Arkansas",null,"2013","3352","Household appliance manufacturing","2","0","0","05",
"0400000US05","Arkansas",null,"2013","33521","Small electrical appliance manufacturing","2","0","0","05",
"0400000US05","Arkansas",null,"2013","335210","Small electrical appliance manufacturing","2","0","0","05",
"0400000US05","Arkansas",null,"2013","3353","Electrical equipment manufacturing","23","0","0","05",
"0400000US05","Arkansas",null,"2013","33531","Electrical equipment manufacturing","23","0","0","05",
"0400000US05","Arkansas",null,"2013","335311","Power, distribution, and specialty transformer manufacturing","3","0","0","05",
"0400000US05","Arkansas",null,"2013","335312","Motor and generator manufacturing","12","0","0","05",
"0400000US05","Arkansas",null,"2013","335313","Switchgear and switchboard apparatus manufacturing","1","0","0","05",
"0400000US05","Arkansas",null,"2013","335314","Relay and industrial control manufacturing","7","182","5325","05",
"0400000US05","Arkansas",null,"2013","3359","Other electrical equipment and component manufacturing","15","2112","98940","05",
"0400000US05","Arkansas",null,"2013","33591","Battery manufacturing","1","0","0","05",
"0400000US05","Arkansas",null,"2013","335911","Storage battery manufacturing","1","0","0","05",
"0400000US05","Arkansas",null,"2013","33592","Communication and energy wire and cable manufacturing","1","0","0","05",
"0400000US05","Arkansas",null,"2013","335929","Other communication and energy wire manufacturing","1","0","0","05",
"0400000US05","Arkansas",null,"2013","33593","Wiring device manufacturing","7","0","0","05",
"0400000US05","Arkansas",null,"2013","335931","Current-carrying wiring device manufacturing","5","0","0","05",
"0400000US05","Arkansas",null,"2013","335932","Noncurrent-carrying wiring device manufacturing","2","0","0","05",
"0400000US05","Arkansas",null,"2013","33599","All other electrical equipment and component manufacturing","6","292","14620","05",
"0400000US05","Arkansas",null,"2013","335991","Carbon and graphite product manufacturing","3","0","0","05",
"0400000US05","Arkansas",null,"2013","335999","All other miscellaneous electrical equipment and component manufacturing","3","81","3835","05",
"0400000US05","Arkansas",null,"2013","336","Transportation equipment manufacturing","118","15302","665524","05",
"0400000US05","Arkansas",null,"2013","3361","Motor vehicle manufacturing","4","0","850","05",
"0400000US05","Arkansas",null,"2013","33611","Automobile and light duty motor vehicle manufacturing","4","0","850","05",
"0400000US05","Arkansas",null,"2013","336111","Automobile manufacturing","4","0","850","05",
"0400000US05","Arkansas",null,"2013","3362","Motor vehicle body and trailer manufacturing","22","1677","51399","05",
"0400000US05","Arkansas",null,"2013","33621","Motor vehicle body and trailer manufacturing","22","1677","51399","05",
"0400000US05","Arkansas",null,"2013","336211","Motor vehicle body manufacturing","4","157","4481","05",
"0400000US05","Arkansas",null,"2013","336212","Truck trailer manufacturing","10","0","40299","05",
"0400000US05","Arkansas",null,"2013","336214","Travel trailer and camper manufacturing","8","229","6619","05",
"0400000US05","Arkansas",null,"2013","3363","Motor vehicle parts manufacturing","46","6225","231685","05",
"0400000US05","Arkansas",null,"2013","33631","Motor vehicle gasoline engine and engine parts manufacturing","11","0","31866","05",
"0400000US05","Arkansas",null,"2013","336310","Motor vehicle gasoline engine and engine parts manufacturing","11","0","31866","05",
"0400000US05","Arkansas",null,"2013","33632","Motor vehicle electrical and electronic equipment manufacturing","5","0","0","05",
"0400000US05","Arkansas",null,"2013","336320","Motor vehicle electrical and electronic equipment manufacturing","5","0","0","05",
"0400000US05","Arkansas",null,"2013","33633","Motor vehicle steering and suspension components (except spring) manufacturing","4","1542","57266","05",
"0400000US05","Arkansas",null,"2013","336330","Motor vehicle steering and suspension components (except spring) manufacturing","4","1542","57266","05",
"0400000US05","Arkansas",null,"2013","33634","Motor vehicle brake system manufacturing","4","75","3301","05",
"0400000US05","Arkansas",null,"2013","336340","Motor vehicle brake system manufacturing","4","75","3301","05",
"0400000US05","Arkansas",null,"2013","33635","Motor vehicle transmission and power train parts manufacturing","5","0","0","05",
"0400000US05","Arkansas",null,"2013","42373","Warm air heating and air-conditioning equipment and supplies merchant wholesalers","71","615","35695","05",
"0400000US05","Arkansas",null,"2013","33636","Motor vehicle seating and interior trim manufacturing","3","0","0","05",
"0400000US05","Arkansas",null,"2013","336360","Motor vehicle seating and interior trim manufacturing","3","0","0","05",
"0400000US05","Arkansas",null,"2013","33637","Motor vehicle metal stamping","2","0","0","05",
"0400000US05","Arkansas",null,"2013","336370","Motor vehicle metal stamping","2","0","0","05",
"0400000US05","Arkansas",null,"2013","33639","Other motor vehicle parts manufacturing","12","2779","109093","05",
"0400000US05","Arkansas",null,"2013","336390","Other motor vehicle parts manufacturing","12","2779","109093","05",
"0400000US05","Arkansas",null,"2013","3364","Aerospace product and parts manufacturing","18","4426","262524","05",
"0400000US05","Arkansas",null,"2013","33641","Aerospace product and parts manufacturing","18","4426","262524","05",
"0400000US05","Arkansas",null,"2013","336411","Aircraft manufacturing","4","0","0","05",
"0400000US05","Arkansas",null,"2013","336412","Aircraft engine and engine parts manufacturing","4","0","0","05",
"0400000US05","Arkansas",null,"2013","336413","Other aircraft parts and auxiliary equipment manufacturing","7","1053","45394","05",
"0400000US05","Arkansas",null,"2013","336414","Guided missile and space vehicle manufacturing","2","0","0","05",
"0400000US05","Arkansas",null,"2013","336415","Guided missile and space vehicle propulsion unit and propulsion unit parts manufacturing","1","0","0","05",
"0400000US05","Arkansas",null,"2013","3365","Railroad rolling stock manufacturing","3","0","0","05",
"0400000US05","Arkansas",null,"2013","33651","Railroad rolling stock manufacturing","3","0","0","05",
"0400000US05","Arkansas",null,"2013","336510","Railroad rolling stock manufacturing","3","0","0","05",
"0400000US05","Arkansas",null,"2013","3366","Ship and boat building","21","1539","48459","05",
"0400000US05","Arkansas",null,"2013","33661","Ship and boat building","21","1539","48459","05",
"0400000US05","Arkansas",null,"2013","336611","Ship building and repairing","4","50","1795","05",
"0400000US05","Arkansas",null,"2013","336612","Boat building","17","1489","46664","05",
"0400000US05","Arkansas",null,"2013","3369","Other transportation equipment manufacturing","4","0","3068","05",
"0400000US05","Arkansas",null,"2013","33699","Other transportation equipment manufacturing","4","0","3068","05",
"0400000US05","Arkansas",null,"2013","336991","Motorcycle, bicycle, and parts manufacturing","1","0","0","05",
"0400000US05","Arkansas",null,"2013","336999","All other transportation equipment manufacturing","3","0","3024","05",
"0400000US05","Arkansas",null,"2013","337","Furniture and related product manufacturing","142","3176","118994","05",
"0400000US05","Arkansas",null,"2013","3371","Household and institutional furniture and kitchen cabinet manufacturing","114","2174","75738","05",
"0400000US05","Arkansas",null,"2013","33711","Wood kitchen cabinet and countertop manufacturing","72","556","15029","05",
"0400000US05","Arkansas",null,"2013","337110","Wood kitchen cabinet and countertop manufacturing","72","556","15029","05",
"0400000US05","Arkansas",null,"2013","33712","Household and institutional furniture manufacturing","42","1618","60709","05",
"0400000US05","Arkansas",null,"2013","337121","Upholstered household furniture manufacturing","8","0","0","05",
"0400000US05","Arkansas",null,"2013","337122","Nonupholstered wood household furniture manufacturing","16","88","2550","05",
"0400000US05","Arkansas",null,"2013","337124","Metal household furniture manufacturing","3","0","0","05",
"0400000US05","Arkansas",null,"2013","337125","Household furniture (except wood and metal) manufacturing","1","0","0","05",
"0400000US05","Arkansas",null,"2013","337127","Institutional furniture manufacturing","14","0","0","05",
"0400000US05","Arkansas",null,"2013","3372","Office furniture (including fixtures) manufacturing","21","915","40940","05",
"0400000US05","Arkansas",null,"2013","33721","Office furniture (including fixtures) manufacturing","21","915","40940","05",
"0400000US05","Arkansas",null,"2013","337211","Wood office furniture manufacturing","2","0","0","05",
"0400000US05","Arkansas",null,"2013","337212","Custom architectural woodwork and millwork manufacturing","6","0","0","05",
"0400000US05","Arkansas",null,"2013","337214","Office furniture (except wood) manufacturing","1","0","0","05",
"0400000US05","Arkansas",null,"2013","337215","Showcase, partition, shelving, and locker manufacturing","12","774","36904","05",
"0400000US05","Arkansas",null,"2013","3379","Other furniture related product manufacturing","7","0","0","05",
"0400000US05","Arkansas",null,"2013","33791","Mattress manufacturing","4","0","0","05",
"0400000US05","Arkansas",null,"2013","337910","Mattress manufacturing","4","0","0","05",
"0400000US05","Arkansas",null,"2013","33792","Blind and shade manufacturing","3","11","289","05",
