"0400000US50","Vermont",null,"2012","3351","Electric lighting equipment manufacturing","8","373","17224","50",
"0400000US50","Vermont",null,"2012","33511","Electric lamp bulb and part manufacturing","3","0","0","50",
"0400000US50","Vermont",null,"2012","335110","Electric lamp bulb and part manufacturing","3","0","0","50",
"0400000US50","Vermont",null,"2012","33512","Lighting fixture manufacturing","5","291","12790","50",
"0400000US50","Vermont",null,"2012","335121","Residential electric lighting fixture manufacturing","3","0","0","50",
"0400000US50","Vermont",null,"2012","335122","Commercial, industrial, and institutional electric lighting fixture manufacturing","2","0","0","50",
"0400000US50","Vermont",null,"2012","3352","Household appliance manufacturing","1","0","0","50",
"0400000US50","Vermont",null,"2012","33522","Major appliance manufacturing","1","0","0","50",
"0400000US50","Vermont",null,"2012","335221","Household cooking appliance manufacturing","1","0","0","50",
"0400000US50","Vermont",null,"2012","3353","Electrical equipment manufacturing","3","0","1196","50",
"0400000US50","Vermont",null,"2012","33531","Electrical equipment manufacturing","3","0","1196","50",
"0400000US50","Vermont",null,"2012","335313","Switchgear and switchboard apparatus manufacturing","1","0","0","50",
"0400000US50","Vermont",null,"2012","335314","Relay and industrial control manufacturing","2","0","0","50",
"0400000US50","Vermont",null,"2012","3359","Other electrical equipment and component manufacturing","12","0","63788","50",
"0400000US50","Vermont",null,"2012","33591","Battery manufacturing","2","0","0","50",
"0400000US50","Vermont",null,"2012","335912","Primary battery manufacturing","2","0","0","50",
"0400000US50","Vermont",null,"2012","33592","Communication and energy wire and cable manufacturing","6","346","21007","50",
"0400000US50","Vermont",null,"2012","335921","Fiber optic cable manufacturing","2","0","0","50",
"0400000US50","Vermont",null,"2012","335929","Other communication and energy wire manufacturing","4","303","17547","50",
"0400000US50","Vermont",null,"2012","33593","Wiring device manufacturing","1","0","0","50",
"0400000US50","Vermont",null,"2012","335931","Current-carrying wiring device manufacturing","1","0","0","50",
"0400000US50","Vermont",null,"2012","33599","All other electrical equipment and component manufacturing","3","0","0","50",
"0400000US50","Vermont",null,"2012","335991","Carbon and graphite product manufacturing","1","0","0","50",
"0400000US50","Vermont",null,"2012","335999","All other miscellaneous electrical equipment and component manufacturing","2","0","0","50",
"0400000US50","Vermont",null,"2012","336","Transportation equipment manufacturing","16","1496","108751","50",
"0400000US50","Vermont",null,"2012","3361","Motor vehicle manufacturing","2","0","0","50",
"0400000US50","Vermont",null,"2012","33611","Automobile and light duty motor vehicle manufacturing","1","0","0","50",
"0400000US50","Vermont",null,"2012","336111","Automobile manufacturing","1","0","0","50",
"0400000US50","Vermont",null,"2012","33612","Heavy duty truck manufacturing","1","0","0","50",
"0400000US50","Vermont",null,"2012","336120","Heavy duty truck manufacturing","1","0","0","50",
"0400000US50","Vermont",null,"2012","3362","Motor vehicle body and trailer manufacturing","1","0","0","50",
"0400000US50","Vermont",null,"2012","33621","Motor vehicle body and trailer manufacturing","1","0","0","50",
"0400000US50","Vermont",null,"2012","336211","Motor vehicle body manufacturing","1","0","0","50",
"0400000US50","Vermont",null,"2012","3363","Motor vehicle parts manufacturing","3","0","0","50",
"0400000US50","Vermont",null,"2012","33631","Motor vehicle gasoline engine and engine parts manufacturing","1","0","0","50",
"0400000US50","Vermont",null,"2012","336310","Motor vehicle gasoline engine and engine parts manufacturing","1","0","0","50",
"0400000US50","Vermont",null,"2012","33636","Motor vehicle seating and interior trim manufacturing","1","0","0","50",
"0400000US50","Vermont",null,"2012","336360","Motor vehicle seating and interior trim manufacturing","1","0","0","50",
"0400000US50","Vermont",null,"2012","33639","Other motor vehicle parts manufacturing","1","0","0","50",
"0400000US50","Vermont",null,"2012","336390","Other motor vehicle parts manufacturing","1","0","0","50",
"0400000US50","Vermont",null,"2012","3364","Aerospace product and parts manufacturing","2","0","0","50",
"0400000US50","Vermont",null,"2012","33641","Aerospace product and parts manufacturing","2","0","0","50",
"0400000US50","Vermont",null,"2012","336412","Aircraft engine and engine parts manufacturing","1","0","0","50",
"0400000US50","Vermont",null,"2012","336413","Other aircraft parts and auxiliary equipment manufacturing","1","0","0","50",
"0400000US50","Vermont",null,"2012","3366","Ship and boat building","4","0","321","50",
"0400000US50","Vermont",null,"2012","33661","Ship and boat building","4","0","321","50",
"0400000US50","Vermont",null,"2012","336612","Boat building","4","0","321","50",
"0400000US50","Vermont",null,"2012","3369","Other transportation equipment manufacturing","4","0","0","50",
"0400000US50","Vermont",null,"2012","33699","Other transportation equipment manufacturing","4","0","0","50",
"0400000US50","Vermont",null,"2012","336991","Motorcycle, bicycle, and parts manufacturing","1","0","0","50",
"0400000US50","Vermont",null,"2012","336992","Military armored vehicle, tank, and tank component manufacturing","2","0","0","50",
"0400000US50","Vermont",null,"2012","336999","All other transportation equipment manufacturing","1","0","0","50",
"0400000US50","Vermont",null,"2012","337","Furniture and related product manufacturing","70","1334","46300","50",
"0400000US50","Vermont",null,"2012","3371","Household and institutional furniture and kitchen cabinet manufacturing","57","1027","32306","50",
"0400000US50","Vermont",null,"2012","33711","Wood kitchen cabinet and countertop manufacturing","19","0","3095","50",
"0400000US50","Vermont",null,"2012","337110","Wood kitchen cabinet and countertop manufacturing","19","0","3095","50",
"0400000US50","Vermont",null,"2012","33712","Household and institutional furniture manufacturing","38","950","29211","50",
"0400000US50","Vermont",null,"2012","337121","Upholstered household furniture manufacturing","4","0","246","50",
"0400000US50","Vermont",null,"2012","337122","Nonupholstered wood household furniture manufacturing","30","866","26688","50",
"0400000US50","Vermont",null,"2012","337124","Metal household furniture manufacturing","2","0","0","50",
"0400000US50","Vermont",null,"2012","337125","Household furniture (except wood and metal) manufacturing","1","0","0","50",
"0400000US50","Vermont",null,"2012","337127","Institutional furniture manufacturing","1","0","0","50",
"0400000US50","Vermont",null,"2012","3372","Office furniture (including fixtures) manufacturing","12","212","10040","50",
"0400000US50","Vermont",null,"2012","33721","Office furniture (including fixtures) manufacturing","12","212","10040","50",
"0400000US50","Vermont",null,"2012","337211","Wood office furniture manufacturing","2","0","0","50",
"0400000US50","Vermont",null,"2012","42433","Women's, children's, and infants' clothing and accessories merchant wholesalers","14","314","14444","50",
"0400000US50","Vermont",null,"2012","337215","Showcase, partition, shelving, and locker manufacturing","3","0","0","50",
"0400000US50","Vermont",null,"2012","3379","Other furniture related product manufacturing","1","0","0","50",
"0400000US50","Vermont",null,"2012","33791","Mattress manufacturing","1","0","0","50",
"0400000US50","Vermont",null,"2012","337910","Mattress manufacturing","1","0","0","50",
"0400000US50","Vermont",null,"2012","339","Miscellaneous manufacturing","107","1453","67147","50",
"0400000US50","Vermont",null,"2012","3391","Medical equipment and supplies manufacturing","30","660","29800","50",
"0400000US50","Vermont",null,"2012","33911","Medical equipment and supplies manufacturing","30","660","29800","50",
"0400000US50","Vermont",null,"2012","339112","Surgical and medical instrument manufacturing","6","0","0","50",
"0400000US50","Vermont",null,"2012","339113","Surgical appliance and supplies manufacturing","8","226","8416","50",
"0400000US50","Vermont",null,"2012","339115","Ophthalmic goods manufacturing","2","0","0","50",
"0400000US50","Vermont",null,"2012","339116","Dental laboratories","14","53","2133","50",
"0400000US50","Vermont",null,"2012","3399","Other miscellaneous manufacturing","77","793","37347","50",
"0400000US50","Vermont",null,"2012","33991","Jewelry and silverware manufacturing","13","146","4778","50",
"0400000US50","Vermont",null,"2012","339910","Jewelry and silverware manufacturing","13","146","4778","50",
"0400000US50","Vermont",null,"2012","33992","Sporting and athletic goods manufacturing","10","0","8283","50",
"0400000US50","Vermont",null,"2012","339920","Sporting and athletic goods manufacturing","10","0","8283","50",
"0400000US50","Vermont",null,"2012","33993","Doll, toy, and game manufacturing","8","0","0","50",
"0400000US50","Vermont",null,"2012","339930","Doll, toy, and game manufacturing","8","0","0","50",
"0400000US50","Vermont",null,"2012","33994","Office supplies (except paper) manufacturing","1","0","0","50",
"0400000US50","Vermont",null,"2012","339940","Office supplies (except paper) manufacturing","1","0","0","50",
"0400000US50","Vermont",null,"2012","33995","Sign manufacturing","9","66","2723","50",
"0400000US50","Vermont",null,"2012","339950","Sign manufacturing","9","66","2723","50",
"0400000US50","Vermont",null,"2012","33999","All other miscellaneous manufacturing","36","243","12052","50",
"0400000US50","Vermont",null,"2012","339991","Gasket, packing, and sealing device manufacturing","1","0","0","50",
"0400000US50","Vermont",null,"2012","339992","Musical instrument manufacturing","8","0","918","50",
"0400000US50","Vermont",null,"2012","339993","Fastener, button, needle, and pin manufacturing","1","0","0","50",
"0400000US50","Vermont",null,"2012","339994","Broom, brush, and mop manufacturing","3","0","0","50",
"0400000US50","Vermont",null,"2012","339999","All other miscellaneous manufacturing","23","91","5436","50",
"0400000US50","Vermont",null,"2012","42","Wholesale trade","826","10745","590428","50",
"0400000US50","Vermont",null,"2012","423","Merchant wholesalers, durable goods","483","4691","267970","50",
"0400000US50","Vermont",null,"2012","4231","Motor vehicle and motor vehicle parts and supplies merchant wholesalers","60","791","33973","50",
"0400000US50","Vermont",null,"2012","42311","Automobile and other motor vehicle merchant wholesalers","14","223","9176","50",
"0400000US50","Vermont",null,"2012","423110","Automobile and other motor vehicle merchant wholesalers","14","223","9176","50",
"0400000US50","Vermont",null,"2012","42312","Motor vehicle supplies and new parts merchant wholesalers","38","403","16489","50",
"0400000US50","Vermont",null,"2012","423120","Motor vehicle supplies and new parts merchant wholesalers","38","403","16489","50",
"0400000US50","Vermont",null,"2012","42313","Tire and tube merchant wholesalers","5","0","0","50",
"0400000US50","Vermont",null,"2012","423130","Tire and tube merchant wholesalers","5","0","0","50",
"0400000US50","Vermont",null,"2012","42314","Motor vehicle parts (used) merchant wholesalers","3","0","0","50",
"0400000US50","Vermont",null,"2012","423140","Motor vehicle parts (used) merchant wholesalers","3","0","0","50",
"0400000US50","Vermont",null,"2012","4232","Furniture and home furnishing merchant wholesalers","25","218","10809","50",
"0400000US50","Vermont",null,"2012","42321","Furniture merchant wholesalers","8","64","3726","50",
"0400000US50","Vermont",null,"2012","423210","Furniture merchant wholesalers","8","64","3726","50",
"0400000US50","Vermont",null,"2012","42322","Home furnishing merchant wholesalers","17","154","7083","50",
"0400000US50","Vermont",null,"2012","423220","Home furnishing merchant wholesalers","17","154","7083","50",
"0400000US50","Vermont",null,"2012","4233","Lumber and other construction materials merchant wholesalers","49","421","22006","50",
"0400000US50","Vermont",null,"2012","42331","Lumber, plywood, millwork, and wood panel merchant wholesalers","19","187","10081","50",
"0400000US50","Vermont",null,"2012","423310","Lumber, plywood, millwork, and wood panel merchant wholesalers","19","187","10081","50",
"0400000US50","Vermont",null,"2012","42332","Brick, stone, and related construction material merchant wholesalers","15","89","4692","50",
"0400000US50","Vermont",null,"2012","423320","Brick, stone, and related construction material merchant wholesalers","15","89","4692","50",
"0400000US50","Vermont",null,"2012","42333","Roofing, siding, and insulation material merchant wholesalers","10","104","4722","50",
"0400000US50","Vermont",null,"2012","423330","Roofing, siding, and insulation material merchant wholesalers","10","104","4722","50",
"0400000US50","Vermont",null,"2012","42339","Other construction material merchant wholesalers","5","0","0","50",
"0400000US50","Vermont",null,"2012","423390","Other construction material merchant wholesalers","5","0","0","50",
"0400000US50","Vermont",null,"2012","4234","Professional and commercial equipment and supplies merchant wholesalers","53","413","37333","50",
"0400000US50","Vermont",null,"2012","42342","Office equipment merchant wholesalers","15","112","8407","50",
"0400000US50","Vermont",null,"2012","423420","Office equipment merchant wholesalers","15","112","8407","50",
"0400000US50","Vermont",null,"2012","42343","Computer and computer peripheral equipment and software merchant wholesalers","13","68","6143","50",
"0400000US50","Vermont",null,"2012","423430","Computer and computer peripheral equipment and software merchant wholesalers","13","68","6143","50",
"0400000US50","Vermont",null,"2012","42344","Other commercial equipment merchant wholesalers","3","0","0","50",
"0400000US50","Vermont",null,"2012","423440","Other commercial equipment merchant wholesalers","3","0","0","50",
"0400000US50","Vermont",null,"2012","42345","Medical, dental, and hospital equipment and supplies merchant wholesalers","14","152","19461","50",
"0400000US50","Vermont",null,"2012","423450","Medical, dental, and hospital equipment and supplies merchant wholesalers","14","152","19461","50",
"0400000US50","Vermont",null,"2012","42346","Ophthalmic goods merchant wholesalers","5","39","1264","50",
"0400000US50","Vermont",null,"2012","423460","Ophthalmic goods merchant wholesalers","5","39","1264","50",
"0400000US50","Vermont",null,"2012","42349","Other professional equipment and supplies merchant wholesalers","3","0","1412","50",
"0400000US50","Vermont",null,"2012","423490","Other professional equipment and supplies merchant wholesalers","3","0","1412","50",
"0400000US50","Vermont",null,"2012","4235","Metal and mineral (except petroleum) merchant wholesalers","13","113","5473","50",
"0400000US50","Vermont",null,"2012","42351","Metal service centers and other metal merchant wholesalers","12","112","5432","50",
"0400000US50","Vermont",null,"2012","423510","Metal service centers and other metal merchant wholesalers","12","112","5432","50",
"0400000US50","Vermont",null,"2012","42352","Coal and other mineral and ore merchant wholesalers","1","0","0","50",
"0400000US50","Vermont",null,"2012","423520","Coal and other mineral and ore merchant wholesalers","1","0","0","50",
"0400000US50","Vermont",null,"2012","4236","Household appliances and electrical and electronic goods merchant wholesalers","56","519","45026","50",
"0400000US50","Vermont",null,"2012","42361","Electrical apparatus and equipment, wiring supplies, and related equipment merchant wholesalers","36","343","18883","50",
"0400000US50","Vermont",null,"2012","423610","Electrical apparatus and equipment, wiring supplies, and related equipment merchant wholesalers","36","343","18883","50",
"0400000US50","Vermont",null,"2012","42362","Household appliances, electric housewares, and consumer electronics merchant wholesalers","1","0","0","50",
"0400000US50","Vermont",null,"2012","423620","Household appliances, electric housewares, and consumer electronics merchant wholesalers","1","0","0","50",
"0400000US50","Vermont",null,"2012","42369","Other electronic parts and equipment merchant wholesalers","19","0","0","50",
"0400000US50","Vermont",null,"2012","423690","Other electronic parts and equipment merchant wholesalers","19","0","0","50",
"0400000US50","Vermont",null,"2012","4237","Hardware, plumbing and heating equipment and supplies merchant wholesalers","38","330","22163","50",
"0400000US50","Vermont",null,"2012","42371","Hardware merchant wholesalers","5","0","1073","50",
"0400000US50","Vermont",null,"2012","423710","Hardware merchant wholesalers","5","0","1073","50",
"0400000US50","Vermont",null,"2012","42372","Plumbing and heating equipment and supplies (hydronics) merchant wholesalers","25","288","19999","50",
"0400000US50","Vermont",null,"2012","423720","Plumbing and heating equipment and supplies (hydronics) merchant wholesalers","25","288","19999","50",
"0400000US50","Vermont",null,"2012","42373","Warm air heating and air-conditioning equipment and supplies merchant wholesalers","4","0","670","50",
"0400000US50","Vermont",null,"2012","423730","Warm air heating and air-conditioning equipment and supplies merchant wholesalers","4","0","670","50",
"0400000US50","Vermont",null,"2012","42374","Refrigeration equipment and supplies merchant wholesalers","4","11","421","50",
"0400000US50","Vermont",null,"2012","423740","Refrigeration equipment and supplies merchant wholesalers","4","11","421","50",
"0400000US50","Vermont",null,"2012","4238","Machinery, equipment, and supplies merchant wholesalers","107","1019","52293","50",
"0400000US50","Vermont",null,"2012","42381","Construction and mining (except oil well) machinery and equipment merchant wholesalers","14","176","9525","50",
"0400000US50","Vermont",null,"2012","423810","Construction and mining (except oil well) machinery and equipment merchant wholesalers","14","176","9525","50",
"0400000US50","Vermont",null,"2012","42382","Farm and garden machinery and equipment merchant wholesalers","29","287","11769","50",
"0400000US50","Vermont",null,"2012","423820","Farm and garden machinery and equipment merchant wholesalers","29","287","11769","50",
"0400000US50","Vermont",null,"2012","42383","Industrial machinery and equipment merchant wholesalers","42","242","12776","50",
"0400000US50","Vermont",null,"2012","423830","Industrial machinery and equipment merchant wholesalers","42","242","12776","50",
"0400000US50","Vermont",null,"2012","42384","Industrial supplies merchant wholesalers","9","213","12637","50",
"0400000US50","Vermont",null,"2012","423840","Industrial supplies merchant wholesalers","9","213","12637","50",
"0400000US50","Vermont",null,"2012","42385","Service establishment equipment and supplies merchant wholesalers","8","0","0","50",
"0400000US50","Vermont",null,"2012","423850","Service establishment equipment and supplies merchant wholesalers","8","0","0","50",
"0400000US50","Vermont",null,"2012","42386","Transportation equipment and supplies (except motor vehicle) merchant wholesalers","5","0","0","50",
"0400000US50","Vermont",null,"2012","423860","Transportation equipment and supplies (except motor vehicle) merchant wholesalers","5","0","0","50",
"0400000US50","Vermont",null,"2012","4239","Miscellaneous durable goods merchant wholesalers","82","867","38894","50",
"0400000US50","Vermont",null,"2012","42391","Sporting and recreational goods and supplies merchant wholesalers","24","345","19382","50",
"0400000US50","Vermont",null,"2012","423910","Sporting and recreational goods and supplies merchant wholesalers","24","345","19382","50",
"0400000US50","Vermont",null,"2012","42392","Toy and hobby goods and supplies merchant wholesalers","8","0","0","50",
"0400000US50","Vermont",null,"2012","423920","Toy and hobby goods and supplies merchant wholesalers","8","0","0","50",
"0400000US50","Vermont",null,"2012","42393","Recyclable material merchant wholesalers","14","84","3009","50",
"0400000US50","Vermont",null,"2012","423930","Recyclable material merchant wholesalers","14","84","3009","50",
"0400000US50","Vermont",null,"2012","42394","Jewelry, watch, precious stone, and precious metal merchant wholesalers","11","38","1393","50",
"0400000US50","Vermont",null,"2012","423940","Jewelry, watch, precious stone, and precious metal merchant wholesalers","11","38","1393","50",
"0400000US50","Vermont",null,"2012","42399","Other miscellaneous durable goods merchant wholesalers","25","0","0","50",
"0400000US50","Vermont",null,"2012","423990","Other miscellaneous durable goods merchant wholesalers","25","0","0","50",
"0400000US50","Vermont",null,"2012","424","Merchant wholesalers, nondurable goods","276","5858","310137","50",
"0400000US50","Vermont",null,"2012","4241","Paper and paper product merchant wholesalers","19","0","0","50",
"0400000US50","Vermont",null,"2012","42411","Printing and writing paper merchant wholesalers","2","0","0","50",
"0400000US50","Vermont",null,"2012","424110","Printing and writing paper merchant wholesalers","2","0","0","50",
"0400000US50","Vermont",null,"2012","42412","Stationery and office supplies merchant wholesalers","10","0","4035","50",
"0400000US50","Vermont",null,"2012","424120","Stationery and office supplies merchant wholesalers","10","0","4035","50",
"0400000US50","Vermont",null,"2012","42413","Industrial and personal service paper merchant wholesalers","7","0","0","50",
"0400000US50","Vermont",null,"2012","424130","Industrial and personal service paper merchant wholesalers","7","0","0","50",
"0400000US50","Vermont",null,"2012","4242","Drugs and druggists' sundries merchant wholesalers","21","604","55868","50",
"0400000US50","Vermont",null,"2012","42421","Drugs and druggists' sundries merchant wholesalers","21","604","55868","50",
"0400000US50","Vermont",null,"2012","424210","Drugs and druggists' sundries merchant wholesalers","21","604","55868","50",
"0400000US50","Vermont",null,"2012","4243","Apparel, piece goods, and notions merchant wholesalers","27","748","28811","50",
"0400000US50","Vermont",null,"2012","42431","Piece goods, notions, and other dry goods merchant wholesalers","4","99","3416","50",
"0400000US50","Vermont",null,"2012","424310","Piece goods, notions, and other dry goods merchant wholesalers","4","99","3416","50",
"0400000US50","Vermont",null,"2012","42432","Men's and boys' clothing and furnishings merchant wholesalers","8","0","10342","50",
"0400000US50","Vermont",null,"2012","424320","Men's and boys' clothing and furnishings merchant wholesalers","8","0","10342","50",
"0400000US50","Vermont",null,"2012","44531","Beer, wine, and liquor stores","131","0","12962","50",
"0400000US50","Vermont",null,"2012","424330","Women's, children's, and infants' clothing and accessories merchant wholesalers","14","314","14444","50",
"0400000US50","Vermont",null,"2012","42434","Footwear merchant wholesalers","1","0","0","50",
"0400000US50","Vermont",null,"2012","424340","Footwear merchant wholesalers","1","0","0","50",
"0400000US50","Vermont",null,"2012","4244","Grocery and related product merchant wholesalers","86","2396","115667","50",
"0400000US50","Vermont",null,"2012","42441","General line grocery merchant wholesalers","5","0","0","50",
"0400000US50","Vermont",null,"2012","424410","General line grocery merchant wholesalers","5","0","0","50",
"0400000US50","Vermont",null,"2012","42442","Packaged frozen food merchant wholesalers","4","19","637","50",
"0400000US50","Vermont",null,"2012","424420","Packaged frozen food merchant wholesalers","4","19","637","50",
"0400000US50","Vermont",null,"2012","42443","Dairy product (except dried or canned) merchant wholesalers","10","0","9775","50",
"0400000US50","Vermont",null,"2012","424430","Dairy product (except dried or canned) merchant wholesalers","10","0","9775","50",
"0400000US50","Vermont",null,"2012","42444","Poultry and poultry product merchant wholesalers","1","0","0","50",
"0400000US50","Vermont",null,"2012","424440","Poultry and poultry product merchant wholesalers","1","0","0","50",
"0400000US50","Vermont",null,"2012","42445","Confectionery merchant wholesalers","3","0","0","50",
"0400000US50","Vermont",null,"2012","424450","Confectionery merchant wholesalers","3","0","0","50",
"0400000US50","Vermont",null,"2012","42446","Fish and seafood merchant wholesalers","2","0","0","50",
"0400000US50","Vermont",null,"2012","424460","Fish and seafood merchant wholesalers","2","0","0","50",
"0400000US50","Vermont",null,"2012","42447","Meat and meat product merchant wholesalers","8","0","1851","50",
"0400000US50","Vermont",null,"2012","424470","Meat and meat product merchant wholesalers","8","0","1851","50",
"0400000US50","Vermont",null,"2012","42448","Fresh fruit and vegetable merchant wholesalers","5","0","0","50",
"0400000US50","Vermont",null,"2012","424480","Fresh fruit and vegetable merchant wholesalers","5","0","0","50",
"0400000US50","Vermont",null,"2012","42449","Other grocery and related products merchant wholesalers","48","1730","86441","50",
"0400000US50","Vermont",null,"2012","424490","Other grocery and related products merchant wholesalers","48","1730","86441","50",
"0400000US50","Vermont",null,"2012","4245","Farm product raw material merchant wholesalers","8","0","0","50",
"0400000US50","Vermont",null,"2012","42451","Grain and field bean merchant wholesalers","2","0","0","50",
"0400000US50","Vermont",null,"2012","424510","Grain and field bean merchant wholesalers","2","0","0","50",
"0400000US50","Vermont",null,"2012","42452","Livestock merchant wholesalers","6","0","0","50",
"0400000US50","Vermont",null,"2012","424520","Livestock merchant wholesalers","6","0","0","50",
"0400000US50","Vermont",null,"2012","4246","Chemical and allied products merchant wholesalers","23","151","7358","50",
