"0400000US50","Vermont",null,"2019","42443","Dairy product (except dried or canned) merchant wholesalers","7","214","11109","50",
"0400000US50","Vermont",null,"2019","42447","Meat and meat product merchant wholesalers","5","60","2179","50",
"0400000US50","Vermont",null,"2019","424430","Dairy product (except dried or canned) merchant wholesalers","7","214","11109","50",
"0400000US50","Vermont",null,"2019","42445","Confectionery merchant wholesalers","4","18","949","50",
"0400000US50","Vermont",null,"2019","424450","Confectionery merchant wholesalers","4","18","949","50",
"0400000US50","Vermont",null,"2019","424470","Meat and meat product merchant wholesalers","5","60","2179","50",
"0400000US50","Vermont",null,"2019","42448","Fresh fruit and vegetable merchant wholesalers","6","238","14154","50",
"0400000US50","Vermont",null,"2019","424480","Fresh fruit and vegetable merchant wholesalers","6","238","14154","50",
"0400000US50","Vermont",null,"2019","42449","Other grocery and related products merchant wholesalers","44","1336","78486","50",
"0400000US50","Vermont",null,"2019","424490","Other grocery and related products merchant wholesalers","44","1336","78486","50",
"0400000US50","Vermont",null,"2019","4246","Chemical and allied products merchant wholesalers","17","288","26458","50",
"0400000US50","Vermont",null,"2019","4245","Farm product raw material merchant wholesalers","7","53","3884","50",
"0400000US50","Vermont",null,"2019","42459","Other farm product raw material merchant wholesalers","3","4","56","50",
"0400000US50","Vermont",null,"2019","424590","Other farm product raw material merchant wholesalers","3","4","56","50",
"0400000US50","Vermont",null,"2019","42461","Plastics materials and basic forms and shapes merchant wholesalers","4","20","1187","50",
"0400000US50","Vermont",null,"2019","424610","Plastics materials and basic forms and shapes merchant wholesalers","4","20","1187","50",
"0400000US50","Vermont",null,"2019","42469","Other chemical and allied products merchant wholesalers","13","268","25271","50",
"0400000US50","Vermont",null,"2019","424710","Petroleum bulk stations and terminals ","12","127","7903","50",
"0400000US50","Vermont",null,"2019","424690","Other chemical and allied products merchant wholesalers","13","268","25271","50",
"0400000US50","Vermont",null,"2019","4247","Petroleum and petroleum products merchant wholesalers","15","149","9643","50",
"0400000US50","Vermont",null,"2019","42471","Petroleum bulk stations and terminals ","12","127","7903","50",
"0400000US50","Vermont",null,"2019","42472","Petroleum and petroleum products merchant wholesalers (except bulk stations and terminals) ","3","22","1740","50",
"0400000US50","Vermont",null,"2019","424720","Petroleum and petroleum products merchant wholesalers (except bulk stations and terminals) ","3","22","1740","50",
"0400000US50","Vermont",null,"2019","4248","Beer, wine, and distilled alcoholic beverage merchant wholesalers","21","900","45321","50",
"0400000US50","Vermont",null,"2019","424820","Wine and distilled alcoholic beverage merchant wholesalers","6","188","12260","50",
"0400000US50","Vermont",null,"2019","42481","Beer and ale merchant wholesalers","15","712","33061","50",
"0400000US50","Vermont",null,"2019","424810","Beer and ale merchant wholesalers","15","712","33061","50",
"0400000US50","Vermont",null,"2019","42482","Wine and distilled alcoholic beverage merchant wholesalers","6","188","12260","50",
"0400000US50","Vermont",null,"2019","4249","Miscellaneous nondurable goods merchant wholesalers","48","593","31398","50",
"0400000US50","Vermont",null,"2019","424930","Flower, nursery stock, and florists' supplies merchant wholesalers","8","33","1527","50",
"0400000US50","Vermont",null,"2019","42491","Farm supplies merchant wholesalers","17","183","12234","50",
"0400000US50","Vermont",null,"2019","424910","Farm supplies merchant wholesalers","17","183","12234","50",
"0400000US50","Vermont",null,"2019","42493","Flower, nursery stock, and florists' supplies merchant wholesalers","8","33","1527","50",
"0400000US50","Vermont",null,"2019","42499","Other miscellaneous nondurable goods merchant wholesalers","18","119","7619","50",
"0400000US50","Vermont",null,"2019","424990","Other miscellaneous nondurable goods merchant wholesalers","18","119","7619","50",
"0400000US50","Vermont",null,"2019","441210","Recreational vehicle dealers","6","148","7858","50",
"0400000US50","Vermont",null,"2019","425","Wholesale electronic markets and agents and brokers","58","227","18201","50",
"0400000US50","Vermont",null,"2019","4251","Wholesale electronic markets and agents and brokers","58","227","18201","50",
"0400000US50","Vermont",null,"2019","42512","Wholesale trade agents and brokers","58","227","18201","50",
"0400000US50","Vermont",null,"2019","425120","Wholesale trade agents and brokers","58","227","18201","50",
"0400000US50","Vermont",null,"2019","44-45","Retail trade","3062","37759","1175667","50",
"0400000US50","Vermont",null,"2019","441","Motor vehicle and parts dealers","354","5399","250333","50",
"0400000US50","Vermont",null,"2019","4411","Automobile dealers","167","3634","186374","50",
"0400000US50","Vermont",null,"2019","44111","New car dealers","89","3266","171543","50",
"0400000US50","Vermont",null,"2019","441110","New car dealers","89","3266","171543","50",
"0400000US50","Vermont",null,"2019","44112","Used car dealers","78","368","14831","50",
"0400000US50","Vermont",null,"2019","441120","Used car dealers","78","368","14831","50",
"0400000US50","Vermont",null,"2019","4412","Other motor vehicle dealers","43","477","22430","50",
"0400000US50","Vermont",null,"2019","44121","Recreational vehicle dealers","6","148","7858","50",
"0400000US50","Vermont",null,"2019","44122","Motorcycle, boat, and other motor vehicle dealers","37","329","14572","50",
"0400000US50","Vermont",null,"2019","44132","Tire dealers","38","381","16700","50",
"0400000US50","Vermont",null,"2019","441222","Boat dealers","12","68","2881","50",
"0400000US50","Vermont",null,"2019","441228","Motorcycle, ATV, and all other motor vehicle dealers","25","261","11691","50",
"0400000US50","Vermont",null,"2019","4413","Automotive parts, accessories, and tire stores","144","1288","41529","50",
"0400000US50","Vermont",null,"2019","44131","Automotive parts and accessories stores","106","907","24829","50",
"0400000US50","Vermont",null,"2019","441310","Automotive parts and accessories stores","106","907","24829","50",
"0400000US50","Vermont",null,"2019","442210","Floor covering stores","33","239","10987","50",
"0400000US50","Vermont",null,"2019","441320","Tire dealers","38","381","16700","50",
"0400000US50","Vermont",null,"2019","442","Furniture and home furnishings stores","140","1010","32054","50",
"0400000US50","Vermont",null,"2019","4421","Furniture stores","53","262","10673","50",
"0400000US50","Vermont",null,"2019","44211","Furniture stores","53","262","10673","50",
"0400000US50","Vermont",null,"2019","442110","Furniture stores","53","262","10673","50",
"0400000US50","Vermont",null,"2019","4422","Home furnishings stores","87","748","21381","50",
"0400000US50","Vermont",null,"2019","44221","Floor covering stores","33","239","10987","50",
"0400000US50","Vermont",null,"2019","443141","Household appliance stores","24","188","8521","50",
"0400000US50","Vermont",null,"2019","44229","Other home furnishings stores","54","509","10394","50",
"0400000US50","Vermont",null,"2019","442299","All other home furnishings stores","52","502","10146","50",
"0400000US50","Vermont",null,"2019","443","Electronics and appliance stores","55","411","14795","50",
"0400000US50","Vermont",null,"2019","4431","Electronics and appliance stores","55","411","14795","50",
"0400000US50","Vermont",null,"2019","44314","Electronics and appliance stores","55","411","14795","50",
"0400000US50","Vermont",null,"2019","44413","Hardware stores","78","733","19677","50",
"0400000US50","Vermont",null,"2019","443142","Electronics stores","31","223","6274","50",
"0400000US50","Vermont",null,"2019","444","Building material and garden equipment and supplies dealers","298","3697","134606","50",
"0400000US50","Vermont",null,"2019","4441","Building material and supplies dealers","217","2886","105206","50",
"0400000US50","Vermont",null,"2019","44411","Home centers","16","1020","30172","50",
"0400000US50","Vermont",null,"2019","444110","Home centers","16","1020","30172","50",
"0400000US50","Vermont",null,"2019","44412","Paint and wallpaper stores","22","128","4722","50",
"0400000US50","Vermont",null,"2019","444120","Paint and wallpaper stores","22","128","4722","50",
"0400000US50","Vermont",null,"2019","444130","Hardware stores","78","733","19677","50",
"0400000US50","Vermont",null,"2019","445","Food and beverage stores","465","10051","245504","50",
"0400000US50","Vermont",null,"2019","44419","Other building material dealers","101","1005","50635","50",
"0400000US50","Vermont",null,"2019","444190","Other building material dealers","101","1005","50635","50",
"0400000US50","Vermont",null,"2019","4442","Lawn and garden equipment and supplies stores","81","811","29400","50",
"0400000US50","Vermont",null,"2019","44421","Outdoor power equipment stores","23","149","6694","50",
"0400000US50","Vermont",null,"2019","444210","Outdoor power equipment stores","23","149","6694","50",
"0400000US50","Vermont",null,"2019","44422","Nursery, garden center, and farm supply stores","58","662","22706","50",
"0400000US50","Vermont",null,"2019","444220","Nursery, garden center, and farm supply stores","58","662","22706","50",
"0400000US50","Vermont",null,"2019","445230","Fruit and vegetable markets","10","14","763","50",
"0400000US50","Vermont",null,"2019","4451","Grocery stores","292","9321","222873","50",
"0400000US50","Vermont",null,"2019","44511","Supermarkets and other grocery (except convenience) stores","214","8827","214634","50",
"0400000US50","Vermont",null,"2019","445110","Supermarkets and other grocery (except convenience) stores","214","8827","214634","50",
"0400000US50","Vermont",null,"2019","44512","Convenience stores","78","494","8239","50",
"0400000US50","Vermont",null,"2019","445120","Convenience stores","78","494","8239","50",
"0400000US50","Vermont",null,"2019","4452","Specialty food stores","55","308","8109","50",
"0400000US50","Vermont",null,"2019","44521","Meat markets","8","44","1640","50",
"0400000US50","Vermont",null,"2019","445210","Meat markets","8","44","1640","50",
"0400000US50","Vermont",null,"2019","44522","Fish and seafood markets","3","8","258","50",
"0400000US50","Vermont",null,"2019","445220","Fish and seafood markets","3","8","258","50",
"0400000US50","Vermont",null,"2019","44523","Fruit and vegetable markets","10","14","763","50",
"0400000US50","Vermont",null,"2019","44529","Other specialty food stores","34","242","5448","50",
"0400000US50","Vermont",null,"2019","4453","Beer, wine, and liquor stores","118","422","14522","50",
"0400000US50","Vermont",null,"2019","445291","Baked goods stores","4","78","1841","50",
"0400000US50","Vermont",null,"2019","445292","Confectionery and nut stores","8","49","841","50",
"0400000US50","Vermont",null,"2019","445299","All other specialty food stores","22","115","2766","50",
"0400000US50","Vermont",null,"2019","44531","Beer, wine, and liquor stores","118","422","14522","50",
"0400000US50","Vermont",null,"2019","44613","Optical goods stores","19","86","2793","50",
"0400000US50","Vermont",null,"2019","445310","Beer, wine, and liquor stores","118","422","14522","50",
"0400000US50","Vermont",null,"2019","446","Health and personal care stores","168","1651","61006","50",
"0400000US50","Vermont",null,"2019","4461","Health and personal care stores","168","1651","61006","50",
"0400000US50","Vermont",null,"2019","44611","Pharmacies and drug stores","99","1318","51474","50",
"0400000US50","Vermont",null,"2019","446110","Pharmacies and drug stores","99","1318","51474","50",
"0400000US50","Vermont",null,"2019","44612","Cosmetics, beauty supplies, and perfume stores","17","122","2554","50",
"0400000US50","Vermont",null,"2019","446120","Cosmetics, beauty supplies, and perfume stores","17","122","2554","50",
"0400000US50","Vermont",null,"2019","446130","Optical goods stores","19","86","2793","50",
"0400000US50","Vermont",null,"2019","447","Gasoline stations","388","3423","75523","50",
"0400000US50","Vermont",null,"2019","44619","Other health and personal care stores","33","125","4185","50",
"0400000US50","Vermont",null,"2019","446191","Food (health) supplement stores","18","60","1087","50",
"0400000US50","Vermont",null,"2019","446199","All other health and personal care stores","15","65","3098","50",
"0400000US50","Vermont",null,"2019","44812","Women's clothing stores","69","450","7665","50",
"0400000US50","Vermont",null,"2019","4471","Gasoline stations","388","3423","75523","50",
"0400000US50","Vermont",null,"2019","44711","Gasoline stations with convenience stores","355","3236","71222","50",
"0400000US50","Vermont",null,"2019","447110","Gasoline stations with convenience stores","355","3236","71222","50",
"0400000US50","Vermont",null,"2019","44719","Other gasoline stations","33","187","4301","50",
"0400000US50","Vermont",null,"2019","447190","Other gasoline stations","33","187","4301","50",
"0400000US50","Vermont",null,"2019","448","Clothing and clothing accessories stores","259","2389","50072","50",
"0400000US50","Vermont",null,"2019","4481","Clothing stores","179","1867","34591","50",
"0400000US50","Vermont",null,"2019","44811","Men's clothing stores","9","51","1485","50",
"0400000US50","Vermont",null,"2019","448110","Men's clothing stores","9","51","1485","50",
"0400000US50","Vermont",null,"2019","44814","Family clothing stores","59","1067","20242","50",
"0400000US50","Vermont",null,"2019","448120","Women's clothing stores","69","450","7665","50",
"0400000US50","Vermont",null,"2019","44813","Children's and infants' clothing stores","11","89","1087","50",
"0400000US50","Vermont",null,"2019","448130","Children's and infants' clothing stores","11","89","1087","50",
"0400000US50","Vermont",null,"2019","4482","Shoe stores","36","304","6697","50",
"0400000US50","Vermont",null,"2019","448140","Family clothing stores","59","1067","20242","50",
"0400000US50","Vermont",null,"2019","44815","Clothing accessories stores","10","34","672","50",
"0400000US50","Vermont",null,"2019","448150","Clothing accessories stores","10","34","672","50",
"0400000US50","Vermont",null,"2019","44819","Other clothing stores","21","176","3440","50",
"0400000US50","Vermont",null,"2019","448190","Other clothing stores","21","176","3440","50",
"0400000US50","Vermont",null,"2019","44821","Shoe stores","36","304","6697","50",
"0400000US50","Vermont",null,"2019","448210","Shoe stores","36","304","6697","50",
"0400000US50","Vermont",null,"2019","45113","Sewing, needlework, and piece goods stores","28","124","1420","50",
"0400000US50","Vermont",null,"2019","4483","Jewelry, luggage, and leather goods stores","44","218","8784","50",
"0400000US50","Vermont",null,"2019","44831","Jewelry stores","42","213","8605","50",
"0400000US50","Vermont",null,"2019","448310","Jewelry stores","42","213","8605","50",
"0400000US50","Vermont",null,"2019","451","Sporting goods, hobby, musical instrument, and book stores","201","1778","39496","50",
"0400000US50","Vermont",null,"2019","4511","Sporting goods, hobby, and musical instrument stores","173","1553","35242","50",
"0400000US50","Vermont",null,"2019","45111","Sporting goods stores","114","1128","27992","50",
"0400000US50","Vermont",null,"2019","451110","Sporting goods stores","114","1128","27992","50",
"0400000US50","Vermont",null,"2019","45112","Hobby, toy, and game stores","21","225","3441","50",
"0400000US50","Vermont",null,"2019","451120","Hobby, toy, and game stores","21","225","3441","50",
"0400000US50","Vermont",null,"2019","451130","Sewing, needlework, and piece goods stores","28","124","1420","50",
"0400000US50","Vermont",null,"2019","45121","Book stores and news dealers","28","225","4254","50",
"0400000US50","Vermont",null,"2019","45114","Musical instrument and supplies stores","10","76","2389","50",
"0400000US50","Vermont",null,"2019","451140","Musical instrument and supplies stores","10","76","2389","50",
"0400000US50","Vermont",null,"2019","4512","Book stores and news dealers","28","225","4254","50",
"0400000US50","Vermont",null,"2019","45221","Department stores","7","438","8928","50",
"0400000US50","Vermont",null,"2019","451211","Book stores","28","225","4254","50",
"0400000US50","Vermont",null,"2019","452","General merchandise stores","120","3064","80145","50",
"0400000US50","Vermont",null,"2019","4522","Department stores","7","438","8928","50",
"0400000US50","Vermont",null,"2019","4532","Office supplies, stationery, and gift stores","78","431","9598","50",
"0400000US50","Vermont",null,"2019","452210","Department stores","7","438","8928","50",
"0400000US50","Vermont",null,"2019","4523","General merchandise stores, including warehouse clubs and supercenters","113","2626","71217","50",
"0400000US50","Vermont",null,"2019","45231","General merchandise stores, including warehouse clubs and supercenters","113","2626","71217","50",
"0400000US50","Vermont",null,"2019","452311","Warehouse clubs and supercenters","10","1590","49368","50",
"0400000US50","Vermont",null,"2019","452319","All other general merchandise stores","103","1036","21849","50",
"0400000US50","Vermont",null,"2019","453","Miscellaneous store retailers","317","1705","41649","50",
"0400000US50","Vermont",null,"2019","4531","Florists","36","126","2721","50",
"0400000US50","Vermont",null,"2019","45311","Florists","36","126","2721","50",
"0400000US50","Vermont",null,"2019","453110","Florists","36","126","2721","50",
"0400000US50","Vermont",null,"2019","453220","Gift, novelty, and souvenir stores","67","300","5956","50",
"0400000US50","Vermont",null,"2019","45321","Office supplies and stationery stores","11","131","3642","50",
"0400000US50","Vermont",null,"2019","453210","Office supplies and stationery stores","11","131","3642","50",
"0400000US50","Vermont",null,"2019","45322","Gift, novelty, and souvenir stores","67","300","5956","50",
"0400000US50","Vermont",null,"2019","453920","Art dealers","29","89","1634","50",
"0400000US50","Vermont",null,"2019","4533","Used merchandise stores","82","497","10259","50",
"0400000US50","Vermont",null,"2019","45331","Used merchandise stores","82","497","10259","50",
"0400000US50","Vermont",null,"2019","453310","Used merchandise stores","82","497","10259","50",
"0400000US50","Vermont",null,"2019","4539","Other miscellaneous store retailers","121","651","19071","50",
"0400000US50","Vermont",null,"2019","45391","Pet and pet supplies stores","20","177","4293","50",
"0400000US50","Vermont",null,"2019","453910","Pet and pet supplies stores","20","177","4293","50",
"0400000US50","Vermont",null,"2019","45392","Art dealers","29","89","1634","50",
"0400000US50","Vermont",null,"2019","45393","Manufactured (mobile) home dealers","8","46","2049","50",
"0400000US50","Vermont",null,"2019","453998","All other miscellaneous store retailers (except tobacco stores)","59","315","10202","50",
"0400000US50","Vermont",null,"2019","453930","Manufactured (mobile) home dealers","8","46","2049","50",
"0400000US50","Vermont",null,"2019","45399","All other miscellaneous store retailers","64","339","11095","50",
"0400000US50","Vermont",null,"2019","453991","Tobacco stores","5","24","893","50",
"0400000US50","Vermont",null,"2019","4543","Direct selling establishments","158","1454","70935","50",
"0400000US50","Vermont",null,"2019","454","Nonstore retailers","297","3181","150484","50",
"0400000US50","Vermont",null,"2019","4541","Electronic shopping and mail-order houses","134","1658","77053","50",
"0400000US50","Vermont",null,"2019","45411","Electronic shopping and mail-order houses","134","1658","77053","50",
"0400000US50","Vermont",null,"2019","454110","Electronic shopping and mail-order houses","134","1658","77053","50",
"0400000US50","Vermont",null,"2019","4542","Vending machine operators","5","69","2496","50",
"0400000US50","Vermont",null,"2019","45421","Vending machine operators","5","69","2496","50",
"0400000US50","Vermont",null,"2019","454210","Vending machine operators","5","69","2496","50",
"0400000US50","Vermont",null,"2019","45431","Fuel dealers","110","1256","63472","50",
"0400000US50","Vermont",null,"2019","481111","Scheduled passenger air transportation","5","185","4468","50",
"0400000US50","Vermont",null,"2019","454310","Fuel dealers","110","1256","63472","50",
"0400000US50","Vermont",null,"2019","45439","Other direct selling establishments","48","198","7463","50",
"0400000US50","Vermont",null,"2019","454390","Other direct selling establishments","48","198","7463","50",
"0400000US50","Vermont",null,"2019","48-49","Transportation and warehousing","474","5890","244487","50",
"0400000US50","Vermont",null,"2019","481","Air transportation","7","190","5092","50",
"0400000US50","Vermont",null,"2019","4811","Scheduled air transportation","5","185","4468","50",
"0400000US50","Vermont",null,"2019","48111","Scheduled air transportation","5","185","4468","50",
"0400000US50","Vermont",null,"2019","483","Water transportation","4","119","2730","50",
"0400000US50","Vermont",null,"2019","4832","Inland water transportation","4","119","2730","50",
"0400000US50","Vermont",null,"2019","48321","Inland water transportation","4","119","2730","50",
"0400000US50","Vermont",null,"2019","483212","Inland water passenger transportation","4","119","2730","50",
"0400000US50","Vermont",null,"2019","484","Truck transportation","280","2079","106906","50",
"0400000US50","Vermont",null,"2019","48421","Used household and office goods moving","14","167","8092","50",
"0400000US50","Vermont",null,"2019","4841","General freight trucking","109","1082","60663","50",
"0400000US50","Vermont",null,"2019","48411","General freight trucking, local","39","171","7947","50",
"0400000US50","Vermont",null,"2019","484110","General freight trucking, local","39","171","7947","50",
"0400000US50","Vermont",null,"2019","48412","General freight trucking, long-distance","70","911","52716","50",
"0400000US50","Vermont",null,"2019","484121","General freight trucking, long-distance, truckload","45","426","25780","50",
"0400000US50","Vermont",null,"2019","484122","General freight trucking, long-distance, less than truckload","25","485","26936","50",
"0400000US50","Vermont",null,"2019","4842","Specialized freight trucking","171","997","46243","50",
"0400000US50","Vermont",null,"2019","485","Transit and ground passenger transportation","63","1306","36192","50",
"0400000US50","Vermont",null,"2019","484210","Used household and office goods moving","14","167","8092","50",
"0400000US50","Vermont",null,"2019","48422","Specialized freight (except used goods) trucking, local","125","485","20571","50",
"0400000US50","Vermont",null,"2019","484220","Specialized freight (except used goods) trucking, local","125","485","20571","50",
"0400000US50","Vermont",null,"2019","48423","Specialized freight (except used goods) trucking, long-distance","32","345","17580","50",
"0400000US50","Vermont",null,"2019","484230","Specialized freight (except used goods) trucking, long-distance","32","345","17580","50",
"0400000US50","Vermont",null,"2019","4852","Interurban and rural bus transportation","3","100","4138","50",
"0400000US50","Vermont",null,"2019","4851","Urban transit systems","6","157","6656","50",
"0400000US50","Vermont",null,"2019","48511","Urban transit systems","6","157","6656","50",
"0400000US50","Vermont",null,"2019","485113","Bus and other motor vehicle transit systems","5","120","4264","50",
"0400000US50","Vermont",null,"2019","48521","Interurban and rural bus transportation","3","100","4138","50",
"0400000US50","Vermont",null,"2019","485210","Interurban and rural bus transportation","3","100","4138","50",
"0400000US50","Vermont",null,"2019","4853","Taxi and limousine service","23","156","2376","50",
"0400000US50","Vermont",null,"2019","48531","Taxi service","14","108","1636","50",
"0400000US50","Vermont",null,"2019","485310","Taxi service","14","108","1636","50",
"0400000US50","Vermont",null,"2019","48541","School and employee bus transportation","16","620","12289","50",
"0400000US50","Vermont",null,"2019","48532","Limousine service","9","48","740","50",
"0400000US50","Vermont",null,"2019","485320","Limousine service","9","48","740","50",
"0400000US50","Vermont",null,"2019","4854","School and employee bus transportation","16","620","12289","50",
"0400000US50","Vermont",null,"2019","485410","School and employee bus transportation","16","620","12289","50",
"0400000US50","Vermont",null,"2019","4855","Charter bus industry","5","129","5649","50",
"0400000US50","Vermont",null,"2019","48551","Charter bus industry","5","129","5649","50",
"0400000US50","Vermont",null,"2019","485510","Charter bus industry","5","129","5649","50",
"0400000US50","Vermont",null,"2019","485999","All other transit and ground passenger transportation","5","30","922","50",
"0400000US50","Vermont",null,"2019","4859","Other transit and ground passenger transportation","10","144","5084","50",
"0400000US50","Vermont",null,"2019","48599","Other transit and ground passenger transportation","10","144","5084","50",
"0400000US50","Vermont",null,"2019","485991","Special needs transportation","5","114","4162","50",
"0400000US50","Vermont",null,"2019","487","Scenic and sightseeing transportation","5","15","1242","50",
"0400000US50","Vermont",null,"2019","488","Support activities for transportation","61","435","23599","50",
"0400000US50","Vermont",null,"2019","4881","Support activities for air transportation","14","152","8278","50",
"0400000US50","Vermont",null,"2019","48811","Airport operations","5","80","4149","50",
"0400000US50","Vermont",null,"2019","488119","Other airport operations","4","78","4068","50",
"0400000US50","Vermont",null,"2019","48819","Other support activities for air transportation","9","72","4129","50",
