"0400000US31","Nebraska",null,"2017","621320","Offices of optometrists","187","1151","48677","31",
"0400000US31","Nebraska",null,"2017","6216","Home health care services","112","3125","101048","31",
"0400000US31","Nebraska",null,"2017","62161","Home health care services","112","3125","101048","31",
"0400000US31","Nebraska",null,"2017","62321","Residential intellectual and developmental disability facilities","78","2764","77339","31",
"0400000US31","Nebraska",null,"2017","623210","Residential intellectual and developmental disability facilities","78","2764","77339","31",
"0400000US31","Nebraska",null,"2017","6242","Community food and housing, and emergency and other relief services","119","1128","39629","31",
"0400000US31","Nebraska",null,"2017","62421","Community food services","55","327","8587","31",
"0400000US31","Nebraska",null,"2017","624210","Community food services","55","327","8587","31",
"0400000US31","Nebraska",null,"2017","71141","Agents and managers for artists, athletes, entertainers, and other public figures","7","10","156","31",
"0400000US31","Nebraska",null,"2017","711410","Agents and managers for artists, athletes, entertainers, and other public figures","7","10","156","31",
"0400000US31","Nebraska",null,"2017","7115","Independent artists, writers, and performers","76","281","12738","31",
"0400000US31","Nebraska",null,"2017","71151","Independent artists, writers, and performers","76","281","12738","31",
"0400000US31","Nebraska",null,"2017","713990","All other amusement and recreation industries","125","658","12606","31",
"0400000US31","Nebraska",null,"2017","72","Accommodation and food services","4631","77822","1200385","31",
"0400000US31","Nebraska",null,"2017","72241","Drinking places (alcoholic beverages)","547","3933","50987","31",
"0400000US31","Nebraska",null,"2017","811118","Other automotive mechanical and electrical repair and maintenance","24","97","3699","31",
"0400000US31","Nebraska",null,"2017","81112","Automotive body, paint, interior, and glass repair","414","2046","91843","31",
"0400000US31","Nebraska",null,"2017","81211","Hair, nail, and skin care services","689","3000","65518","31",
"0400000US31","Nebraska",null,"2017","812111","Barber shops","37","100","2250","31",
"0400000US31","Nebraska",null,"2017","813","Religious, grantmaking, civic, professional, and similar organizations","2586","19101","469068","31",
"0400000US31","Nebraska",null,"2017","62","Health care and social assistance","5818","133276","6270945","31",
"0400000US31","Nebraska",null,"2017","62133","Offices of mental health practitioners (except physicians)","269","945","27508","31",
"0400000US31","Nebraska",null,"2017","621330","Offices of mental health practitioners (except physicians)","269","945","27508","31",
"0400000US31","Nebraska",null,"2017","621610","Home health care services","112","3125","101048","31",
"0400000US31","Nebraska",null,"2017","62322","Residential mental health and substance abuse facilities","50","1079","34809","31",
"0400000US31","Nebraska",null,"2017","623220","Residential mental health and substance abuse facilities","50","1079","34809","31",
"0400000US31","Nebraska",null,"2017","62422","Community housing services","59","751","26743","31",
"0400000US31","Nebraska",null,"2017","624221","Temporary shelters","22","423","11373","31",
"0400000US31","Nebraska",null,"2017","624229","Other community housing services","37","328","15370","31",
"0400000US31","Nebraska",null,"2017","711510","Independent artists, writers, and performers","76","281","12738","31",
"0400000US31","Nebraska",null,"2017","712","Museums, historical sites, and similar institutions","72","1917","45761","31",
"0400000US31","Nebraska",null,"2017","7121","Museums, historical sites, and similar institutions","72","1917","45761","31",
"0400000US31","Nebraska",null,"2017","722410","Drinking places (alcoholic beverages)","547","3933","50987","31",
"0400000US31","Nebraska",null,"2017","811121","Automotive body, paint, and interior repair and maintenance","359","1797","83347","31",
"0400000US31","Nebraska",null,"2017","811122","Automotive glass replacement shops","55","249","8496","31",
"0400000US31","Nebraska",null,"2017","812112","Beauty salons","607","2743","59788","31",
"0400000US31","Nebraska",null,"2017","812113","Nail salons","45","157","3480","31",
"0400000US31","Nebraska",null,"2017","8131","Religious organizations","1606","12939","250798","31",
"0400000US31","Nebraska",null,"2017","81311","Religious organizations","1606","12939","250798","31",
"0400000US31","Nebraska",null,"2017","621","Ambulatory health care services","3755","37475","2452864","31",
"0400000US31","Nebraska",null,"2017","62134","Offices of physical, occupational and speech therapists, and audiologists","316","3396","149088","31",
"0400000US31","Nebraska",null,"2017","6219","Other ambulatory health care services","77","1658","62854","31",
"0400000US31","Nebraska",null,"2017","6233","Continuing care retirement communities and assisted living facilities for the elderly","176","8687","196371","31",
"0400000US31","Nebraska",null,"2017","62423","Emergency and other relief services","5","50","4299","31",
"0400000US31","Nebraska",null,"2017","624230","Emergency and other relief services","5","50","4299","31",
"0400000US31","Nebraska",null,"2017","6243","Vocational rehabilitation services","77","2385","41371","31",
"0400000US31","Nebraska",null,"2017","62431","Vocational rehabilitation services","77","2385","41371","31",
"0400000US31","Nebraska",null,"2017","71211","Museums","53","571","12545","31",
"0400000US31","Nebraska",null,"2017","712110","Museums","53","571","12545","31",
"0400000US31","Nebraska",null,"2017","71212","Historical sites","7","39","806","31",
"0400000US31","Nebraska",null,"2017","712120","Historical sites","7","39","806","31",
"0400000US31","Nebraska",null,"2017","71213","Zoos and botanical gardens","5","1037","25904","31",
"0400000US31","Nebraska",null,"2017","712130","Zoos and botanical gardens","5","1037","25904","31",
"0400000US31","Nebraska",null,"2017","71219","Nature parks and other similar institutions","7","270","6506","31",
"0400000US31","Nebraska",null,"2017","712190","Nature parks and other similar institutions","7","270","6506","31",
"0400000US31","Nebraska",null,"2017","721","Accommodation","538","8245","155478","31",
"0400000US31","Nebraska",null,"2017","7211","Traveler accommodation","475","8026","150385","31",
"0400000US31","Nebraska",null,"2017","7225","Restaurants and other eating places","3291","62076","934179","31",
"0400000US31","Nebraska",null,"2017","81119","Other automotive repair and maintenance","197","1399","28338","31",
"0400000US31","Nebraska",null,"2017","811191","Automotive oil change and lubrication shops","49","329","7358","31",
"0400000US31","Nebraska",null,"2017","81219","Other personal care services","154","847","13701","31",
"0400000US31","Nebraska",null,"2017","812191","Diet and weight reducing centers","22","153","1608","31",
"0400000US31","Nebraska",null,"2017","812199","Other personal care services","132","694","12093","31",
"0400000US31","Nebraska",null,"2017","813110","Religious organizations","1606","12939","250798","31",
"0400000US31","Nebraska",null,"2017","8132","Grantmaking and giving services","200","1388","74705","31",
"0400000US31","Nebraska",null,"2017","81321","Grantmaking and giving services","200","1388","74705","31",
"0400000US31","Nebraska",null,"2017","6211","Offices of physicians","1010","14326","1470213","31",
"0400000US31","Nebraska",null,"2017","621340","Offices of physical, occupational and speech therapists, and audiologists","316","3396","149088","31",
"0400000US31","Nebraska",null,"2017","62191","Ambulance services","39","693","25169","31",
"0400000US31","Nebraska",null,"2017","621910","Ambulance services","39","693","25169","31",
"0400000US31","Nebraska",null,"2017","62199","All other ambulatory health care services","38","965","37685","31",
"0400000US31","Nebraska",null,"2017","62331","Continuing care retirement communities and assisted living facilities for the elderly","176","8687","196371","31",
"0400000US31","Nebraska",null,"2017","624310","Vocational rehabilitation services","77","2385","41371","31",
"0400000US31","Nebraska",null,"2017","6244","Child day care services","694","9030","155454","31",
"0400000US31","Nebraska",null,"2017","713","Amusement, gambling, and recreation industries","650","10534","153223","31",
"0400000US31","Nebraska",null,"2017","72111","Hotels (except casino hotels) and motels","463","7856","146854","31",
"0400000US31","Nebraska",null,"2017","72251","Restaurants and other eating places","3291","62076","934179","31",
"0400000US31","Nebraska",null,"2017","811192","Car washes","142","1061","20621","31",
"0400000US31","Nebraska",null,"2017","811198","All other automotive repair and maintenance","6","9","359","31",
"0400000US31","Nebraska",null,"2017","8112","Electronic and precision equipment repair and maintenance","80","287","14412","31",
"0400000US31","Nebraska",null,"2017","8122","Death care services","195","1028","32549","31",
"0400000US31","Nebraska",null,"2017","813211","Grantmaking foundations","134","1061","57729","31",
"0400000US31","Nebraska",null,"2017","813212","Voluntary health organizations","46","209","11054","31",
"0400000US31","Nebraska",null,"2017","813219","Other grantmaking and giving services","20","118","5922","31",
"0400000US31","Nebraska",null,"2017","8133","Social advocacy organizations","127","840","31662","31",
"0400000US31","Nebraska",null,"2017","62139","Offices of all other health practitioners","182","969","47124","31",
"0400000US31","Nebraska",null,"2017","621391","Offices of podiatrists","40","218","10774","31",
"0400000US31","Nebraska",null,"2017","621991","Blood and organ banks","12","813","31535","31",
"0400000US31","Nebraska",null,"2017","621999","All other miscellaneous ambulatory health care services","26","152","6150","31",
"0400000US31","Nebraska",null,"2017","622","Hospitals","106","45107","2561869","31",
"0400000US31","Nebraska",null,"2017","623311","Continuing care retirement communities","73","4967","113594","31",
"0400000US31","Nebraska",null,"2017","62441","Child day care services","694","9030","155454","31",
"0400000US31","Nebraska",null,"2017","7131","Amusement parks and arcades","23","334","3685","31",
"0400000US31","Nebraska",null,"2017","71311","Amusement and theme parks","3","0","0","31",
"0400000US31","Nebraska",null,"2017","713110","Amusement and theme parks","3","0","0","31",
"0400000US31","Nebraska",null,"2017","71312","Amusement arcades","20","328","3025","31",
"0400000US31","Nebraska",null,"2017","713120","Amusement arcades","20","328","3025","31",
"0400000US31","Nebraska",null,"2017","7132","Gambling industries","19","374","8085","31",
"0400000US31","Nebraska",null,"2017","721110","Hotels (except casino hotels) and motels","463","7856","146854","31",
"0400000US31","Nebraska",null,"2017","722511","Full-service restaurants","1470","29209","465926","31",
"0400000US31","Nebraska",null,"2017","81121","Electronic and precision equipment repair and maintenance","80","287","14412","31",
"0400000US31","Nebraska",null,"2017","811211","Consumer electronics repair and maintenance","7","27","1056","31",
"0400000US31","Nebraska",null,"2017","811212","Computer and office machine repair and maintenance","36","94","3323","31",
"0400000US31","Nebraska",null,"2017","81221","Funeral homes and funeral services","158","882","27551","31",
"0400000US31","Nebraska",null,"2017","812210","Funeral homes and funeral services","158","882","27551","31",
"0400000US31","Nebraska",null,"2017","81331","Social advocacy organizations","127","840","31662","31",
"0400000US31","Nebraska",null,"2017","813311","Human rights organizations","25","91","4422","31",
"0400000US31","Nebraska",null,"2017","813312","Environment, conservation and wildlife organizations","56","519","19473","31",
"0400000US31","Nebraska",null,"2017","62111","Offices of physicians","1010","14326","1470213","31",
"0400000US31","Nebraska",null,"2017","621399","Offices of all other miscellaneous health practitioners","142","751","36350","31",
"0400000US31","Nebraska",null,"2017","6214","Outpatient care centers","313","4439","190720","31",
"0400000US31","Nebraska",null,"2017","6221","General medical and surgical hospitals","93","40408","2352253","31",
"0400000US31","Nebraska",null,"2017","62211","General medical and surgical hospitals","93","40408","2352253","31",
"0400000US31","Nebraska",null,"2017","623312","Assisted living facilities for the elderly","103","3720","82777","31",
"0400000US31","Nebraska",null,"2017","6239","Other residential care facilities","17","1920","88275","31",
"0400000US31","Nebraska",null,"2017","62399","Other residential care facilities","17","1920","88275","31",
"0400000US31","Nebraska",null,"2017","624410","Child day care services","694","9030","155454","31",
"0400000US31","Nebraska",null,"2017","71329","Other gambling industries","19","374","8085","31",
"0400000US31","Nebraska",null,"2017","713290","Other gambling industries","19","374","8085","31",
"0400000US31","Nebraska",null,"2017","7139","Other amusement and recreation industries","608","9826","141453","31",
"0400000US31","Nebraska",null,"2017","72119","Other traveler accommodation","10","38","314","31",
"0400000US31","Nebraska",null,"2017","721191","Bed-and-breakfast inns","7","28","168","31",
"0400000US31","Nebraska",null,"2017","721199","All other traveler accommodation","3","10","146","31",
"0400000US31","Nebraska",null,"2017","7212","RV (recreational vehicle) parks and recreational camps","32","85","3253","31",
"0400000US31","Nebraska",null,"2017","722513","Limited-service restaurants","1434","27978","405040","31",
"0400000US31","Nebraska",null,"2017","811213","Communication equipment repair and maintenance","10","45","2081","31",
"0400000US31","Nebraska",null,"2017","811219","Other electronic and precision equipment repair and maintenance","27","121","7952","31",
"0400000US31","Nebraska",null,"2017","8113","Commercial and industrial machinery and equipment (except automotive and electronic) repair and maintenance","276","1372","66889","31",
"0400000US31","Nebraska",null,"2017","81222","Cemeteries and crematories","37","146","4998","31",
"0400000US31","Nebraska",null,"2017","812220","Cemeteries and crematories","37","146","4998","31",
"0400000US31","Nebraska",null,"2017","8123","Drycleaning and laundry services","141","1623","43684","31",
"0400000US31","Nebraska",null,"2017","813319","Other social advocacy organizations","46","230","7767","31",
"0400000US31","Nebraska",null,"2017","8134","Civic and social organizations","284","1918","33812","31",
"0400000US31","Nebraska",null,"2017","81341","Civic and social organizations","284","1918","33812","31",
"0400000US31","Nebraska",null,"2017","621111","Offices of physicians (except mental health specialists)","947","14094","1452250","31",
"0400000US31","Nebraska",null,"2017","62141","Family planning centers","13","147","4324","31",
"0400000US31","Nebraska",null,"2017","621410","Family planning centers","13","147","4324","31",
"0400000US31","Nebraska",null,"2017","622110","General medical and surgical hospitals","93","40408","2352253","31",
"0400000US31","Nebraska",null,"2017","6222","Psychiatric and substance abuse hospitals","6","1550","68173","31",
"0400000US31","Nebraska",null,"2017","62221","Psychiatric and substance abuse hospitals","6","1550","68173","31",
"0400000US31","Nebraska",null,"2017","622210","Psychiatric and substance abuse hospitals","6","1550","68173","31",
"0400000US31","Nebraska",null,"2017","6223","Specialty (except psychiatric and substance abuse) hospitals","7","3149","141443","31",
"0400000US31","Nebraska",null,"2017","623990","Other residential care facilities","17","1920","88275","31",
"0400000US31","Nebraska",null,"2017","624","Social assistance","1472","22087","475308","31",
"0400000US31","Nebraska",null,"2017","71","Arts, entertainment, and recreation","928","14765","252981","31",
"0400000US31","Nebraska",null,"2017","71391","Golf courses and country clubs","147","1863","53589","31",
"0400000US31","Nebraska",null,"2017","72121","RV (recreational vehicle) parks and recreational camps","32","85","3253","31",
"0400000US31","Nebraska",null,"2017","721211","RV (recreational vehicle) parks and campgrounds","15","36","1161","31",
"0400000US31","Nebraska",null,"2017","721214","Recreational and vacation camps (except campgrounds)","17","49","2092","31",
"0400000US31","Nebraska",null,"2017","722514","Cafeterias, grill buffets, and buffets","47","753","10774","31",
"0400000US31","Nebraska",null,"2017","722515","Snack and nonalcoholic beverage bars","340","4136","52439","31",
"0400000US31","Nebraska",null,"2017","81131","Commercial and industrial machinery and equipment (except automotive and electronic) repair and maintenance","276","1372","66889","31",
"0400000US31","Nebraska",null,"2017","81231","Coin-operated laundries and drycleaners","36","118","2000","31",
"0400000US31","Nebraska",null,"2017","812310","Coin-operated laundries and drycleaners","36","118","2000","31",
"0400000US31","Nebraska",null,"2017","813410","Civic and social organizations","284","1918","33812","31",
"0400000US31","Nebraska",null,"2017","8139","Business, professional, labor, political, and similar organizations","369","2016","78091","31",
"0400000US31","Nebraska",null,"2017","621112","Offices of physicians, mental health specialists","63","232","17963","31",
"0400000US31","Nebraska",null,"2017","6212","Offices of dentists","809","5418","269609","31",
"0400000US31","Nebraska",null,"2017","62142","Outpatient mental health and substance abuse centers","112","926","29045","31",
"0400000US31","Nebraska",null,"2017","621420","Outpatient mental health and substance abuse centers","112","926","29045","31",
"0400000US31","Nebraska",null,"2017","62231","Specialty (except psychiatric and substance abuse) hospitals","7","3149","141443","31",
"0400000US31","Nebraska",null,"2017","622310","Specialty (except psychiatric and substance abuse) hospitals","7","3149","141443","31",
"0400000US31","Nebraska",null,"2017","623","Nursing and residential care facilities","485","28607","780904","31",
"0400000US31","Nebraska",null,"2017","6241","Individual and family services","582","9544","238854","31",
"0400000US31","Nebraska",null,"2017","711","Performing arts, spectator sports, and related industries","206","2314","53997","31",
"0400000US31","Nebraska",null,"2017","713910","Golf courses and country clubs","147","1863","53589","31",
"0400000US31","Nebraska",null,"2017","7213","Rooming and boarding houses","31","134","1840","31",
"0400000US31","Nebraska",null,"2017","72131","Rooming and boarding houses","31","134","1840","31",
"0400000US31","Nebraska",null,"2017","721310","Rooming and boarding houses","31","134","1840","31",
"0400000US31","Nebraska",null,"2017","722","Food services and drinking places","4093","69577","1044907","31",
"0400000US31","Nebraska",null,"2017","81","Other services (except public administration)","5850","35983","1014954","31",
"0400000US31","Nebraska",null,"2017","811310","Commercial and industrial machinery and equipment (except automotive and electronic) repair and maintenance","276","1372","66889","31",
"0400000US31","Nebraska",null,"2017","81232","Drycleaning and laundry services (except coin-operated)","82","586","11659","31",
"0400000US31","Nebraska",null,"2017","812320","Drycleaning and laundry services (except coin-operated)","82","586","11659","31",
"0400000US31","Nebraska",null,"2017","81391","Business associations","172","828","43767","31",
"0400000US31","Nebraska",null,"2017","813910","Business associations","172","828","43767","31",
"0400000US31","Nebraska",null,"2017","81392","Professional organizations","44","169","9959","31",
"0400000US31","Nebraska",null,"2017","62121","Offices of dentists","809","5418","269609","31",
"0400000US31","Nebraska",null,"2017","62149","Other outpatient care centers","188","3366","157351","31",
"0400000US31","Nebraska",null,"2017","6231","Nursing care facilities (skilled nursing facilities)","164","14157","384110","31",
"0400000US31","Nebraska",null,"2017","62411","Child and youth services","118","1726","57217","31",
"0400000US31","Nebraska",null,"2017","624110","Child and youth services","118","1726","57217","31",
"0400000US31","Nebraska",null,"2017","7111","Performing arts companies","38","466","10285","31",
"0400000US31","Nebraska",null,"2017","71111","Theater companies and dinner theaters","20","169","5196","31",
"0400000US31","Nebraska",null,"2017","71394","Fitness and recreational sports centers","276","6555","64524","31",
"0400000US31","Nebraska",null,"2017","7223","Special food services","255","3568","59741","31",
"0400000US31","Nebraska",null,"2017","811","Repair and maintenance","1873","8997","365261","31",
"0400000US31","Nebraska",null,"2017","8114","Personal and household goods repair and maintenance","120","385","11437","31",
"0400000US31","Nebraska",null,"2017","81141","Home and garden equipment and appliance repair and maintenance","54","187","6549","31",
"0400000US31","Nebraska",null,"2017","81233","Linen and uniform supply","23","919","30025","31",
"0400000US31","Nebraska",null,"2017","812331","Linen supply","10","341","9781","31",
"0400000US31","Nebraska",null,"2017","812332","Industrial launderers","13","578","20244","31",
"0400000US31","Nebraska",null,"2017","813920","Professional organizations","44","169","9959","31",
"0400000US31","Nebraska",null,"2017","81393","Labor unions and similar labor organizations","106","873","19595","31",
"0400000US31","Nebraska",null,"2017","813930","Labor unions and similar labor organizations","106","873","19595","31",
"0400000US31","Nebraska",null,"2017","81394","Political organizations","16","51","1358","31",
"0400000US31","Nebraska",null,"2017","541611","Administrative management and general management consulting services","343","1314","77778","31",
"0400000US31","Nebraska",null,"2017","541713","Research and development in nanotechnology","14","284","35054","31",
"0400000US31","Nebraska",null,"2017","541714","Research and development in biotechnology (except nanobiotechnology)","12","167","9618","31",
"0400000US31","Nebraska",null,"2017","541715","Research and development in the physical, engineering, and life sciences (except nanotechnology and biotechnology)","37","681","42359","31",
"0400000US31","Nebraska",null,"2017","54186","Direct mail advertising","15","103","6682","31",
"0400000US31","Nebraska",null,"2017","541860","Direct mail advertising","15","103","6682","31",
"0400000US31","Nebraska",null,"2017","54187","Advertising material distribution services","4","17","589","31",
"0400000US31","Nebraska",null,"2017","541870","Advertising material distribution services","4","17","589","31",
"0400000US31","Nebraska",null,"2017","54189","Other services related to advertising","52","369","9478","31",
"0400000US31","Nebraska",null,"2017","541890","Other services related to advertising","52","369","9478","31",
"0400000US31","Nebraska",null,"2017","541940","Veterinary services","305","2658","91414","31",
"0400000US31","Nebraska",null,"2017","5511","Management of companies and enterprises","364","22233","1759956","31",
"0400000US31","Nebraska",null,"2017","56","Administrative and support and waste management and remediation services","2798","64726","2462173","31",
"0400000US31","Nebraska",null,"2017","5611","Office administrative services","147","1503","111566","31",
"0400000US31","Nebraska",null,"2017","56111","Office administrative services","147","1503","111566","31",
"0400000US31","Nebraska",null,"2017","56131","Employment placement agencies and executive search services","62","1075","34682","31",
"0400000US31","Nebraska",null,"2017","561311","Employment placement agencies","33","989","27944","31",
"0400000US31","Nebraska",null,"2017","56141","Document preparation services","31","79","2560","31",
"0400000US31","Nebraska",null,"2017","561410","Document preparation services","31","79","2560","31",
"0400000US31","Nebraska",null,"2017","56142","Telephone call centers","53","6471","149910","31",
"0400000US31","Nebraska",null,"2017","56151","Travel agencies","99","708","41016","31",
"0400000US31","Nebraska",null,"2017","561510","Travel agencies","99","708","41016","31",
"0400000US31","Nebraska",null,"2017","561621","Security systems services (except locksmiths)","34","642","28392","31",
"0400000US31","Nebraska",null,"2017","561622","Locksmiths","18","60","2368","31",
"0400000US31","Nebraska",null,"2017","5617","Services to buildings and dwellings","1532","11549","324820","31",
"0400000US31","Nebraska",null,"2017","56173","Landscaping services","861","4185","156292","31",
"0400000US31","Nebraska",null,"2017","56191","Packaging and labeling services","5","35","733","31",
"0400000US31","Nebraska",null,"2017","561910","Packaging and labeling services","5","35","733","31",
"0400000US31","Nebraska",null,"2017","56192","Convention and trade show organizers","11","70","2427","31",
"0400000US31","Nebraska",null,"2017","561920","Convention and trade show organizers","11","70","2427","31",
"0400000US31","Nebraska",null,"2017","56199","All other support services","107","786","29649","31",
"0400000US31","Nebraska",null,"2017","562119","Other waste collection","4","17","1028","31",
"0400000US31","Nebraska",null,"2017","5622","Waste treatment and disposal","16","326","20622","31",
"0400000US31","Nebraska",null,"2017","56221","Waste treatment and disposal","16","326","20622","31",
"0400000US31","Nebraska",null,"2017","6111","Elementary and secondary schools","163","4425","116011","31",
"0400000US31","Nebraska",null,"2017","61142","Computer training","5","0","0","31",
"0400000US31","Nebraska",null,"2017","611420","Computer training","5","0","0","31",
"0400000US31","Nebraska",null,"2017","61143","Professional and management development training","21","65","4051","31",
