"0400000US04","Arizona",null,"2014","331491","Nonferrous metal (except copper and aluminum) rolling, drawing, extruding, and alloying","4","50","2445","04",
"0400000US04","Arizona",null,"2014","331492","Secondary smelting, refining, and alloying of nonferrous metal (except copper and aluminum)","5","0","0","04",
"0400000US04","Arizona",null,"2014","3315","Foundries","22","761","33124","04",
"0400000US04","Arizona",null,"2014","33151","Ferrous metal foundries","8","310","14851","04",
"0400000US04","Arizona",null,"2014","331511","Iron foundries","2","0","0","04",
"0400000US04","Arizona",null,"2014","331512","Steel investment foundries","3","150","6607","04",
"0400000US04","Arizona",null,"2014","331513","Steel foundries (except investment)","3","0","0","04",
"0400000US04","Arizona",null,"2014","33152","Nonferrous metal foundries","14","451","18273","04",
"0400000US04","Arizona",null,"2014","331523","Nonferrous metal die-casting foundries","3","0","0","04",
"0400000US04","Arizona",null,"2014","331524","Aluminum foundries (except die-casting)","2","0","0","04",
"0400000US04","Arizona",null,"2014","331529","Other nonferrous metal foundries (except die-casting)","9","0","0","04",
"0400000US04","Arizona",null,"2014","332","Fabricated metal product manufacturing","859","19183","1038643","04",
"0400000US04","Arizona",null,"2014","3321","Forging and stamping","20","945","48449","04",
"0400000US04","Arizona",null,"2014","33211","Forging and stamping","20","945","48449","04",
"0400000US04","Arizona",null,"2014","332111","Iron and steel forging","2","0","0","04",
"0400000US04","Arizona",null,"2014","332114","Custom roll forming","6","0","25654","04",
"0400000US04","Arizona",null,"2014","332119","Metal crown, closure, and other metal stamping (except automotive)","12","450","22692","04",
"0400000US04","Arizona",null,"2014","3322","Cutlery and handtool manufacturing","16","215","6184","04",
"0400000US04","Arizona",null,"2014","33221","Cutlery and handtool manufacturing","16","215","6184","04",
"0400000US04","Arizona",null,"2014","332215","Metal kitchen cookware, utensil, cutlery, and flatware (except precious) manufacturing","1","0","0","04",
"0400000US04","Arizona",null,"2014","332216","Saw blade and handtool manufacturing","15","214","6179","04",
"0400000US04","Arizona",null,"2014","3323","Architectural and structural metals manufacturing","251","5176","212468","04",
"0400000US04","Arizona",null,"2014","33231","Plate work and fabricated structural product manufacturing","72","1797","82435","04",
"0400000US04","Arizona",null,"2014","332311","Prefabricated metal building and component manufacturing","9","100","3694","04",
"0400000US04","Arizona",null,"2014","332312","Fabricated structural metal manufacturing","51","1560","74017","04",
"0400000US04","Arizona",null,"2014","332313","Plate work manufacturing","12","137","4724","04",
"0400000US04","Arizona",null,"2014","33232","Ornamental and architectural metal products manufacturing","179","3379","130033","04",
"0400000US04","Arizona",null,"2014","332321","Metal window and door manufacturing","37","1173","47148","04",
"0400000US04","Arizona",null,"2014","332322","Sheet metal work manufacturing","76","1488","59275","04",
"0400000US04","Arizona",null,"2014","332323","Ornamental and architectural metal work manufacturing","66","718","23610","04",
"0400000US04","Arizona",null,"2014","3324","Boiler, tank, and shipping container manufacturing","13","354","19097","04",
"0400000US04","Arizona",null,"2014","33241","Power boiler and heat exchanger manufacturing","1","0","0","04",
"0400000US04","Arizona",null,"2014","332410","Power boiler and heat exchanger manufacturing","1","0","0","04",
"0400000US04","Arizona",null,"2014","33242","Metal tank (heavy gauge) manufacturing","8","0","2374","04",
"0400000US04","Arizona",null,"2014","332420","Metal tank (heavy gauge) manufacturing","8","0","2374","04",
"0400000US04","Arizona",null,"2014","33243","Metal can, box, and other metal container (light gauge) manufacturing","4","160","10266","04",
"0400000US04","Arizona",null,"2014","332431","Metal can manufacturing","2","0","0","04",
"0400000US04","Arizona",null,"2014","332439","Other metal container manufacturing","2","0","0","04",
"0400000US04","Arizona",null,"2014","33512","Lighting fixture manufacturing","17","337","15917","04",
"0400000US04","Arizona",null,"2014","33251","Hardware manufacturing","12","92","4054","04",
"0400000US04","Arizona",null,"2014","332510","Hardware manufacturing","12","92","4054","04",
"0400000US04","Arizona",null,"2014","3326","Spring and wire product manufacturing","19","247","12010","04",
"0400000US04","Arizona",null,"2014","33261","Spring and wire product manufacturing","19","247","12010","04",
"0400000US04","Arizona",null,"2014","332613","Spring manufacturing","3","0","0","04",
"0400000US04","Arizona",null,"2014","332618","Other fabricated wire product manufacturing","16","210","10440","04",
"0400000US04","Arizona",null,"2014","3327","Machine shops; turned product; and screw, nut, and bolt manufacturing","318","5599","281132","04",
"0400000US04","Arizona",null,"2014","33271","Machine shops","272","4176","209946","04",
"0400000US04","Arizona",null,"2014","332710","Machine shops","272","4176","209946","04",
"0400000US04","Arizona",null,"2014","33272","Turned product and screw, nut, and bolt manufacturing","46","1423","71186","04",
"0400000US04","Arizona",null,"2014","332721","Precision turned product manufacturing","35","975","50979","04",
"0400000US04","Arizona",null,"2014","332722","Bolt, nut, screw, rivet, and washer manufacturing","11","448","20207","04",
"0400000US04","Arizona",null,"2014","3328","Coating, engraving, heat treating, and allied activities","79","1324","49650","04",
"0400000US04","Arizona",null,"2014","33281","Coating, engraving, heat treating, and allied activities","79","1324","49650","04",
"0400000US04","Arizona",null,"2014","332811","Metal heat treating","8","169","7431","04",
"0400000US04","Arizona",null,"2014","332812","Metal coating, engraving (except jewelry and silverware), and allied services to manufacturers","39","624","23094","04",
"0400000US04","Arizona",null,"2014","332813","Electroplating, plating, polishing, anodizing, and coloring","32","531","19125","04",
"0400000US04","Arizona",null,"2014","3329","Other fabricated metal product manufacturing","131","5231","405599","04",
"0400000US04","Arizona",null,"2014","33291","Metal valve manufacturing","20","2558","235657","04",
"0400000US04","Arizona",null,"2014","332911","Industrial valve manufacturing","6","104","7632","04",
"0400000US04","Arizona",null,"2014","332912","Fluid power valve and hose fitting manufacturing","8","0","223583","04",
"0400000US04","Arizona",null,"2014","332913","Plumbing fixture fitting and trim manufacturing","2","0","0","04",
"0400000US04","Arizona",null,"2014","332919","Other metal valve and pipe fitting manufacturing","4","89","3769","04",
"0400000US04","Arizona",null,"2014","33299","All other fabricated metal product manufacturing","111","2673","169942","04",
"0400000US04","Arizona",null,"2014","332992","Small arms ammunition manufacturing","3","0","1969","04",
"0400000US04","Arizona",null,"2014","332993","Ammunition (except small arms) manufacturing","2","0","0","04",
"0400000US04","Arizona",null,"2014","332994","Small arms, ordnance, and ordnance accessories manufacturing","25","0","0","04",
"0400000US04","Arizona",null,"2014","332996","Fabricated pipe and pipe fitting manufacturing","9","158","5816","04",
"0400000US04","Arizona",null,"2014","332999","All other miscellaneous fabricated metal product manufacturing","72","996","44473","04",
"0400000US04","Arizona",null,"2014","333","Machinery manufacturing","259","6424","346558","04",
"0400000US04","Arizona",null,"2014","3331","Agriculture, construction, and mining machinery manufacturing","29","1719","84700","04",
"0400000US04","Arizona",null,"2014","33311","Agricultural implement manufacturing","11","672","30016","04",
"0400000US04","Arizona",null,"2014","333111","Farm machinery and equipment manufacturing","6","312","13553","04",
"0400000US04","Arizona",null,"2014","333112","Lawn and garden tractor and home lawn and garden equipment manufacturing","5","360","16463","04",
"0400000US04","Arizona",null,"2014","33312","Construction machinery manufacturing","10","396","18665","04",
"0400000US04","Arizona",null,"2014","333120","Construction machinery manufacturing","10","396","18665","04",
"0400000US04","Arizona",null,"2014","33313","Mining and oil and gas field machinery manufacturing","8","0","0","04",
"0400000US04","Arizona",null,"2014","333131","Mining machinery and equipment manufacturing","8","0","0","04",
"0400000US04","Arizona",null,"2014","3332","Industrial machinery manufacturing","36","648","34115","04",
"0400000US04","Arizona",null,"2014","33324","Industrial machinery manufacturing","36","648","34115","04",
"0400000US04","Arizona",null,"2014","333241","Food product machinery manufacturing","1","0","0","04",
"0400000US04","Arizona",null,"2014","333242","Semiconductor machinery manufacturing","6","0","4692","04",
"0400000US04","Arizona",null,"2014","333243","Sawmill, woodworking, and paper machinery manufacturing","4","0","286","04",
"0400000US04","Arizona",null,"2014","333244","Printing machinery and equipment manufacturing","5","152","10421","04",
"0400000US04","Arizona",null,"2014","333249","Other industrial machinery manufacturing","20","393","17344","04",
"0400000US04","Arizona",null,"2014","3333","Commercial and service industry machinery manufacturing","43","799","68507","04",
"0400000US04","Arizona",null,"2014","33331","Commercial and service industry machinery manufacturing","43","799","68507","04",
"0400000US04","Arizona",null,"2014","333314","Optical instrument and lens manufacturing","14","183","17223","04",
"0400000US04","Arizona",null,"2014","333316","Photographic and photocopying equipment manufacturing","5","0","2740","04",
"0400000US04","Arizona",null,"2014","333318","Other commercial and service industry machinery manufacturing","24","582","48544","04",
"0400000US04","Arizona",null,"2014","3334","Ventilation, heating, air-conditioning, and commercial refrigeration equipment manufacturing","27","837","43339","04",
"0400000US04","Arizona",null,"2014","33341","Ventilation, heating, air-conditioning, and commercial refrigeration equipment manufacturing","27","837","43339","04",
"0400000US04","Arizona",null,"2014","333413","Industrial and commercial fan and blower and air purification equipment manufacturing","4","0","1808","04",
"0400000US04","Arizona",null,"2014","333414","Heating equipment (except warm air furnaces) manufacturing","4","0","0","04",
"0400000US04","Arizona",null,"2014","333415","Air-conditioning and warm air heating equipment and commercial and industrial refrigeration equipment manufacturing","19","796","41209","04",
"0400000US04","Arizona",null,"2014","3335","Metalworking machinery manufacturing","71","1284","61113","04",
"0400000US04","Arizona",null,"2014","33351","Metalworking machinery manufacturing","71","1284","61113","04",
"0400000US04","Arizona",null,"2014","333511","Industrial mold manufacturing","21","485","25281","04",
"0400000US04","Arizona",null,"2014","333514","Special die and tool, die set, jig, and fixture manufacturing","15","156","8024","04",
"0400000US04","Arizona",null,"2014","333515","Cutting tool and machine tool accessory manufacturing","13","84","3766","04",
"0400000US04","Arizona",null,"2014","333517","Machine tool manufacturing","19","333","13614","04",
"0400000US04","Arizona",null,"2014","333519","Rolling mill and other metalworking machinery manufacturing","3","0","0","04",
"0400000US04","Arizona",null,"2014","3336","Engine, turbine, and power transmission equipment manufacturing","11","268","14942","04",
"0400000US04","Arizona",null,"2014","33361","Engine, turbine, and power transmission equipment manufacturing","11","268","14942","04",
"0400000US04","Arizona",null,"2014","333611","Turbine and turbine generator set units manufacturing","4","196","11567","04",
"0400000US04","Arizona",null,"2014","333612","Speed changer, industrial high-speed drive, and gear manufacturing","2","0","0","04",
"0400000US04","Arizona",null,"2014","333613","Mechanical power transmission equipment manufacturing","1","0","0","04",
"0400000US04","Arizona",null,"2014","333618","Other engine equipment manufacturing","4","0","1503","04",
"0400000US04","Arizona",null,"2014","3339","Other general purpose machinery manufacturing","42","869","39842","04",
"0400000US04","Arizona",null,"2014","33391","Pump and compressor manufacturing","4","95","5369","04",
"0400000US04","Arizona",null,"2014","333911","Pump and pumping equipment manufacturing","3","0","0","04",
"0400000US04","Arizona",null,"2014","333912","Air and gas compressor manufacturing","1","0","0","04",
"0400000US04","Arizona",null,"2014","33392","Material handling equipment manufacturing","10","301","13366","04",
"0400000US04","Arizona",null,"2014","333921","Elevator and moving stairway manufacturing","1","0","0","04",
"0400000US04","Arizona",null,"2014","333922","Conveyor and conveying equipment manufacturing","3","69","3461","04",
"0400000US04","Arizona",null,"2014","333923","Overhead traveling crane, hoist, and monorail system manufacturing","3","0","0","04",
"0400000US04","Arizona",null,"2014","333924","Industrial truck, trailer, and stacker machinery manufacturing","3","0","0","04",
"0400000US04","Arizona",null,"2014","33399","All other general purpose machinery manufacturing","28","473","21107","04",
"0400000US04","Arizona",null,"2014","333991","Power-driven handtool manufacturing","1","0","0","04",
"0400000US04","Arizona",null,"2014","333992","Welding and soldering equipment manufacturing","5","0","0","04",
"0400000US04","Arizona",null,"2014","333993","Packaging machinery manufacturing","2","0","0","04",
"0400000US04","Arizona",null,"2014","333994","Industrial process furnace and oven manufacturing","3","0","0","04",
"0400000US04","Arizona",null,"2014","333995","Fluid power cylinder and actuator manufacturing","3","0","1388","04",
"0400000US04","Arizona",null,"2014","333996","Fluid power pump and motor manufacturing","1","0","0","04",
"0400000US04","Arizona",null,"2014","333997","Scale and balance manufacturing","1","0","0","04",
"0400000US04","Arizona",null,"2014","333999","All other miscellaneous general purpose machinery manufacturing","12","354","17407","04",
"0400000US04","Arizona",null,"2014","334","Computer and electronic product manufacturing","268","24349","2262673","04",
"0400000US04","Arizona",null,"2014","3341","Computer and peripheral equipment manufacturing","26","768","42594","04",
"0400000US04","Arizona",null,"2014","33411","Computer and peripheral equipment manufacturing","26","768","42594","04",
"0400000US04","Arizona",null,"2014","334111","Electronic computer manufacturing","7","105","5672","04",
"0400000US04","Arizona",null,"2014","334112","Computer storage device manufacturing","5","0","6762","04",
"0400000US04","Arizona",null,"2014","334118","Computer terminal and other computer peripheral equipment manufacturing","14","584","30160","04",
"0400000US04","Arizona",null,"2014","3342","Communications equipment manufacturing","23","3248","332336","04",
"0400000US04","Arizona",null,"2014","33421","Telephone apparatus manufacturing","2","0","0","04",
"0400000US04","Arizona",null,"2014","334210","Telephone apparatus manufacturing","2","0","0","04",
"0400000US04","Arizona",null,"2014","33422","Radio and television broadcasting and wireless communications equipment manufacturing","10","0","0","04",
"0400000US04","Arizona",null,"2014","334220","Radio and television broadcasting and wireless communications equipment manufacturing","10","0","0","04",
"0400000US04","Arizona",null,"2014","33429","Other communications equipment manufacturing","11","0","0","04",
"0400000US04","Arizona",null,"2014","334290","Other communications equipment manufacturing","11","0","0","04",
"0400000US04","Arizona",null,"2014","3343","Audio and video equipment manufacturing","7","58","2691","04",
"0400000US04","Arizona",null,"2014","33431","Audio and video equipment manufacturing","7","58","2691","04",
"0400000US04","Arizona",null,"2014","334310","Audio and video equipment manufacturing","7","58","2691","04",
"0400000US04","Arizona",null,"2014","3344","Semiconductor and other electronic component manufacturing","101","0","0","04",
"0400000US04","Arizona",null,"2014","33441","Semiconductor and other electronic component manufacturing","101","0","0","04",
"0400000US04","Arizona",null,"2014","334412","Bare printed circuit board manufacturing","11","0","18305","04",
"0400000US04","Arizona",null,"2014","334413","Semiconductor and related device manufacturing","42","0","0","04",
"0400000US04","Arizona",null,"2014","334416","Capacitor, resistor, coil, transformer, and other inductor manufacturing","8","274","8178","04",
"0400000US04","Arizona",null,"2014","334417","Electronic connector manufacturing","3","86","4059","04",
"0400000US04","Arizona",null,"2014","334418","Printed circuit assembly (electronic assembly) manufacturing","15","0","35399","04",
"0400000US04","Arizona",null,"2014","334419","Other electronic component manufacturing","22","874","51468","04",
"0400000US04","Arizona",null,"2014","3345","Navigational, measuring, electromedical, and control instruments manufacturing","102","7086","562689","04",
"0400000US04","Arizona",null,"2014","33451","Navigational, measuring, electromedical, and control instruments manufacturing","102","7086","562689","04",
"0400000US04","Arizona",null,"2014","334510","Electromedical and electrotherapeutic apparatus manufacturing","11","909","52709","04",
"0400000US04","Arizona",null,"2014","334511","Search, detection, navigation, guidance, aeronautical, and nautical system and instrument manufacturing","20","0","0","04",
"0400000US04","Arizona",null,"2014","334512","Automatic environmental control manufacturing for residential, commercial, and appliance use","5","279","15531","04",
"0400000US04","Arizona",null,"2014","334513","Instruments and related products manufacturing for measuring, displaying, and controlling industrial process variables","17","178","9384","04",
"0400000US04","Arizona",null,"2014","334514","Totalizing fluid meter and counting device manufacturing","1","0","0","04",
"0400000US04","Arizona",null,"2014","334515","Instrument manufacturing for measuring and testing electricity and electrical systems","24","464","22249","04",
"0400000US04","Arizona",null,"2014","334516","Analytical laboratory instrument manufacturing","8","189","11342","04",
"0400000US04","Arizona",null,"2014","334517","Irradiation apparatus manufacturing","1","0","0","04",
"0400000US04","Arizona",null,"2014","334519","Other measuring and controlling device manufacturing","15","266","17063","04",
"0400000US04","Arizona",null,"2014","3346","Manufacturing and reproducing magnetic and optical media","9","0","440","04",
"0400000US04","Arizona",null,"2014","33461","Manufacturing and reproducing magnetic and optical media","9","0","440","04",
"0400000US04","Arizona",null,"2014","334614","Software and other prerecorded compact disc, tape, and record reproducing","9","0","440","04",
"0400000US04","Arizona",null,"2014","335","Electrical equipment, appliance, and component manufacturing","76","2346","142802","04",
"0400000US04","Arizona",null,"2014","3351","Electric lighting equipment manufacturing","17","337","15917","04",
"0400000US04","Arizona",null,"2014","4232","Furniture and home furnishing merchant wholesalers","215","2400","127636","04",
"0400000US04","Arizona",null,"2014","335121","Residential electric lighting fixture manufacturing","6","63","2994","04",
"0400000US04","Arizona",null,"2014","335122","Commercial, industrial, and institutional electric lighting fixture manufacturing","8","230","10743","04",
"0400000US04","Arizona",null,"2014","335129","Other lighting equipment manufacturing","3","44","2180","04",
"0400000US04","Arizona",null,"2014","3352","Household appliance manufacturing","8","0","0","04",
"0400000US04","Arizona",null,"2014","33521","Small electrical appliance manufacturing","2","0","0","04",
"0400000US04","Arizona",null,"2014","335210","Small electrical appliance manufacturing","2","0","0","04",
"0400000US04","Arizona",null,"2014","33522","Major appliance manufacturing","6","0","0","04",
"0400000US04","Arizona",null,"2014","335221","Household cooking appliance manufacturing","2","0","0","04",
"0400000US04","Arizona",null,"2014","335222","Household refrigerator and home freezer manufacturing","3","0","0","04",
"0400000US04","Arizona",null,"2014","335228","Other major household appliance manufacturing","1","0","0","04",
"0400000US04","Arizona",null,"2014","3353","Electrical equipment manufacturing","21","584","47962","04",
"0400000US04","Arizona",null,"2014","33531","Electrical equipment manufacturing","21","584","47962","04",
"0400000US04","Arizona",null,"2014","335311","Power, distribution, and specialty transformer manufacturing","4","0","0","04",
"0400000US04","Arizona",null,"2014","335312","Motor and generator manufacturing","2","0","0","04",
"0400000US04","Arizona",null,"2014","335313","Switchgear and switchboard apparatus manufacturing","6","0","0","04",
"0400000US04","Arizona",null,"2014","335314","Relay and industrial control manufacturing","9","0","0","04",
"0400000US04","Arizona",null,"2014","3359","Other electrical equipment and component manufacturing","30","0","57140","04",
"0400000US04","Arizona",null,"2014","33591","Battery manufacturing","1","0","0","04",
"0400000US04","Arizona",null,"2014","335911","Storage battery manufacturing","1","0","0","04",
"0400000US04","Arizona",null,"2014","33592","Communication and energy wire and cable manufacturing","6","118","4044","04",
"0400000US04","Arizona",null,"2014","335929","Other communication and energy wire manufacturing","6","118","4044","04",
"0400000US04","Arizona",null,"2014","33593","Wiring device manufacturing","6","0","0","04",
"0400000US04","Arizona",null,"2014","335931","Current-carrying wiring device manufacturing","4","0","0","04",
"0400000US04","Arizona",null,"2014","335932","Noncurrent-carrying wiring device manufacturing","2","0","0","04",
"0400000US04","Arizona",null,"2014","33599","All other electrical equipment and component manufacturing","17","0","0","04",
"0400000US04","Arizona",null,"2014","335991","Carbon and graphite product manufacturing","5","0","0","04",
"0400000US04","Arizona",null,"2014","335999","All other miscellaneous electrical equipment and component manufacturing","12","0","0","04",
"0400000US04","Arizona",null,"2014","336","Transportation equipment manufacturing","206","22266","2083137","04",
"0400000US04","Arizona",null,"2014","3361","Motor vehicle manufacturing","4","0","0","04",
"0400000US04","Arizona",null,"2014","33611","Automobile and light duty motor vehicle manufacturing","4","0","0","04",
"0400000US04","Arizona",null,"2014","336111","Automobile manufacturing","3","0","0","04",
"0400000US04","Arizona",null,"2014","336112","Light truck and utility vehicle manufacturing","1","0","0","04",
"0400000US04","Arizona",null,"2014","3362","Motor vehicle body and trailer manufacturing","30","806","34802","04",
"0400000US04","Arizona",null,"2014","33621","Motor vehicle body and trailer manufacturing","30","806","34802","04",
"0400000US04","Arizona",null,"2014","336211","Motor vehicle body manufacturing","13","527","24728","04",
"0400000US04","Arizona",null,"2014","336212","Truck trailer manufacturing","4","0","0","04",
"0400000US04","Arizona",null,"2014","336213","Motor home manufacturing","1","0","0","04",
"0400000US04","Arizona",null,"2014","336214","Travel trailer and camper manufacturing","12","200","7116","04",
"0400000US04","Arizona",null,"2014","3363","Motor vehicle parts manufacturing","68","2691","148528","04",
"0400000US04","Arizona",null,"2014","33631","Motor vehicle gasoline engine and engine parts manufacturing","18","0","0","04",
"0400000US04","Arizona",null,"2014","336310","Motor vehicle gasoline engine and engine parts manufacturing","18","0","0","04",
"0400000US04","Arizona",null,"2014","33632","Motor vehicle electrical and electronic equipment manufacturing","7","126","4140","04",
"0400000US04","Arizona",null,"2014","336320","Motor vehicle electrical and electronic equipment manufacturing","7","126","4140","04",
"0400000US04","Arizona",null,"2014","33633","Motor vehicle steering and suspension components (except spring) manufacturing","5","46","1441","04",
"0400000US04","Arizona",null,"2014","336330","Motor vehicle steering and suspension components (except spring) manufacturing","5","46","1441","04",
"0400000US04","Arizona",null,"2014","33634","Motor vehicle brake system manufacturing","2","0","0","04",
"0400000US04","Arizona",null,"2014","336340","Motor vehicle brake system manufacturing","2","0","0","04",
"0400000US04","Arizona",null,"2014","33635","Motor vehicle transmission and power train parts manufacturing","6","85","3284","04",
"0400000US04","Arizona",null,"2014","336350","Motor vehicle transmission and power train parts manufacturing","6","85","3284","04",
"0400000US04","Arizona",null,"2014","33636","Motor vehicle seating and interior trim manufacturing","8","1039","66269","04",
"0400000US04","Arizona",null,"2014","336360","Motor vehicle seating and interior trim manufacturing","8","1039","66269","04",
"0400000US04","Arizona",null,"2014","33637","Motor vehicle metal stamping","1","0","0","04",
"0400000US04","Arizona",null,"2014","336370","Motor vehicle metal stamping","1","0","0","04",
"0400000US04","Arizona",null,"2014","33639","Other motor vehicle parts manufacturing","21","1166","57493","04",
"0400000US04","Arizona",null,"2014","336390","Other motor vehicle parts manufacturing","21","1166","57493","04",
"0400000US04","Arizona",null,"2014","3364","Aerospace product and parts manufacturing","76","18379","1881630","04",
