"0400000US06","California",null,"2016","32622","Rubber and plastics hoses and belting manufacturing","18","541","23267","06",
"0400000US06","California",null,"2016","326220","Rubber and plastics hoses and belting manufacturing","18","541","23267","06",
"0400000US06","California",null,"2016","32629","Other rubber product manufacturing","129","3989","189778","06",
"0400000US06","California",null,"2016","326291","Rubber product manufacturing for mechanical use","54","2174","106295","06",
"0400000US06","California",null,"2016","326299","All other rubber product manufacturing","75","1815","83483","06",
"0400000US06","California",null,"2016","327","Nonmetallic mineral product manufacturing","1190","32914","1801577","06",
"0400000US06","California",null,"2016","3271","Clay product and refractory manufacturing","117","2054","93529","06",
"0400000US06","California",null,"2016","32711","Pottery, ceramics, and plumbing fixture manufacturing","71","1002","43198","06",
"0400000US06","California",null,"2016","327110","Pottery, ceramics, and plumbing fixture manufacturing","71","1002","43198","06",
"0400000US06","California",null,"2016","32712","Clay building material and refractories manufacturing","46","1052","50331","06",
"0400000US06","California",null,"2016","327120","Clay building material and refractories manufacturing","46","1052","50331","06",
"0400000US06","California",null,"2016","3272","Glass and glass product manufacturing","234","8125","442651","06",
"0400000US06","California",null,"2016","32721","Glass and glass product manufacturing","234","8125","442651","06",
"0400000US06","California",null,"2016","327211","Flat glass manufacturing","18","1148","59263","06",
"0400000US06","California",null,"2016","327212","Other pressed and blown glass and glassware manufacturing","63","799","32403","06",
"0400000US06","California",null,"2016","327213","Glass container manufacturing","8","1827","122221","06",
"0400000US06","California",null,"2016","327215","Glass product manufacturing made of purchased glass","145","4351","228764","06",
"0400000US06","California",null,"2016","3273","Cement and concrete product manufacturing","563","15674","906442","06",
"0400000US06","California",null,"2016","32731","Cement manufacturing","20","1234","95572","06",
"0400000US06","California",null,"2016","327310","Cement manufacturing","20","1234","95572","06",
"0400000US06","California",null,"2016","32732","Ready-mix concrete manufacturing","349","7428","438516","06",
"0400000US06","California",null,"2016","327320","Ready-mix concrete manufacturing","349","7428","438516","06",
"0400000US06","California",null,"2016","32733","Concrete pipe, brick, and block manufacturing","67","2043","110192","06",
"0400000US06","California",null,"2016","327331","Concrete block and brick manufacturing","45","1404","77546","06",
"0400000US06","California",null,"2016","327332","Concrete pipe manufacturing","22","639","32646","06",
"0400000US06","California",null,"2016","32739","Other concrete product manufacturing","127","4969","262162","06",
"0400000US06","California",null,"2016","327390","Other concrete product manufacturing","127","4969","262162","06",
"0400000US06","California",null,"2016","3274","Lime and gypsum product manufacturing","32","763","48568","06",
"0400000US06","California",null,"2016","32741","Lime manufacturing","4","34","1626","06",
"0400000US06","California",null,"2016","327410","Lime manufacturing","4","34","1626","06",
"0400000US06","California",null,"2016","32742","Gypsum product manufacturing","28","729","46942","06",
"0400000US06","California",null,"2016","327420","Gypsum product manufacturing","28","729","46942","06",
"0400000US06","California",null,"2016","3279","Other nonmetallic mineral product manufacturing","244","6298","310387","06",
"0400000US06","California",null,"2016","32791","Abrasive product manufacturing","24","358","14727","06",
"0400000US06","California",null,"2016","327910","Abrasive product manufacturing","24","358","14727","06",
"0400000US06","California",null,"2016","32799","All other nonmetallic mineral product manufacturing","220","5940","295660","06",
"0400000US06","California",null,"2016","327991","Cut stone and stone product manufacturing","130","1796","75100","06",
"0400000US06","California",null,"2016","327992","Ground or treated mineral and earth manufacturing","15","547","35064","06",
"0400000US06","California",null,"2016","327993","Mineral wool manufacturing","28","2040","113181","06",
"0400000US06","California",null,"2016","327999","All other miscellaneous nonmetallic mineral product manufacturing","47","1557","72315","06",
"0400000US06","California",null,"2016","331","Primary metal manufacturing","408","15675","886787","06",
"0400000US06","California",null,"2016","3311","Iron and steel mills and ferroalloy manufacturing","59","3021","230941","06",
"0400000US06","California",null,"2016","33111","Iron and steel mills and ferroalloy manufacturing","59","3021","230941","06",
"0400000US06","California",null,"2016","331110","Iron and steel mills and ferroalloy manufacturing","59","3021","230941","06",
"0400000US06","California",null,"2016","3312","Steel product manufacturing from purchased steel","64","1660","105524","06",
"0400000US06","California",null,"2016","33121","Iron and steel pipe and tube manufacturing from purchased steel","17","840","59448","06",
"0400000US06","California",null,"2016","331210","Iron and steel pipe and tube manufacturing from purchased steel","17","840","59448","06",
"0400000US06","California",null,"2016","33122","Rolling and drawing of purchased steel","47","820","46076","06",
"0400000US06","California",null,"2016","331221","Rolled steel shape manufacturing","17","204","14553","06",
"0400000US06","California",null,"2016","331222","Steel wire drawing","30","616","31523","06",
"0400000US06","California",null,"2016","3313","Alumina and aluminum production and processing","55","2898","160047","06",
"0400000US06","California",null,"2016","33392","Material handling equipment manufacturing","104","2728","164127","06",
"0400000US06","California",null,"2016","331313","Alumina refining and primary aluminum production","9","96","5955","06",
"0400000US06","California",null,"2016","331314","Secondary smelting and alloying of aluminum","10","520","31090","06",
"0400000US06","California",null,"2016","331315","Aluminum sheet, plate, and foil manufacturing","8","524","25409","06",
"0400000US06","California",null,"2016","331318","Other aluminum rolling, drawing, and extruding","28","1758","97593","06",
"0400000US06","California",null,"2016","3314","Nonferrous metal (except aluminum) production and processing","78","2284","126659","06",
"0400000US06","California",null,"2016","33141","Nonferrous metal (except aluminum) smelting and refining","11","505","33662","06",
"0400000US06","California",null,"2016","331410","Nonferrous metal (except aluminum) smelting and refining","11","505","33662","06",
"0400000US06","California",null,"2016","33142","Copper rolling, drawing, extruding, and alloying","17","380","17310","06",
"0400000US06","California",null,"2016","331420","Copper rolling, drawing, extruding, and alloying","17","380","17310","06",
"0400000US06","California",null,"2016","33149","Nonferrous metal (except copper and aluminum) rolling, drawing, extruding, and alloying","50","1399","75687","06",
"0400000US06","California",null,"2016","331491","Nonferrous metal (except copper and aluminum) rolling, drawing, extruding, and alloying","32","854","41734","06",
"0400000US06","California",null,"2016","331492","Secondary smelting, refining, and alloying of nonferrous metal (except copper and aluminum)","18","545","33953","06",
"0400000US06","California",null,"2016","3315","Foundries","152","5812","263616","06",
"0400000US06","California",null,"2016","33151","Ferrous metal foundries","58","2975","137023","06",
"0400000US06","California",null,"2016","331511","Iron foundries","26","934","52176","06",
"0400000US06","California",null,"2016","331512","Steel investment foundries","8","845","32782","06",
"0400000US06","California",null,"2016","331513","Steel foundries (except investment)","24","1196","52065","06",
"0400000US06","California",null,"2016","33152","Nonferrous metal foundries","94","2837","126593","06",
"0400000US06","California",null,"2016","331523","Nonferrous metal die-casting foundries","43","1528","62764","06",
"0400000US06","California",null,"2016","331524","Aluminum foundries (except die-casting)","30","1100","55984","06",
"0400000US06","California",null,"2016","331529","Other nonferrous metal foundries (except die-casting)","21","209","7845","06",
"0400000US06","California",null,"2016","332","Fabricated metal product manufacturing","6464","126665","6823445","06",
"0400000US06","California",null,"2016","3321","Forging and stamping","261","8104","452385","06",
"0400000US06","California",null,"2016","33211","Forging and stamping","261","8104","452385","06",
"0400000US06","California",null,"2016","332111","Iron and steel forging","44","1654","101112","06",
"0400000US06","California",null,"2016","332112","Nonferrous forging","13","1859","113611","06",
"0400000US06","California",null,"2016","332114","Custom roll forming","40","1031","58913","06",
"0400000US06","California",null,"2016","332117","Powder metallurgy part manufacturing","8","319","13825","06",
"0400000US06","California",null,"2016","332119","Metal crown, closure, and other metal stamping (except automotive)","156","3241","164924","06",
"0400000US06","California",null,"2016","3322","Cutlery and handtool manufacturing","155","2105","108465","06",
"0400000US06","California",null,"2016","33221","Cutlery and handtool manufacturing","155","2105","108465","06",
"0400000US06","California",null,"2016","332215","Metal kitchen cookware, utensil, cutlery, and flatware (except precious) manufacturing","20","167","11406","06",
"0400000US06","California",null,"2016","332216","Saw blade and handtool manufacturing","135","1938","97059","06",
"0400000US06","California",null,"2016","3323","Architectural and structural metals manufacturing","1379","28959","1501910","06",
"0400000US06","California",null,"2016","33231","Plate work and fabricated structural product manufacturing","376","7550","423139","06",
"0400000US06","California",null,"2016","332311","Prefabricated metal building and component manufacturing","49","1159","65170","06",
"0400000US06","California",null,"2016","332312","Fabricated structural metal manufacturing","258","5462","307323","06",
"0400000US06","California",null,"2016","332313","Plate work manufacturing","69","929","50646","06",
"0400000US06","California",null,"2016","33232","Ornamental and architectural metal products manufacturing","1003","21409","1078771","06",
"0400000US06","California",null,"2016","332321","Metal window and door manufacturing","125","4160","188331","06",
"0400000US06","California",null,"2016","332322","Sheet metal work manufacturing","577","13717","694897","06",
"0400000US06","California",null,"2016","332323","Ornamental and architectural metal work manufacturing","301","3532","195543","06",
"0400000US06","California",null,"2016","3324","Boiler, tank, and shipping container manufacturing","117","4130","268487","06",
"0400000US06","California",null,"2016","33241","Power boiler and heat exchanger manufacturing","20","748","48756","06",
"0400000US06","California",null,"2016","332410","Power boiler and heat exchanger manufacturing","20","748","48756","06",
"0400000US06","California",null,"2016","33242","Metal tank (heavy gauge) manufacturing","44","1211","69293","06",
"0400000US06","California",null,"2016","332420","Metal tank (heavy gauge) manufacturing","44","1211","69293","06",
"0400000US06","California",null,"2016","33243","Metal can, box, and other metal container (light gauge) manufacturing","53","2171","150438","06",
"0400000US06","California",null,"2016","332431","Metal can manufacturing","21","1440","107862","06",
"0400000US06","California",null,"2016","332439","Other metal container manufacturing","32","731","42576","06",
"0400000US06","California",null,"2016","3325","Hardware manufacturing","80","2839","148866","06",
"0400000US06","California",null,"2016","33251","Hardware manufacturing","80","2839","148866","06",
"0400000US06","California",null,"2016","332510","Hardware manufacturing","80","2839","148866","06",
"0400000US06","California",null,"2016","3326","Spring and wire product manufacturing","119","1906","87591","06",
"0400000US06","California",null,"2016","33261","Spring and wire product manufacturing","119","1906","87591","06",
"0400000US06","California",null,"2016","332613","Spring manufacturing","47","1035","47618","06",
"0400000US06","California",null,"2016","332618","Other fabricated wire product manufacturing","72","871","39973","06",
"0400000US06","California",null,"2016","3327","Machine shops; turned product; and screw, nut, and bolt manufacturing","2929","46293","2508828","06",
"0400000US06","California",null,"2016","33271","Machine shops","2344","28734","1509194","06",
"0400000US06","California",null,"2016","332710","Machine shops","2344","28734","1509194","06",
"0400000US06","California",null,"2016","33272","Turned product and screw, nut, and bolt manufacturing","585","17559","999634","06",
"0400000US06","California",null,"2016","332721","Precision turned product manufacturing","465","9281","503405","06",
"0400000US06","California",null,"2016","332722","Bolt, nut, screw, rivet, and washer manufacturing","120","8278","496229","06",
"0400000US06","California",null,"2016","3328","Coating, engraving, heat treating, and allied activities","803","15547","693757","06",
"0400000US06","California",null,"2016","33281","Coating, engraving, heat treating, and allied activities","803","15547","693757","06",
"0400000US06","California",null,"2016","332811","Metal heat treating","78","2055","107112","06",
"0400000US06","California",null,"2016","332812","Metal coating, engraving (except jewelry and silverware), and allied services to manufacturers","342","5321","237716","06",
"0400000US06","California",null,"2016","332813","Electroplating, plating, polishing, anodizing, and coloring","383","8171","348929","06",
"0400000US06","California",null,"2016","3329","Other fabricated metal product manufacturing","621","16782","1053156","06",
"0400000US06","California",null,"2016","33291","Metal valve manufacturing","139","8278","616642","06",
"0400000US06","California",null,"2016","332911","Industrial valve manufacturing","58","3208","231033","06",
"0400000US06","California",null,"2016","332912","Fluid power valve and hose fitting manufacturing","43","3923","305863","06",
"0400000US06","California",null,"2016","332913","Plumbing fixture fitting and trim manufacturing","22","574","50933","06",
"0400000US06","California",null,"2016","332919","Other metal valve and pipe fitting manufacturing","16","573","28813","06",
"0400000US06","California",null,"2016","33299","All other fabricated metal product manufacturing","482","8504","436514","06",
"0400000US06","California",null,"2016","332991","Ball and roller bearing manufacturing","15","728","40408","06",
"0400000US06","California",null,"2016","332992","Small arms ammunition manufacturing","12","81","3387","06",
"0400000US06","California",null,"2016","332993","Ammunition (except small arms) manufacturing","2","0","0","06",
"0400000US06","California",null,"2016","332994","Small arms, ordnance, and ordnance accessories manufacturing","14","199","10493","06",
"0400000US06","California",null,"2016","332996","Fabricated pipe and pipe fitting manufacturing","75","1590","77272","06",
"0400000US06","California",null,"2016","332999","All other miscellaneous fabricated metal product manufacturing","364","5632","286201","06",
"0400000US06","California",null,"2016","333","Machinery manufacturing","2329","65624","4944994","06",
"0400000US06","California",null,"2016","3331","Agriculture, construction, and mining machinery manufacturing","175","4359","244413","06",
"0400000US06","California",null,"2016","33311","Agricultural implement manufacturing","106","2520","141901","06",
"0400000US06","California",null,"2016","333111","Farm machinery and equipment manufacturing","95","2453","139331","06",
"0400000US06","California",null,"2016","333112","Lawn and garden tractor and home lawn and garden equipment manufacturing","11","67","2570","06",
"0400000US06","California",null,"2016","33312","Construction machinery manufacturing","40","898","45212","06",
"0400000US06","California",null,"2016","333120","Construction machinery manufacturing","40","898","45212","06",
"0400000US06","California",null,"2016","33313","Mining and oil and gas field machinery manufacturing","29","941","57300","06",
"0400000US06","California",null,"2016","333131","Mining machinery and equipment manufacturing","8","44","4630","06",
"0400000US06","California",null,"2016","333132","Oil and gas field machinery and equipment manufacturing","21","897","52670","06",
"0400000US06","California",null,"2016","3332","Industrial machinery manufacturing","346","9942","992712","06",
"0400000US06","California",null,"2016","33324","Industrial machinery manufacturing","346","9942","992712","06",
"0400000US06","California",null,"2016","333241","Food product machinery manufacturing","65","1671","108409","06",
"0400000US06","California",null,"2016","333242","Semiconductor machinery manufacturing","67","4656","681683","06",
"0400000US06","California",null,"2016","333243","Sawmill, woodworking, and paper machinery manufacturing","17","314","19781","06",
"0400000US06","California",null,"2016","333244","Printing machinery and equipment manufacturing","27","720","45237","06",
"0400000US06","California",null,"2016","333249","Other industrial machinery manufacturing","170","2581","137602","06",
"0400000US06","California",null,"2016","3333","Commercial and service industry machinery manufacturing","350","9325","679610","06",
"0400000US06","California",null,"2016","33331","Commercial and service industry machinery manufacturing","350","9325","679610","06",
"0400000US06","California",null,"2016","333314","Optical instrument and lens manufacturing","101","3300","236383","06",
"0400000US06","California",null,"2016","333316","Photographic and photocopying equipment manufacturing","73","1926","141537","06",
"0400000US06","California",null,"2016","333318","Other commercial and service industry machinery manufacturing","176","4099","301690","06",
"0400000US06","California",null,"2016","3334","Ventilation, heating, air-conditioning, and commercial refrigeration equipment manufacturing","188","5762","340059","06",
"0400000US06","California",null,"2016","33341","Ventilation, heating, air-conditioning, and commercial refrigeration equipment manufacturing","188","5762","340059","06",
"0400000US06","California",null,"2016","333413","Industrial and commercial fan and blower and air purification equipment manufacturing","44","1248","62850","06",
"0400000US06","California",null,"2016","333414","Heating equipment (except warm air furnaces) manufacturing","57","1843","113283","06",
"0400000US06","California",null,"2016","333415","Air-conditioning and warm air heating equipment and commercial and industrial refrigeration equipment manufacturing","87","2671","163926","06",
"0400000US06","California",null,"2016","3335","Metalworking machinery manufacturing","575","10026","554829","06",
"0400000US06","California",null,"2016","33351","Metalworking machinery manufacturing","575","10026","554829","06",
"0400000US06","California",null,"2016","333511","Industrial mold manufacturing","121","2891","152678","06",
"0400000US06","California",null,"2016","333514","Special die and tool, die set, jig, and fixture manufacturing","133","1685","90392","06",
"0400000US06","California",null,"2016","333515","Cutting tool and machine tool accessory manufacturing","126","1911","98765","06",
"0400000US06","California",null,"2016","333517","Machine tool manufacturing","167","3210","198699","06",
"0400000US06","California",null,"2016","333519","Rolling mill and other metalworking machinery manufacturing","28","329","14295","06",
"0400000US06","California",null,"2016","3336","Engine, turbine, and power transmission equipment manufacturing","93","6869","768247","06",
"0400000US06","California",null,"2016","33361","Engine, turbine, and power transmission equipment manufacturing","93","6869","768247","06",
"0400000US06","California",null,"2016","333611","Turbine and turbine generator set units manufacturing","24","4718","637680","06",
"0400000US06","California",null,"2016","333612","Speed changer, industrial high-speed drive, and gear manufacturing","14","231","13991","06",
"0400000US06","California",null,"2016","333613","Mechanical power transmission equipment manufacturing","19","1049","61770","06",
"0400000US06","California",null,"2016","333618","Other engine equipment manufacturing","36","871","54806","06",
"0400000US06","California",null,"2016","3339","Other general purpose machinery manufacturing","602","19341","1365124","06",
"0400000US06","California",null,"2016","33391","Pump and compressor manufacturing","83","3150","209614","06",
"0400000US06","California",null,"2016","333911","Pump and pumping equipment manufacturing","48","2102","147507","06",
"0400000US06","California",null,"2016","333912","Air and gas compressor manufacturing","32","1024","61442","06",
"0400000US06","California",null,"2016","333913","Measuring and dispensing pump manufacturing","3","24","665","06",
"0400000US06","California",null,"2016","3366","Ship and boat building","104","11236","548198","06",
"0400000US06","California",null,"2016","333921","Elevator and moving stairway manufacturing","17","356","19377","06",
"0400000US06","California",null,"2016","333922","Conveyor and conveying equipment manufacturing","40","918","67034","06",
"0400000US06","California",null,"2016","333923","Overhead traveling crane, hoist, and monorail system manufacturing","11","253","17626","06",
"0400000US06","California",null,"2016","333924","Industrial truck, trailer, and stacker machinery manufacturing","36","1201","60090","06",
"0400000US06","California",null,"2016","33399","All other general purpose machinery manufacturing","415","13463","991383","06",
"0400000US06","California",null,"2016","333991","Power-driven handtool manufacturing","19","1061","67036","06",
"0400000US06","California",null,"2016","333992","Welding and soldering equipment manufacturing","55","978","74758","06",
"0400000US06","California",null,"2016","333993","Packaging machinery manufacturing","71","1661","97765","06",
"0400000US06","California",null,"2016","333994","Industrial process furnace and oven manufacturing","33","678","41899","06",
"0400000US06","California",null,"2016","333995","Fluid power cylinder and actuator manufacturing","33","3840","357976","06",
"0400000US06","California",null,"2016","333996","Fluid power pump and motor manufacturing","14","442","35002","06",
"0400000US06","California",null,"2016","333997","Scale and balance manufacturing","8","52","2705","06",
"0400000US06","California",null,"2016","333999","All other miscellaneous general purpose machinery manufacturing","182","4751","314242","06",
"0400000US06","California",null,"2016","334","Computer and electronic product manufacturing","2801","159117","14794434","06",
"0400000US06","California",null,"2016","3341","Computer and peripheral equipment manufacturing","292","8492","782360","06",
"0400000US06","California",null,"2016","33411","Computer and peripheral equipment manufacturing","292","8492","782360","06",
"0400000US06","California",null,"2016","334111","Electronic computer manufacturing","105","3300","286304","06",
"0400000US06","California",null,"2016","334112","Computer storage device manufacturing","36","2715","271291","06",
"0400000US06","California",null,"2016","334118","Computer terminal and other computer peripheral equipment manufacturing","151","2477","224765","06",
"0400000US06","California",null,"2016","3342","Communications equipment manufacturing","292","22549","2394240","06",
"0400000US06","California",null,"2016","33421","Telephone apparatus manufacturing","55","2423","280643","06",
"0400000US06","California",null,"2016","334210","Telephone apparatus manufacturing","55","2423","280643","06",
"0400000US06","California",null,"2016","33422","Radio and television broadcasting and wireless communications equipment manufacturing","174","19137","2042920","06",
"0400000US06","California",null,"2016","334220","Radio and television broadcasting and wireless communications equipment manufacturing","174","19137","2042920","06",
"0400000US06","California",null,"2016","33429","Other communications equipment manufacturing","63","989","70677","06",
"0400000US06","California",null,"2016","334290","Other communications equipment manufacturing","63","989","70677","06",
"0400000US06","California",null,"2016","3343","Audio and video equipment manufacturing","134","2498","192544","06",
"0400000US06","California",null,"2016","33431","Audio and video equipment manufacturing","134","2498","192544","06",
"0400000US06","California",null,"2016","334310","Audio and video equipment manufacturing","134","2498","192544","06",
"0400000US06","California",null,"2016","3344","Semiconductor and other electronic component manufacturing","1024","63516","5187784","06",
"0400000US06","California",null,"2016","33441","Semiconductor and other electronic component manufacturing","1024","63516","5187784","06",
"0400000US06","California",null,"2016","334412","Bare printed circuit board manufacturing","148","7877","402395","06",
"0400000US06","California",null,"2016","334413","Semiconductor and related device manufacturing","298","25441","2972387","06",
"0400000US06","California",null,"2016","334416","Capacitor, resistor, coil, transformer, and other inductor manufacturing","76","3127","155060","06",
