"0400000US31","Nebraska",null,"2017","611430","Professional and management development training","21","65","4051","31",
"0400000US31","Nebraska",null,"2017","6115","Technical and trade schools","46","390","13647","31",
"0400000US31","Nebraska",null,"2017","61151","Technical and trade schools","46","390","13647","31",
"0400000US31","Nebraska",null,"2017","541612","Human resources consulting services","45","1992","121257","31",
"0400000US31","Nebraska",null,"2017","541613","Marketing consulting services","159","699","38409","31",
"0400000US31","Nebraska",null,"2017","54172","Research and development in the social sciences and humanities","3","27","2522","31",
"0400000US31","Nebraska",null,"2017","541720","Research and development in the social sciences and humanities","3","27","2522","31",
"0400000US31","Nebraska",null,"2017","5418","Advertising, public relations, and related services","209","2514","142411","31",
"0400000US31","Nebraska",null,"2017","5419","Other professional, scientific, and technical services","534","4957","174371","31",
"0400000US31","Nebraska",null,"2017","54199","All other professional, scientific, and technical services","59","212","11786","31",
"0400000US31","Nebraska",null,"2017","541990","All other professional, scientific, and technical services","59","212","11786","31",
"0400000US31","Nebraska",null,"2017","55111","Management of companies and enterprises","364","22233","1759956","31",
"0400000US31","Nebraska",null,"2017","561110","Office administrative services","147","1503","111566","31",
"0400000US31","Nebraska",null,"2017","561312","Executive search services","29","86","6738","31",
"0400000US31","Nebraska",null,"2017","56132","Temporary help services","211","19774","844392","31",
"0400000US31","Nebraska",null,"2017","561421","Telephone answering services","6","163","8272","31",
"0400000US31","Nebraska",null,"2017","561422","Telemarketing bureaus and other contact centers","47","6308","141638","31",
"0400000US31","Nebraska",null,"2017","56143","Business service centers","29","210","7186","31",
"0400000US31","Nebraska",null,"2017","561431","Private mail centers","8","25","348","31",
"0400000US31","Nebraska",null,"2017","56152","Tour operators","4","35","723","31",
"0400000US31","Nebraska",null,"2017","561520","Tour operators","4","35","723","31",
"0400000US31","Nebraska",null,"2017","56159","Other travel arrangement and reservation services","20","1540","48176","31",
"0400000US31","Nebraska",null,"2017","561591","Convention and visitors bureaus","4","20","583","31",
"0400000US31","Nebraska",null,"2017","561599","All other travel arrangement and reservation services","16","1520","47593","31",
"0400000US31","Nebraska",null,"2017","5616","Investigation and security services","117","3732","110572","31",
"0400000US31","Nebraska",null,"2017","56171","Exterminating and pest control services","86","369","15447","31",
"0400000US31","Nebraska",null,"2017","561730","Landscaping services","861","4185","156292","31",
"0400000US31","Nebraska",null,"2017","561990","All other support services","107","786","29649","31",
"0400000US31","Nebraska",null,"2017","562","Waste management and remediation services","215","2230","103685","31",
"0400000US31","Nebraska",null,"2017","562212","Solid waste landfill","13","271","18174","31",
"0400000US31","Nebraska",null,"2017","5629","Remediation and other waste management services","55","322","15550","31",
"0400000US31","Nebraska",null,"2017","56291","Remediation services","22","222","11863","31",
"0400000US31","Nebraska",null,"2017","562910","Remediation services","22","222","11863","31",
"0400000US31","Nebraska",null,"2017","61111","Elementary and secondary schools","163","4425","116011","31",
"0400000US31","Nebraska",null,"2017","611110","Elementary and secondary schools","163","4425","116011","31",
"0400000US31","Nebraska",null,"2017","611511","Cosmetology and barber schools","16","154","4879","31",
"0400000US31","Nebraska",null,"2017","611512","Flight training","4","0","0","31",
"0400000US31","Nebraska",null,"2017","611513","Apprenticeship training","7","57","1416","31",
"0400000US31","Nebraska",null,"2017","611519","Other technical and trade schools","19","134","4852","31",
"0400000US31","Nebraska",null,"2017","541614","Process, physical distribution, and logistics consulting services","50","137","6631","31",
"0400000US31","Nebraska",null,"2017","541618","Other management consulting services","13","135","7725","31",
"0400000US31","Nebraska",null,"2017","54162","Environmental consulting services","29","138","7951","31",
"0400000US31","Nebraska",null,"2017","541620","Environmental consulting services","29","138","7951","31",
"0400000US31","Nebraska",null,"2017","11521","Support activities for animal production","47","229","11166","31",
"0400000US31","Nebraska",null,"2017","115210","Support activities for animal production","47","229","11166","31",
"0400000US31","Nebraska",null,"2017","23621","Industrial building construction","19","543","31376","31",
"0400000US31","Nebraska",null,"2017","236210","Industrial building construction","19","543","31376","31",
"0400000US31","Nebraska",null,"2017","23814","Masonry contractors","164","1092","43369","31",
"0400000US31","Nebraska",null,"2017","238140","Masonry contractors","164","1092","43369","31",
"0400000US31","Nebraska",null,"2017","238350","Finish carpentry contractors","312","1242","45067","31",
"0400000US31","Nebraska",null,"2017","23839","Other building finishing contractors","45","378","17079","31",
"0400000US31","Nebraska",null,"2017","238390","Other building finishing contractors","45","378","17079","31",
"0400000US31","Nebraska",null,"2017","21","Mining, quarrying, and oil and gas extraction","111","1057","58273","31",
"0400000US31","Nebraska",null,"2017","211","Oil and gas extraction","16","93","4725","31",
"0400000US31","Nebraska",null,"2017","2111","Oil and gas extraction","16","93","4725","31",
"0400000US31","Nebraska",null,"2017","23622","Commercial and institutional building construction","309","4512","269273","31",
"0400000US31","Nebraska",null,"2017","23815","Glass and glazing contractors","40","476","23387","31",
"0400000US31","Nebraska",null,"2017","238150","Glass and glazing contractors","40","476","23387","31",
"0400000US31","Nebraska",null,"2017","2389","Other specialty trade contractors","627","3964","197976","31",
"0400000US31","Nebraska",null,"2017","3118","Bakeries and tortilla manufacturing","52","1773","78050","31",
"0400000US31","Nebraska",null,"2017","31181","Bread and bakery product manufacturing","49","1426","64528","31",
"0400000US31","Nebraska",null,"2017","323111","Commercial printing (except screen and books)","123","2275","100520","31",
"0400000US31","Nebraska",null,"2017","32733","Concrete pipe, brick, and block manufacturing","5","98","6490","31",
"0400000US31","Nebraska",null,"2017","327331","Concrete block and brick manufacturing","4","93","6225","31",
"0400000US31","Nebraska",null,"2017","32739","Other concrete product manufacturing","25","721","37250","31",
"0400000US31","Nebraska",null,"2017","327390","Other concrete product manufacturing","25","721","37250","31",
"0400000US31","Nebraska",null,"2017","3279","Other nonmetallic mineral product manufacturing","15","291","18487","31",
"0400000US31","Nebraska",null,"2017","3331","Agriculture, construction, and mining machinery manufacturing","91","6152","333937","31",
"0400000US31","Nebraska",null,"2017","33311","Agricultural implement manufacturing","83","5921","321223","31",
"0400000US31","Nebraska",null,"2017","3364","Aerospace product and parts manufacturing","7","600","31738","31",
"0400000US31","Nebraska",null,"2017","33641","Aerospace product and parts manufacturing","7","600","31738","31",
"0400000US31","Nebraska",null,"2017","336412","Aircraft engine and engine parts manufacturing","3","0","0","31",
"0400000US31","Nebraska",null,"2017","3365","Railroad rolling stock manufacturing","6","513","26283","31",
"0400000US31","Nebraska",null,"2017","33651","Railroad rolling stock manufacturing","6","513","26283","31",
"0400000US31","Nebraska",null,"2017","336510","Railroad rolling stock manufacturing","6","513","26283","31",
"0400000US31","Nebraska",null,"2017","3369","Other transportation equipment manufacturing","9","0","0","31",
"0400000US31","Nebraska",null,"2017","33699","Other transportation equipment manufacturing","9","0","0","31",
"0400000US31","Nebraska",null,"2017","42312","Motor vehicle supplies and new parts merchant wholesalers","92","1003","43064","31",
"0400000US31","Nebraska",null,"2017","423450","Medical, dental, and hospital equipment and supplies merchant wholesalers","58","656","48996","31",
"0400000US31","Nebraska",null,"2017","42346","Ophthalmic goods merchant wholesalers","5","27","469","31",
"0400000US31","Nebraska",null,"2017","423460","Ophthalmic goods merchant wholesalers","5","27","469","31",
"0400000US31","Nebraska",null,"2017","42349","Other professional equipment and supplies merchant wholesalers","17","224","18485","31",
"0400000US31","Nebraska",null,"2017","21112","Crude petroleum extraction","13","85","4221","31",
"0400000US31","Nebraska",null,"2017","211120","Crude petroleum extraction","13","85","4221","31",
"0400000US31","Nebraska",null,"2017","21113","Natural gas extraction","3","0","0","31",
"0400000US31","Nebraska",null,"2017","211130","Natural gas extraction","3","0","0","31",
"0400000US31","Nebraska",null,"2017","212","Mining (except oil and gas)","60","820","45460","31",
"0400000US31","Nebraska",null,"2017","236220","Commercial and institutional building construction","309","4512","269273","31",
"0400000US31","Nebraska",null,"2017","237","Heavy and civil engineering construction","400","5149","315465","31",
"0400000US31","Nebraska",null,"2017","23816","Roofing contractors","218","1495","76417","31",
"0400000US31","Nebraska",null,"2017","238160","Roofing contractors","218","1495","76417","31",
"0400000US31","Nebraska",null,"2017","23891","Site preparation contractors","337","2534","127639","31",
"0400000US31","Nebraska",null,"2017","238910","Site preparation contractors","337","2534","127639","31",
"0400000US31","Nebraska",null,"2017","311811","Retail bakeries","31","296","4635","31",
"0400000US31","Nebraska",null,"2017","311812","Commercial bakeries","17","794","45214","31",
"0400000US31","Nebraska",null,"2017","31183","Tortilla manufacturing","3","0","0","31",
"0400000US31","Nebraska",null,"2017","311830","Tortilla manufacturing","3","0","0","31",
"0400000US31","Nebraska",null,"2017","3119","Other food manufacturing","13","942","32493","31",
"0400000US31","Nebraska",null,"2017","31191","Snack food manufacturing","3","100","3732","31",
"0400000US31","Nebraska",null,"2017","31199","All other food manufacturing","8","839","28665","31",
"0400000US31","Nebraska",null,"2017","311999","All other miscellaneous food manufacturing","6","682","23131","31",
"0400000US31","Nebraska",null,"2017","323113","Commercial screen printing","45","366","11043","31",
"0400000US31","Nebraska",null,"2017","323117","Books printing","4","0","0","31",
"0400000US31","Nebraska",null,"2017","32312","Support activities for printing","4","0","0","31",
"0400000US31","Nebraska",null,"2017","323120","Support activities for printing","4","0","0","31",
"0400000US31","Nebraska",null,"2017","324","Petroleum and coal products manufacturing","4","0","0","31",
"0400000US31","Nebraska",null,"2017","3241","Petroleum and coal products manufacturing","4","0","0","31",
"0400000US31","Nebraska",null,"2017","32799","All other nonmetallic mineral product manufacturing","15","291","18487","31",
"0400000US31","Nebraska",null,"2017","327991","Cut stone and stone product manufacturing","7","111","6654","31",
"0400000US31","Nebraska",null,"2017","327992","Ground or treated mineral and earth manufacturing","3","28","1236","31",
"0400000US31","Nebraska",null,"2017","327999","All other miscellaneous nonmetallic mineral product manufacturing","5","152","10597","31",
"0400000US31","Nebraska",null,"2017","331","Primary metal manufacturing","15","1109","99458","31",
"0400000US31","Nebraska",null,"2017","333111","Farm machinery and equipment manufacturing","80","5853","318647","31",
"0400000US31","Nebraska",null,"2017","336999","All other transportation equipment manufacturing","7","0","0","31",
"0400000US31","Nebraska",null,"2017","337","Furniture and related product manufacturing","56","1480","67555","31",
"0400000US31","Nebraska",null,"2017","3371","Household and institutional furniture and kitchen cabinet manufacturing","34","275","12094","31",
"0400000US31","Nebraska",null,"2017","423120","Motor vehicle supplies and new parts merchant wholesalers","92","1003","43064","31",
"0400000US31","Nebraska",null,"2017","42313","Tire and tube merchant wholesalers","19","325","13125","31",
"0400000US31","Nebraska",null,"2017","423490","Other professional equipment and supplies merchant wholesalers","17","224","18485","31",
"0400000US31","Nebraska",null,"2017","4235","Metal and mineral (except petroleum) merchant wholesalers","42","877","45288","31",
"0400000US31","Nebraska",null,"2017","42351","Metal service centers and other metal merchant wholesalers","42","877","45288","31",
"0400000US31","Nebraska",null,"2017","2123","Nonmetallic mineral mining and quarrying","59","782","42820","31",
"0400000US31","Nebraska",null,"2017","21231","Stone mining and quarrying","10","285","20940","31",
"0400000US31","Nebraska",null,"2017","212312","Crushed and broken limestone mining and quarrying","8","276","20492","31",
"0400000US31","Nebraska",null,"2017","21232","Sand, gravel, clay, and ceramic and refractory minerals mining and quarrying","49","497","21880","31",
"0400000US31","Nebraska",null,"2017","2371","Utility system construction","252","2371","123967","31",
"0400000US31","Nebraska",null,"2017","23817","Siding contractors","146","483","18501","31",
"0400000US31","Nebraska",null,"2017","238170","Siding contractors","146","483","18501","31",
"0400000US31","Nebraska",null,"2017","23899","All other specialty trade contractors","290","1430","70337","31",
"0400000US31","Nebraska",null,"2017","312","Beverage and tobacco product manufacturing","44","402","13133","31",
"0400000US31","Nebraska",null,"2017","3121","Beverage manufacturing","44","402","13133","31",
"0400000US31","Nebraska",null,"2017","31211","Soft drink and ice manufacturing","5","160","7608","31",
"0400000US31","Nebraska",null,"2017","312111","Soft drink manufacturing","3","0","0","31",
"0400000US31","Nebraska",null,"2017","31212","Breweries","22","169","3911","31",
"0400000US31","Nebraska",null,"2017","32412","Asphalt paving, roofing, and saturated materials manufacturing","3","0","0","31",
"0400000US31","Nebraska",null,"2017","324121","Asphalt paving mixture and block manufacturing","3","0","0","31",
"0400000US31","Nebraska",null,"2017","325","Chemical manufacturing","85","5126","356944","31",
"0400000US31","Nebraska",null,"2017","3251","Basic chemical manufacturing","38","2465","146299","31",
"0400000US31","Nebraska",null,"2017","3312","Steel product manufacturing from purchased steel","3","37","2232","31",
"0400000US31","Nebraska",null,"2017","3315","Foundries","8","351","15791","31",
"0400000US31","Nebraska",null,"2017","33151","Ferrous metal foundries","5","0","0","31",
"0400000US31","Nebraska",null,"2017","331511","Iron foundries","3","0","0","31",
"0400000US31","Nebraska",null,"2017","33152","Nonferrous metal foundries","3","170","7097","31",
"0400000US31","Nebraska",null,"2017","332","Fabricated metal product manufacturing","255","8239","396194","31",
"0400000US31","Nebraska",null,"2017","333112","Lawn and garden tractor and home lawn and garden equipment manufacturing","3","68","2576","31",
"0400000US31","Nebraska",null,"2017","33312","Construction machinery manufacturing","8","231","12714","31",
"0400000US31","Nebraska",null,"2017","333120","Construction machinery manufacturing","8","231","12714","31",
"0400000US31","Nebraska",null,"2017","3332","Industrial machinery manufacturing","19","612","23711","31",
"0400000US31","Nebraska",null,"2017","33324","Industrial machinery manufacturing","19","612","23711","31",
"0400000US31","Nebraska",null,"2017","333241","Food product machinery manufacturing","4","27","1588","31",
"0400000US31","Nebraska",null,"2017","333249","Other industrial machinery manufacturing","13","564","20544","31",
"0400000US31","Nebraska",null,"2017","33711","Wood kitchen cabinet and countertop manufacturing","27","172","7961","31",
"0400000US31","Nebraska",null,"2017","337110","Wood kitchen cabinet and countertop manufacturing","27","172","7961","31",
"0400000US31","Nebraska",null,"2017","33712","Household and institutional furniture manufacturing","7","103","4133","31",
"0400000US31","Nebraska",null,"2017","337122","Nonupholstered wood household furniture manufacturing","3","0","0","31",
"0400000US31","Nebraska",null,"2017","337127","Institutional furniture manufacturing","4","94","3879","31",
"0400000US31","Nebraska",null,"2017","3372","Office furniture (including fixtures) manufacturing","20","1113","51565","31",
"0400000US31","Nebraska",null,"2017","423130","Tire and tube merchant wholesalers","19","325","13125","31",
"0400000US31","Nebraska",null,"2017","42314","Motor vehicle parts (used) merchant wholesalers","11","301","12874","31",
"0400000US31","Nebraska",null,"2017","423140","Motor vehicle parts (used) merchant wholesalers","11","301","12874","31",
"0400000US31","Nebraska",null,"2017","4232","Furniture and home furnishing merchant wholesalers","51","298","16871","31",
"0400000US31","Nebraska",null,"2017","423510","Metal service centers and other metal merchant wholesalers","42","877","45288","31",
"0400000US31","Nebraska",null,"2017","212321","Construction sand and gravel mining","47","359","14816","31",
"0400000US31","Nebraska",null,"2017","23711","Water and sewer line and related structures construction","189","1547","78633","31",
"0400000US31","Nebraska",null,"2017","23819","Other foundation, structure, and building exterior contractors","35","157","6561","31",
"0400000US31","Nebraska",null,"2017","238190","Other foundation, structure, and building exterior contractors","35","157","6561","31",
"0400000US31","Nebraska",null,"2017","2382","Building equipment contractors","1584","16032","881733","31",
"0400000US31","Nebraska",null,"2017","238990","All other specialty trade contractors","290","1430","70337","31",
"0400000US31","Nebraska",null,"2017","31-33","Manufacturing","1758","96270","4662792","31",
"0400000US31","Nebraska",null,"2017","312120","Breweries","22","169","3911","31",
"0400000US31","Nebraska",null,"2017","31213","Wineries","14","70","1472","31",
"0400000US31","Nebraska",null,"2017","312130","Wineries","14","70","1472","31",
"0400000US31","Nebraska",null,"2017","31214","Distilleries","3","0","0","31",
"0400000US31","Nebraska",null,"2017","312140","Distilleries","3","0","0","31",
"0400000US31","Nebraska",null,"2017","313","Textile mills","9","176","3442","31",
"0400000US31","Nebraska",null,"2017","3132","Fabric mills","4","0","0","31",
"0400000US31","Nebraska",null,"2017","3133","Textile and fabric finishing and fabric coating mills","4","17","536","31",
"0400000US31","Nebraska",null,"2017","31331","Textile and fabric finishing mills","4","17","536","31",
"0400000US31","Nebraska",null,"2017","313310","Textile and fabric finishing mills","4","17","536","31",
"0400000US31","Nebraska",null,"2017","32512","Industrial gas manufacturing","3","0","0","31",
"0400000US31","Nebraska",null,"2017","325120","Industrial gas manufacturing","3","0","0","31",
"0400000US31","Nebraska",null,"2017","32518","Other basic inorganic chemical manufacturing","4","0","0","31",
"0400000US31","Nebraska",null,"2017","325180","Other basic inorganic chemical manufacturing","4","0","0","31",
"0400000US31","Nebraska",null,"2017","32519","Other basic organic chemical manufacturing","31","2250","134439","31",
"0400000US31","Nebraska",null,"2017","325193","Ethyl alcohol manufacturing","23","1522","91550","31",
"0400000US31","Nebraska",null,"2017","3321","Forging and stamping","8","178","8833","31",
"0400000US31","Nebraska",null,"2017","33211","Forging and stamping","8","178","8833","31",
"0400000US31","Nebraska",null,"2017","332114","Custom roll forming","5","123","6825","31",
"0400000US31","Nebraska",null,"2017","332119","Metal crown, closure, and other metal stamping (except automotive)","3","55","2008","31",
"0400000US31","Nebraska",null,"2017","3322","Cutlery and handtool manufacturing","4","0","0","31",
"0400000US31","Nebraska",null,"2017","33221","Cutlery and handtool manufacturing","4","0","0","31",
"0400000US31","Nebraska",null,"2017","332216","Saw blade and handtool manufacturing","4","0","0","31",
"0400000US31","Nebraska",null,"2017","3323","Architectural and structural metals manufacturing","73","3738","172990","31",
"0400000US31","Nebraska",null,"2017","3333","Commercial and service industry machinery manufacturing","6","34","1339","31",
"0400000US31","Nebraska",null,"2017","33331","Commercial and service industry machinery manufacturing","6","34","1339","31",
"0400000US31","Nebraska",null,"2017","333318","Other commercial and service industry machinery manufacturing","6","34","1339","31",
"0400000US31","Nebraska",null,"2017","3334","Ventilation, heating, air-conditioning, and commercial refrigeration equipment manufacturing","8","535","21435","31",
"0400000US31","Nebraska",null,"2017","33341","Ventilation, heating, air-conditioning, and commercial refrigeration equipment manufacturing","8","535","21435","31",
"0400000US31","Nebraska",null,"2017","333413","Industrial and commercial fan and blower and air purification equipment manufacturing","3","88","3740","31",
"0400000US31","Nebraska",null,"2017","333415","Air-conditioning and warm air heating equipment and commercial and industrial refrigeration equipment manufacturing","3","0","0","31",
"0400000US31","Nebraska",null,"2017","3335","Metalworking machinery manufacturing","19","442","22866","31",
"0400000US31","Nebraska",null,"2017","33721","Office furniture (including fixtures) manufacturing","20","1113","51565","31",
"0400000US31","Nebraska",null,"2017","337212","Custom architectural woodwork and millwork manufacturing","10","183","8374","31",
"0400000US31","Nebraska",null,"2017","337215","Showcase, partition, shelving, and locker manufacturing","8","923","42796","31",
"0400000US31","Nebraska",null,"2017","339","Miscellaneous manufacturing","139","5171","278676","31",
"0400000US31","Nebraska",null,"2017","42321","Furniture merchant wholesalers","20","136","7477","31",
"0400000US31","Nebraska",null,"2017","423210","Furniture merchant wholesalers","20","136","7477","31",
"0400000US31","Nebraska",null,"2017","42322","Home furnishing merchant wholesalers","31","162","9394","31",
"0400000US31","Nebraska",null,"2017","423220","Home furnishing merchant wholesalers","31","162","9394","31",
"0400000US31","Nebraska",null,"2017","4236","Household appliances and electrical and electronic goods merchant wholesalers","149","1586","95227","31",
"0400000US31","Nebraska",null,"2017","42361","Electrical apparatus and equipment, wiring supplies, and related equipment merchant wholesalers","95","1047","58644","31",
"0400000US31","Nebraska",null,"2017","213","Support activities for mining","35","144","8088","31",
"0400000US31","Nebraska",null,"2017","2131","Support activities for mining","35","144","8088","31",
"0400000US31","Nebraska",null,"2017","21311","Support activities for mining","35","144","8088","31",
"0400000US31","Nebraska",null,"2017","213111","Drilling oil and gas wells","6","18","961","31",
"0400000US31","Nebraska",null,"2017","237110","Water and sewer line and related structures construction","189","1547","78633","31",
"0400000US31","Nebraska",null,"2017","23712","Oil and gas pipeline and related structures construction","6","27","2160","31",
"0400000US31","Nebraska",null,"2017","237120","Oil and gas pipeline and related structures construction","6","27","2160","31",
"0400000US31","Nebraska",null,"2017","23821","Electrical contractors and other wiring installation contractors","678","6927","377180","31",
"0400000US31","Nebraska",null,"2017","311","Food manufacturing","283","36240","1599435","31",
"0400000US31","Nebraska",null,"2017","314","Textile product mills","38","232","7801","31",
"0400000US31","Nebraska",null,"2017","3141","Textile furnishings mills","8","46","1646","31",
"0400000US31","Nebraska",null,"2017","31412","Curtain and linen mills","8","46","1646","31",
"0400000US31","Nebraska",null,"2017","314120","Curtain and linen mills","8","46","1646","31",
"0400000US31","Nebraska",null,"2017","3149","Other textile product mills","30","186","6155","31",
"0400000US31","Nebraska",null,"2017","325199","All other basic organic chemical manufacturing","8","728","42889","31",
"0400000US31","Nebraska",null,"2017","3252","Resin, synthetic rubber, and artificial synthetic fibers and filaments manufacturing","4","98","4272","31",
"0400000US31","Nebraska",null,"2017","32521","Resin and synthetic rubber manufacturing","4","98","4272","31",
"0400000US31","Nebraska",null,"2017","325211","Plastics material and resin manufacturing","4","98","4272","31",
"0400000US31","Nebraska",null,"2017","3253","Pesticide, fertilizer, and other agricultural chemical manufacturing","9","270","28371","31",
"0400000US31","Nebraska",null,"2017","32531","Fertilizer manufacturing","6","146","13199","31",
"0400000US31","Nebraska",null,"2017","325314","Fertilizer (mixing only) manufacturing","3","10","424","31",
"0400000US31","Nebraska",null,"2017","32532","Pesticide and other agricultural chemical manufacturing","3","0","0","31",
"0400000US31","Nebraska",null,"2017","325320","Pesticide and other agricultural chemical manufacturing","3","0","0","31",
"0400000US31","Nebraska",null,"2017","3254","Pharmaceutical and medicine manufacturing","22","2131","170131","31",
