"0400000US25","Massachusetts",null,"2014","424310","Piece goods, notions, and other dry goods merchant wholesalers","42","675","40289","25",
"0400000US25","Massachusetts",null,"2014","42432","Men's and boys' clothing and furnishings merchant wholesalers","70","1374","87459","25",
"0400000US25","Massachusetts",null,"2014","424320","Men's and boys' clothing and furnishings merchant wholesalers","70","1374","87459","25",
"0400000US25","Massachusetts",null,"2014","42433","Women's, children's, and infants' clothing and accessories merchant wholesalers","81","581","29096","25",
"0400000US25","Massachusetts",null,"2014","424330","Women's, children's, and infants' clothing and accessories merchant wholesalers","81","581","29096","25",
"0400000US25","Massachusetts",null,"2014","42434","Footwear merchant wholesalers","47","3508","387492","25",
"0400000US25","Massachusetts",null,"2014","424340","Footwear merchant wholesalers","47","3508","387492","25",
"0400000US25","Massachusetts",null,"2014","4244","Grocery and related product merchant wholesalers","797","18636","1085759","25",
"0400000US25","Massachusetts",null,"2014","42441","General line grocery merchant wholesalers","52","2329","147168","25",
"0400000US25","Massachusetts",null,"2014","424410","General line grocery merchant wholesalers","52","2329","147168","25",
"0400000US25","Massachusetts",null,"2014","42442","Packaged frozen food merchant wholesalers","95","2555","143066","25",
"0400000US25","Massachusetts",null,"2014","424420","Packaged frozen food merchant wholesalers","95","2555","143066","25",
"0400000US25","Massachusetts",null,"2014","42443","Dairy product (except dried or canned) merchant wholesalers","38","1730","122604","25",
"0400000US25","Massachusetts",null,"2014","424430","Dairy product (except dried or canned) merchant wholesalers","38","1730","122604","25",
"0400000US25","Massachusetts",null,"2014","42444","Poultry and poultry product merchant wholesalers","16","143","10712","25",
"0400000US25","Massachusetts",null,"2014","424440","Poultry and poultry product merchant wholesalers","16","143","10712","25",
"0400000US25","Massachusetts",null,"2014","42445","Confectionery merchant wholesalers","56","495","23645","25",
"0400000US25","Massachusetts",null,"2014","424450","Confectionery merchant wholesalers","56","495","23645","25",
"0400000US25","Massachusetts",null,"2014","42446","Fish and seafood merchant wholesalers","130","1859","101512","25",
"0400000US25","Massachusetts",null,"2014","424460","Fish and seafood merchant wholesalers","130","1859","101512","25",
"0400000US25","Massachusetts",null,"2014","42447","Meat and meat product merchant wholesalers","52","747","41082","25",
"0400000US25","Massachusetts",null,"2014","424470","Meat and meat product merchant wholesalers","52","747","41082","25",
"0400000US25","Massachusetts",null,"2014","42448","Fresh fruit and vegetable merchant wholesalers","120","2086","134188","25",
"0400000US25","Massachusetts",null,"2014","424480","Fresh fruit and vegetable merchant wholesalers","120","2086","134188","25",
"0400000US25","Massachusetts",null,"2014","42449","Other grocery and related products merchant wholesalers","238","6692","361782","25",
"0400000US25","Massachusetts",null,"2014","424490","Other grocery and related products merchant wholesalers","238","6692","361782","25",
"0400000US25","Massachusetts",null,"2014","4245","Farm product raw material merchant wholesalers","12","88","4782","25",
"0400000US25","Massachusetts",null,"2014","42451","Grain and field bean merchant wholesalers","1","0","0","25",
"0400000US25","Massachusetts",null,"2014","448110","Men's clothing stores","179","1570","43813","25",
"0400000US25","Massachusetts",null,"2014","42452","Livestock merchant wholesalers","3","0","0","25",
"0400000US25","Massachusetts",null,"2014","424520","Livestock merchant wholesalers","3","0","0","25",
"0400000US25","Massachusetts",null,"2014","42459","Other farm product raw material merchant wholesalers","8","0","3950","25",
"0400000US25","Massachusetts",null,"2014","424590","Other farm product raw material merchant wholesalers","8","0","3950","25",
"0400000US25","Massachusetts",null,"2014","4246","Chemical and allied products merchant wholesalers","218","2310","175567","25",
"0400000US25","Massachusetts",null,"2014","42461","Plastics materials and basic forms and shapes merchant wholesalers","80","728","53886","25",
"0400000US25","Massachusetts",null,"2014","424610","Plastics materials and basic forms and shapes merchant wholesalers","80","728","53886","25",
"0400000US25","Massachusetts",null,"2014","42469","Other chemical and allied products merchant wholesalers","138","1582","121681","25",
"0400000US25","Massachusetts",null,"2014","424690","Other chemical and allied products merchant wholesalers","138","1582","121681","25",
"0400000US25","Massachusetts",null,"2014","4247","Petroleum and petroleum products merchant wholesalers","80","1645","151045","25",
"0400000US25","Massachusetts",null,"2014","42471","Petroleum bulk stations and terminals","43","1054","97448","25",
"0400000US25","Massachusetts",null,"2014","424710","Petroleum bulk stations and terminals","43","1054","97448","25",
"0400000US25","Massachusetts",null,"2014","42472","Petroleum and petroleum products merchant wholesalers (except bulk stations and terminals)","37","591","53597","25",
"0400000US25","Massachusetts",null,"2014","424720","Petroleum and petroleum products merchant wholesalers (except bulk stations and terminals)","37","591","53597","25",
"0400000US25","Massachusetts",null,"2014","4248","Beer, wine, and distilled alcoholic beverage merchant wholesalers","109","4160","302057","25",
"0400000US25","Massachusetts",null,"2014","42481","Beer and ale merchant wholesalers","31","1923","114967","25",
"0400000US25","Massachusetts",null,"2014","424810","Beer and ale merchant wholesalers","31","1923","114967","25",
"0400000US25","Massachusetts",null,"2014","42482","Wine and distilled alcoholic beverage merchant wholesalers","78","2237","187090","25",
"0400000US25","Massachusetts",null,"2014","424820","Wine and distilled alcoholic beverage merchant wholesalers","78","2237","187090","25",
"0400000US25","Massachusetts",null,"2014","4249","Miscellaneous nondurable goods merchant wholesalers","402","5924","314166","25",
"0400000US25","Massachusetts",null,"2014","42491","Farm supplies merchant wholesalers","54","469","32498","25",
"0400000US25","Massachusetts",null,"2014","424910","Farm supplies merchant wholesalers","54","469","32498","25",
"0400000US25","Massachusetts",null,"2014","42492","Book, periodical, and newspaper merchant wholesalers","65","1140","67089","25",
"0400000US25","Massachusetts",null,"2014","424920","Book, periodical, and newspaper merchant wholesalers","65","1140","67089","25",
"0400000US25","Massachusetts",null,"2014","42493","Flower, nursery stock, and florists' supplies merchant wholesalers","53","1104","47080","25",
"0400000US25","Massachusetts",null,"2014","424930","Flower, nursery stock, and florists' supplies merchant wholesalers","53","1104","47080","25",
"0400000US25","Massachusetts",null,"2014","42494","Tobacco and tobacco product merchant wholesalers","23","1275","63280","25",
"0400000US25","Massachusetts",null,"2014","424940","Tobacco and tobacco product merchant wholesalers","23","1275","63280","25",
"0400000US25","Massachusetts",null,"2014","42495","Paint, varnish, and supplies merchant wholesalers","41","521","30200","25",
"0400000US25","Massachusetts",null,"2014","424950","Paint, varnish, and supplies merchant wholesalers","41","521","30200","25",
"0400000US25","Massachusetts",null,"2014","42499","Other miscellaneous nondurable goods merchant wholesalers","166","1415","74019","25",
"0400000US25","Massachusetts",null,"2014","424990","Other miscellaneous nondurable goods merchant wholesalers","166","1415","74019","25",
"0400000US25","Massachusetts",null,"2014","425","Wholesale electronic markets and agents and brokers","1068","9676","699644","25",
"0400000US25","Massachusetts",null,"2014","4251","Wholesale electronic markets and agents and brokers","1068","9676","699644","25",
"0400000US25","Massachusetts",null,"2014","42511","Business to business electronic markets","9","0","1806","25",
"0400000US25","Massachusetts",null,"2014","425110","Business to business electronic markets","9","0","1806","25",
"0400000US25","Massachusetts",null,"2014","42512","Wholesale trade agents and brokers","1059","9652","697838","25",
"0400000US25","Massachusetts",null,"2014","425120","Wholesale trade agents and brokers","1059","9652","697838","25",
"0400000US25","Massachusetts",null,"2014","44-45","Retail trade","24136","359700","10151693","25",
"0400000US25","Massachusetts",null,"2014","441","Motor vehicle and parts dealers","2089","34402","1694239","25",
"0400000US25","Massachusetts",null,"2014","4411","Automobile dealers","977","24122","1346021","25",
"0400000US25","Massachusetts",null,"2014","44111","New car dealers","451","21830","1247682","25",
"0400000US25","Massachusetts",null,"2014","441110","New car dealers","451","21830","1247682","25",
"0400000US25","Massachusetts",null,"2014","44112","Used car dealers","526","2292","98339","25",
"0400000US25","Massachusetts",null,"2014","441120","Used car dealers","526","2292","98339","25",
"0400000US25","Massachusetts",null,"2014","4412","Other motor vehicle dealers","230","1688","78278","25",
"0400000US25","Massachusetts",null,"2014","44121","Recreational vehicle dealers","32","344","14768","25",
"0400000US25","Massachusetts",null,"2014","441210","Recreational vehicle dealers","32","344","14768","25",
"0400000US25","Massachusetts",null,"2014","44122","Motorcycle, boat, and other motor vehicle dealers","198","1344","63510","25",
"0400000US25","Massachusetts",null,"2014","441222","Boat dealers","112","720","39563","25",
"0400000US25","Massachusetts",null,"2014","441228","Motorcycle, ATV, and all other motor vehicle dealers","86","624","23947","25",
"0400000US25","Massachusetts",null,"2014","4413","Automotive parts, accessories, and tire stores","882","8592","269940","25",
"0400000US25","Massachusetts",null,"2014","44131","Automotive parts and accessories stores","583","5617","159704","25",
"0400000US25","Massachusetts",null,"2014","441310","Automotive parts and accessories stores","583","5617","159704","25",
"0400000US25","Massachusetts",null,"2014","44132","Tire dealers","299","2975","110236","25",
"0400000US25","Massachusetts",null,"2014","441320","Tire dealers","299","2975","110236","25",
"0400000US25","Massachusetts",null,"2014","442","Furniture and home furnishings stores","1115","10428","320497","25",
"0400000US25","Massachusetts",null,"2014","4421","Furniture stores","436","3891","158153","25",
"0400000US25","Massachusetts",null,"2014","44211","Furniture stores","436","3891","158153","25",
"0400000US25","Massachusetts",null,"2014","442110","Furniture stores","436","3891","158153","25",
"0400000US25","Massachusetts",null,"2014","4422","Home furnishings stores","679","6537","162344","25",
"0400000US25","Massachusetts",null,"2014","44221","Floor covering stores","211","998","45581","25",
"0400000US25","Massachusetts",null,"2014","442210","Floor covering stores","211","998","45581","25",
"0400000US25","Massachusetts",null,"2014","44229","Other home furnishings stores","468","5539","116763","25",
"0400000US25","Massachusetts",null,"2014","442291","Window treatment stores","70","339","8440","25",
"0400000US25","Massachusetts",null,"2014","442299","All other home furnishings stores","398","5200","108323","25",
"0400000US25","Massachusetts",null,"2014","443","Electronics and appliance stores","925","8865","284660","25",
"0400000US25","Massachusetts",null,"2014","4431","Electronics and appliance stores","925","8865","284660","25",
"0400000US25","Massachusetts",null,"2014","44314","Electronics and appliance stores","925","8865","284660","25",
"0400000US25","Massachusetts",null,"2014","443141","Household appliance stores","164","1286","56571","25",
"0400000US25","Massachusetts",null,"2014","443142","Electronics stores","761","7579","228089","25",
"0400000US25","Massachusetts",null,"2014","444","Building material and garden equipment and supplies dealers","1699","27868","1020206","25",
"0400000US25","Massachusetts",null,"2014","4441","Building material and supplies dealers","1369","25728","933020","25",
"0400000US25","Massachusetts",null,"2014","44411","Home centers","113","0","0","25",
"0400000US25","Massachusetts",null,"2014","444110","Home centers","113","0","0","25",
"0400000US25","Massachusetts",null,"2014","44412","Paint and wallpaper stores","151","816","31657","25",
"0400000US25","Massachusetts",null,"2014","444120","Paint and wallpaper stores","151","816","31657","25",
"0400000US25","Massachusetts",null,"2014","44413","Hardware stores","302","2910","77278","25",
"0400000US25","Massachusetts",null,"2014","444130","Hardware stores","302","2910","77278","25",
"0400000US25","Massachusetts",null,"2014","44419","Other building material dealers","803","8082","446595","25",
"0400000US25","Massachusetts",null,"2014","444190","Other building material dealers","803","8082","446595","25",
"0400000US25","Massachusetts",null,"2014","4442","Lawn and garden equipment and supplies stores","330","2140","87186","25",
"0400000US25","Massachusetts",null,"2014","44421","Outdoor power equipment stores","79","485","18206","25",
"0400000US25","Massachusetts",null,"2014","444210","Outdoor power equipment stores","79","485","18206","25",
"0400000US25","Massachusetts",null,"2014","44422","Nursery, garden center, and farm supply stores","251","1655","68980","25",
"0400000US25","Massachusetts",null,"2014","444220","Nursery, garden center, and farm supply stores","251","1655","68980","25",
"0400000US25","Massachusetts",null,"2014","445","Food and beverage stores","4914","103103","2280307","25",
"0400000US25","Massachusetts",null,"2014","4451","Grocery stores","2918","89768","1967673","25",
"0400000US25","Massachusetts",null,"2014","44511","Supermarkets and other grocery (except convenience) stores","1415","83788","1863645","25",
"0400000US25","Massachusetts",null,"2014","445110","Supermarkets and other grocery (except convenience) stores","1415","83788","1863645","25",
"0400000US25","Massachusetts",null,"2014","44512","Convenience stores","1503","5980","104028","25",
"0400000US25","Massachusetts",null,"2014","445120","Convenience stores","1503","5980","104028","25",
"0400000US25","Massachusetts",null,"2014","4452","Specialty food stores","614","4605","106621","25",
"0400000US25","Massachusetts",null,"2014","44521","Meat markets","109","1067","26979","25",
"0400000US25","Massachusetts",null,"2014","445210","Meat markets","109","1067","26979","25",
"0400000US25","Massachusetts",null,"2014","44522","Fish and seafood markets","114","647","19516","25",
"0400000US25","Massachusetts",null,"2014","445220","Fish and seafood markets","114","647","19516","25",
"0400000US25","Massachusetts",null,"2014","44523","Fruit and vegetable markets","63","925","26282","25",
"0400000US25","Massachusetts",null,"2014","445230","Fruit and vegetable markets","63","925","26282","25",
"0400000US25","Massachusetts",null,"2014","44529","Other specialty food stores","328","1966","33844","25",
"0400000US25","Massachusetts",null,"2014","445291","Baked goods stores","99","485","7084","25",
"0400000US25","Massachusetts",null,"2014","445292","Confectionery and nut stores","91","657","8740","25",
"0400000US25","Massachusetts",null,"2014","445299","All other specialty food stores","138","824","18020","25",
"0400000US25","Massachusetts",null,"2014","4453","Beer, wine, and liquor stores","1382","8730","206013","25",
"0400000US25","Massachusetts",null,"2014","44531","Beer, wine, and liquor stores","1382","8730","206013","25",
"0400000US25","Massachusetts",null,"2014","445310","Beer, wine, and liquor stores","1382","8730","206013","25",
"0400000US25","Massachusetts",null,"2014","446","Health and personal care stores","1859","25916","871262","25",
"0400000US25","Massachusetts",null,"2014","4461","Health and personal care stores","1859","25916","871262","25",
"0400000US25","Massachusetts",null,"2014","44611","Pharmacies and drug stores","879","19720","698403","25",
"0400000US25","Massachusetts",null,"2014","446110","Pharmacies and drug stores","879","19720","698403","25",
"0400000US25","Massachusetts",null,"2014","44612","Cosmetics, beauty supplies, and perfume stores","305","2699","51480","25",
"0400000US25","Massachusetts",null,"2014","446120","Cosmetics, beauty supplies, and perfume stores","305","2699","51480","25",
"0400000US25","Massachusetts",null,"2014","44613","Optical goods stores","333","1773","59258","25",
"0400000US25","Massachusetts",null,"2014","446130","Optical goods stores","333","1773","59258","25",
"0400000US25","Massachusetts",null,"2014","44619","Other health and personal care stores","342","1724","62121","25",
"0400000US25","Massachusetts",null,"2014","446191","Food (health) supplement stores","170","672","15681","25",
"0400000US25","Massachusetts",null,"2014","446199","All other health and personal care stores","172","1052","46440","25",
"0400000US25","Massachusetts",null,"2014","447","Gasoline stations","1988","13010","280330","25",
"0400000US25","Massachusetts",null,"2014","4471","Gasoline stations","1988","13010","280330","25",
"0400000US25","Massachusetts",null,"2014","44711","Gasoline stations with convenience stores","1291","9151","178580","25",
"0400000US25","Massachusetts",null,"2014","447110","Gasoline stations with convenience stores","1291","9151","178580","25",
"0400000US25","Massachusetts",null,"2014","44719","Other gasoline stations","697","3859","101750","25",
"0400000US25","Massachusetts",null,"2014","447190","Other gasoline stations","697","3859","101750","25",
"0400000US25","Massachusetts",null,"2014","448","Clothing and clothing accessories stores","3586","46225","885009","25",
"0400000US25","Massachusetts",null,"2014","4481","Clothing stores","2403","38139","677250","25",
"0400000US25","Massachusetts",null,"2014","44811","Men's clothing stores","179","1570","43813","25",
"0400000US25","Massachusetts",null,"2014","4854","School and employee bus transportation","153","9941","250365","25",
"0400000US25","Massachusetts",null,"2014","44812","Women's clothing stores","864","9254","170765","25",
"0400000US25","Massachusetts",null,"2014","448120","Women's clothing stores","864","9254","170765","25",
"0400000US25","Massachusetts",null,"2014","44813","Children's and infants' clothing stores","203","2548","33042","25",
"0400000US25","Massachusetts",null,"2014","448130","Children's and infants' clothing stores","203","2548","33042","25",
"0400000US25","Massachusetts",null,"2014","44814","Family clothing stores","695","20712","350664","25",
"0400000US25","Massachusetts",null,"2014","448140","Family clothing stores","695","20712","350664","25",
"0400000US25","Massachusetts",null,"2014","44815","Clothing accessories stores","199","1290","25226","25",
"0400000US25","Massachusetts",null,"2014","448150","Clothing accessories stores","199","1290","25226","25",
"0400000US25","Massachusetts",null,"2014","44819","Other clothing stores","263","2765","53740","25",
"0400000US25","Massachusetts",null,"2014","448190","Other clothing stores","263","2765","53740","25",
"0400000US25","Massachusetts",null,"2014","4482","Shoe stores","539","4667","97995","25",
"0400000US25","Massachusetts",null,"2014","44821","Shoe stores","539","4667","97995","25",
"0400000US25","Massachusetts",null,"2014","448210","Shoe stores","539","4667","97995","25",
"0400000US25","Massachusetts",null,"2014","4483","Jewelry, luggage, and leather goods stores","644","3419","109764","25",
"0400000US25","Massachusetts",null,"2014","44831","Jewelry stores","617","3280","104787","25",
"0400000US25","Massachusetts",null,"2014","448310","Jewelry stores","617","3280","104787","25",
"0400000US25","Massachusetts",null,"2014","44832","Luggage and leather goods stores","27","0","4977","25",
"0400000US25","Massachusetts",null,"2014","448320","Luggage and leather goods stores","27","0","4977","25",
"0400000US25","Massachusetts",null,"2014","451","Sporting goods, hobby, musical instrument, and book stores","1218","13779","250544","25",
"0400000US25","Massachusetts",null,"2014","4511","Sporting goods, hobby, and musical instrument stores","956","10686","196129","25",
"0400000US25","Massachusetts",null,"2014","45111","Sporting goods stores","558","5669","117813","25",
"0400000US25","Massachusetts",null,"2014","451110","Sporting goods stores","558","5669","117813","25",
"0400000US25","Massachusetts",null,"2014","45112","Hobby, toy, and game stores","217","3502","47731","25",
"0400000US25","Massachusetts",null,"2014","451120","Hobby, toy, and game stores","217","3502","47731","25",
"0400000US25","Massachusetts",null,"2014","45113","Sewing, needlework, and piece goods stores","106","976","15678","25",
"0400000US25","Massachusetts",null,"2014","451130","Sewing, needlework, and piece goods stores","106","976","15678","25",
"0400000US25","Massachusetts",null,"2014","45114","Musical instrument and supplies stores","75","539","14907","25",
"0400000US25","Massachusetts",null,"2014","451140","Musical instrument and supplies stores","75","539","14907","25",
"0400000US25","Massachusetts",null,"2014","4512","Book stores and news dealers","262","3093","54415","25",
"0400000US25","Massachusetts",null,"2014","45121","Book stores and news dealers","262","3093","54415","25",
"0400000US25","Massachusetts",null,"2014","451211","Book stores","226","0","45472","25",
"0400000US25","Massachusetts",null,"2014","451212","News dealers and newsstands","36","339","8943","25",
"0400000US25","Massachusetts",null,"2014","452","General merchandise stores","736","42486","949827","25",
"0400000US25","Massachusetts",null,"2014","4521","Department stores","171","27642","606582","25",
"0400000US25","Massachusetts",null,"2014","45211","Department stores","171","27642","606582","25",
"0400000US25","Massachusetts",null,"2014","452111","Department stores (except discount department stores)","54","8196","185285","25",
"0400000US25","Massachusetts",null,"2014","452112","Discount department stores","117","19446","421297","25",
"0400000US25","Massachusetts",null,"2014","4529","Other general merchandise stores","565","14844","343245","25",
"0400000US25","Massachusetts",null,"2014","45291","Warehouse clubs and supercenters","46","9163","239960","25",
"0400000US25","Massachusetts",null,"2014","452910","Warehouse clubs and supercenters","46","9163","239960","25",
"0400000US25","Massachusetts",null,"2014","45299","All other general merchandise stores","519","5681","103285","25",
"0400000US25","Massachusetts",null,"2014","452990","All other general merchandise stores","519","5681","103285","25",
"0400000US25","Massachusetts",null,"2014","453","Miscellaneous store retailers","2385","16908","357551","25",
"0400000US25","Massachusetts",null,"2014","4531","Florists","353","1420","31556","25",
"0400000US25","Massachusetts",null,"2014","45311","Florists","353","1420","31556","25",
"0400000US25","Massachusetts",null,"2014","453110","Florists","353","1420","31556","25",
"0400000US25","Massachusetts",null,"2014","4532","Office supplies, stationery, and gift stores","759","7035","122494","25",
"0400000US25","Massachusetts",null,"2014","45321","Office supplies and stationery stores","131","2560","51431","25",
"0400000US25","Massachusetts",null,"2014","453210","Office supplies and stationery stores","131","2560","51431","25",
"0400000US25","Massachusetts",null,"2014","45322","Gift, novelty, and souvenir stores","628","4475","71063","25",
"0400000US25","Massachusetts",null,"2014","453220","Gift, novelty, and souvenir stores","628","4475","71063","25",
"0400000US25","Massachusetts",null,"2014","4533","Used merchandise stores","367","2873","58075","25",
"0400000US25","Massachusetts",null,"2014","45331","Used merchandise stores","367","2873","58075","25",
"0400000US25","Massachusetts",null,"2014","453310","Used merchandise stores","367","2873","58075","25",
"0400000US25","Massachusetts",null,"2014","4539","Other miscellaneous store retailers","906","5580","145426","25",
"0400000US25","Massachusetts",null,"2014","45391","Pet and pet supplies stores","219","2739","57153","25",
"0400000US25","Massachusetts",null,"2014","453910","Pet and pet supplies stores","219","2739","57153","25",
"0400000US25","Massachusetts",null,"2014","45392","Art dealers","160","414","15497","25",
"0400000US25","Massachusetts",null,"2014","453920","Art dealers","160","414","15497","25",
"0400000US25","Massachusetts",null,"2014","45393","Manufactured (mobile) home dealers","1","0","0","25",
"0400000US25","Massachusetts",null,"2014","453930","Manufactured (mobile) home dealers","1","0","0","25",
"0400000US25","Massachusetts",null,"2014","45399","All other miscellaneous store retailers","526","2423","72672","25",
"0400000US25","Massachusetts",null,"2014","453991","Tobacco stores","203","784","14482","25",
"0400000US25","Massachusetts",null,"2014","453998","All other miscellaneous store retailers (except tobacco stores)","323","1639","58190","25",
"0400000US25","Massachusetts",null,"2014","454","Nonstore retailers","1622","16710","957261","25",
"0400000US25","Massachusetts",null,"2014","4541","Electronic shopping and mail-order houses","655","9222","587320","25",
"0400000US25","Massachusetts",null,"2014","45411","Electronic shopping and mail-order houses","655","9222","587320","25",
"0400000US25","Massachusetts",null,"2014","454111","Electronic shopping","510","5708","395408","25",
"0400000US25","Massachusetts",null,"2014","454112","Electronic auctions","6","0","0","25",
"0400000US25","Massachusetts",null,"2014","454113","Mail-order houses","139","3460","188032","25",
"0400000US25","Massachusetts",null,"2014","4542","Vending machine operators","72","371","13591","25",
"0400000US25","Massachusetts",null,"2014","45421","Vending machine operators","72","371","13591","25",
