"0400000US15","Hawaii",null,"2016","522220","Sales financing","4","17","1127","15",
"0400000US15","Hawaii",null,"2016","52229","Other nondepository credit intermediation","105","547","51159","15",
"0400000US15","Hawaii",null,"2016","522291","Consumer lending","7","38","2668","15",
"0400000US15","Hawaii",null,"2016","522292","Real estate credit","79","440","45503","15",
"0400000US15","Hawaii",null,"2016","522293","International trade financing","1","0","0","15",
"0400000US15","Hawaii",null,"2016","522298","All other nondepository credit intermediation","18","67","2856","15",
"0400000US15","Hawaii",null,"2016","5223","Activities related to credit intermediation","110","406","22222","15",
"0400000US15","Hawaii",null,"2016","52231","Mortgage and nonmortgage loan brokers","43","146","13338","15",
"0400000US15","Hawaii",null,"2016","522310","Mortgage and nonmortgage loan brokers","43","146","13338","15",
"0400000US15","Hawaii",null,"2016","52232","Financial transactions processing, reserve, and clearinghouse activities","9","50","3352","15",
"0400000US15","Hawaii",null,"2016","522320","Financial transactions processing, reserve, and clearinghouse activities","9","50","3352","15",
"0400000US15","Hawaii",null,"2016","52239","Other activities related to credit intermediation","58","210","5532","15",
"0400000US15","Hawaii",null,"2016","522390","Other activities related to credit intermediation","58","210","5532","15",
"0400000US15","Hawaii",null,"2016","523","Securities, commodity contracts, and other financial investments and related activities","240","978","113417","15",
"0400000US15","Hawaii",null,"2016","5231","Securities and commodity contracts intermediation and brokerage","102","560","75816","15",
"0400000US15","Hawaii",null,"2016","52311","Investment banking and securities dealing","2","0","0","15",
"0400000US15","Hawaii",null,"2016","523110","Investment banking and securities dealing","2","0","0","15",
"0400000US15","Hawaii",null,"2016","52312","Securities brokerage","93","535","74692","15",
"0400000US15","Hawaii",null,"2016","523120","Securities brokerage","93","535","74692","15",
"0400000US15","Hawaii",null,"2016","52313","Commodity contracts dealing","5","15","262","15",
"0400000US15","Hawaii",null,"2016","523130","Commodity contracts dealing","5","15","262","15",
"0400000US15","Hawaii",null,"2016","52314","Commodity contracts brokerage","2","0","0","15",
"0400000US15","Hawaii",null,"2016","523140","Commodity contracts brokerage","2","0","0","15",
"0400000US15","Hawaii",null,"2016","5239","Other financial investment activities","138","418","37601","15",
"0400000US15","Hawaii",null,"2016","52391","Miscellaneous intermediation","22","64","5182","15",
"0400000US15","Hawaii",null,"2016","523910","Miscellaneous intermediation","22","64","5182","15",
"0400000US15","Hawaii",null,"2016","52392","Portfolio management","52","218","20900","15",
"0400000US15","Hawaii",null,"2016","523920","Portfolio management","52","218","20900","15",
"0400000US15","Hawaii",null,"2016","52393","Investment advice","62","116","9949","15",
"0400000US15","Hawaii",null,"2016","523930","Investment advice","62","116","9949","15",
"0400000US15","Hawaii",null,"2016","52399","All other financial investment activities","2","0","0","15",
"0400000US15","Hawaii",null,"2016","523991","Trust, fiduciary, and custody activities","2","0","0","15",
"0400000US15","Hawaii",null,"2016","524","Insurance carriers and related activities","540","8299","541331","15",
"0400000US15","Hawaii",null,"2016","5241","Insurance carriers","145","5578","365522","15",
"0400000US15","Hawaii",null,"2016","52411","Direct life, health, and medical insurance carriers","72","4183","258155","15",
"0400000US15","Hawaii",null,"2016","524113","Direct life insurance carriers","32","400","51864","15",
"0400000US15","Hawaii",null,"2016","524114","Direct health and medical insurance carriers","40","3783","206291","15",
"0400000US15","Hawaii",null,"2016","52412","Direct insurance (except life, health, and medical) carriers","72","1394","107282","15",
"0400000US15","Hawaii",null,"2016","524126","Direct property and casualty insurance carriers","33","1052","79957","15",
"0400000US15","Hawaii",null,"2016","524127","Direct title insurance carriers","38","320","26869","15",
"0400000US15","Hawaii",null,"2016","524128","Other direct insurance (except life, health, and medical) carriers","1","0","0","15",
"0400000US15","Hawaii",null,"2016","52413","Reinsurance carriers","1","0","0","15",
"0400000US15","Hawaii",null,"2016","524130","Reinsurance carriers","1","0","0","15",
"0400000US15","Hawaii",null,"2016","5242","Agencies, brokerages, and other insurance related activities","395","2721","175809","15",
"0400000US15","Hawaii",null,"2016","52421","Insurance agencies and brokerages","354","1960","124589","15",
"0400000US15","Hawaii",null,"2016","524210","Insurance agencies and brokerages","354","1960","124589","15",
"0400000US15","Hawaii",null,"2016","52429","Other insurance related activities","41","761","51220","15",
"0400000US15","Hawaii",null,"2016","524291","Claims adjusting","10","126","7265","15",
"0400000US15","Hawaii",null,"2016","524292","Third party administration of insurance and pension funds","25","580","40828","15",
"0400000US15","Hawaii",null,"2016","524298","All other insurance related activities","6","55","3127","15",
"0400000US15","Hawaii",null,"2016","525","Funds, trusts, and other financial vehicles","4","3","224","15",
"0400000US15","Hawaii",null,"2016","5259","Other investment pools and funds","4","3","224","15",
"0400000US15","Hawaii",null,"2016","52599","Other financial vehicles","4","3","224","15",
"0400000US15","Hawaii",null,"2016","525990","Other financial vehicles","4","3","224","15",
"0400000US15","Hawaii",null,"2016","53","Real estate and rental and leasing","1966","11945","595672","15",
"0400000US15","Hawaii",null,"2016","531","Real estate","1568","8108","441529","15",
"0400000US15","Hawaii",null,"2016","5311","Lessors of real estate","616","3097","157920","15",
"0400000US15","Hawaii",null,"2016","53111","Lessors of residential buildings and dwellings","277","1440","53938","15",
"0400000US15","Hawaii",null,"2016","531110","Lessors of residential buildings and dwellings","277","1440","53938","15",
"0400000US15","Hawaii",null,"2016","53112","Lessors of nonresidential buildings (except miniwarehouses)","253","1275","85674","15",
"0400000US15","Hawaii",null,"2016","531120","Lessors of nonresidential buildings (except miniwarehouses)","253","1275","85674","15",
"0400000US15","Hawaii",null,"2016","53113","Lessors of miniwarehouses and self-storage units","61","242","7489","15",
"0400000US15","Hawaii",null,"2016","531130","Lessors of miniwarehouses and self-storage units","61","242","7489","15",
"0400000US15","Hawaii",null,"2016","53119","Lessors of other real estate property","25","140","10819","15",
"0400000US15","Hawaii",null,"2016","531190","Lessors of other real estate property","25","140","10819","15",
"0400000US15","Hawaii",null,"2016","5312","Offices of real estate agents and brokers","501","1729","109684","15",
"0400000US15","Hawaii",null,"2016","53121","Offices of real estate agents and brokers","501","1729","109684","15",
"0400000US15","Hawaii",null,"2016","531210","Offices of real estate agents and brokers","501","1729","109684","15",
"0400000US15","Hawaii",null,"2016","5313","Activities related to real estate","451","3282","173925","15",
"0400000US15","Hawaii",null,"2016","53131","Real estate property managers","324","2884","148228","15",
"0400000US15","Hawaii",null,"2016","531311","Residential property managers","226","2207","109281","15",
"0400000US15","Hawaii",null,"2016","531312","Nonresidential property managers","98","677","38947","15",
"0400000US15","Hawaii",null,"2016","53132","Offices of real estate appraisers","62","127","7660","15",
"0400000US15","Hawaii",null,"2016","531320","Offices of real estate appraisers","62","127","7660","15",
"0400000US15","Hawaii",null,"2016","53139","Other activities related to real estate","65","271","18037","15",
"0400000US15","Hawaii",null,"2016","531390","Other activities related to real estate","65","271","18037","15",
"0400000US15","Hawaii",null,"2016","532","Rental and leasing services","393","3717","144055","15",
"0400000US15","Hawaii",null,"2016","5321","Automotive equipment rental and leasing","154","2190","85465","15",
"0400000US15","Hawaii",null,"2016","53211","Passenger car rental and leasing","142","2051","79227","15",
"0400000US15","Hawaii",null,"2016","532111","Passenger car rental","141","2036","78148","15",
"0400000US15","Hawaii",null,"2016","561110","Office administrative services","51","769","41217","15",
"0400000US15","Hawaii",null,"2016","53212","Truck, utility trailer, and RV (recreational vehicle) rental and leasing","12","139","6238","15",
"0400000US15","Hawaii",null,"2016","532120","Truck, utility trailer, and RV (recreational vehicle) rental and leasing","12","139","6238","15",
"0400000US15","Hawaii",null,"2016","5322","Consumer goods rental","144","1020","30253","15",
"0400000US15","Hawaii",null,"2016","53221","Consumer electronics and appliances rental","13","62","1900","15",
"0400000US15","Hawaii",null,"2016","532210","Consumer electronics and appliances rental","13","62","1900","15",
"0400000US15","Hawaii",null,"2016","53222","Formal wear and costume rental","7","86","1646","15",
"0400000US15","Hawaii",null,"2016","532220","Formal wear and costume rental","7","86","1646","15",
"0400000US15","Hawaii",null,"2016","53223","Video tape and disc rental","11","24","285","15",
"0400000US15","Hawaii",null,"2016","532230","Video tape and disc rental","11","24","285","15",
"0400000US15","Hawaii",null,"2016","53229","Other consumer goods rental","113","848","26422","15",
"0400000US15","Hawaii",null,"2016","532291","Home health equipment rental","9","135","6468","15",
"0400000US15","Hawaii",null,"2016","532292","Recreational goods rental","64","403","10957","15",
"0400000US15","Hawaii",null,"2016","532299","All other consumer goods rental","40","310","8997","15",
"0400000US15","Hawaii",null,"2016","5323","General rental centers","6","31","1834","15",
"0400000US15","Hawaii",null,"2016","53231","General rental centers","6","31","1834","15",
"0400000US15","Hawaii",null,"2016","532310","General rental centers","6","31","1834","15",
"0400000US15","Hawaii",null,"2016","5324","Commercial and industrial machinery and equipment rental and leasing","89","476","26503","15",
"0400000US15","Hawaii",null,"2016","53241","Construction, transportation, mining, and forestry machinery and equipment rental and leasing","15","44","2582","15",
"0400000US15","Hawaii",null,"2016","532411","Commercial air, rail, and water transportation equipment rental and leasing","4","4","340","15",
"0400000US15","Hawaii",null,"2016","532412","Construction, mining, and forestry machinery and equipment rental and leasing","11","40","2242","15",
"0400000US15","Hawaii",null,"2016","53242","Office machinery and equipment rental and leasing","4","0","0","15",
"0400000US15","Hawaii",null,"2016","532420","Office machinery and equipment rental and leasing","4","0","0","15",
"0400000US15","Hawaii",null,"2016","53249","Other commercial and industrial machinery and equipment rental and leasing","70","420","23643","15",
"0400000US15","Hawaii",null,"2016","532490","Other commercial and industrial machinery and equipment rental and leasing","70","420","23643","15",
"0400000US15","Hawaii",null,"2016","533","Lessors of nonfinancial intangible assets (except copyrighted works)","5","120","10088","15",
"0400000US15","Hawaii",null,"2016","5331","Lessors of nonfinancial intangible assets (except copyrighted works)","5","120","10088","15",
"0400000US15","Hawaii",null,"2016","53311","Lessors of nonfinancial intangible assets (except copyrighted works)","5","120","10088","15",
"0400000US15","Hawaii",null,"2016","533110","Lessors of nonfinancial intangible assets (except copyrighted works)","5","120","10088","15",
"0400000US15","Hawaii",null,"2016","54","Professional, scientific, and technical services","3341","22782","1522620","15",
"0400000US15","Hawaii",null,"2016","541","Professional, scientific, and technical services","3341","22782","1522620","15",
"0400000US15","Hawaii",null,"2016","5411","Legal services","636","3471","263806","15",
"0400000US15","Hawaii",null,"2016","54111","Offices of lawyers","623","3200","245157","15",
"0400000US15","Hawaii",null,"2016","541110","Offices of lawyers","623","3200","245157","15",
"0400000US15","Hawaii",null,"2016","54119","Other legal services","13","271","18649","15",
"0400000US15","Hawaii",null,"2016","541191","Title abstract and settlement offices","6","0","0","15",
"0400000US15","Hawaii",null,"2016","541199","All other legal services","7","23","893","15",
"0400000US15","Hawaii",null,"2016","5412","Accounting, tax preparation, bookkeeping, and payroll services","658","3264","140248","15",
"0400000US15","Hawaii",null,"2016","54121","Accounting, tax preparation, bookkeeping, and payroll services","658","3264","140248","15",
"0400000US15","Hawaii",null,"2016","541211","Offices of certified public accountants","302","1677","98934","15",
"0400000US15","Hawaii",null,"2016","541213","Tax preparation services","149","876","11661","15",
"0400000US15","Hawaii",null,"2016","541214","Payroll services","15","134","9831","15",
"0400000US15","Hawaii",null,"2016","541219","Other accounting services","192","577","19822","15",
"0400000US15","Hawaii",null,"2016","5413","Architectural, engineering, and related services","580","5223","427482","15",
"0400000US15","Hawaii",null,"2016","54131","Architectural services","153","1106","88725","15",
"0400000US15","Hawaii",null,"2016","541310","Architectural services","153","1106","88725","15",
"0400000US15","Hawaii",null,"2016","54132","Landscape architectural services","28","153","13459","15",
"0400000US15","Hawaii",null,"2016","541320","Landscape architectural services","28","153","13459","15",
"0400000US15","Hawaii",null,"2016","54133","Engineering services","312","3582","305683","15",
"0400000US15","Hawaii",null,"2016","541330","Engineering services","312","3582","305683","15",
"0400000US15","Hawaii",null,"2016","54134","Drafting services","17","20","1166","15",
"0400000US15","Hawaii",null,"2016","541340","Drafting services","17","20","1166","15",
"0400000US15","Hawaii",null,"2016","54135","Building inspection services","18","72","4184","15",
"0400000US15","Hawaii",null,"2016","541350","Building inspection services","18","72","4184","15",
"0400000US15","Hawaii",null,"2016","54136","Geophysical surveying and mapping services","2","0","0","15",
"0400000US15","Hawaii",null,"2016","541360","Geophysical surveying and mapping services","2","0","0","15",
"0400000US15","Hawaii",null,"2016","54137","Surveying and mapping (except geophysical) services","31","195","8315","15",
"0400000US15","Hawaii",null,"2016","541370","Surveying and mapping (except geophysical) services","31","195","8315","15",
"0400000US15","Hawaii",null,"2016","54138","Testing laboratories","19","88","5411","15",
"0400000US15","Hawaii",null,"2016","541380","Testing laboratories","19","88","5411","15",
"0400000US15","Hawaii",null,"2016","5414","Specialized design services","92","259","11861","15",
"0400000US15","Hawaii",null,"2016","54141","Interior design services","33","109","6000","15",
"0400000US15","Hawaii",null,"2016","541410","Interior design services","33","109","6000","15",
"0400000US15","Hawaii",null,"2016","54143","Graphic design services","53","137","5562","15",
"0400000US15","Hawaii",null,"2016","541430","Graphic design services","53","137","5562","15",
"0400000US15","Hawaii",null,"2016","54149","Other specialized design services","6","13","299","15",
"0400000US15","Hawaii",null,"2016","541490","Other specialized design services","6","13","299","15",
"0400000US15","Hawaii",null,"2016","5415","Computer systems design and related services","430","3818","300683","15",
"0400000US15","Hawaii",null,"2016","54151","Computer systems design and related services","430","3818","300683","15",
"0400000US15","Hawaii",null,"2016","541511","Custom computer programming services","156","1246","95719","15",
"0400000US15","Hawaii",null,"2016","541512","Computer systems design services","214","1611","144257","15",
"0400000US15","Hawaii",null,"2016","541513","Computer facilities management services","42","889","56241","15",
"0400000US15","Hawaii",null,"2016","541519","Other computer related services","18","72","4466","15",
"0400000US15","Hawaii",null,"2016","5416","Management, scientific, and technical consulting services","455","2186","148095","15",
"0400000US15","Hawaii",null,"2016","54161","Management consulting services","341","1593","112438","15",
"0400000US15","Hawaii",null,"2016","541611","Administrative management and general management consulting services","191","1020","87154","15",
"0400000US15","Hawaii",null,"2016","541612","Human resources consulting services","30","286","13960","15",
"0400000US15","Hawaii",null,"2016","541613","Marketing consulting services","98","209","7994","15",
"0400000US15","Hawaii",null,"2016","541614","Process, physical distribution, and logistics consulting services","18","68","2677","15",
"0400000US15","Hawaii",null,"2016","541618","Other management consulting services","4","0","0","15",
"0400000US15","Hawaii",null,"2016","54162","Environmental consulting services","56","324","20653","15",
"0400000US15","Hawaii",null,"2016","541620","Environmental consulting services","56","324","20653","15",
"0400000US15","Hawaii",null,"2016","54169","Other scientific and technical consulting services","58","269","15004","15",
"0400000US15","Hawaii",null,"2016","541690","Other scientific and technical consulting services","58","269","15004","15",
"0400000US15","Hawaii",null,"2016","5417","Scientific research and development services","97","1390","108005","15",
"0400000US15","Hawaii",null,"2016","54171","Research and development in the physical, engineering, and life sciences","84","1196","99284","15",
"0400000US15","Hawaii",null,"2016","541711","Research and development in biotechnology","13","325","23913","15",
"0400000US15","Hawaii",null,"2016","541712","Research and development in the physical, engineering, and life sciences (except biotechnology)","71","871","75371","15",
"0400000US15","Hawaii",null,"2016","54172","Research and development in the social sciences and humanities","13","194","8721","15",
"0400000US15","Hawaii",null,"2016","541720","Research and development in the social sciences and humanities","13","194","8721","15",
"0400000US15","Hawaii",null,"2016","5418","Advertising, public relations, and related services","109","979","36213","15",
"0400000US15","Hawaii",null,"2016","54181","Advertising agencies","33","219","11250","15",
"0400000US15","Hawaii",null,"2016","541810","Advertising agencies","33","219","11250","15",
"0400000US15","Hawaii",null,"2016","54182","Public relations agencies","24","262","14154","15",
"0400000US15","Hawaii",null,"2016","541820","Public relations agencies","24","262","14154","15",
"0400000US15","Hawaii",null,"2016","54183","Media buying agencies","1","0","0","15",
"0400000US15","Hawaii",null,"2016","541830","Media buying agencies","1","0","0","15",
"0400000US15","Hawaii",null,"2016","54184","Media representatives","8","18","954","15",
"0400000US15","Hawaii",null,"2016","541840","Media representatives","8","18","954","15",
"0400000US15","Hawaii",null,"2016","54185","Outdoor advertising","7","20","650","15",
"0400000US15","Hawaii",null,"2016","541850","Outdoor advertising","7","20","650","15",
"0400000US15","Hawaii",null,"2016","54186","Direct mail advertising","3","32","761","15",
"0400000US15","Hawaii",null,"2016","541860","Direct mail advertising","3","32","761","15",
"0400000US15","Hawaii",null,"2016","54189","Other services related to advertising","33","428","8411","15",
"0400000US15","Hawaii",null,"2016","541890","Other services related to advertising","33","428","8411","15",
"0400000US15","Hawaii",null,"2016","5419","Other professional, scientific, and technical services","284","2192","86227","15",
"0400000US15","Hawaii",null,"2016","54191","Marketing research and public opinion polling","14","237","4634","15",
"0400000US15","Hawaii",null,"2016","541910","Marketing research and public opinion polling","14","237","4634","15",
"0400000US15","Hawaii",null,"2016","54192","Photographic services","144","719","17348","15",
"0400000US15","Hawaii",null,"2016","541921","Photography studios, portrait","116","595","14757","15",
"0400000US15","Hawaii",null,"2016","541922","Commercial photography","28","124","2591","15",
"0400000US15","Hawaii",null,"2016","54193","Translation and interpretation services","8","29","1070","15",
"0400000US15","Hawaii",null,"2016","541930","Translation and interpretation services","8","29","1070","15",
"0400000US15","Hawaii",null,"2016","54194","Veterinary services","81","1067","53973","15",
"0400000US15","Hawaii",null,"2016","541940","Veterinary services","81","1067","53973","15",
"0400000US15","Hawaii",null,"2016","54199","All other professional, scientific, and technical services","37","140","9202","15",
"0400000US15","Hawaii",null,"2016","541990","All other professional, scientific, and technical services","37","140","9202","15",
"0400000US15","Hawaii",null,"2016","55","Management of companies and enterprises","266","6395","484316","15",
"0400000US15","Hawaii",null,"2016","551","Management of companies and enterprises","266","6395","484316","15",
"0400000US15","Hawaii",null,"2016","5511","Management of companies and enterprises","266","6395","484316","15",
"0400000US15","Hawaii",null,"2016","55111","Management of companies and enterprises","266","6395","484316","15",
"0400000US15","Hawaii",null,"2016","551112","Offices of other holding companies","27","187","22769","15",
"0400000US15","Hawaii",null,"2016","551114","Corporate, subsidiary, and regional managing offices","239","6208","461547","15",
"0400000US15","Hawaii",null,"2016","56","Administrative and support and waste management and remediation services","1846","55128","1955533","15",
"0400000US15","Hawaii",null,"2016","561","Administrative and support services","1732","53400","1862959","15",
"0400000US15","Hawaii",null,"2016","5611","Office administrative services","51","769","41217","15",
"0400000US15","Hawaii",null,"2016","56111","Office administrative services","51","769","41217","15",
"0400000US15","Hawaii",null,"2016","621320","Offices of optometrists","113","574","22748","15",
"0400000US15","Hawaii",null,"2016","5612","Facilities support services","30","796","33653","15",
"0400000US15","Hawaii",null,"2016","56121","Facilities support services","30","796","33653","15",
"0400000US15","Hawaii",null,"2016","561210","Facilities support services","30","796","33653","15",
"0400000US15","Hawaii",null,"2016","5613","Employment services","153","28820","1117757","15",
"0400000US15","Hawaii",null,"2016","56131","Employment placement agencies and executive search services","18","696","18055","15",
"0400000US15","Hawaii",null,"2016","561311","Employment placement agencies","12","682","17216","15",
"0400000US15","Hawaii",null,"2016","561312","Executive search services","6","14","839","15",
"0400000US15","Hawaii",null,"2016","56132","Temporary help services","89","13167","465765","15",
"0400000US15","Hawaii",null,"2016","561320","Temporary help services","89","13167","465765","15",
"0400000US15","Hawaii",null,"2016","56133","Professional employer organizations","46","14957","633937","15",
"0400000US15","Hawaii",null,"2016","561330","Professional employer organizations","46","14957","633937","15",
"0400000US15","Hawaii",null,"2016","5614","Business support services","106","778","26162","15",
"0400000US15","Hawaii",null,"2016","56141","Document preparation services","11","50","1380","15",
"0400000US15","Hawaii",null,"2016","561410","Document preparation services","11","50","1380","15",
"0400000US15","Hawaii",null,"2016","56142","Telephone call centers","10","295","9937","15",
"0400000US15","Hawaii",null,"2016","561421","Telephone answering services","5","50","1205","15",
"0400000US15","Hawaii",null,"2016","561422","Telemarketing bureaus and other contact centers","5","245","8732","15",
"0400000US15","Hawaii",null,"2016","56143","Business service centers","50","269","8429","15",
"0400000US15","Hawaii",null,"2016","561431","Private mail centers","24","110","2457","15",
"0400000US15","Hawaii",null,"2016","561439","Other business service centers (including copy shops)","26","159","5972","15",
"0400000US15","Hawaii",null,"2016","56144","Collection agencies","14","92","3212","15",
"0400000US15","Hawaii",null,"2016","561440","Collection agencies","14","92","3212","15",
"0400000US15","Hawaii",null,"2016","56149","Other business support services","21","72","3204","15",
"0400000US15","Hawaii",null,"2016","561491","Repossession services","2","0","0","15",
"0400000US15","Hawaii",null,"2016","561492","Court reporting and stenotype services","12","29","1572","15",
"0400000US15","Hawaii",null,"2016","561499","All other business support services","7","32","1147","15",
"0400000US15","Hawaii",null,"2016","5615","Travel arrangement and reservation services","388","4368","164477","15",
"0400000US15","Hawaii",null,"2016","56151","Travel agencies","180","1384","60720","15",
"0400000US15","Hawaii",null,"2016","561510","Travel agencies","180","1384","60720","15",
"0400000US15","Hawaii",null,"2016","56152","Tour operators","149","1897","59692","15",
"0400000US15","Hawaii",null,"2016","561520","Tour operators","149","1897","59692","15",
"0400000US15","Hawaii",null,"2016","56159","Other travel arrangement and reservation services","59","1087","44065","15",
"0400000US15","Hawaii",null,"2016","561591","Convention and visitors bureaus","12","98","6423","15",
"0400000US15","Hawaii",null,"2016","561599","All other travel arrangement and reservation services","47","989","37642","15",
