"0400000US12","Florida",null,"2013","42433","Women's, children's, and infants' clothing and accessories merchant wholesalers","504","2739","90588","12",
"0400000US12","Florida",null,"2013","424330","Women's, children's, and infants' clothing and accessories merchant wholesalers","504","2739","90588","12",
"0400000US12","Florida",null,"2013","42434","Footwear merchant wholesalers","153","867","43226","12",
"0400000US12","Florida",null,"2013","424340","Footwear merchant wholesalers","153","867","43226","12",
"0400000US12","Florida",null,"2013","4244","Grocery and related product merchant wholesalers","2585","45870","2212961","12",
"0400000US12","Florida",null,"2013","42441","General line grocery merchant wholesalers","273","7815","429185","12",
"0400000US12","Florida",null,"2013","424410","General line grocery merchant wholesalers","273","7815","429185","12",
"0400000US12","Florida",null,"2013","42442","Packaged frozen food merchant wholesalers","288","6115","342863","12",
"0400000US12","Florida",null,"2013","424420","Packaged frozen food merchant wholesalers","288","6115","342863","12",
"0400000US12","Florida",null,"2013","42443","Dairy product (except dried or canned) merchant wholesalers","127","1893","85528","12",
"0400000US12","Florida",null,"2013","424430","Dairy product (except dried or canned) merchant wholesalers","127","1893","85528","12",
"0400000US12","Florida",null,"2013","42444","Poultry and poultry product merchant wholesalers","17","0","17681","12",
"0400000US12","Florida",null,"2013","424440","Poultry and poultry product merchant wholesalers","17","0","17681","12",
"0400000US12","Florida",null,"2013","42445","Confectionery merchant wholesalers","157","2236","111594","12",
"0400000US12","Florida",null,"2013","424450","Confectionery merchant wholesalers","157","2236","111594","12",
"0400000US12","Florida",null,"2013","42446","Fish and seafood merchant wholesalers","234","1878","79266","12",
"0400000US12","Florida",null,"2013","424460","Fish and seafood merchant wholesalers","234","1878","79266","12",
"0400000US12","Florida",null,"2013","42447","Meat and meat product merchant wholesalers","114","1442","62659","12",
"0400000US12","Florida",null,"2013","424470","Meat and meat product merchant wholesalers","114","1442","62659","12",
"0400000US12","Florida",null,"2013","42448","Fresh fruit and vegetable merchant wholesalers","503","8854","348722","12",
"0400000US12","Florida",null,"2013","424480","Fresh fruit and vegetable merchant wholesalers","503","8854","348722","12",
"0400000US12","Florida",null,"2013","42449","Other grocery and related products merchant wholesalers","872","15276","735463","12",
"0400000US12","Florida",null,"2013","424490","Other grocery and related products merchant wholesalers","872","15276","735463","12",
"0400000US12","Florida",null,"2013","4245","Farm product raw material merchant wholesalers","103","791","50560","12",
"0400000US12","Florida",null,"2013","42451","Grain and field bean merchant wholesalers","44","493","35892","12",
"0400000US12","Florida",null,"2013","424510","Grain and field bean merchant wholesalers","44","493","35892","12",
"0400000US12","Florida",null,"2013","42452","Livestock merchant wholesalers","26","89","2573","12",
"0400000US12","Florida",null,"2013","424520","Livestock merchant wholesalers","26","89","2573","12",
"0400000US12","Florida",null,"2013","42459","Other farm product raw material merchant wholesalers","33","0","0","12",
"0400000US12","Florida",null,"2013","424590","Other farm product raw material merchant wholesalers","33","0","0","12",
"0400000US12","Florida",null,"2013","4246","Chemical and allied products merchant wholesalers","792","6153","346729","12",
"0400000US12","Florida",null,"2013","42461","Plastics materials and basic forms and shapes merchant wholesalers","207","1437","72184","12",
"0400000US12","Florida",null,"2013","424610","Plastics materials and basic forms and shapes merchant wholesalers","207","1437","72184","12",
"0400000US12","Florida",null,"2013","42469","Other chemical and allied products merchant wholesalers","585","4716","274545","12",
"0400000US12","Florida",null,"2013","424690","Other chemical and allied products merchant wholesalers","585","4716","274545","12",
"0400000US12","Florida",null,"2013","4247","Petroleum and petroleum products merchant wholesalers","276","3621","325854","12",
"0400000US12","Florida",null,"2013","42471","Petroleum bulk stations and terminals","156","2283","131054","12",
"0400000US12","Florida",null,"2013","424710","Petroleum bulk stations and terminals","156","2283","131054","12",
"0400000US12","Florida",null,"2013","42472","Petroleum and petroleum products merchant wholesalers (except bulk stations and terminals)","120","1338","194800","12",
"0400000US12","Florida",null,"2013","424720","Petroleum and petroleum products merchant wholesalers (except bulk stations and terminals)","120","1338","194800","12",
"0400000US12","Florida",null,"2013","4248","Beer, wine, and distilled alcoholic beverage merchant wholesalers","258","12955","766320","12",
"0400000US12","Florida",null,"2013","42481","Beer and ale merchant wholesalers","90","6959","322211","12",
"0400000US12","Florida",null,"2013","424810","Beer and ale merchant wholesalers","90","6959","322211","12",
"0400000US12","Florida",null,"2013","42482","Wine and distilled alcoholic beverage merchant wholesalers","168","5996","444109","12",
"0400000US12","Florida",null,"2013","424820","Wine and distilled alcoholic beverage merchant wholesalers","168","5996","444109","12",
"0400000US12","Florida",null,"2013","4249","Miscellaneous nondurable goods merchant wholesalers","2279","19662","828249","12",
"0400000US12","Florida",null,"2013","42491","Farm supplies merchant wholesalers","298","2197","123293","12",
"0400000US12","Florida",null,"2013","424910","Farm supplies merchant wholesalers","298","2197","123293","12",
"0400000US12","Florida",null,"2013","42492","Book, periodical, and newspaper merchant wholesalers","146","1044","47921","12",
"0400000US12","Florida",null,"2013","424920","Book, periodical, and newspaper merchant wholesalers","146","1044","47921","12",
"0400000US12","Florida",null,"2013","42493","Flower, nursery stock, and florists' supplies merchant wholesalers","497","7038","229369","12",
"0400000US12","Florida",null,"2013","424930","Flower, nursery stock, and florists' supplies merchant wholesalers","497","7038","229369","12",
"0400000US12","Florida",null,"2013","42494","Tobacco and tobacco product merchant wholesalers","141","2872","165900","12",
"0400000US12","Florida",null,"2013","424940","Tobacco and tobacco product merchant wholesalers","141","2872","165900","12",
"0400000US12","Florida",null,"2013","42495","Paint, varnish, and supplies merchant wholesalers","167","961","43951","12",
"0400000US12","Florida",null,"2013","424950","Paint, varnish, and supplies merchant wholesalers","167","961","43951","12",
"0400000US12","Florida",null,"2013","42499","Other miscellaneous nondurable goods merchant wholesalers","1030","5550","217815","12",
"0400000US12","Florida",null,"2013","424990","Other miscellaneous nondurable goods merchant wholesalers","1030","5550","217815","12",
"0400000US12","Florida",null,"2013","425","Wholesale electronic markets and agents and brokers","4049","19183","847358","12",
"0400000US12","Florida",null,"2013","4251","Wholesale electronic markets and agents and brokers","4049","19183","847358","12",
"0400000US12","Florida",null,"2013","42511","Business to business electronic markets","53","0","8752","12",
"0400000US12","Florida",null,"2013","425110","Business to business electronic markets","53","0","8752","12",
"0400000US12","Florida",null,"2013","42512","Wholesale trade agents and brokers","3996","19011","838606","12",
"0400000US12","Florida",null,"2013","425120","Wholesale trade agents and brokers","3996","19011","838606","12",
"0400000US12","Florida",null,"2013","44-45","Retail trade","72347","985663","25704574","12",
"0400000US12","Florida",null,"2013","441","Motor vehicle and parts dealers","8040","117847","5180319","12",
"0400000US12","Florida",null,"2013","4411","Automobile dealers","2936","76476","3861869","12",
"0400000US12","Florida",null,"2013","44111","New car dealers","1170","67938","3548392","12",
"0400000US12","Florida",null,"2013","441110","New car dealers","1170","67938","3548392","12",
"0400000US12","Florida",null,"2013","44112","Used car dealers","1766","8538","313477","12",
"0400000US12","Florida",null,"2013","441120","Used car dealers","1766","8538","313477","12",
"0400000US12","Florida",null,"2013","4412","Other motor vehicle dealers","1479","12638","521041","12",
"0400000US12","Florida",null,"2013","44121","Recreational vehicle dealers","157","3090","145781","12",
"0400000US12","Florida",null,"2013","441210","Recreational vehicle dealers","157","3090","145781","12",
"0400000US12","Florida",null,"2013","44122","Motorcycle, boat, and other motor vehicle dealers","1322","9548","375260","12",
"0400000US12","Florida",null,"2013","441222","Boat dealers","775","4984","213975","12",
"0400000US12","Florida",null,"2013","441228","Motorcycle, ATV, and all other motor vehicle dealers","547","4564","161285","12",
"0400000US12","Florida",null,"2013","4413","Automotive parts, accessories, and tire stores","3625","28733","797409","12",
"0400000US12","Florida",null,"2013","44131","Automotive parts and accessories stores","2215","18571","450840","12",
"0400000US12","Florida",null,"2013","441310","Automotive parts and accessories stores","2215","18571","450840","12",
"0400000US12","Florida",null,"2013","44132","Tire dealers","1410","10162","346569","12",
"0400000US12","Florida",null,"2013","441320","Tire dealers","1410","10162","346569","12",
"0400000US12","Florida",null,"2013","442","Furniture and home furnishings stores","3791","30717","912574","12",
"0400000US12","Florida",null,"2013","4421","Furniture stores","1774","14574","537766","12",
"0400000US12","Florida",null,"2013","44211","Furniture stores","1774","14574","537766","12",
"0400000US12","Florida",null,"2013","442110","Furniture stores","1774","14574","537766","12",
"0400000US12","Florida",null,"2013","4422","Home furnishings stores","2017","16143","374808","12",
"0400000US12","Florida",null,"2013","44221","Floor covering stores","763","3921","144144","12",
"0400000US12","Florida",null,"2013","442210","Floor covering stores","763","3921","144144","12",
"0400000US12","Florida",null,"2013","44229","Other home furnishings stores","1254","12222","230664","12",
"0400000US12","Florida",null,"2013","442291","Window treatment stores","223","556","17247","12",
"0400000US12","Florida",null,"2013","442299","All other home furnishings stores","1031","11666","213417","12",
"0400000US12","Florida",null,"2013","443","Electronics and appliance stores","3543","29426","805037","12",
"0400000US12","Florida",null,"2013","4431","Electronics and appliance stores","3543","29426","805037","12",
"0400000US12","Florida",null,"2013","44314","Electronics and appliance stores","3543","29426","805037","12",
"0400000US12","Florida",null,"2013","443141","Household appliance stores","597","3429","109290","12",
"0400000US12","Florida",null,"2013","443142","Electronics stores","2946","25997","695747","12",
"0400000US12","Florida",null,"2013","444","Building material and garden equipment and supplies dealers","4173","72722","2063870","12",
"0400000US12","Florida",null,"2013","4441","Building material and supplies dealers","3398","67697","1926261","12",
"0400000US12","Florida",null,"2013","44411","Home centers","374","0","0","12",
"0400000US12","Florida",null,"2013","444110","Home centers","374","0","0","12",
"0400000US12","Florida",null,"2013","44412","Paint and wallpaper stores","487","2094","78548","12",
"0400000US12","Florida",null,"2013","444120","Paint and wallpaper stores","487","2094","78548","12",
"0400000US12","Florida",null,"2013","44413","Hardware stores","673","5989","137335","12",
"0400000US12","Florida",null,"2013","444130","Hardware stores","673","5989","137335","12",
"0400000US12","Florida",null,"2013","44419","Other building material dealers","1864","12080","510749","12",
"0400000US12","Florida",null,"2013","444190","Other building material dealers","1864","12080","510749","12",
"0400000US12","Florida",null,"2013","4442","Lawn and garden equipment and supplies stores","775","5025","137609","12",
"0400000US12","Florida",null,"2013","44421","Outdoor power equipment stores","210","1190","40678","12",
"0400000US12","Florida",null,"2013","444210","Outdoor power equipment stores","210","1190","40678","12",
"0400000US12","Florida",null,"2013","44422","Nursery, garden center, and farm supply stores","565","3835","96931","12",
"0400000US12","Florida",null,"2013","444220","Nursery, garden center, and farm supply stores","565","3835","96931","12",
"0400000US12","Florida",null,"2013","445","Food and beverage stores","9139","186007","4085212","12",
"0400000US12","Florida",null,"2013","481219","Other nonscheduled air transportation","69","0","15591","12",
"0400000US12","Florida",null,"2013","44511","Supermarkets and other grocery (except convenience) stores","3658","162643","3663641","12",
"0400000US12","Florida",null,"2013","445110","Supermarkets and other grocery (except convenience) stores","3658","162643","3663641","12",
"0400000US12","Florida",null,"2013","44512","Convenience stores","2691","8409","133089","12",
"0400000US12","Florida",null,"2013","445120","Convenience stores","2691","8409","133089","12",
"0400000US12","Florida",null,"2013","4452","Specialty food stores","1409","8023","142504","12",
"0400000US12","Florida",null,"2013","44521","Meat markets","263","1465","31790","12",
"0400000US12","Florida",null,"2013","445210","Meat markets","263","1465","31790","12",
"0400000US12","Florida",null,"2013","44522","Fish and seafood markets","165","909","23476","12",
"0400000US12","Florida",null,"2013","445220","Fish and seafood markets","165","909","23476","12",
"0400000US12","Florida",null,"2013","44523","Fruit and vegetable markets","230","1652","28451","12",
"0400000US12","Florida",null,"2013","445230","Fruit and vegetable markets","230","1652","28451","12",
"0400000US12","Florida",null,"2013","44529","Other specialty food stores","751","3997","58787","12",
"0400000US12","Florida",null,"2013","445291","Baked goods stores","210","1034","18535","12",
"0400000US12","Florida",null,"2013","445292","Confectionery and nut stores","190","1295","17057","12",
"0400000US12","Florida",null,"2013","445299","All other specialty food stores","351","1668","23195","12",
"0400000US12","Florida",null,"2013","4453","Beer, wine, and liquor stores","1381","6932","145978","12",
"0400000US12","Florida",null,"2013","44531","Beer, wine, and liquor stores","1381","6932","145978","12",
"0400000US12","Florida",null,"2013","445310","Beer, wine, and liquor stores","1381","6932","145978","12",
"0400000US12","Florida",null,"2013","446","Health and personal care stores","7380","73328","2539144","12",
"0400000US12","Florida",null,"2013","4461","Health and personal care stores","7380","73328","2539144","12",
"0400000US12","Florida",null,"2013","44611","Pharmacies and drug stores","2950","47775","1791926","12",
"0400000US12","Florida",null,"2013","446110","Pharmacies and drug stores","2950","47775","1791926","12",
"0400000US12","Florida",null,"2013","44612","Cosmetics, beauty supplies, and perfume stores","1401","9203","172642","12",
"0400000US12","Florida",null,"2013","446120","Cosmetics, beauty supplies, and perfume stores","1401","9203","172642","12",
"0400000US12","Florida",null,"2013","44613","Optical goods stores","1122","6959","180944","12",
"0400000US12","Florida",null,"2013","446130","Optical goods stores","1122","6959","180944","12",
"0400000US12","Florida",null,"2013","44619","Other health and personal care stores","1907","9391","393632","12",
"0400000US12","Florida",null,"2013","446191","Food (health) supplement stores","847","3588","77033","12",
"0400000US12","Florida",null,"2013","446199","All other health and personal care stores","1060","5803","316599","12",
"0400000US12","Florida",null,"2013","447","Gasoline stations","6255","40972","763876","12",
"0400000US12","Florida",null,"2013","4471","Gasoline stations","6255","40972","763876","12",
"0400000US12","Florida",null,"2013","44711","Gasoline stations with convenience stores","5817","37184","681724","12",
"0400000US12","Florida",null,"2013","447110","Gasoline stations with convenience stores","5817","37184","681724","12",
"0400000US12","Florida",null,"2013","44719","Other gasoline stations","438","3788","82152","12",
"0400000US12","Florida",null,"2013","447190","Other gasoline stations","438","3788","82152","12",
"0400000US12","Florida",null,"2013","448","Clothing and clothing accessories stores","11304","139249","2343850","12",
"0400000US12","Florida",null,"2013","4481","Clothing stores","7373","112992","1748159","12",
"0400000US12","Florida",null,"2013","44811","Men's clothing stores","501","3564","87284","12",
"0400000US12","Florida",null,"2013","448110","Men's clothing stores","501","3564","87284","12",
"0400000US12","Florida",null,"2013","44812","Women's clothing stores","2517","26001","445394","12",
"0400000US12","Florida",null,"2013","448120","Women's clothing stores","2517","26001","445394","12",
"0400000US12","Florida",null,"2013","44813","Children's and infants' clothing stores","460","5571","70128","12",
"0400000US12","Florida",null,"2013","448130","Children's and infants' clothing stores","460","5571","70128","12",
"0400000US12","Florida",null,"2013","44814","Family clothing stores","2318","63682","896356","12",
"0400000US12","Florida",null,"2013","448140","Family clothing stores","2318","63682","896356","12",
"0400000US12","Florida",null,"2013","44815","Clothing accessories stores","741","4848","94689","12",
"0400000US12","Florida",null,"2013","448150","Clothing accessories stores","741","4848","94689","12",
"0400000US12","Florida",null,"2013","44819","Other clothing stores","836","9326","154308","12",
"0400000US12","Florida",null,"2013","448190","Other clothing stores","836","9326","154308","12",
"0400000US12","Florida",null,"2013","4482","Shoe stores","1803","15416","273482","12",
"0400000US12","Florida",null,"2013","44821","Shoe stores","1803","15416","273482","12",
"0400000US12","Florida",null,"2013","448210","Shoe stores","1803","15416","273482","12",
"0400000US12","Florida",null,"2013","4483","Jewelry, luggage, and leather goods stores","2128","10841","322209","12",
"0400000US12","Florida",null,"2013","44831","Jewelry stores","2009","10249","300534","12",
"0400000US12","Florida",null,"2013","448310","Jewelry stores","2009","10249","300534","12",
"0400000US12","Florida",null,"2013","44832","Luggage and leather goods stores","119","592","21675","12",
"0400000US12","Florida",null,"2013","448320","Luggage and leather goods stores","119","592","21675","12",
"0400000US12","Florida",null,"2013","451","Sporting goods, hobby, musical instrument, and book stores","2881","28618","534016","12",
"0400000US12","Florida",null,"2013","4511","Sporting goods, hobby, and musical instrument stores","2462","22949","442682","12",
"0400000US12","Florida",null,"2013","45111","Sporting goods stores","1575","12126","268954","12",
"0400000US12","Florida",null,"2013","451110","Sporting goods stores","1575","12126","268954","12",
"0400000US12","Florida",null,"2013","45112","Hobby, toy, and game stores","454","6984","103353","12",
"0400000US12","Florida",null,"2013","451120","Hobby, toy, and game stores","454","6984","103353","12",
"0400000US12","Florida",null,"2013","45113","Sewing, needlework, and piece goods stores","225","2304","34669","12",
"0400000US12","Florida",null,"2013","451130","Sewing, needlework, and piece goods stores","225","2304","34669","12",
"0400000US12","Florida",null,"2013","45114","Musical instrument and supplies stores","208","1535","35706","12",
"0400000US12","Florida",null,"2013","451140","Musical instrument and supplies stores","208","1535","35706","12",
"0400000US12","Florida",null,"2013","4512","Book stores and news dealers","419","5669","91334","12",
"0400000US12","Florida",null,"2013","45121","Book stores and news dealers","419","5669","91334","12",
"0400000US12","Florida",null,"2013","451211","Book stores","380","0","74893","12",
"0400000US12","Florida",null,"2013","451212","News dealers and newsstands","39","868","16441","12",
"0400000US12","Florida",null,"2013","452","General merchandise stores","3111","178215","3896562","12",
"0400000US12","Florida",null,"2013","4521","Department stores","478","58307","1174744","12",
"0400000US12","Florida",null,"2013","45211","Department stores","478","58307","1174744","12",
"0400000US12","Florida",null,"2013","452111","Department stores (except discount department stores)","247","31626","658997","12",
"0400000US12","Florida",null,"2013","452112","Discount department stores","231","26681","515747","12",
"0400000US12","Florida",null,"2013","4529","Other general merchandise stores","2633","0","0","12",
"0400000US12","Florida",null,"2013","45291","Warehouse clubs and supercenters","332","0","0","12",
"0400000US12","Florida",null,"2013","452910","Warehouse clubs and supercenters","332","0","0","12",
"0400000US12","Florida",null,"2013","45299","All other general merchandise stores","2301","18527","295950","12",
"0400000US12","Florida",null,"2013","452990","All other general merchandise stores","2301","18527","295950","12",
"0400000US12","Florida",null,"2013","453","Miscellaneous store retailers","7609","48316","976383","12",
"0400000US12","Florida",null,"2013","4531","Florists","689","2839","53727","12",
"0400000US12","Florida",null,"2013","45311","Florists","689","2839","53727","12",
"0400000US12","Florida",null,"2013","453110","Florists","689","2839","53727","12",
"0400000US12","Florida",null,"2013","4532","Office supplies, stationery, and gift stores","2045","18088","319464","12",
"0400000US12","Florida",null,"2013","45321","Office supplies and stationery stores","474","5741","113487","12",
"0400000US12","Florida",null,"2013","453210","Office supplies and stationery stores","474","5741","113487","12",
"0400000US12","Florida",null,"2013","45322","Gift, novelty, and souvenir stores","1571","12347","205977","12",
"0400000US12","Florida",null,"2013","453220","Gift, novelty, and souvenir stores","1571","12347","205977","12",
"0400000US12","Florida",null,"2013","4533","Used merchandise stores","1428","10032","191001","12",
"0400000US12","Florida",null,"2013","45331","Used merchandise stores","1428","10032","191001","12",
"0400000US12","Florida",null,"2013","453310","Used merchandise stores","1428","10032","191001","12",
"0400000US12","Florida",null,"2013","4539","Other miscellaneous store retailers","3447","17357","412191","12",
"0400000US12","Florida",null,"2013","45391","Pet and pet supplies stores","723","6614","136055","12",
"0400000US12","Florida",null,"2013","453910","Pet and pet supplies stores","723","6614","136055","12",
"0400000US12","Florida",null,"2013","45392","Art dealers","420","1197","35406","12",
"0400000US12","Florida",null,"2013","453920","Art dealers","420","1197","35406","12",
"0400000US12","Florida",null,"2013","45393","Manufactured (mobile) home dealers","131","791","23009","12",
"0400000US12","Florida",null,"2013","453930","Manufactured (mobile) home dealers","131","791","23009","12",
"0400000US12","Florida",null,"2013","45399","All other miscellaneous store retailers","2173","8755","217721","12",
"0400000US12","Florida",null,"2013","453991","Tobacco stores","552","1577","31343","12",
"0400000US12","Florida",null,"2013","453998","All other miscellaneous store retailers (except tobacco stores)","1621","7178","186378","12",
"0400000US12","Florida",null,"2013","454","Nonstore retailers","5121","40246","1603731","12",
"0400000US12","Florida",null,"2013","4541","Electronic shopping and mail-order houses","2826","29676","1257468","12",
"0400000US12","Florida",null,"2013","45411","Electronic shopping and mail-order houses","2826","29676","1257468","12",
"0400000US12","Florida",null,"2013","454111","Electronic shopping","2261","11566","469095","12",
"0400000US12","Florida",null,"2013","454112","Electronic auctions","31","91","2335","12",
"0400000US12","Florida",null,"2013","454113","Mail-order houses","534","18019","786038","12",
"0400000US12","Florida",null,"2013","4542","Vending machine operators","329","1528","44170","12",
"0400000US12","Florida",null,"2013","45421","Vending machine operators","329","1528","44170","12",
"0400000US12","Florida",null,"2013","454210","Vending machine operators","329","1528","44170","12",
"0400000US12","Florida",null,"2013","4543","Direct selling establishments","1966","9042","302093","12",
"0400000US12","Florida",null,"2013","45431","Fuel dealers","244","1885","73108","12",
"0400000US12","Florida",null,"2013","454310","Fuel dealers","244","1885","73108","12",
"0400000US12","Florida",null,"2013","45439","Other direct selling establishments","1722","7157","228985","12",
"0400000US12","Florida",null,"2013","454390","Other direct selling establishments","1722","7157","228985","12",
"0400000US12","Florida",null,"2013","48-49","Transportation and warehousing","13517","209498","9223123","12",
"0400000US12","Florida",null,"2013","481","Air transportation","533","22099","1266728","12",
"0400000US12","Florida",null,"2013","4811","Scheduled air transportation","250","18597","1037959","12",
"0400000US12","Florida",null,"2013","48111","Scheduled air transportation","250","18597","1037959","12",
"0400000US12","Florida",null,"2013","481111","Scheduled passenger air transportation","182","16682","935529","12",
"0400000US12","Florida",null,"2013","481112","Scheduled freight air transportation","68","1915","102430","12",
"0400000US12","Florida",null,"2013","4812","Nonscheduled air transportation","283","3502","228769","12",
"0400000US12","Florida",null,"2013","48121","Nonscheduled air transportation","283","3502","228769","12",
