"GEO_ID","GEO_TTL","COUNTY","YEAR","NAICS2012","NAICS2012_TTL","ESTAB","EMP","PAYANN","state",
"0400000US05","Arkansas",null,"2013","00","Total for all sectors","64772","978094","36808096","05",
"0400000US05","Arkansas",null,"2013","11","Agriculture, forestry, fishing and hunting","654","4474","158142","05",
"0400000US05","Arkansas",null,"2013","113","Forestry and logging","358","2184","76152","05",
"0400000US05","Arkansas",null,"2013","238210","Electrical contractors and other wiring installation contractors","579","5869","260291","05",
"0400000US05","Arkansas",null,"2013","1131","Timber tract operations","16","79","4393","05",
"0400000US05","Arkansas",null,"2013","11311","Timber tract operations","16","79","4393","05",
"0400000US05","Arkansas",null,"2013","113110","Timber tract operations","16","79","4393","05",
"0400000US05","Arkansas",null,"2013","1132","Forest nurseries and gathering of forest products","8","0","0","05",
"0400000US05","Arkansas",null,"2013","11321","Forest nurseries and gathering of forest products","8","0","0","05",
"0400000US05","Arkansas",null,"2013","113210","Forest nurseries and gathering of forest products","8","0","0","05",
"0400000US05","Arkansas",null,"2013","1133","Logging","334","1912","67685","05",
"0400000US05","Arkansas",null,"2013","11331","Logging","334","1912","67685","05",
"0400000US05","Arkansas",null,"2013","113310","Logging","334","1912","67685","05",
"0400000US05","Arkansas",null,"2013","114","Fishing, hunting and trapping","5","20","524","05",
"0400000US05","Arkansas",null,"2013","1141","Fishing","1","0","0","05",
"0400000US05","Arkansas",null,"2013","11411","Fishing","1","0","0","05",
"0400000US05","Arkansas",null,"2013","114111","Finfish fishing","1","0","0","05",
"0400000US05","Arkansas",null,"2013","1142","Hunting and trapping","4","0","0","05",
"0400000US05","Arkansas",null,"2013","11421","Hunting and trapping","4","0","0","05",
"0400000US05","Arkansas",null,"2013","114210","Hunting and trapping","4","0","0","05",
"0400000US05","Arkansas",null,"2013","115","Support activities for agriculture and forestry","291","2270","81466","05",
"0400000US05","Arkansas",null,"2013","1151","Support activities for crop production","192","1179","49815","05",
"0400000US05","Arkansas",null,"2013","11511","Support activities for crop production","192","1179","49815","05",
"0400000US05","Arkansas",null,"2013","115111","Cotton ginning","18","176","10026","05",
"0400000US05","Arkansas",null,"2013","115112","Soil preparation, planting, and cultivating","123","568","24846","05",
"0400000US05","Arkansas",null,"2013","115113","Crop harvesting, primarily by machine","3","1","45","05",
"0400000US05","Arkansas",null,"2013","115114","Postharvest crop activities (except cotton ginning)","24","0","0","05",
"0400000US05","Arkansas",null,"2013","115115","Farm labor contractors and crew leaders","7","0","0","05",
"0400000US05","Arkansas",null,"2013","115116","Farm management services","17","33","2661","05",
"0400000US05","Arkansas",null,"2013","1152","Support activities for animal production","38","295","7990","05",
"0400000US05","Arkansas",null,"2013","11521","Support activities for animal production","38","295","7990","05",
"0400000US05","Arkansas",null,"2013","115210","Support activities for animal production","38","295","7990","05",
"0400000US05","Arkansas",null,"2013","1153","Support activities for forestry","61","796","23661","05",
"0400000US05","Arkansas",null,"2013","11531","Support activities for forestry","61","796","23661","05",
"0400000US05","Arkansas",null,"2013","115310","Support activities for forestry","61","796","23661","05",
"0400000US05","Arkansas",null,"2013","21","Mining, quarrying, and oil and gas extraction","406","8365","591384","05",
"0400000US05","Arkansas",null,"2013","211","Oil and gas extraction","105","1936","173494","05",
"0400000US05","Arkansas",null,"2013","2111","Oil and gas extraction","105","1936","173494","05",
"0400000US05","Arkansas",null,"2013","21111","Oil and gas extraction","105","1936","173494","05",
"0400000US05","Arkansas",null,"2013","211111","Crude petroleum and natural gas extraction","103","1909","172640","05",
"0400000US05","Arkansas",null,"2013","211112","Natural gas liquid extraction","2","0","0","05",
"0400000US05","Arkansas",null,"2013","212","Mining (except oil and gas)","98","1576","73479","05",
"0400000US05","Arkansas",null,"2013","2121","Coal mining","1","0","0","05",
"0400000US05","Arkansas",null,"2013","21211","Coal mining","1","0","0","05",
"0400000US05","Arkansas",null,"2013","212112","Bituminous coal underground mining","1","0","0","05",
"0400000US05","Arkansas",null,"2013","2123","Nonmetallic mineral mining and quarrying","97","1566","71220","05",
"0400000US05","Arkansas",null,"2013","21231","Stone mining and quarrying","49","818","37828","05",
"0400000US05","Arkansas",null,"2013","212311","Dimension stone mining and quarrying","5","75","2432","05",
"0400000US05","Arkansas",null,"2013","212312","Crushed and broken limestone mining and quarrying","27","252","11382","05",
"0400000US05","Arkansas",null,"2013","212313","Crushed and broken granite mining and quarrying","4","0","0","05",
"0400000US05","Arkansas",null,"2013","212319","Other crushed and broken stone mining and quarrying","13","342","17389","05",
"0400000US05","Arkansas",null,"2013","21232","Sand, gravel, clay, and ceramic and refractory minerals mining and quarrying","45","736","32921","05",
"0400000US05","Arkansas",null,"2013","212321","Construction sand and gravel mining","37","506","21458","05",
"0400000US05","Arkansas",null,"2013","212322","Industrial sand mining","6","0","0","05",
"0400000US05","Arkansas",null,"2013","212324","Kaolin and ball clay mining","1","0","0","05",
"0400000US05","Arkansas",null,"2013","212325","Clay and ceramic and refractory minerals mining","1","0","0","05",
"0400000US05","Arkansas",null,"2013","21239","Other nonmetallic mineral mining and quarrying","3","0","471","05",
"0400000US05","Arkansas",null,"2013","212399","All other nonmetallic mineral mining","3","0","471","05",
"0400000US05","Arkansas",null,"2013","213","Support activities for mining","203","4853","344411","05",
"0400000US05","Arkansas",null,"2013","2131","Support activities for mining","203","4853","344411","05",
"0400000US05","Arkansas",null,"2013","21311","Support activities for mining","203","4853","344411","05",
"0400000US05","Arkansas",null,"2013","213111","Drilling oil and gas wells","47","1334","100793","05",
"0400000US05","Arkansas",null,"2013","213112","Support activities for oil and gas operations","153","3511","243008","05",
"0400000US05","Arkansas",null,"2013","213114","Support activities for metal mining","2","0","0","05",
"0400000US05","Arkansas",null,"2013","213115","Support activities for nonmetallic minerals (except fuels) mining","1","0","0","05",
"0400000US05","Arkansas",null,"2013","22","Utilities","334","7727","614835","05",
"0400000US05","Arkansas",null,"2013","221","Utilities","334","7727","614835","05",
"0400000US05","Arkansas",null,"2013","2211","Electric power generation, transmission and distribution","169","5813","505209","05",
"0400000US05","Arkansas",null,"2013","22111","Electric power generation","32","1775","182074","05",
"0400000US05","Arkansas",null,"2013","221111","Hydroelectric power generation","3","0","0","05",
"0400000US05","Arkansas",null,"2013","221112","Fossil fuel electric power generation","23","681","64895","05",
"0400000US05","Arkansas",null,"2013","221113","Nuclear electric power generation","5","0","0","05",
"0400000US05","Arkansas",null,"2013","221118","Other electric power generation","1","0","0","05",
"0400000US05","Arkansas",null,"2013","22112","Electric power transmission, control, and distribution","137","4038","323135","05",
"0400000US05","Arkansas",null,"2013","221121","Electric bulk power transmission and control","5","0","0","05",
"0400000US05","Arkansas",null,"2013","221122","Electric power distribution","132","3494","267006","05",
"0400000US05","Arkansas",null,"2013","2212","Natural gas distribution","55","0","0","05",
"0400000US05","Arkansas",null,"2013","22121","Natural gas distribution","55","0","0","05",
"0400000US05","Arkansas",null,"2013","221210","Natural gas distribution","55","0","0","05",
"0400000US05","Arkansas",null,"2013","2213","Water, sewage and other systems","110","485","14976","05",
"0400000US05","Arkansas",null,"2013","22131","Water supply and irrigation systems","106","468","14287","05",
"0400000US05","Arkansas",null,"2013","221310","Water supply and irrigation systems","106","468","14287","05",
"0400000US05","Arkansas",null,"2013","22132","Sewage treatment facilities","4","0","689","05",
"0400000US05","Arkansas",null,"2013","221320","Sewage treatment facilities","4","0","689","05",
"0400000US05","Arkansas",null,"2013","23","Construction","5173","40629","1651160","05",
"0400000US05","Arkansas",null,"2013","236","Construction of buildings","1314","7849","324197","05",
"0400000US05","Arkansas",null,"2013","2361","Residential building construction","917","2646","86085","05",
"0400000US05","Arkansas",null,"2013","23611","Residential building construction","917","2646","86085","05",
"0400000US05","Arkansas",null,"2013","236115","New single-family housing construction (except for-sale builders)","401","965","30199","05",
"0400000US05","Arkansas",null,"2013","236116","New multifamily housing construction (except for-sale builders)","13","130","5913","05",
"0400000US05","Arkansas",null,"2013","236117","New housing for-sale builders","155","460","16270","05",
"0400000US05","Arkansas",null,"2013","236118","Residential remodelers","348","1091","33703","05",
"0400000US05","Arkansas",null,"2013","2362","Nonresidential building construction","397","5203","238112","05",
"0400000US05","Arkansas",null,"2013","23621","Industrial building construction","43","1239","55902","05",
"0400000US05","Arkansas",null,"2013","236210","Industrial building construction","43","1239","55902","05",
"0400000US05","Arkansas",null,"2013","23622","Commercial and institutional building construction","354","3964","182210","05",
"0400000US05","Arkansas",null,"2013","236220","Commercial and institutional building construction","354","3964","182210","05",
"0400000US05","Arkansas",null,"2013","237","Heavy and civil engineering construction","464","6116","276147","05",
"0400000US05","Arkansas",null,"2013","2371","Utility system construction","255","3747","176461","05",
"0400000US05","Arkansas",null,"2013","23711","Water and sewer line and related structures construction","140","1255","43237","05",
"0400000US05","Arkansas",null,"2013","237110","Water and sewer line and related structures construction","140","1255","43237","05",
"0400000US05","Arkansas",null,"2013","23712","Oil and gas pipeline and related structures construction","33","1461","89578","05",
"0400000US05","Arkansas",null,"2013","237120","Oil and gas pipeline and related structures construction","33","1461","89578","05",
"0400000US05","Arkansas",null,"2013","23713","Power and communication line and related structures construction","82","1031","43646","05",
"0400000US05","Arkansas",null,"2013","237130","Power and communication line and related structures construction","82","1031","43646","05",
"0400000US05","Arkansas",null,"2013","2372","Land subdivision","61","262","14818","05",
"0400000US05","Arkansas",null,"2013","23721","Land subdivision","61","262","14818","05",
"0400000US05","Arkansas",null,"2013","237210","Land subdivision","61","262","14818","05",
"0400000US05","Arkansas",null,"2013","2373","Highway, street, and bridge construction","128","1974","79537","05",
"0400000US05","Arkansas",null,"2013","23731","Highway, street, and bridge construction","128","1974","79537","05",
"0400000US05","Arkansas",null,"2013","237310","Highway, street, and bridge construction","128","1974","79537","05",
"0400000US05","Arkansas",null,"2013","2379","Other heavy and civil engineering construction","20","133","5331","05",
"0400000US05","Arkansas",null,"2013","23799","Other heavy and civil engineering construction","20","133","5331","05",
"0400000US05","Arkansas",null,"2013","237990","Other heavy and civil engineering construction","20","133","5331","05",
"0400000US05","Arkansas",null,"2013","238","Specialty trade contractors","3395","26664","1050816","05",
"0400000US05","Arkansas",null,"2013","2381","Foundation, structure, and building exterior contractors","624","5493","207365","05",
"0400000US05","Arkansas",null,"2013","23811","Poured concrete foundation and structure contractors","143","1144","38746","05",
"0400000US05","Arkansas",null,"2013","238110","Poured concrete foundation and structure contractors","143","1144","38746","05",
"0400000US05","Arkansas",null,"2013","23812","Structural steel and precast concrete contractors","25","0","0","05",
"0400000US05","Arkansas",null,"2013","238120","Structural steel and precast concrete contractors","25","0","0","05",
"0400000US05","Arkansas",null,"2013","23813","Framing contractors","47","180","3553","05",
"0400000US05","Arkansas",null,"2013","238130","Framing contractors","47","180","3553","05",
"0400000US05","Arkansas",null,"2013","23814","Masonry contractors","141","1113","32266","05",
"0400000US05","Arkansas",null,"2013","238140","Masonry contractors","141","1113","32266","05",
"0400000US05","Arkansas",null,"2013","23815","Glass and glazing contractors","37","277","10192","05",
"0400000US05","Arkansas",null,"2013","238150","Glass and glazing contractors","37","277","10192","05",
"0400000US05","Arkansas",null,"2013","23816","Roofing contractors","116","1159","41331","05",
"0400000US05","Arkansas",null,"2013","238160","Roofing contractors","116","1159","41331","05",
"0400000US05","Arkansas",null,"2013","23817","Siding contractors","65","251","7354","05",
"0400000US05","Arkansas",null,"2013","238170","Siding contractors","65","251","7354","05",
"0400000US05","Arkansas",null,"2013","23819","Other foundation, structure, and building exterior contractors","50","217","7544","05",
"0400000US05","Arkansas",null,"2013","238190","Other foundation, structure, and building exterior contractors","50","217","7544","05",
"0400000US05","Arkansas",null,"2013","2382","Building equipment contractors","1585","14060","598305","05",
"0400000US05","Arkansas",null,"2013","23821","Electrical contractors and other wiring installation contractors","579","5869","260291","05",
"0400000US05","Arkansas",null,"2013","315220","Men's and boys' cut and sew apparel manufacturing","3","0","0","05",
"0400000US05","Arkansas",null,"2013","23822","Plumbing, heating, and air-conditioning contractors","917","6984","284236","05",
"0400000US05","Arkansas",null,"2013","238220","Plumbing, heating, and air-conditioning contractors","917","6984","284236","05",
"0400000US05","Arkansas",null,"2013","23829","Other building equipment contractors","89","1207","53778","05",
"0400000US05","Arkansas",null,"2013","238290","Other building equipment contractors","89","1207","53778","05",
"0400000US05","Arkansas",null,"2013","2383","Building finishing contractors","609","3451","111485","05",
"0400000US05","Arkansas",null,"2013","23831","Drywall and insulation contractors","128","1131","39299","05",
"0400000US05","Arkansas",null,"2013","238310","Drywall and insulation contractors","128","1131","39299","05",
"0400000US05","Arkansas",null,"2013","23832","Painting and wall covering contractors","159","952","29041","05",
"0400000US05","Arkansas",null,"2013","238320","Painting and wall covering contractors","159","952","29041","05",
"0400000US05","Arkansas",null,"2013","23833","Flooring contractors","72","312","10351","05",
"0400000US05","Arkansas",null,"2013","238330","Flooring contractors","72","312","10351","05",
"0400000US05","Arkansas",null,"2013","23834","Tile and terrazzo contractors","49","237","7300","05",
"0400000US05","Arkansas",null,"2013","238340","Tile and terrazzo contractors","49","237","7300","05",
"0400000US05","Arkansas",null,"2013","23835","Finish carpentry contractors","153","588","17298","05",
"0400000US05","Arkansas",null,"2013","238350","Finish carpentry contractors","153","588","17298","05",
"0400000US05","Arkansas",null,"2013","23839","Other building finishing contractors","48","231","8196","05",
"0400000US05","Arkansas",null,"2013","238390","Other building finishing contractors","48","231","8196","05",
"0400000US05","Arkansas",null,"2013","2389","Other specialty trade contractors","577","3660","133661","05",
"0400000US05","Arkansas",null,"2013","23891","Site preparation contractors","408","2567","98819","05",
"0400000US05","Arkansas",null,"2013","238910","Site preparation contractors","408","2567","98819","05",
"0400000US05","Arkansas",null,"2013","23899","All other specialty trade contractors","169","1093","34842","05",
"0400000US05","Arkansas",null,"2013","238990","All other specialty trade contractors","169","1093","34842","05",
"0400000US05","Arkansas",null,"2013","31-33","Manufacturing","2610","153711","6411734","05",
"0400000US05","Arkansas",null,"2013","311","Food manufacturing","241","42138","1333006","05",
"0400000US05","Arkansas",null,"2013","3111","Animal food manufacturing","36","1683","65671","05",
"0400000US05","Arkansas",null,"2013","31111","Animal food manufacturing","36","1683","65671","05",
"0400000US05","Arkansas",null,"2013","311111","Dog and cat food manufacturing","5","976","34476","05",
"0400000US05","Arkansas",null,"2013","311119","Other animal food manufacturing","31","707","31195","05",
"0400000US05","Arkansas",null,"2013","3112","Grain and oilseed milling","32","2478","106064","05",
"0400000US05","Arkansas",null,"2013","31121","Flour milling and malt manufacturing","27","0","73400","05",
"0400000US05","Arkansas",null,"2013","311211","Flour milling","1","0","0","05",
"0400000US05","Arkansas",null,"2013","311212","Rice milling","25","0","0","05",
"0400000US05","Arkansas",null,"2013","311213","Malt manufacturing","1","0","0","05",
"0400000US05","Arkansas",null,"2013","31122","Starch and vegetable fats and oils manufacturing","4","493","19712","05",
"0400000US05","Arkansas",null,"2013","311221","Wet corn milling","1","0","0","05",
"0400000US05","Arkansas",null,"2013","311224","Soybean and other oilseed processing","2","0","0","05",
"0400000US05","Arkansas",null,"2013","311225","Fats and oils refining and blending","1","0","0","05",
"0400000US05","Arkansas",null,"2013","31123","Breakfast cereal manufacturing","1","0","0","05",
"0400000US05","Arkansas",null,"2013","311230","Breakfast cereal manufacturing","1","0","0","05",
"0400000US05","Arkansas",null,"2013","3113","Sugar and confectionery product manufacturing","8","0","0","05",
"0400000US05","Arkansas",null,"2013","31134","Nonchocolate confectionery manufacturing","4","0","0","05",
"0400000US05","Arkansas",null,"2013","311340","Nonchocolate confectionery manufacturing","4","0","0","05",
"0400000US05","Arkansas",null,"2013","31135","Chocolate and chocolate confectionery manufacturing","4","0","0","05",
"0400000US05","Arkansas",null,"2013","311352","Confectionery manufacturing from purchased chocolate","4","0","0","05",
"0400000US05","Arkansas",null,"2013","3114","Fruit and vegetable preserving and specialty food manufacturing","16","4125","169233","05",
"0400000US05","Arkansas",null,"2013","31141","Frozen food manufacturing","8","3101","121123","05",
"0400000US05","Arkansas",null,"2013","311411","Frozen fruit, juice, and vegetable manufacturing","3","0","0","05",
"0400000US05","Arkansas",null,"2013","311412","Frozen specialty food manufacturing","5","2851","105576","05",
"0400000US05","Arkansas",null,"2013","31142","Fruit and vegetable canning, pickling, and drying","8","0","0","05",
"0400000US05","Arkansas",null,"2013","311421","Fruit and vegetable canning","6","404","15699","05",
"0400000US05","Arkansas",null,"2013","311422","Specialty canning","2","0","0","05",
"0400000US05","Arkansas",null,"2013","3115","Dairy product manufacturing","11","0","0","05",
"0400000US05","Arkansas",null,"2013","31151","Dairy product (except frozen) manufacturing","9","0","0","05",
"0400000US05","Arkansas",null,"2013","311511","Fluid milk manufacturing","4","0","0","05",
"0400000US05","Arkansas",null,"2013","311513","Cheese manufacturing","4","0","0","05",
"0400000US05","Arkansas",null,"2013","311514","Dry, condensed, and evaporated dairy product manufacturing","1","0","0","05",
"0400000US05","Arkansas",null,"2013","31152","Ice cream and frozen dessert manufacturing","2","0","0","05",
"0400000US05","Arkansas",null,"2013","311520","Ice cream and frozen dessert manufacturing","2","0","0","05",
"0400000US05","Arkansas",null,"2013","3116","Animal slaughtering and processing","67","29202","806528","05",
"0400000US05","Arkansas",null,"2013","31161","Animal slaughtering and processing","67","29202","806528","05",
"0400000US05","Arkansas",null,"2013","311611","Animal (except poultry) slaughtering","13","0","0","05",
"0400000US05","Arkansas",null,"2013","311612","Meat processed from carcasses","11","1918","57962","05",
"0400000US05","Arkansas",null,"2013","311613","Rendering and meat byproduct processing","3","0","0","05",
"0400000US05","Arkansas",null,"2013","311615","Poultry processing","40","26315","725517","05",
"0400000US05","Arkansas",null,"2013","3117","Seafood product preparation and packaging","3","0","0","05",
"0400000US05","Arkansas",null,"2013","31171","Seafood product preparation and packaging","3","0","0","05",
"0400000US05","Arkansas",null,"2013","311710","Seafood product preparation and packaging","3","0","0","05",
"0400000US05","Arkansas",null,"2013","3118","Bakeries and tortilla manufacturing","50","2224","92580","05",
"0400000US05","Arkansas",null,"2013","31181","Bread and bakery product manufacturing","45","1527","65547","05",
"0400000US05","Arkansas",null,"2013","311811","Retail bakeries","24","142","2196","05",
"0400000US05","Arkansas",null,"2013","311812","Commercial bakeries","20","1340","62192","05",
"0400000US05","Arkansas",null,"2013","311813","Frozen cakes, pies, and other pastries manufacturing","1","0","0","05",
"0400000US05","Arkansas",null,"2013","31182","Cookie, cracker, and pasta manufacturing","3","0","0","05",
"0400000US05","Arkansas",null,"2013","311821","Cookie and cracker manufacturing","1","0","0","05",
"0400000US05","Arkansas",null,"2013","311824","Dry pasta, dough, and flour mixes manufacturing from purchased flour","2","0","0","05",
"0400000US05","Arkansas",null,"2013","31183","Tortilla manufacturing","2","0","0","05",
"0400000US05","Arkansas",null,"2013","311830","Tortilla manufacturing","2","0","0","05",
"0400000US05","Arkansas",null,"2013","3119","Other food manufacturing","18","1654","65704","05",
"0400000US05","Arkansas",null,"2013","31191","Snack food manufacturing","6","1215","54534","05",
"0400000US05","Arkansas",null,"2013","311911","Roasted nuts and peanut butter manufacturing","4","0","0","05",
"0400000US05","Arkansas",null,"2013","311919","Other snack food manufacturing","2","0","0","05",
"0400000US05","Arkansas",null,"2013","31192","Coffee and tea manufacturing","2","0","0","05",
"0400000US05","Arkansas",null,"2013","311920","Coffee and tea manufacturing","2","0","0","05",
"0400000US05","Arkansas",null,"2013","31193","Flavoring syrup and concentrate manufacturing","1","0","0","05",
"0400000US05","Arkansas",null,"2013","311930","Flavoring syrup and concentrate manufacturing","1","0","0","05",
"0400000US05","Arkansas",null,"2013","31194","Seasoning and dressing manufacturing","4","0","0","05",
"0400000US05","Arkansas",null,"2013","311941","Mayonnaise, dressing, and other prepared sauce manufacturing","2","0","0","05",
"0400000US05","Arkansas",null,"2013","311942","Spice and extract manufacturing","2","0","0","05",
"0400000US05","Arkansas",null,"2013","31199","All other food manufacturing","5","0","0","05",
"0400000US05","Arkansas",null,"2013","311991","Perishable prepared food manufacturing","1","0","0","05",
"0400000US05","Arkansas",null,"2013","311999","All other miscellaneous food manufacturing","4","0","0","05",
"0400000US05","Arkansas",null,"2013","312","Beverage and tobacco product manufacturing","35","644","29267","05",
"0400000US05","Arkansas",null,"2013","3121","Beverage manufacturing","34","644","29264","05",
"0400000US05","Arkansas",null,"2013","31211","Soft drink and ice manufacturing","19","0","0","05",
"0400000US05","Arkansas",null,"2013","312111","Soft drink manufacturing","2","0","0","05",
"0400000US05","Arkansas",null,"2013","312112","Bottled water manufacturing","4","0","0","05",
"0400000US05","Arkansas",null,"2013","312113","Ice manufacturing","13","0","1346","05",
"0400000US05","Arkansas",null,"2013","31212","Breweries","7","42","1245","05",
"0400000US05","Arkansas",null,"2013","312120","Breweries","7","42","1245","05",
"0400000US05","Arkansas",null,"2013","31213","Wineries","6","0","0","05",
"0400000US05","Arkansas",null,"2013","312130","Wineries","6","0","0","05",
"0400000US05","Arkansas",null,"2013","31214","Distilleries","2","0","0","05",
"0400000US05","Arkansas",null,"2013","312140","Distilleries","2","0","0","05",
"0400000US05","Arkansas",null,"2013","3122","Tobacco manufacturing","1","0","0","05",
"0400000US05","Arkansas",null,"2013","31223","Tobacco manufacturing","1","0","0","05",
"0400000US05","Arkansas",null,"2013","312230","Tobacco manufacturing","1","0","0","05",
"0400000US05","Arkansas",null,"2013","313","Textile mills","4","0","0","05",
"0400000US05","Arkansas",null,"2013","3133","Textile and fabric finishing and fabric coating mills","4","0","0","05",
"0400000US05","Arkansas",null,"2013","31331","Textile and fabric finishing mills","1","0","0","05",
"0400000US05","Arkansas",null,"2013","313310","Textile and fabric finishing mills","1","0","0","05",
"0400000US05","Arkansas",null,"2013","31332","Fabric coating mills","3","0","0","05",
"0400000US05","Arkansas",null,"2013","313320","Fabric coating mills","3","0","0","05",
"0400000US05","Arkansas",null,"2013","314","Textile product mills","48","0","0","05",
