"0400000US25","Massachusetts",null,"2014","522293","International trade financing","2","0","0","25",
"0400000US25","Massachusetts",null,"2014","522294","Secondary market financing","4","0","0","25",
"0400000US25","Massachusetts",null,"2014","522298","All other nondepository credit intermediation","45","412","89530","25",
"0400000US25","Massachusetts",null,"2014","5223","Activities related to credit intermediation","319","2412","207821","25",
"0400000US25","Massachusetts",null,"2014","52231","Mortgage and nonmortgage loan brokers","132","654","59744","25",
"0400000US25","Massachusetts",null,"2014","522310","Mortgage and nonmortgage loan brokers","132","654","59744","25",
"0400000US25","Massachusetts",null,"2014","52232","Financial transactions processing, reserve, and clearinghouse activities","84","1179","113688","25",
"0400000US25","Massachusetts",null,"2014","522320","Financial transactions processing, reserve, and clearinghouse activities","84","1179","113688","25",
"0400000US25","Massachusetts",null,"2014","52239","Other activities related to credit intermediation","103","579","34389","25",
"0400000US25","Massachusetts",null,"2014","522390","Other activities related to credit intermediation","103","579","34389","25",
"0400000US25","Massachusetts",null,"2014","523","Securities, commodity contracts, and other financial investments and related activities","2526","45728","10441891","25",
"0400000US25","Massachusetts",null,"2014","5231","Securities and commodity contracts intermediation and brokerage","763","9851","2362542","25",
"0400000US25","Massachusetts",null,"2014","52311","Investment banking and securities dealing","132","2047","470762","25",
"0400000US25","Massachusetts",null,"2014","523110","Investment banking and securities dealing","132","2047","470762","25",
"0400000US25","Massachusetts",null,"2014","52312","Securities brokerage","615","7771","1887469","25",
"0400000US25","Massachusetts",null,"2014","523120","Securities brokerage","615","7771","1887469","25",
"0400000US25","Massachusetts",null,"2014","52313","Commodity contracts dealing","8","0","0","25",
"0400000US25","Massachusetts",null,"2014","523130","Commodity contracts dealing","8","0","0","25",
"0400000US25","Massachusetts",null,"2014","52314","Commodity contracts brokerage","8","0","926","25",
"0400000US25","Massachusetts",null,"2014","523140","Commodity contracts brokerage","8","0","926","25",
"0400000US25","Massachusetts",null,"2014","5232","Securities and commodity exchanges","2","0","0","25",
"0400000US25","Massachusetts",null,"2014","52321","Securities and commodity exchanges","2","0","0","25",
"0400000US25","Massachusetts",null,"2014","523210","Securities and commodity exchanges","2","0","0","25",
"0400000US25","Massachusetts",null,"2014","5239","Other financial investment activities","1761","35857","8076652","25",
"0400000US25","Massachusetts",null,"2014","52391","Miscellaneous intermediation","162","1486","374722","25",
"0400000US25","Massachusetts",null,"2014","523910","Miscellaneous intermediation","162","1486","374722","25",
"0400000US25","Massachusetts",null,"2014","52392","Portfolio management","967","23812","6552330","25",
"0400000US25","Massachusetts",null,"2014","523920","Portfolio management","967","23812","6552330","25",
"0400000US25","Massachusetts",null,"2014","52393","Investment advice","548","3992","642210","25",
"0400000US25","Massachusetts",null,"2014","523930","Investment advice","548","3992","642210","25",
"0400000US25","Massachusetts",null,"2014","52399","All other financial investment activities","84","6567","507390","25",
"0400000US25","Massachusetts",null,"2014","523991","Trust, fiduciary, and custody activities","67","5139","323233","25",
"0400000US25","Massachusetts",null,"2014","523999","Miscellaneous financial investment activities","17","1428","184157","25",
"0400000US25","Massachusetts",null,"2014","524","Insurance carriers and related activities","3315","67730","6584862","25",
"0400000US25","Massachusetts",null,"2014","5241","Insurance carriers","575","43654","4795831","25",
"0400000US25","Massachusetts",null,"2014","52411","Direct life, health, and medical insurance carriers","313","26221","2891280","25",
"0400000US25","Massachusetts",null,"2014","524113","Direct life insurance carriers","244","14558","1890230","25",
"0400000US25","Massachusetts",null,"2014","524114","Direct health and medical insurance carriers","69","11663","1001050","25",
"0400000US25","Massachusetts",null,"2014","52412","Direct insurance (except life, health, and medical) carriers","250","17224","1876183","25",
"0400000US25","Massachusetts",null,"2014","524126","Direct property and casualty insurance carriers","233","17056","1855849","25",
"0400000US25","Massachusetts",null,"2014","524127","Direct title insurance carriers","16","0","0","25",
"0400000US25","Massachusetts",null,"2014","524128","Other direct insurance (except life, health, and medical) carriers","1","0","0","25",
"0400000US25","Massachusetts",null,"2014","52413","Reinsurance carriers","12","209","28368","25",
"0400000US25","Massachusetts",null,"2014","524130","Reinsurance carriers","12","209","28368","25",
"0400000US25","Massachusetts",null,"2014","5242","Agencies, brokerages, and other insurance related activities","2740","24076","1789031","25",
"0400000US25","Massachusetts",null,"2014","52421","Insurance agencies and brokerages","2451","16537","1239532","25",
"0400000US25","Massachusetts",null,"2014","524210","Insurance agencies and brokerages","2451","16537","1239532","25",
"0400000US25","Massachusetts",null,"2014","52429","Other insurance related activities","289","7539","549499","25",
"0400000US25","Massachusetts",null,"2014","524291","Claims adjusting","121","1546","119811","25",
"0400000US25","Massachusetts",null,"2014","524292","Third party administration of insurance and pension funds","112","4139","286890","25",
"0400000US25","Massachusetts",null,"2014","524298","All other insurance related activities","56","1854","142798","25",
"0400000US25","Massachusetts",null,"2014","525","Funds, trusts, and other financial vehicles","28","0","0","25",
"0400000US25","Massachusetts",null,"2014","5259","Other investment pools and funds","28","0","0","25",
"0400000US25","Massachusetts",null,"2014","52591","Open-end investment funds","3","0","0","25",
"0400000US25","Massachusetts",null,"2014","525910","Open-end investment funds","3","0","0","25",
"0400000US25","Massachusetts",null,"2014","52599","Other financial vehicles","25","0","0","25",
"0400000US25","Massachusetts",null,"2014","525990","Other financial vehicles","25","0","0","25",
"0400000US25","Massachusetts",null,"2014","53","Real estate and rental and leasing","6723","44909","2936019","25",
"0400000US25","Massachusetts",null,"2014","531","Real estate","5684","34517","2298906","25",
"0400000US25","Massachusetts",null,"2014","5311","Lessors of real estate","2126","11335","617649","25",
"0400000US25","Massachusetts",null,"2014","53111","Lessors of residential buildings and dwellings","1025","6014","295570","25",
"0400000US25","Massachusetts",null,"2014","531110","Lessors of residential buildings and dwellings","1025","6014","295570","25",
"0400000US25","Massachusetts",null,"2014","53112","Lessors of nonresidential buildings (except miniwarehouses)","782","4462","291035","25",
"0400000US25","Massachusetts",null,"2014","531120","Lessors of nonresidential buildings (except miniwarehouses)","782","4462","291035","25",
"0400000US25","Massachusetts",null,"2014","53113","Lessors of miniwarehouses and self-storage units","243","605","20322","25",
"0400000US25","Massachusetts",null,"2014","531130","Lessors of miniwarehouses and self-storage units","243","605","20322","25",
"0400000US25","Massachusetts",null,"2014","53119","Lessors of other real estate property","76","254","10722","25",
"0400000US25","Massachusetts",null,"2014","531190","Lessors of other real estate property","76","254","10722","25",
"0400000US25","Massachusetts",null,"2014","5312","Offices of real estate agents and brokers","1523","5305","487904","25",
"0400000US25","Massachusetts",null,"2014","53121","Offices of real estate agents and brokers","1523","5305","487904","25",
"0400000US25","Massachusetts",null,"2014","531210","Offices of real estate agents and brokers","1523","5305","487904","25",
"0400000US25","Massachusetts",null,"2014","5313","Activities related to real estate","2035","17877","1193353","25",
"0400000US25","Massachusetts",null,"2014","53131","Real estate property managers","1510","16057","1029320","25",
"0400000US25","Massachusetts",null,"2014","531311","Residential property managers","1074","11576","530969","25",
"0400000US25","Massachusetts",null,"2014","531312","Nonresidential property managers","436","4481","498351","25",
"0400000US25","Massachusetts",null,"2014","53132","Offices of real estate appraisers","186","584","40105","25",
"0400000US25","Massachusetts",null,"2014","541990","All other professional, scientific, and technical services","461","2247","181228","25",
"0400000US25","Massachusetts",null,"2014","53139","Other activities related to real estate","339","1236","123928","25",
"0400000US25","Massachusetts",null,"2014","531390","Other activities related to real estate","339","1236","123928","25",
"0400000US25","Massachusetts",null,"2014","532","Rental and leasing services","1000","9032","444540","25",
"0400000US25","Massachusetts",null,"2014","5321","Automotive equipment rental and leasing","371","0","126067","25",
"0400000US25","Massachusetts",null,"2014","53211","Passenger car rental and leasing","263","0","0","25",
"0400000US25","Massachusetts",null,"2014","532111","Passenger car rental","256","0","0","25",
"0400000US25","Massachusetts",null,"2014","532112","Passenger car leasing","7","64","4468","25",
"0400000US25","Massachusetts",null,"2014","53212","Truck, utility trailer, and RV (recreational vehicle) rental and leasing","108","1034","49696","25",
"0400000US25","Massachusetts",null,"2014","532120","Truck, utility trailer, and RV (recreational vehicle) rental and leasing","108","1034","49696","25",
"0400000US25","Massachusetts",null,"2014","5322","Consumer goods rental","312","2619","115375","25",
"0400000US25","Massachusetts",null,"2014","53221","Consumer electronics and appliances rental","101","0","22622","25",
"0400000US25","Massachusetts",null,"2014","532210","Consumer electronics and appliances rental","101","0","22622","25",
"0400000US25","Massachusetts",null,"2014","53222","Formal wear and costume rental","20","107","3193","25",
"0400000US25","Massachusetts",null,"2014","532220","Formal wear and costume rental","20","107","3193","25",
"0400000US25","Massachusetts",null,"2014","53223","Video tape and disc rental","24","0","1004","25",
"0400000US25","Massachusetts",null,"2014","532230","Video tape and disc rental","24","0","1004","25",
"0400000US25","Massachusetts",null,"2014","53229","Other consumer goods rental","167","1704","88556","25",
"0400000US25","Massachusetts",null,"2014","532291","Home health equipment rental","26","506","27709","25",
"0400000US25","Massachusetts",null,"2014","532292","Recreational goods rental","39","75","6136","25",
"0400000US25","Massachusetts",null,"2014","532299","All other consumer goods rental","102","1123","54711","25",
"0400000US25","Massachusetts",null,"2014","5323","General rental centers","58","247","11389","25",
"0400000US25","Massachusetts",null,"2014","53231","General rental centers","58","247","11389","25",
"0400000US25","Massachusetts",null,"2014","532310","General rental centers","58","247","11389","25",
"0400000US25","Massachusetts",null,"2014","5324","Commercial and industrial machinery and equipment rental and leasing","259","3208","191709","25",
"0400000US25","Massachusetts",null,"2014","53241","Construction, transportation, mining, and forestry machinery and equipment rental and leasing","79","497","41377","25",
"0400000US25","Massachusetts",null,"2014","532411","Commercial air, rail, and water transportation equipment rental and leasing","17","56","6846","25",
"0400000US25","Massachusetts",null,"2014","532412","Construction, mining, and forestry machinery and equipment rental and leasing","62","441","34531","25",
"0400000US25","Massachusetts",null,"2014","53242","Office machinery and equipment rental and leasing","21","0","15467","25",
"0400000US25","Massachusetts",null,"2014","532420","Office machinery and equipment rental and leasing","21","0","15467","25",
"0400000US25","Massachusetts",null,"2014","53249","Other commercial and industrial machinery and equipment rental and leasing","159","2472","134865","25",
"0400000US25","Massachusetts",null,"2014","532490","Other commercial and industrial machinery and equipment rental and leasing","159","2472","134865","25",
"0400000US25","Massachusetts",null,"2014","533","Lessors of nonfinancial intangible assets (except copyrighted works)","39","0","0","25",
"0400000US25","Massachusetts",null,"2014","5331","Lessors of nonfinancial intangible assets (except copyrighted works)","39","0","0","25",
"0400000US25","Massachusetts",null,"2014","53311","Lessors of nonfinancial intangible assets (except copyrighted works)","39","0","0","25",
"0400000US25","Massachusetts",null,"2014","533110","Lessors of nonfinancial intangible assets (except copyrighted works)","39","0","0","25",
"0400000US25","Massachusetts",null,"2014","54","Professional, scientific, and technical services","21470","261703","26811384","25",
"0400000US25","Massachusetts",null,"2014","541","Professional, scientific, and technical services","21470","261703","26811384","25",
"0400000US25","Massachusetts",null,"2014","5411","Legal services","4697","29130","2851295","25",
"0400000US25","Massachusetts",null,"2014","54111","Offices of lawyers","4561","28653","2819724","25",
"0400000US25","Massachusetts",null,"2014","541110","Offices of lawyers","4561","28653","2819724","25",
"0400000US25","Massachusetts",null,"2014","54119","Other legal services","136","477","31571","25",
"0400000US25","Massachusetts",null,"2014","541191","Title abstract and settlement offices","87","259","14589","25",
"0400000US25","Massachusetts",null,"2014","541199","All other legal services","49","218","16982","25",
"0400000US25","Massachusetts",null,"2014","5412","Accounting, tax preparation, bookkeeping, and payroll services","2642","25635","1689739","25",
"0400000US25","Massachusetts",null,"2014","54121","Accounting, tax preparation, bookkeeping, and payroll services","2642","25635","1689739","25",
"0400000US25","Massachusetts",null,"2014","541211","Offices of certified public accountants","1246","14752","1274661","25",
"0400000US25","Massachusetts",null,"2014","541213","Tax preparation services","587","3985","57181","25",
"0400000US25","Massachusetts",null,"2014","541214","Payroll services","125","2857","192556","25",
"0400000US25","Massachusetts",null,"2014","541219","Other accounting services","684","4041","165341","25",
"0400000US25","Massachusetts",null,"2014","5413","Architectural, engineering, and related services","2725","39842","3790866","25",
"0400000US25","Massachusetts",null,"2014","54131","Architectural services","700","5934","522854","25",
"0400000US25","Massachusetts",null,"2014","541310","Architectural services","700","5934","522854","25",
"0400000US25","Massachusetts",null,"2014","54132","Landscape architectural services","171","1098","87162","25",
"0400000US25","Massachusetts",null,"2014","541320","Landscape architectural services","171","1098","87162","25",
"0400000US25","Massachusetts",null,"2014","54133","Engineering services","1437","28559","2900625","25",
"0400000US25","Massachusetts",null,"2014","541330","Engineering services","1437","28559","2900625","25",
"0400000US25","Massachusetts",null,"2014","54134","Drafting services","19","45","3043","25",
"0400000US25","Massachusetts",null,"2014","541340","Drafting services","19","45","3043","25",
"0400000US25","Massachusetts",null,"2014","54135","Building inspection services","102","256","14333","25",
"0400000US25","Massachusetts",null,"2014","541350","Building inspection services","102","256","14333","25",
"0400000US25","Massachusetts",null,"2014","54136","Geophysical surveying and mapping services","4","0","655","25",
"0400000US25","Massachusetts",null,"2014","541360","Geophysical surveying and mapping services","4","0","655","25",
"0400000US25","Massachusetts",null,"2014","54137","Surveying and mapping (except geophysical) services","156","775","44050","25",
"0400000US25","Massachusetts",null,"2014","541370","Surveying and mapping (except geophysical) services","156","775","44050","25",
"0400000US25","Massachusetts",null,"2014","54138","Testing laboratories","136","3159","218144","25",
"0400000US25","Massachusetts",null,"2014","541380","Testing laboratories","136","3159","218144","25",
"0400000US25","Massachusetts",null,"2014","5414","Specialized design services","659","2701","178635","25",
"0400000US25","Massachusetts",null,"2014","54141","Interior design services","278","907","62411","25",
"0400000US25","Massachusetts",null,"2014","541410","Interior design services","278","907","62411","25",
"0400000US25","Massachusetts",null,"2014","54142","Industrial design services","41","258","22273","25",
"0400000US25","Massachusetts",null,"2014","541420","Industrial design services","41","258","22273","25",
"0400000US25","Massachusetts",null,"2014","54143","Graphic design services","318","1502","92159","25",
"0400000US25","Massachusetts",null,"2014","541430","Graphic design services","318","1502","92159","25",
"0400000US25","Massachusetts",null,"2014","54149","Other specialized design services","22","0","1792","25",
"0400000US25","Massachusetts",null,"2014","541490","Other specialized design services","22","0","1792","25",
"0400000US25","Massachusetts",null,"2014","5415","Computer systems design and related services","3662","52764","5840535","25",
"0400000US25","Massachusetts",null,"2014","54151","Computer systems design and related services","3662","52764","5840535","25",
"0400000US25","Massachusetts",null,"2014","541511","Custom computer programming services","2004","25896","2944420","25",
"0400000US25","Massachusetts",null,"2014","541512","Computer systems design services","1039","21068","2331604","25",
"0400000US25","Massachusetts",null,"2014","541513","Computer facilities management services","159","2403","218461","25",
"0400000US25","Massachusetts",null,"2014","541519","Other computer related services","460","3397","346050","25",
"0400000US25","Massachusetts",null,"2014","5416","Management, scientific, and technical consulting services","3678","40383","4325289","25",
"0400000US25","Massachusetts",null,"2014","54161","Management consulting services","2973","32203","3431240","25",
"0400000US25","Massachusetts",null,"2014","541611","Administrative management and general management consulting services","1631","19581","2372257","25",
"0400000US25","Massachusetts",null,"2014","541612","Human resources consulting services","221","3549","351491","25",
"0400000US25","Massachusetts",null,"2014","541613","Marketing consulting services","838","6219","512733","25",
"0400000US25","Massachusetts",null,"2014","541614","Process, physical distribution, and logistics consulting services","186","2490","168200","25",
"0400000US25","Massachusetts",null,"2014","541618","Other management consulting services","97","364","26559","25",
"0400000US25","Massachusetts",null,"2014","54162","Environmental consulting services","274","3683","284194","25",
"0400000US25","Massachusetts",null,"2014","541620","Environmental consulting services","274","3683","284194","25",
"0400000US25","Massachusetts",null,"2014","54169","Other scientific and technical consulting services","431","4497","609855","25",
"0400000US25","Massachusetts",null,"2014","541690","Other scientific and technical consulting services","431","4497","609855","25",
"0400000US25","Massachusetts",null,"2014","5417","Scientific research and development services","1114","43972","6284022","25",
"0400000US25","Massachusetts",null,"2014","54171","Research and development in the physical, engineering, and life sciences","1017","41755","6115981","25",
"0400000US25","Massachusetts",null,"2014","541711","Research and development in biotechnology","296","9581","1782885","25",
"0400000US25","Massachusetts",null,"2014","541712","Research and development in the physical, engineering, and life sciences (except biotechnology)","721","32174","4333096","25",
"0400000US25","Massachusetts",null,"2014","54172","Research and development in the social sciences and humanities","97","2217","168041","25",
"0400000US25","Massachusetts",null,"2014","541720","Research and development in the social sciences and humanities","97","2217","168041","25",
"0400000US25","Massachusetts",null,"2014","5418","Advertising, public relations, and related services","790","11005","916120","25",
"0400000US25","Massachusetts",null,"2014","54181","Advertising agencies","261","4416","433111","25",
"0400000US25","Massachusetts",null,"2014","541810","Advertising agencies","261","4416","433111","25",
"0400000US25","Massachusetts",null,"2014","54182","Public relations agencies","205","2045","177593","25",
"0400000US25","Massachusetts",null,"2014","541820","Public relations agencies","205","2045","177593","25",
"0400000US25","Massachusetts",null,"2014","54183","Media buying agencies","24","0","0","25",
"0400000US25","Massachusetts",null,"2014","541830","Media buying agencies","24","0","0","25",
"0400000US25","Massachusetts",null,"2014","54184","Media representatives","28","0","0","25",
"0400000US25","Massachusetts",null,"2014","541840","Media representatives","28","0","0","25",
"0400000US25","Massachusetts",null,"2014","54185","Outdoor advertising","39","367","21322","25",
"0400000US25","Massachusetts",null,"2014","541850","Outdoor advertising","39","367","21322","25",
"0400000US25","Massachusetts",null,"2014","54186","Direct mail advertising","62","842","58328","25",
"0400000US25","Massachusetts",null,"2014","541860","Direct mail advertising","62","842","58328","25",
"0400000US25","Massachusetts",null,"2014","54187","Advertising material distribution services","16","464","28172","25",
"0400000US25","Massachusetts",null,"2014","541870","Advertising material distribution services","16","464","28172","25",
"0400000US25","Massachusetts",null,"2014","54189","Other services related to advertising","155","1372","90988","25",
"0400000US25","Massachusetts",null,"2014","541890","Other services related to advertising","155","1372","90988","25",
"0400000US25","Massachusetts",null,"2014","5419","Other professional, scientific, and technical services","1503","16271","934883","25",
"0400000US25","Massachusetts",null,"2014","54191","Marketing research and public opinion polling","177","3433","340409","25",
"0400000US25","Massachusetts",null,"2014","541910","Marketing research and public opinion polling","177","3433","340409","25",
"0400000US25","Massachusetts",null,"2014","54192","Photographic services","286","1030","29776","25",
"0400000US25","Massachusetts",null,"2014","541921","Photography studios, portrait","206","843","21257","25",
"0400000US25","Massachusetts",null,"2014","541922","Commercial photography","80","0","8519","25",
"0400000US25","Massachusetts",null,"2014","54193","Translation and interpretation services","47","697","33461","25",
"0400000US25","Massachusetts",null,"2014","541930","Translation and interpretation services","47","697","33461","25",
"0400000US25","Massachusetts",null,"2014","54194","Veterinary services","532","8864","350009","25",
"0400000US25","Massachusetts",null,"2014","541940","Veterinary services","532","8864","350009","25",
"0400000US25","Massachusetts",null,"2014","54199","All other professional, scientific, and technical services","461","2247","181228","25",
"0400000US25","Massachusetts",null,"2014","611691","Exam preparation and tutoring","232","4438","85161","25",
"0400000US25","Massachusetts",null,"2014","55","Management of companies and enterprises","1215","87436","10596899","25",
"0400000US25","Massachusetts",null,"2014","551","Management of companies and enterprises","1215","87436","10596899","25",
"0400000US25","Massachusetts",null,"2014","5511","Management of companies and enterprises","1215","87436","10596899","25",
"0400000US25","Massachusetts",null,"2014","55111","Management of companies and enterprises","1215","87436","10596899","25",
"0400000US25","Massachusetts",null,"2014","551111","Offices of bank holding companies","7","0","20365","25",
"0400000US25","Massachusetts",null,"2014","551112","Offices of other holding companies","125","2338","248693","25",
"0400000US25","Massachusetts",null,"2014","551114","Corporate, subsidiary, and regional managing offices","1083","85018","10327841","25",
"0400000US25","Massachusetts",null,"2014","56","Administrative and support and waste management and remediation services","10400","189571","8751894","25",
"0400000US25","Massachusetts",null,"2014","561","Administrative and support services","9765","180161","8162022","25",
"0400000US25","Massachusetts",null,"2014","5611","Office administrative services","646","10004","769969","25",
"0400000US25","Massachusetts",null,"2014","56111","Office administrative services","646","10004","769969","25",
"0400000US25","Massachusetts",null,"2014","561110","Office administrative services","646","10004","769969","25",
"0400000US25","Massachusetts",null,"2014","5612","Facilities support services","139","2383","108549","25",
"0400000US25","Massachusetts",null,"2014","56121","Facilities support services","139","2383","108549","25",
"0400000US25","Massachusetts",null,"2014","561210","Facilities support services","139","2383","108549","25",
"0400000US25","Massachusetts",null,"2014","5613","Employment services","1301","83367","3900918","25",
"0400000US25","Massachusetts",null,"2014","56131","Employment placement agencies and executive search services","386","8746","654760","25",
