"0400000US54","West Virginia",null,"2013","52231","Mortgage and nonmortgage loan brokers","8","23","861","54",
"0400000US54","West Virginia",null,"2013","522310","Mortgage and nonmortgage loan brokers","8","23","861","54",
"0400000US54","West Virginia",null,"2013","52232","Financial transactions processing, reserve, and clearinghouse activities","6","0","0","54",
"0400000US54","West Virginia",null,"2013","522320","Financial transactions processing, reserve, and clearinghouse activities","6","0","0","54",
"0400000US54","West Virginia",null,"2013","52239","Other activities related to credit intermediation","4","0","1003","54",
"0400000US54","West Virginia",null,"2013","522390","Other activities related to credit intermediation","4","0","1003","54",
"0400000US54","West Virginia",null,"2013","523","Securities, commodity contracts, and other financial investments and related activities","254","1078","95986","54",
"0400000US54","West Virginia",null,"2013","5231","Securities and commodity contracts intermediation and brokerage","155","546","62177","54",
"0400000US54","West Virginia",null,"2013","52311","Investment banking and securities dealing","9","0","0","54",
"0400000US54","West Virginia",null,"2013","523110","Investment banking and securities dealing","9","0","0","54",
"0400000US54","West Virginia",null,"2013","52312","Securities brokerage","145","516","56837","54",
"0400000US54","West Virginia",null,"2013","523120","Securities brokerage","145","516","56837","54",
"0400000US54","West Virginia",null,"2013","52314","Commodity contracts brokerage","1","0","0","54",
"0400000US54","West Virginia",null,"2013","523140","Commodity contracts brokerage","1","0","0","54",
"0400000US54","West Virginia",null,"2013","5239","Other financial investment activities","99","532","33809","54",
"0400000US54","West Virginia",null,"2013","52391","Miscellaneous intermediation","22","96","5428","54",
"0400000US54","West Virginia",null,"2013","523910","Miscellaneous intermediation","22","96","5428","54",
"0400000US54","West Virginia",null,"2013","52392","Portfolio management","35","234","11835","54",
"0400000US54","West Virginia",null,"2013","523920","Portfolio management","35","234","11835","54",
"0400000US54","West Virginia",null,"2013","52393","Investment advice","29","120","12325","54",
"0400000US54","West Virginia",null,"2013","523930","Investment advice","29","120","12325","54",
"0400000US54","West Virginia",null,"2013","52399","All other financial investment activities","13","82","4221","54",
"0400000US54","West Virginia",null,"2013","523991","Trust, fiduciary, and custody activities","8","62","3391","54",
"0400000US54","West Virginia",null,"2013","523999","Miscellaneous financial investment activities","5","20","830","54",
"0400000US54","West Virginia",null,"2013","524","Insurance carriers and related activities","881","5955","295279","54",
"0400000US54","West Virginia",null,"2013","5241","Insurance carriers","133","2272","137305","54",
"0400000US54","West Virginia",null,"2013","52411","Direct life, health, and medical insurance carriers","76","1506","80813","54",
"0400000US54","West Virginia",null,"2013","524113","Direct life insurance carriers","50","0","25989","54",
"0400000US54","West Virginia",null,"2013","524114","Direct health and medical insurance carriers","26","1061","54824","54",
"0400000US54","West Virginia",null,"2013","52412","Direct insurance (except life, health, and medical) carriers","57","0","0","54",
"0400000US54","West Virginia",null,"2013","524126","Direct property and casualty insurance carriers","51","0","0","54",
"0400000US54","West Virginia",null,"2013","524127","Direct title insurance carriers","4","0","646","54",
"0400000US54","West Virginia",null,"2013","524128","Other direct insurance (except life, health, and medical) carriers","2","0","0","54",
"0400000US54","West Virginia",null,"2013","5242","Agencies, brokerages, and other insurance related activities","748","3683","157974","54",
"0400000US54","West Virginia",null,"2013","52421","Insurance agencies and brokerages","716","2894","120237","54",
"0400000US54","West Virginia",null,"2013","524210","Insurance agencies and brokerages","716","2894","120237","54",
"0400000US54","West Virginia",null,"2013","52429","Other insurance related activities","32","789","37737","54",
"0400000US54","West Virginia",null,"2013","524291","Claims adjusting","13","46","2643","54",
"0400000US54","West Virginia",null,"2013","524292","Third party administration of insurance and pension funds","15","0","0","54",
"0400000US54","West Virginia",null,"2013","524298","All other insurance related activities","4","9","290","54",
"0400000US54","West Virginia",null,"2013","53","Real estate and rental and leasing","1401","6151","221740","54",
"0400000US54","West Virginia",null,"2013","531","Real estate","1070","3555","111550","54",
"0400000US54","West Virginia",null,"2013","5311","Lessors of real estate","703","2278","71996","54",
"0400000US54","West Virginia",null,"2013","53111","Lessors of residential buildings and dwellings","403","1164","26410","54",
"0400000US54","West Virginia",null,"2013","531110","Lessors of residential buildings and dwellings","403","1164","26410","54",
"0400000US54","West Virginia",null,"2013","541922","Commercial photography","5","0","453","54",
"0400000US54","West Virginia",null,"2013","531120","Lessors of nonresidential buildings (except miniwarehouses)","192","776","25422","54",
"0400000US54","West Virginia",null,"2013","53113","Lessors of miniwarehouses and self-storage units","39","82","1352","54",
"0400000US54","West Virginia",null,"2013","531130","Lessors of miniwarehouses and self-storage units","39","82","1352","54",
"0400000US54","West Virginia",null,"2013","53119","Lessors of other real estate property","69","256","18812","54",
"0400000US54","West Virginia",null,"2013","531190","Lessors of other real estate property","69","256","18812","54",
"0400000US54","West Virginia",null,"2013","5312","Offices of real estate agents and brokers","185","432","13504","54",
"0400000US54","West Virginia",null,"2013","53121","Offices of real estate agents and brokers","185","432","13504","54",
"0400000US54","West Virginia",null,"2013","531210","Offices of real estate agents and brokers","185","432","13504","54",
"0400000US54","West Virginia",null,"2013","5313","Activities related to real estate","182","845","26050","54",
"0400000US54","West Virginia",null,"2013","53131","Real estate property managers","114","701","20395","54",
"0400000US54","West Virginia",null,"2013","531311","Residential property managers","80","546","13712","54",
"0400000US54","West Virginia",null,"2013","531312","Nonresidential property managers","34","155","6683","54",
"0400000US54","West Virginia",null,"2013","53132","Offices of real estate appraisers","54","113","3929","54",
"0400000US54","West Virginia",null,"2013","531320","Offices of real estate appraisers","54","113","3929","54",
"0400000US54","West Virginia",null,"2013","53139","Other activities related to real estate","14","0","1726","54",
"0400000US54","West Virginia",null,"2013","531390","Other activities related to real estate","14","0","1726","54",
"0400000US54","West Virginia",null,"2013","532","Rental and leasing services","319","2429","97531","54",
"0400000US54","West Virginia",null,"2013","5321","Automotive equipment rental and leasing","81","0","0","54",
"0400000US54","West Virginia",null,"2013","53211","Passenger car rental and leasing","55","0","0","54",
"0400000US54","West Virginia",null,"2013","532111","Passenger car rental","54","0","0","54",
"0400000US54","West Virginia",null,"2013","532112","Passenger car leasing","1","0","0","54",
"0400000US54","West Virginia",null,"2013","53212","Truck, utility trailer, and RV (recreational vehicle) rental and leasing","26","152","5821","54",
"0400000US54","West Virginia",null,"2013","532120","Truck, utility trailer, and RV (recreational vehicle) rental and leasing","26","152","5821","54",
"0400000US54","West Virginia",null,"2013","5322","Consumer goods rental","156","960","28515","54",
"0400000US54","West Virginia",null,"2013","53221","Consumer electronics and appliances rental","63","0","0","54",
"0400000US54","West Virginia",null,"2013","532210","Consumer electronics and appliances rental","63","0","0","54",
"0400000US54","West Virginia",null,"2013","53222","Formal wear and costume rental","4","0","0","54",
"0400000US54","West Virginia",null,"2013","532220","Formal wear and costume rental","4","0","0","54",
"0400000US54","West Virginia",null,"2013","53223","Video tape and disc rental","19","0","1605","54",
"0400000US54","West Virginia",null,"2013","532230","Video tape and disc rental","19","0","1605","54",
"0400000US54","West Virginia",null,"2013","53229","Other consumer goods rental","70","547","17485","54",
"0400000US54","West Virginia",null,"2013","532291","Home health equipment rental","49","393","13998","54",
"0400000US54","West Virginia",null,"2013","532292","Recreational goods rental","4","0","0","54",
"0400000US54","West Virginia",null,"2013","532299","All other consumer goods rental","17","129","3118","54",
"0400000US54","West Virginia",null,"2013","5323","General rental centers","18","166","5452","54",
"0400000US54","West Virginia",null,"2013","53231","General rental centers","18","166","5452","54",
"0400000US54","West Virginia",null,"2013","532310","General rental centers","18","166","5452","54",
"0400000US54","West Virginia",null,"2013","5324","Commercial and industrial machinery and equipment rental and leasing","64","766","43744","54",
"0400000US54","West Virginia",null,"2013","53241","Construction, transportation, mining, and forestry machinery and equipment rental and leasing","22","334","21069","54",
"0400000US54","West Virginia",null,"2013","532412","Construction, mining, and forestry machinery and equipment rental and leasing","22","334","21069","54",
"0400000US54","West Virginia",null,"2013","53249","Other commercial and industrial machinery and equipment rental and leasing","42","432","22675","54",
"0400000US54","West Virginia",null,"2013","532490","Other commercial and industrial machinery and equipment rental and leasing","42","432","22675","54",
"0400000US54","West Virginia",null,"2013","533","Lessors of nonfinancial intangible assets (except copyrighted works)","12","0","12659","54",
"0400000US54","West Virginia",null,"2013","5331","Lessors of nonfinancial intangible assets (except copyrighted works)","12","0","12659","54",
"0400000US54","West Virginia",null,"2013","53311","Lessors of nonfinancial intangible assets (except copyrighted works)","12","0","12659","54",
"0400000US54","West Virginia",null,"2013","533110","Lessors of nonfinancial intangible assets (except copyrighted works)","12","0","12659","54",
"0400000US54","West Virginia",null,"2013","54","Professional, scientific, and technical services","2970","25086","1190989","54",
"0400000US54","West Virginia",null,"2013","541","Professional, scientific, and technical services","2970","25086","1190989","54",
"0400000US54","West Virginia",null,"2013","5411","Legal services","976","6230","318806","54",
"0400000US54","West Virginia",null,"2013","54111","Offices of lawyers","930","6052","312419","54",
"0400000US54","West Virginia",null,"2013","541110","Offices of lawyers","930","6052","312419","54",
"0400000US54","West Virginia",null,"2013","54119","Other legal services","46","178","6387","54",
"0400000US54","West Virginia",null,"2013","541191","Title abstract and settlement offices","41","172","6214","54",
"0400000US54","West Virginia",null,"2013","541199","All other legal services","5","0","0","54",
"0400000US54","West Virginia",null,"2013","5412","Accounting, tax preparation, bookkeeping, and payroll services","544","4034","116487","54",
"0400000US54","West Virginia",null,"2013","54121","Accounting, tax preparation, bookkeeping, and payroll services","544","4034","116487","54",
"0400000US54","West Virginia",null,"2013","541211","Offices of certified public accountants","255","1608","72493","54",
"0400000US54","West Virginia",null,"2013","541213","Tax preparation services","116","1214","8929","54",
"0400000US54","West Virginia",null,"2013","541214","Payroll services","22","309","9778","54",
"0400000US54","West Virginia",null,"2013","541219","Other accounting services","151","903","25287","54",
"0400000US54","West Virginia",null,"2013","5413","Architectural, engineering, and related services","420","4318","242167","54",
"0400000US54","West Virginia",null,"2013","54131","Architectural services","37","297","18679","54",
"0400000US54","West Virginia",null,"2013","541310","Architectural services","37","297","18679","54",
"0400000US54","West Virginia",null,"2013","54132","Landscape architectural services","5","15","922","54",
"0400000US54","West Virginia",null,"2013","541320","Landscape architectural services","5","15","922","54",
"0400000US54","West Virginia",null,"2013","54133","Engineering services","212","2684","172538","54",
"0400000US54","West Virginia",null,"2013","541330","Engineering services","212","2684","172538","54",
"0400000US54","West Virginia",null,"2013","54134","Drafting services","12","0","2715","54",
"0400000US54","West Virginia",null,"2013","541340","Drafting services","12","0","2715","54",
"0400000US54","West Virginia",null,"2013","54135","Building inspection services","19","0","3702","54",
"0400000US54","West Virginia",null,"2013","541350","Building inspection services","19","0","3702","54",
"0400000US54","West Virginia",null,"2013","54136","Geophysical surveying and mapping services","4","0","0","54",
"0400000US54","West Virginia",null,"2013","541360","Geophysical surveying and mapping services","4","0","0","54",
"0400000US54","West Virginia",null,"2013","54137","Surveying and mapping (except geophysical) services","81","353","13395","54",
"0400000US54","West Virginia",null,"2013","541370","Surveying and mapping (except geophysical) services","81","353","13395","54",
"0400000US54","West Virginia",null,"2013","54138","Testing laboratories","50","789","29200","54",
"0400000US54","West Virginia",null,"2013","541380","Testing laboratories","50","789","29200","54",
"0400000US54","West Virginia",null,"2013","5414","Specialized design services","39","105","2875","54",
"0400000US54","West Virginia",null,"2013","54141","Interior design services","17","46","1585","54",
"0400000US54","West Virginia",null,"2013","541410","Interior design services","17","46","1585","54",
"0400000US54","West Virginia",null,"2013","54143","Graphic design services","22","59","1290","54",
"0400000US54","West Virginia",null,"2013","541430","Graphic design services","22","59","1290","54",
"0400000US54","West Virginia",null,"2013","5415","Computer systems design and related services","269","2818","171591","54",
"0400000US54","West Virginia",null,"2013","54151","Computer systems design and related services","269","2818","171591","54",
"0400000US54","West Virginia",null,"2013","541511","Custom computer programming services","94","905","61000","54",
"0400000US54","West Virginia",null,"2013","541512","Computer systems design services","128","1360","80347","54",
"0400000US54","West Virginia",null,"2013","541513","Computer facilities management services","33","388","18243","54",
"0400000US54","West Virginia",null,"2013","541519","Other computer related services","14","165","12001","54",
"0400000US54","West Virginia",null,"2013","5416","Management, scientific, and technical consulting services","308","2430","129256","54",
"0400000US54","West Virginia",null,"2013","54161","Management consulting services","213","1724","96262","54",
"0400000US54","West Virginia",null,"2013","541611","Administrative management and general management consulting services","134","873","56636","54",
"0400000US54","West Virginia",null,"2013","541612","Human resources consulting services","22","463","24256","54",
"0400000US54","West Virginia",null,"2013","541613","Marketing consulting services","40","109","3760","54",
"0400000US54","West Virginia",null,"2013","541614","Process, physical distribution, and logistics consulting services","14","249","8447","54",
"0400000US54","West Virginia",null,"2013","541618","Other management consulting services","3","0","0","54",
"0400000US54","West Virginia",null,"2013","54162","Environmental consulting services","43","548","23676","54",
"0400000US54","West Virginia",null,"2013","541620","Environmental consulting services","43","548","23676","54",
"0400000US54","West Virginia",null,"2013","54169","Other scientific and technical consulting services","52","158","9318","54",
"0400000US54","West Virginia",null,"2013","541690","Other scientific and technical consulting services","52","158","9318","54",
"0400000US54","West Virginia",null,"2013","5417","Scientific research and development services","53","2367","117165","54",
"0400000US54","West Virginia",null,"2013","54171","Research and development in the physical, engineering, and life sciences","44","1513","100510","54",
"0400000US54","West Virginia",null,"2013","541711","Research and development in biotechnology","5","0","0","54",
"0400000US54","West Virginia",null,"2013","541712","Research and development in the physical, engineering, and life sciences (except biotechnology)","39","1447","96053","54",
"0400000US54","West Virginia",null,"2013","54172","Research and development in the social sciences and humanities","9","0","16655","54",
"0400000US54","West Virginia",null,"2013","541720","Research and development in the social sciences and humanities","9","0","16655","54",
"0400000US54","West Virginia",null,"2013","5418","Advertising, public relations, and related services","98","672","21223","54",
"0400000US54","West Virginia",null,"2013","54181","Advertising agencies","32","151","5949","54",
"0400000US54","West Virginia",null,"2013","541810","Advertising agencies","32","151","5949","54",
"0400000US54","West Virginia",null,"2013","54182","Public relations agencies","16","76","4303","54",
"0400000US54","West Virginia",null,"2013","541820","Public relations agencies","16","76","4303","54",
"0400000US54","West Virginia",null,"2013","54183","Media buying agencies","2","0","0","54",
"0400000US54","West Virginia",null,"2013","541830","Media buying agencies","2","0","0","54",
"0400000US54","West Virginia",null,"2013","54184","Media representatives","4","0","331","54",
"0400000US54","West Virginia",null,"2013","541840","Media representatives","4","0","331","54",
"0400000US54","West Virginia",null,"2013","54185","Outdoor advertising","17","113","4257","54",
"0400000US54","West Virginia",null,"2013","541850","Outdoor advertising","17","113","4257","54",
"0400000US54","West Virginia",null,"2013","54186","Direct mail advertising","4","0","0","54",
"0400000US54","West Virginia",null,"2013","541860","Direct mail advertising","4","0","0","54",
"0400000US54","West Virginia",null,"2013","54187","Advertising material distribution services","3","0","0","54",
"0400000US54","West Virginia",null,"2013","541870","Advertising material distribution services","3","0","0","54",
"0400000US54","West Virginia",null,"2013","54189","Other services related to advertising","20","177","2203","54",
"0400000US54","West Virginia",null,"2013","541890","Other services related to advertising","20","177","2203","54",
"0400000US54","West Virginia",null,"2013","5419","Other professional, scientific, and technical services","263","2112","71419","54",
"0400000US54","West Virginia",null,"2013","54191","Marketing research and public opinion polling","3","0","0","54",
"0400000US54","West Virginia",null,"2013","541910","Marketing research and public opinion polling","3","0","0","54",
"0400000US54","West Virginia",null,"2013","54192","Photographic services","84","232","3197","54",
"0400000US54","West Virginia",null,"2013","541921","Photography studios, portrait","79","220","2744","54",
"0400000US54","West Virginia",null,"2013","611692","Automobile driving schools","2","0","0","54",
"0400000US54","West Virginia",null,"2013","54193","Translation and interpretation services","3","0","0","54",
"0400000US54","West Virginia",null,"2013","541930","Translation and interpretation services","3","0","0","54",
"0400000US54","West Virginia",null,"2013","54194","Veterinary services","153","1649","48037","54",
"0400000US54","West Virginia",null,"2013","541940","Veterinary services","153","1649","48037","54",
"0400000US54","West Virginia",null,"2013","54199","All other professional, scientific, and technical services","20","192","18938","54",
"0400000US54","West Virginia",null,"2013","541990","All other professional, scientific, and technical services","20","192","18938","54",
"0400000US54","West Virginia",null,"2013","55","Management of companies and enterprises","228","5350","330615","54",
"0400000US54","West Virginia",null,"2013","551","Management of companies and enterprises","228","5350","330615","54",
"0400000US54","West Virginia",null,"2013","5511","Management of companies and enterprises","228","5350","330615","54",
"0400000US54","West Virginia",null,"2013","55111","Management of companies and enterprises","228","5350","330615","54",
"0400000US54","West Virginia",null,"2013","551111","Offices of bank holding companies","4","0","1592","54",
"0400000US54","West Virginia",null,"2013","551112","Offices of other holding companies","24","208","27853","54",
"0400000US54","West Virginia",null,"2013","551114","Corporate, subsidiary, and regional managing offices","200","5099","301170","54",
"0400000US54","West Virginia",null,"2013","56","Administrative and support and waste management and remediation services","1473","33003","912724","54",
"0400000US54","West Virginia",null,"2013","561","Administrative and support services","1286","30480","811430","54",
"0400000US54","West Virginia",null,"2013","5611","Office administrative services","96","1490","113762","54",
"0400000US54","West Virginia",null,"2013","56111","Office administrative services","96","1490","113762","54",
"0400000US54","West Virginia",null,"2013","561110","Office administrative services","96","1490","113762","54",
"0400000US54","West Virginia",null,"2013","5612","Facilities support services","23","414","19935","54",
"0400000US54","West Virginia",null,"2013","56121","Facilities support services","23","414","19935","54",
"0400000US54","West Virginia",null,"2013","561210","Facilities support services","23","414","19935","54",
"0400000US54","West Virginia",null,"2013","5613","Employment services","172","10087","271928","54",
"0400000US54","West Virginia",null,"2013","56131","Employment placement agencies and executive search services","10","0","0","54",
"0400000US54","West Virginia",null,"2013","561311","Employment placement agencies","8","0","0","54",
"0400000US54","West Virginia",null,"2013","561312","Executive search services","2","0","0","54",
"0400000US54","West Virginia",null,"2013","56132","Temporary help services","136","6836","147851","54",
"0400000US54","West Virginia",null,"2013","561320","Temporary help services","136","6836","147851","54",
"0400000US54","West Virginia",null,"2013","56133","Professional employer organizations","26","3168","122225","54",
"0400000US54","West Virginia",null,"2013","561330","Professional employer organizations","26","3168","122225","54",
"0400000US54","West Virginia",null,"2013","5614","Business support services","112","8608","162070","54",
"0400000US54","West Virginia",null,"2013","56141","Document preparation services","14","185","3992","54",
"0400000US54","West Virginia",null,"2013","561410","Document preparation services","14","185","3992","54",
"0400000US54","West Virginia",null,"2013","56142","Telephone call centers","31","7223","134603","54",
"0400000US54","West Virginia",null,"2013","561421","Telephone answering services","10","0","0","54",
"0400000US54","West Virginia",null,"2013","561422","Telemarketing bureaus and other contact centers","21","6405","110547","54",
"0400000US54","West Virginia",null,"2013","56143","Business service centers","26","326","9361","54",
"0400000US54","West Virginia",null,"2013","561431","Private mail centers","16","0","940","54",
"0400000US54","West Virginia",null,"2013","561439","Other business service centers (including copy shops)","10","264","8421","54",
"0400000US54","West Virginia",null,"2013","56144","Collection agencies","13","0","0","54",
"0400000US54","West Virginia",null,"2013","561440","Collection agencies","13","0","0","54",
"0400000US54","West Virginia",null,"2013","56145","Credit bureaus","1","0","0","54",
"0400000US54","West Virginia",null,"2013","561450","Credit bureaus","1","0","0","54",
"0400000US54","West Virginia",null,"2013","56149","Other business support services","27","121","3151","54",
"0400000US54","West Virginia",null,"2013","561491","Repossession services","4","30","915","54",
"0400000US54","West Virginia",null,"2013","561492","Court reporting and stenotype services","20","52","1451","54",
"0400000US54","West Virginia",null,"2013","561499","All other business support services","3","0","0","54",
"0400000US54","West Virginia",null,"2013","5615","Travel arrangement and reservation services","74","672","19687","54",
"0400000US54","West Virginia",null,"2013","56151","Travel agencies","21","124","4642","54",
"0400000US54","West Virginia",null,"2013","561510","Travel agencies","21","124","4642","54",
"0400000US54","West Virginia",null,"2013","56152","Tour operators","7","20","518","54",
"0400000US54","West Virginia",null,"2013","561520","Tour operators","7","20","518","54",
"0400000US54","West Virginia",null,"2013","56159","Other travel arrangement and reservation services","46","528","14527","54",
"0400000US54","West Virginia",null,"2013","561591","Convention and visitors bureaus","31","109","3350","54",
"0400000US54","West Virginia",null,"2013","561599","All other travel arrangement and reservation services","15","0","11177","54",
"0400000US54","West Virginia",null,"2013","5616","Investigation and security services","116","3760","90058","54",
