"GEO_ID","GEO_TTL","COUNTY","YEAR","NAICS2012","NAICS2012_TTL","ESTAB","EMP","PAYANN","state",
"0400000US28","Mississippi",null,"2012","00","Total for all sectors","58644","895804","30897159","28",
"0400000US28","Mississippi",null,"2012","11","Agriculture, forestry, fishing and hunting","695","4850","169439","28",
"0400000US28","Mississippi",null,"2012","113","Forestry and logging","473","3041","106347","28",
"0400000US28","Mississippi",null,"2012","238190","Other foundation, structure, and building exterior contractors","44","516","22304","28",
"0400000US28","Mississippi",null,"2012","1131","Timber tract operations","29","73","3147","28",
"0400000US28","Mississippi",null,"2012","11311","Timber tract operations","29","73","3147","28",
"0400000US28","Mississippi",null,"2012","113110","Timber tract operations","29","73","3147","28",
"0400000US28","Mississippi",null,"2012","1132","Forest nurseries and gathering of forest products","1","0","0","28",
"0400000US28","Mississippi",null,"2012","11321","Forest nurseries and gathering of forest products","1","0","0","28",
"0400000US28","Mississippi",null,"2012","113210","Forest nurseries and gathering of forest products","1","0","0","28",
"0400000US28","Mississippi",null,"2012","1133","Logging","443","2957","102280","28",
"0400000US28","Mississippi",null,"2012","11331","Logging","443","2957","102280","28",
"0400000US28","Mississippi",null,"2012","113310","Logging","443","2957","102280","28",
"0400000US28","Mississippi",null,"2012","114","Fishing, hunting and trapping","9","0","1137","28",
"0400000US28","Mississippi",null,"2012","1141","Fishing","6","32","856","28",
"0400000US28","Mississippi",null,"2012","11411","Fishing","6","32","856","28",
"0400000US28","Mississippi",null,"2012","114111","Finfish fishing","4","26","625","28",
"0400000US28","Mississippi",null,"2012","114112","Shellfish fishing","2","0","0","28",
"0400000US28","Mississippi",null,"2012","1142","Hunting and trapping","3","0","281","28",
"0400000US28","Mississippi",null,"2012","11421","Hunting and trapping","3","0","281","28",
"0400000US28","Mississippi",null,"2012","114210","Hunting and trapping","3","0","281","28",
"0400000US28","Mississippi",null,"2012","115","Support activities for agriculture and forestry","213","1767","61955","28",
"0400000US28","Mississippi",null,"2012","1151","Support activities for crop production","108","746","28468","28",
"0400000US28","Mississippi",null,"2012","11511","Support activities for crop production","108","746","28468","28",
"0400000US28","Mississippi",null,"2012","115111","Cotton ginning","14","0","1660","28",
"0400000US28","Mississippi",null,"2012","115112","Soil preparation, planting, and cultivating","71","295","16448","28",
"0400000US28","Mississippi",null,"2012","115113","Crop harvesting, primarily by machine","2","0","0","28",
"0400000US28","Mississippi",null,"2012","115114","Postharvest crop activities (except cotton ginning)","12","179","5223","28",
"0400000US28","Mississippi",null,"2012","115115","Farm labor contractors and crew leaders","4","0","0","28",
"0400000US28","Mississippi",null,"2012","115116","Farm management services","5","0","228","28",
"0400000US28","Mississippi",null,"2012","1152","Support activities for animal production","17","300","9271","28",
"0400000US28","Mississippi",null,"2012","11521","Support activities for animal production","17","300","9271","28",
"0400000US28","Mississippi",null,"2012","115210","Support activities for animal production","17","300","9271","28",
"0400000US28","Mississippi",null,"2012","1153","Support activities for forestry","88","721","24216","28",
"0400000US28","Mississippi",null,"2012","11531","Support activities for forestry","88","721","24216","28",
"0400000US28","Mississippi",null,"2012","115310","Support activities for forestry","88","721","24216","28",
"0400000US28","Mississippi",null,"2012","21","Mining, quarrying, and oil and gas extraction","389","6487","480486","28",
"0400000US28","Mississippi",null,"2012","211","Oil and gas extraction","88","1071","126488","28",
"0400000US28","Mississippi",null,"2012","2111","Oil and gas extraction","88","1071","126488","28",
"0400000US28","Mississippi",null,"2012","21111","Oil and gas extraction","88","1071","126488","28",
"0400000US28","Mississippi",null,"2012","211111","Crude petroleum and natural gas extraction","85","994","118433","28",
"0400000US28","Mississippi",null,"2012","211112","Natural gas liquid extraction","3","0","0","28",
"0400000US28","Mississippi",null,"2012","212","Mining (except oil and gas)","43","722","34556","28",
"0400000US28","Mississippi",null,"2012","2121","Coal mining","3","0","0","28",
"0400000US28","Mississippi",null,"2012","21211","Coal mining","3","0","0","28",
"0400000US28","Mississippi",null,"2012","212111","Bituminous coal and lignite surface mining","3","0","0","28",
"0400000US28","Mississippi",null,"2012","2123","Nonmetallic mineral mining and quarrying","40","471","16502","28",
"0400000US28","Mississippi",null,"2012","21231","Stone mining and quarrying","3","0","0","28",
"0400000US28","Mississippi",null,"2012","212311","Dimension stone mining and quarrying","1","0","0","28",
"0400000US28","Mississippi",null,"2012","212312","Crushed and broken limestone mining and quarrying","2","0","0","28",
"0400000US28","Mississippi",null,"2012","21232","Sand, gravel, clay, and ceramic and refractory minerals mining and quarrying","36","429","15267","28",
"0400000US28","Mississippi",null,"2012","212321","Construction sand and gravel mining","33","308","10371","28",
"0400000US28","Mississippi",null,"2012","212324","Kaolin and ball clay mining","1","0","0","28",
"0400000US28","Mississippi",null,"2012","212325","Clay and ceramic and refractory minerals mining","2","0","0","28",
"0400000US28","Mississippi",null,"2012","21239","Other nonmetallic mineral mining and quarrying","1","0","0","28",
"0400000US28","Mississippi",null,"2012","212399","All other nonmetallic mineral mining","1","0","0","28",
"0400000US28","Mississippi",null,"2012","213","Support activities for mining","258","4694","319442","28",
"0400000US28","Mississippi",null,"2012","2131","Support activities for mining","258","4694","319442","28",
"0400000US28","Mississippi",null,"2012","21311","Support activities for mining","258","4694","319442","28",
"0400000US28","Mississippi",null,"2012","213111","Drilling oil and gas wells","44","1787","131123","28",
"0400000US28","Mississippi",null,"2012","213112","Support activities for oil and gas operations","208","2884","187424","28",
"0400000US28","Mississippi",null,"2012","213113","Support activities for coal mining","2","0","0","28",
"0400000US28","Mississippi",null,"2012","213115","Support activities for nonmetallic minerals (except fuels) mining","4","21","880","28",
"0400000US28","Mississippi",null,"2012","22","Utilities","593","9244","634402","28",
"0400000US28","Mississippi",null,"2012","221","Utilities","593","9244","634402","28",
"0400000US28","Mississippi",null,"2012","2211","Electric power generation, transmission and distribution","217","6852","547883","28",
"0400000US28","Mississippi",null,"2012","22111","Electric power generation","28","1795","165635","28",
"0400000US28","Mississippi",null,"2012","221111","Hydroelectric power generation","3","0","0","28",
"0400000US28","Mississippi",null,"2012","221112","Fossil fuel electric power generation","18","980","79939","28",
"0400000US28","Mississippi",null,"2012","221113","Nuclear electric power generation","6","0","0","28",
"0400000US28","Mississippi",null,"2012","221117","Biomass electric power generation","1","0","0","28",
"0400000US28","Mississippi",null,"2012","22112","Electric power transmission, control, and distribution","189","5057","382248","28",
"0400000US28","Mississippi",null,"2012","221121","Electric bulk power transmission and control","2","0","0","28",
"0400000US28","Mississippi",null,"2012","221122","Electric power distribution","187","5020","379322","28",
"0400000US28","Mississippi",null,"2012","2212","Natural gas distribution","39","0","36662","28",
"0400000US28","Mississippi",null,"2012","22121","Natural gas distribution","39","0","36662","28",
"0400000US28","Mississippi",null,"2012","221210","Natural gas distribution","39","0","36662","28",
"0400000US28","Mississippi",null,"2012","2213","Water, sewage and other systems","337","1716","49857","28",
"0400000US28","Mississippi",null,"2012","22131","Water supply and irrigation systems","315","1365","38309","28",
"0400000US28","Mississippi",null,"2012","221310","Water supply and irrigation systems","315","1365","38309","28",
"0400000US28","Mississippi",null,"2012","22132","Sewage treatment facilities","21","0","11159","28",
"0400000US28","Mississippi",null,"2012","221320","Sewage treatment facilities","21","0","11159","28",
"0400000US28","Mississippi",null,"2012","22133","Steam and air-conditioning supply","1","0","0","28",
"0400000US28","Mississippi",null,"2012","221330","Steam and air-conditioning supply","1","0","0","28",
"0400000US28","Mississippi",null,"2012","23","Construction","3932","41042","1719222","28",
"0400000US28","Mississippi",null,"2012","236","Construction of buildings","1007","8363","374372","28",
"0400000US28","Mississippi",null,"2012","2361","Residential building construction","631","1980","56754","28",
"0400000US28","Mississippi",null,"2012","23611","Residential building construction","631","1980","56754","28",
"0400000US28","Mississippi",null,"2012","236115","New single-family housing construction (except for-sale builders)","280","780","21292","28",
"0400000US28","Mississippi",null,"2012","236116","New multifamily housing construction (except for-sale builders)","9","118","4200","28",
"0400000US28","Mississippi",null,"2012","236117","New housing for-sale builders","114","459","15764","28",
"0400000US28","Mississippi",null,"2012","236118","Residential remodelers","228","623","15498","28",
"0400000US28","Mississippi",null,"2012","2362","Nonresidential building construction","376","6383","317618","28",
"0400000US28","Mississippi",null,"2012","23621","Industrial building construction","29","996","44698","28",
"0400000US28","Mississippi",null,"2012","236210","Industrial building construction","29","996","44698","28",
"0400000US28","Mississippi",null,"2012","23622","Commercial and institutional building construction","347","5387","272920","28",
"0400000US28","Mississippi",null,"2012","236220","Commercial and institutional building construction","347","5387","272920","28",
"0400000US28","Mississippi",null,"2012","237","Heavy and civil engineering construction","426","11203","548340","28",
"0400000US28","Mississippi",null,"2012","2371","Utility system construction","183","5755","325424","28",
"0400000US28","Mississippi",null,"2012","23711","Water and sewer line and related structures construction","110","1406","59252","28",
"0400000US28","Mississippi",null,"2012","237110","Water and sewer line and related structures construction","110","1406","59252","28",
"0400000US28","Mississippi",null,"2012","23712","Oil and gas pipeline and related structures construction","23","0","0","28",
"0400000US28","Mississippi",null,"2012","237120","Oil and gas pipeline and related structures construction","23","0","0","28",
"0400000US28","Mississippi",null,"2012","23713","Power and communication line and related structures construction","50","2882","177773","28",
"0400000US28","Mississippi",null,"2012","237130","Power and communication line and related structures construction","50","2882","177773","28",
"0400000US28","Mississippi",null,"2012","2372","Land subdivision","47","289","8276","28",
"0400000US28","Mississippi",null,"2012","23721","Land subdivision","47","289","8276","28",
"0400000US28","Mississippi",null,"2012","237210","Land subdivision","47","289","8276","28",
"0400000US28","Mississippi",null,"2012","2373","Highway, street, and bridge construction","137","4438","179284","28",
"0400000US28","Mississippi",null,"2012","23731","Highway, street, and bridge construction","137","4438","179284","28",
"0400000US28","Mississippi",null,"2012","237310","Highway, street, and bridge construction","137","4438","179284","28",
"0400000US28","Mississippi",null,"2012","2379","Other heavy and civil engineering construction","59","721","35356","28",
"0400000US28","Mississippi",null,"2012","23799","Other heavy and civil engineering construction","59","721","35356","28",
"0400000US28","Mississippi",null,"2012","237990","Other heavy and civil engineering construction","59","721","35356","28",
"0400000US28","Mississippi",null,"2012","238","Specialty trade contractors","2499","21476","796510","28",
"0400000US28","Mississippi",null,"2012","2381","Foundation, structure, and building exterior contractors","435","3269","99641","28",
"0400000US28","Mississippi",null,"2012","23811","Poured concrete foundation and structure contractors","80","524","13097","28",
"0400000US28","Mississippi",null,"2012","238110","Poured concrete foundation and structure contractors","80","524","13097","28",
"0400000US28","Mississippi",null,"2012","23812","Structural steel and precast concrete contractors","34","590","21950","28",
"0400000US28","Mississippi",null,"2012","238120","Structural steel and precast concrete contractors","34","590","21950","28",
"0400000US28","Mississippi",null,"2012","23813","Framing contractors","35","91","1500","28",
"0400000US28","Mississippi",null,"2012","238130","Framing contractors","35","91","1500","28",
"0400000US28","Mississippi",null,"2012","23814","Masonry contractors","89","451","8905","28",
"0400000US28","Mississippi",null,"2012","238140","Masonry contractors","89","451","8905","28",
"0400000US28","Mississippi",null,"2012","23815","Glass and glazing contractors","24","168","5220","28",
"0400000US28","Mississippi",null,"2012","238150","Glass and glazing contractors","24","168","5220","28",
"0400000US28","Mississippi",null,"2012","23816","Roofing contractors","93","829","24171","28",
"0400000US28","Mississippi",null,"2012","238160","Roofing contractors","93","829","24171","28",
"0400000US28","Mississippi",null,"2012","23817","Siding contractors","36","100","2494","28",
"0400000US28","Mississippi",null,"2012","238170","Siding contractors","36","100","2494","28",
"0400000US28","Mississippi",null,"2012","23819","Other foundation, structure, and building exterior contractors","44","516","22304","28",
"0400000US28","Mississippi",null,"2012","31599","Apparel accessories and other apparel manufacturing","6","0","7652","28",
"0400000US28","Mississippi",null,"2012","2382","Building equipment contractors","1162","11758","489277","28",
"0400000US28","Mississippi",null,"2012","23821","Electrical contractors and other wiring installation contractors","412","4653","210878","28",
"0400000US28","Mississippi",null,"2012","238210","Electrical contractors and other wiring installation contractors","412","4653","210878","28",
"0400000US28","Mississippi",null,"2012","23822","Plumbing, heating, and air-conditioning contractors","693","6380","246186","28",
"0400000US28","Mississippi",null,"2012","238220","Plumbing, heating, and air-conditioning contractors","693","6380","246186","28",
"0400000US28","Mississippi",null,"2012","23829","Other building equipment contractors","57","725","32213","28",
"0400000US28","Mississippi",null,"2012","238290","Other building equipment contractors","57","725","32213","28",
"0400000US28","Mississippi",null,"2012","2383","Building finishing contractors","446","2665","80599","28",
"0400000US28","Mississippi",null,"2012","23831","Drywall and insulation contractors","92","787","28396","28",
"0400000US28","Mississippi",null,"2012","238310","Drywall and insulation contractors","92","787","28396","28",
"0400000US28","Mississippi",null,"2012","23832","Painting and wall covering contractors","147","818","21911","28",
"0400000US28","Mississippi",null,"2012","238320","Painting and wall covering contractors","147","818","21911","28",
"0400000US28","Mississippi",null,"2012","23833","Flooring contractors","46","134","2771","28",
"0400000US28","Mississippi",null,"2012","238330","Flooring contractors","46","134","2771","28",
"0400000US28","Mississippi",null,"2012","23834","Tile and terrazzo contractors","27","215","5606","28",
"0400000US28","Mississippi",null,"2012","238340","Tile and terrazzo contractors","27","215","5606","28",
"0400000US28","Mississippi",null,"2012","23835","Finish carpentry contractors","107","470","14723","28",
"0400000US28","Mississippi",null,"2012","238350","Finish carpentry contractors","107","470","14723","28",
"0400000US28","Mississippi",null,"2012","23839","Other building finishing contractors","27","241","7192","28",
"0400000US28","Mississippi",null,"2012","238390","Other building finishing contractors","27","241","7192","28",
"0400000US28","Mississippi",null,"2012","2389","Other specialty trade contractors","456","3784","126993","28",
"0400000US28","Mississippi",null,"2012","23891","Site preparation contractors","313","2452","77403","28",
"0400000US28","Mississippi",null,"2012","238910","Site preparation contractors","313","2452","77403","28",
"0400000US28","Mississippi",null,"2012","23899","All other specialty trade contractors","143","1332","49590","28",
"0400000US28","Mississippi",null,"2012","238990","All other specialty trade contractors","143","1332","49590","28",
"0400000US28","Mississippi",null,"2012","31-33","Manufacturing","2243","140072","6042274","28",
"0400000US28","Mississippi",null,"2012","311","Food manufacturing","182","22326","619345","28",
"0400000US28","Mississippi",null,"2012","3111","Animal food manufacturing","20","630","24876","28",
"0400000US28","Mississippi",null,"2012","31111","Animal food manufacturing","20","630","24876","28",
"0400000US28","Mississippi",null,"2012","311111","Dog and cat food manufacturing","2","0","0","28",
"0400000US28","Mississippi",null,"2012","311119","Other animal food manufacturing","18","490","19217","28",
"0400000US28","Mississippi",null,"2012","3112","Grain and oilseed milling","7","0","0","28",
"0400000US28","Mississippi",null,"2012","31121","Flour milling and malt manufacturing","3","0","0","28",
"0400000US28","Mississippi",null,"2012","311211","Flour milling","2","0","0","28",
"0400000US28","Mississippi",null,"2012","311212","Rice milling","1","0","0","28",
"0400000US28","Mississippi",null,"2012","31122","Starch and vegetable fats and oils manufacturing","4","0","0","28",
"0400000US28","Mississippi",null,"2012","311221","Wet corn milling","1","0","0","28",
"0400000US28","Mississippi",null,"2012","311224","Soybean and other oilseed processing","3","0","0","28",
"0400000US28","Mississippi",null,"2012","3113","Sugar and confectionery product manufacturing","4","21","405","28",
"0400000US28","Mississippi",null,"2012","31135","Chocolate and chocolate confectionery manufacturing","4","21","405","28",
"0400000US28","Mississippi",null,"2012","311351","Chocolate and confectionery manufacturing from cacao beans","1","0","0","28",
"0400000US28","Mississippi",null,"2012","311352","Confectionery manufacturing from purchased chocolate","3","20","360","28",
"0400000US28","Mississippi",null,"2012","3114","Fruit and vegetable preserving and specialty food manufacturing","3","0","0","28",
"0400000US28","Mississippi",null,"2012","31141","Frozen food manufacturing","2","0","0","28",
"0400000US28","Mississippi",null,"2012","311412","Frozen specialty food manufacturing","2","0","0","28",
"0400000US28","Mississippi",null,"2012","31142","Fruit and vegetable canning, pickling, and drying","1","0","0","28",
"0400000US28","Mississippi",null,"2012","311421","Fruit and vegetable canning","1","0","0","28",
"0400000US28","Mississippi",null,"2012","3115","Dairy product manufacturing","4","597","24012","28",
"0400000US28","Mississippi",null,"2012","31151","Dairy product (except frozen) manufacturing","4","597","24012","28",
"0400000US28","Mississippi",null,"2012","311511","Fluid milk manufacturing","3","0","0","28",
"0400000US28","Mississippi",null,"2012","311513","Cheese manufacturing","1","0","0","28",
"0400000US28","Mississippi",null,"2012","3116","Animal slaughtering and processing","62","16682","441332","28",
"0400000US28","Mississippi",null,"2012","31161","Animal slaughtering and processing","62","16682","441332","28",
"0400000US28","Mississippi",null,"2012","311611","Animal (except poultry) slaughtering","26","304","6487","28",
"0400000US28","Mississippi",null,"2012","311612","Meat processed from carcasses","13","0","0","28",
"0400000US28","Mississippi",null,"2012","311613","Rendering and meat byproduct processing","3","0","20936","28",
"0400000US28","Mississippi",null,"2012","311615","Poultry processing","20","14968","386440","28",
"0400000US28","Mississippi",null,"2012","3117","Seafood product preparation and packaging","18","2368","55407","28",
"0400000US28","Mississippi",null,"2012","31171","Seafood product preparation and packaging","18","2368","55407","28",
"0400000US28","Mississippi",null,"2012","311710","Seafood product preparation and packaging","18","2368","55407","28",
"0400000US28","Mississippi",null,"2012","3118","Bakeries and tortilla manufacturing","54","1144","42568","28",
"0400000US28","Mississippi",null,"2012","31181","Bread and bakery product manufacturing","51","0","0","28",
"0400000US28","Mississippi",null,"2012","311811","Retail bakeries","39","256","3153","28",
"0400000US28","Mississippi",null,"2012","311812","Commercial bakeries","10","0","0","28",
"0400000US28","Mississippi",null,"2012","311813","Frozen cakes, pies, and other pastries manufacturing","2","0","0","28",
"0400000US28","Mississippi",null,"2012","31182","Cookie, cracker, and pasta manufacturing","3","165","7071","28",
"0400000US28","Mississippi",null,"2012","311821","Cookie and cracker manufacturing","1","0","0","28",
"0400000US28","Mississippi",null,"2012","311824","Dry pasta, dough, and flour mixes manufacturing from purchased flour","2","0","0","28",
"0400000US28","Mississippi",null,"2012","3119","Other food manufacturing","10","138","4609","28",
"0400000US28","Mississippi",null,"2012","31191","Snack food manufacturing","4","51","675","28",
"0400000US28","Mississippi",null,"2012","311911","Roasted nuts and peanut butter manufacturing","1","0","0","28",
"0400000US28","Mississippi",null,"2012","311919","Other snack food manufacturing","3","43","630","28",
"0400000US28","Mississippi",null,"2012","31192","Coffee and tea manufacturing","1","0","0","28",
"0400000US28","Mississippi",null,"2012","311920","Coffee and tea manufacturing","1","0","0","28",
"0400000US28","Mississippi",null,"2012","31193","Flavoring syrup and concentrate manufacturing","1","0","0","28",
"0400000US28","Mississippi",null,"2012","311930","Flavoring syrup and concentrate manufacturing","1","0","0","28",
"0400000US28","Mississippi",null,"2012","31194","Seasoning and dressing manufacturing","1","0","0","28",
"0400000US28","Mississippi",null,"2012","311941","Mayonnaise, dressing, and other prepared sauce manufacturing","1","0","0","28",
"0400000US28","Mississippi",null,"2012","31199","All other food manufacturing","3","0","0","28",
"0400000US28","Mississippi",null,"2012","311991","Perishable prepared food manufacturing","1","0","0","28",
"0400000US28","Mississippi",null,"2012","311999","All other miscellaneous food manufacturing","2","0","0","28",
"0400000US28","Mississippi",null,"2012","312","Beverage and tobacco product manufacturing","20","291","10322","28",
"0400000US28","Mississippi",null,"2012","3121","Beverage manufacturing","20","291","10322","28",
"0400000US28","Mississippi",null,"2012","31211","Soft drink and ice manufacturing","19","291","10282","28",
"0400000US28","Mississippi",null,"2012","312111","Soft drink manufacturing","2","0","0","28",
"0400000US28","Mississippi",null,"2012","312112","Bottled water manufacturing","6","0","1316","28",
"0400000US28","Mississippi",null,"2012","312113","Ice manufacturing","11","94","2630","28",
"0400000US28","Mississippi",null,"2012","31212","Breweries","1","0","0","28",
"0400000US28","Mississippi",null,"2012","312120","Breweries","1","0","0","28",
"0400000US28","Mississippi",null,"2012","313","Textile mills","17","1017","56162","28",
"0400000US28","Mississippi",null,"2012","3132","Fabric mills","9","0","0","28",
"0400000US28","Mississippi",null,"2012","31321","Broadwoven fabric mills","2","0","0","28",
"0400000US28","Mississippi",null,"2012","313210","Broadwoven fabric mills","2","0","0","28",
"0400000US28","Mississippi",null,"2012","31323","Nonwoven fabric mills","5","0","0","28",
"0400000US28","Mississippi",null,"2012","313230","Nonwoven fabric mills","5","0","0","28",
"0400000US28","Mississippi",null,"2012","31324","Knit fabric mills","2","0","0","28",
"0400000US28","Mississippi",null,"2012","313240","Knit fabric mills","2","0","0","28",
"0400000US28","Mississippi",null,"2012","3133","Textile and fabric finishing and fabric coating mills","8","0","0","28",
"0400000US28","Mississippi",null,"2012","31331","Textile and fabric finishing mills","6","26","791","28",
"0400000US28","Mississippi",null,"2012","313310","Textile and fabric finishing mills","6","26","791","28",
"0400000US28","Mississippi",null,"2012","31332","Fabric coating mills","2","0","0","28",
"0400000US28","Mississippi",null,"2012","313320","Fabric coating mills","2","0","0","28",
"0400000US28","Mississippi",null,"2012","314","Textile product mills","46","1352","38671","28",
"0400000US28","Mississippi",null,"2012","3141","Textile furnishings mills","12","446","12823","28",
"0400000US28","Mississippi",null,"2012","31412","Curtain and linen mills","12","446","12823","28",
"0400000US28","Mississippi",null,"2012","314120","Curtain and linen mills","12","446","12823","28",
"0400000US28","Mississippi",null,"2012","3149","Other textile product mills","34","0","0","28",
"0400000US28","Mississippi",null,"2012","31491","Textile bag and canvas mills","5","0","0","28",
"0400000US28","Mississippi",null,"2012","314910","Textile bag and canvas mills","5","0","0","28",
