"0400000US15","Hawaii",null,"2016","45111","Sporting goods stores","130","1342","25771","15",
"0400000US15","Hawaii",null,"2016","451110","Sporting goods stores","130","1342","25771","15",
"0400000US15","Hawaii",null,"2016","45112","Hobby, toy, and game stores","32","290","5787","15",
"0400000US15","Hawaii",null,"2016","451120","Hobby, toy, and game stores","32","290","5787","15",
"0400000US15","Hawaii",null,"2016","45113","Sewing, needlework, and piece goods stores","17","112","2188","15",
"0400000US15","Hawaii",null,"2016","451130","Sewing, needlework, and piece goods stores","17","112","2188","15",
"0400000US15","Hawaii",null,"2016","45114","Musical instrument and supplies stores","27","115","3249","15",
"0400000US15","Hawaii",null,"2016","451140","Musical instrument and supplies stores","27","115","3249","15",
"0400000US15","Hawaii",null,"2016","4512","Book stores and news dealers","23","323","8089","15",
"0400000US15","Hawaii",null,"2016","45121","Book stores and news dealers","23","323","8089","15",
"0400000US15","Hawaii",null,"2016","451211","Book stores","18","202","4253","15",
"0400000US15","Hawaii",null,"2016","451212","News dealers and newsstands","5","121","3836","15",
"0400000US15","Hawaii",null,"2016","452","General merchandise stores","86","12284","385993","15",
"0400000US15","Hawaii",null,"2016","4521","Department stores","38","7326","215182","15",
"0400000US15","Hawaii",null,"2016","45211","Department stores","38","7326","215182","15",
"0400000US15","Hawaii",null,"2016","452111","Department stores (except discount department stores)","17","2124","56280","15",
"0400000US15","Hawaii",null,"2016","452112","Discount department stores","21","5202","158902","15",
"0400000US15","Hawaii",null,"2016","4529","Other general merchandise stores","48","4958","170811","15",
"0400000US15","Hawaii",null,"2016","45291","Warehouse clubs and supercenters","14","4097","144726","15",
"0400000US15","Hawaii",null,"2016","452910","Warehouse clubs and supercenters","14","4097","144726","15",
"0400000US15","Hawaii",null,"2016","45299","All other general merchandise stores","34","861","26085","15",
"0400000US15","Hawaii",null,"2016","452990","All other general merchandise stores","34","861","26085","15",
"0400000US15","Hawaii",null,"2016","453","Miscellaneous store retailers","616","4642","108670","15",
"0400000US15","Hawaii",null,"2016","4531","Florists","70","368","7988","15",
"0400000US15","Hawaii",null,"2016","45311","Florists","70","368","7988","15",
"0400000US15","Hawaii",null,"2016","453110","Florists","70","368","7988","15",
"0400000US15","Hawaii",null,"2016","4532","Office supplies, stationery, and gift stores","310","2413","52792","15",
"0400000US15","Hawaii",null,"2016","45321","Office supplies and stationery stores","27","490","12028","15",
"0400000US15","Hawaii",null,"2016","453210","Office supplies and stationery stores","27","490","12028","15",
"0400000US15","Hawaii",null,"2016","45322","Gift, novelty, and souvenir stores","283","1923","40764","15",
"0400000US15","Hawaii",null,"2016","453220","Gift, novelty, and souvenir stores","283","1923","40764","15",
"0400000US15","Hawaii",null,"2016","4533","Used merchandise stores","55","715","15243","15",
"0400000US15","Hawaii",null,"2016","45331","Used merchandise stores","55","715","15243","15",
"0400000US15","Hawaii",null,"2016","453310","Used merchandise stores","55","715","15243","15",
"0400000US15","Hawaii",null,"2016","4539","Other miscellaneous store retailers","181","1146","32647","15",
"0400000US15","Hawaii",null,"2016","45391","Pet and pet supplies stores","33","376","9114","15",
"0400000US15","Hawaii",null,"2016","453910","Pet and pet supplies stores","33","376","9114","15",
"0400000US15","Hawaii",null,"2016","45392","Art dealers","68","313","9830","15",
"0400000US15","Hawaii",null,"2016","453920","Art dealers","68","313","9830","15",
"0400000US15","Hawaii",null,"2016","45393","Manufactured (mobile) home dealers","2","0","0","15",
"0400000US15","Hawaii",null,"2016","453930","Manufactured (mobile) home dealers","2","0","0","15",
"0400000US15","Hawaii",null,"2016","45399","All other miscellaneous store retailers","78","446","13280","15",
"0400000US15","Hawaii",null,"2016","453991","Tobacco stores","18","107","2197","15",
"0400000US15","Hawaii",null,"2016","453998","All other miscellaneous store retailers (except tobacco stores)","60","339","11083","15",
"0400000US15","Hawaii",null,"2016","454","Nonstore retailers","206","840","31423","15",
"0400000US15","Hawaii",null,"2016","4541","Electronic shopping and mail-order houses","87","341","11984","15",
"0400000US15","Hawaii",null,"2016","45411","Electronic shopping and mail-order houses","87","341","11984","15",
"0400000US15","Hawaii",null,"2016","454111","Electronic shopping","68","272","9913","15",
"0400000US15","Hawaii",null,"2016","454112","Electronic auctions","3","0","0","15",
"0400000US15","Hawaii",null,"2016","454113","Mail-order houses","16","68","1938","15",
"0400000US15","Hawaii",null,"2016","4542","Vending machine operators","12","47","1718","15",
"0400000US15","Hawaii",null,"2016","45421","Vending machine operators","12","47","1718","15",
"0400000US15","Hawaii",null,"2016","454210","Vending machine operators","12","47","1718","15",
"0400000US15","Hawaii",null,"2016","4543","Direct selling establishments","107","452","17721","15",
"0400000US15","Hawaii",null,"2016","45431","Fuel dealers","17","167","8838","15",
"0400000US15","Hawaii",null,"2016","454310","Fuel dealers","17","167","8838","15",
"0400000US15","Hawaii",null,"2016","45439","Other direct selling establishments","90","285","8883","15",
"0400000US15","Hawaii",null,"2016","454390","Other direct selling establishments","90","285","8883","15",
"0400000US15","Hawaii",null,"2016","48-49","Transportation and warehousing","904","30155","1544994","15",
"0400000US15","Hawaii",null,"2016","481","Air transportation","72","9474","610971","15",
"0400000US15","Hawaii",null,"2016","4811","Scheduled air transportation","59","9306","601609","15",
"0400000US15","Hawaii",null,"2016","48111","Scheduled air transportation","59","9306","601609","15",
"0400000US15","Hawaii",null,"2016","481111","Scheduled passenger air transportation","52","8799","576825","15",
"0400000US15","Hawaii",null,"2016","481112","Scheduled freight air transportation","7","0","0","15",
"0400000US15","Hawaii",null,"2016","4812","Nonscheduled air transportation","13","168","9362","15",
"0400000US15","Hawaii",null,"2016","48121","Nonscheduled air transportation","13","168","9362","15",
"0400000US15","Hawaii",null,"2016","481211","Nonscheduled chartered passenger air transportation","8","38","2552","15",
"0400000US15","Hawaii",null,"2016","481212","Nonscheduled chartered freight air transportation","2","0","0","15",
"0400000US15","Hawaii",null,"2016","481219","Other nonscheduled air transportation","3","33","2399","15",
"0400000US15","Hawaii",null,"2016","483","Water transportation","13","1388","99117","15",
"0400000US15","Hawaii",null,"2016","4831","Deep sea, coastal, and great lakes water transportation","12","1380","98817","15",
"0400000US15","Hawaii",null,"2016","48311","Deep sea, coastal, and great lakes water transportation","12","1380","98817","15",
"0400000US15","Hawaii",null,"2016","483111","Deep sea freight transportation","1","0","0","15",
"0400000US15","Hawaii",null,"2016","483112","Deep sea passenger transportation","1","0","0","15",
"0400000US15","Hawaii",null,"2016","483113","Coastal and great lakes freight transportation","7","425","50267","15",
"0400000US15","Hawaii",null,"2016","483114","Coastal and great lakes passenger transportation","3","0","0","15",
"0400000US15","Hawaii",null,"2016","5151","Radio and television broadcasting","45","856","46002","15",
"0400000US15","Hawaii",null,"2016","48321","Inland water transportation","1","0","0","15",
"0400000US15","Hawaii",null,"2016","483212","Inland water passenger transportation","1","0","0","15",
"0400000US15","Hawaii",null,"2016","484","Truck transportation","201","3680","164719","15",
"0400000US15","Hawaii",null,"2016","4841","General freight trucking","86","1345","67493","15",
"0400000US15","Hawaii",null,"2016","48411","General freight trucking, local","74","1030","48993","15",
"0400000US15","Hawaii",null,"2016","484110","General freight trucking, local","74","1030","48993","15",
"0400000US15","Hawaii",null,"2016","48412","General freight trucking, long-distance","12","315","18500","15",
"0400000US15","Hawaii",null,"2016","484121","General freight trucking, long-distance, truckload","8","287","17093","15",
"0400000US15","Hawaii",null,"2016","484122","General freight trucking, long-distance, less than truckload","4","28","1407","15",
"0400000US15","Hawaii",null,"2016","4842","Specialized freight trucking","115","2335","97226","15",
"0400000US15","Hawaii",null,"2016","48421","Used household and office goods moving","36","1225","47540","15",
"0400000US15","Hawaii",null,"2016","484210","Used household and office goods moving","36","1225","47540","15",
"0400000US15","Hawaii",null,"2016","48422","Specialized freight (except used goods) trucking, local","70","967","47621","15",
"0400000US15","Hawaii",null,"2016","484220","Specialized freight (except used goods) trucking, local","70","967","47621","15",
"0400000US15","Hawaii",null,"2016","48423","Specialized freight (except used goods) trucking, long-distance","9","143","2065","15",
"0400000US15","Hawaii",null,"2016","484230","Specialized freight (except used goods) trucking, long-distance","9","143","2065","15",
"0400000US15","Hawaii",null,"2016","485","Transit and ground passenger transportation","132","4375","171517","15",
"0400000US15","Hawaii",null,"2016","4851","Urban transit systems","6","0","0","15",
"0400000US15","Hawaii",null,"2016","48511","Urban transit systems","6","0","0","15",
"0400000US15","Hawaii",null,"2016","485113","Bus and other motor vehicle transit systems","4","0","0","15",
"0400000US15","Hawaii",null,"2016","485119","Other urban transit systems","2","0","0","15",
"0400000US15","Hawaii",null,"2016","4852","Interurban and rural bus transportation","1","0","0","15",
"0400000US15","Hawaii",null,"2016","48521","Interurban and rural bus transportation","1","0","0","15",
"0400000US15","Hawaii",null,"2016","485210","Interurban and rural bus transportation","1","0","0","15",
"0400000US15","Hawaii",null,"2016","4853","Taxi and limousine service","71","646","16090","15",
"0400000US15","Hawaii",null,"2016","48531","Taxi service","27","306","6344","15",
"0400000US15","Hawaii",null,"2016","485310","Taxi service","27","306","6344","15",
"0400000US15","Hawaii",null,"2016","48532","Limousine service","44","340","9746","15",
"0400000US15","Hawaii",null,"2016","485320","Limousine service","44","340","9746","15",
"0400000US15","Hawaii",null,"2016","4854","School and employee bus transportation","13","1008","22413","15",
"0400000US15","Hawaii",null,"2016","48541","School and employee bus transportation","13","1008","22413","15",
"0400000US15","Hawaii",null,"2016","485410","School and employee bus transportation","13","1008","22413","15",
"0400000US15","Hawaii",null,"2016","4855","Charter bus industry","5","114","4227","15",
"0400000US15","Hawaii",null,"2016","48551","Charter bus industry","5","114","4227","15",
"0400000US15","Hawaii",null,"2016","485510","Charter bus industry","5","114","4227","15",
"0400000US15","Hawaii",null,"2016","4859","Other transit and ground passenger transportation","36","1159","40129","15",
"0400000US15","Hawaii",null,"2016","48599","Other transit and ground passenger transportation","36","1159","40129","15",
"0400000US15","Hawaii",null,"2016","485991","Special needs transportation","18","520","27178","15",
"0400000US15","Hawaii",null,"2016","485999","All other transit and ground passenger transportation","18","639","12951","15",
"0400000US15","Hawaii",null,"2016","486","Pipeline transportation","1","0","0","15",
"0400000US15","Hawaii",null,"2016","4869","Other pipeline transportation","1","0","0","15",
"0400000US15","Hawaii",null,"2016","48691","Pipeline transportation of refined petroleum products","1","0","0","15",
"0400000US15","Hawaii",null,"2016","486910","Pipeline transportation of refined petroleum products","1","0","0","15",
"0400000US15","Hawaii",null,"2016","487","Scenic and sightseeing transportation","213","4834","169308","15",
"0400000US15","Hawaii",null,"2016","4871","Scenic and sightseeing transportation, land","47","1884","63220","15",
"0400000US15","Hawaii",null,"2016","48711","Scenic and sightseeing transportation, land","47","1884","63220","15",
"0400000US15","Hawaii",null,"2016","487110","Scenic and sightseeing transportation, land","47","1884","63220","15",
"0400000US15","Hawaii",null,"2016","4872","Scenic and sightseeing transportation, water","140","2294","71219","15",
"0400000US15","Hawaii",null,"2016","48721","Scenic and sightseeing transportation, water","140","2294","71219","15",
"0400000US15","Hawaii",null,"2016","487210","Scenic and sightseeing transportation, water","140","2294","71219","15",
"0400000US15","Hawaii",null,"2016","4879","Scenic and sightseeing transportation, other","26","656","34869","15",
"0400000US15","Hawaii",null,"2016","48799","Scenic and sightseeing transportation, other","26","656","34869","15",
"0400000US15","Hawaii",null,"2016","487990","Scenic and sightseeing transportation, other","26","656","34869","15",
"0400000US15","Hawaii",null,"2016","488","Support activities for transportation","163","4012","212062","15",
"0400000US15","Hawaii",null,"2016","4881","Support activities for air transportation","38","2052","48377","15",
"0400000US15","Hawaii",null,"2016","48811","Airport operations","24","1914","41176","15",
"0400000US15","Hawaii",null,"2016","488119","Other airport operations","24","1914","41176","15",
"0400000US15","Hawaii",null,"2016","48819","Other support activities for air transportation","14","138","7201","15",
"0400000US15","Hawaii",null,"2016","488190","Other support activities for air transportation","14","138","7201","15",
"0400000US15","Hawaii",null,"2016","4883","Support activities for water transportation","30","1006","124860","15",
"0400000US15","Hawaii",null,"2016","48832","Marine cargo handling","12","846","115582","15",
"0400000US15","Hawaii",null,"2016","488320","Marine cargo handling","12","846","115582","15",
"0400000US15","Hawaii",null,"2016","48833","Navigational services to shipping","11","69","5697","15",
"0400000US15","Hawaii",null,"2016","488330","Navigational services to shipping","11","69","5697","15",
"0400000US15","Hawaii",null,"2016","48839","Other support activities for water transportation","7","91","3581","15",
"0400000US15","Hawaii",null,"2016","488390","Other support activities for water transportation","7","91","3581","15",
"0400000US15","Hawaii",null,"2016","4884","Support activities for road transportation","36","191","5215","15",
"0400000US15","Hawaii",null,"2016","48841","Motor vehicle towing","36","191","5215","15",
"0400000US15","Hawaii",null,"2016","488410","Motor vehicle towing","36","191","5215","15",
"0400000US15","Hawaii",null,"2016","4885","Freight transportation arrangement","57","748","33295","15",
"0400000US15","Hawaii",null,"2016","48851","Freight transportation arrangement","57","748","33295","15",
"0400000US15","Hawaii",null,"2016","488510","Freight transportation arrangement","57","748","33295","15",
"0400000US15","Hawaii",null,"2016","4889","Other support activities for transportation","2","0","0","15",
"0400000US15","Hawaii",null,"2016","48899","Other support activities for transportation","2","0","0","15",
"0400000US15","Hawaii",null,"2016","488991","Packing and crating","2","0","0","15",
"0400000US15","Hawaii",null,"2016","492","Couriers and messengers","57","1559","65395","15",
"0400000US15","Hawaii",null,"2016","4921","Couriers and express delivery services","39","1387","60601","15",
"0400000US15","Hawaii",null,"2016","49211","Couriers and express delivery services","39","1387","60601","15",
"0400000US15","Hawaii",null,"2016","492110","Couriers and express delivery services","39","1387","60601","15",
"0400000US15","Hawaii",null,"2016","4922","Local messengers and local delivery","18","172","4794","15",
"0400000US15","Hawaii",null,"2016","49221","Local messengers and local delivery","18","172","4794","15",
"0400000US15","Hawaii",null,"2016","492210","Local messengers and local delivery","18","172","4794","15",
"0400000US15","Hawaii",null,"2016","493","Warehousing and storage","52","825","51668","15",
"0400000US15","Hawaii",null,"2016","4931","Warehousing and storage","52","825","51668","15",
"0400000US15","Hawaii",null,"2016","49311","General warehousing and storage","38","644","41153","15",
"0400000US15","Hawaii",null,"2016","493110","General warehousing and storage","38","644","41153","15",
"0400000US15","Hawaii",null,"2016","49312","Refrigerated warehousing and storage","3","0","0","15",
"0400000US15","Hawaii",null,"2016","493120","Refrigerated warehousing and storage","3","0","0","15",
"0400000US15","Hawaii",null,"2016","49319","Other warehousing and storage","11","114","6711","15",
"0400000US15","Hawaii",null,"2016","493190","Other warehousing and storage","11","114","6711","15",
"0400000US15","Hawaii",null,"2016","51","Information","516","8202","511023","15",
"0400000US15","Hawaii",null,"2016","511","Publishing industries (except internet)","105","1243","80341","15",
"0400000US15","Hawaii",null,"2016","5111","Newspaper, periodical, book, and directory publishers","73","1023","53005","15",
"0400000US15","Hawaii",null,"2016","51111","Newspaper publishers","14","0","0","15",
"0400000US15","Hawaii",null,"2016","511110","Newspaper publishers","14","0","0","15",
"0400000US15","Hawaii",null,"2016","51112","Periodical publishers","42","291","15232","15",
"0400000US15","Hawaii",null,"2016","511120","Periodical publishers","42","291","15232","15",
"0400000US15","Hawaii",null,"2016","51113","Book publishers","10","45","2417","15",
"0400000US15","Hawaii",null,"2016","511130","Book publishers","10","45","2417","15",
"0400000US15","Hawaii",null,"2016","51114","Directory and mailing list publishers","5","65","3022","15",
"0400000US15","Hawaii",null,"2016","511140","Directory and mailing list publishers","5","65","3022","15",
"0400000US15","Hawaii",null,"2016","51119","Other publishers","2","0","0","15",
"0400000US15","Hawaii",null,"2016","511191","Greeting card publishers","1","0","0","15",
"0400000US15","Hawaii",null,"2016","511199","All other publishers","1","0","0","15",
"0400000US15","Hawaii",null,"2016","5112","Software publishers","32","220","27336","15",
"0400000US15","Hawaii",null,"2016","51121","Software publishers","32","220","27336","15",
"0400000US15","Hawaii",null,"2016","511210","Software publishers","32","220","27336","15",
"0400000US15","Hawaii",null,"2016","512","Motion picture and sound recording industries","87","1087","18791","15",
"0400000US15","Hawaii",null,"2016","5121","Motion picture and video industries","72","1044","16742","15",
"0400000US15","Hawaii",null,"2016","51211","Motion picture and video production","45","297","6026","15",
"0400000US15","Hawaii",null,"2016","512110","Motion picture and video production","45","297","6026","15",
"0400000US15","Hawaii",null,"2016","51213","Motion picture and video exhibition","21","738","10380","15",
"0400000US15","Hawaii",null,"2016","512131","Motion picture theaters (except drive-ins)","20","727","9987","15",
"0400000US15","Hawaii",null,"2016","512132","Drive-in motion picture theaters","1","0","0","15",
"0400000US15","Hawaii",null,"2016","51219","Postproduction services and other motion picture and video industries","6","9","336","15",
"0400000US15","Hawaii",null,"2016","512191","Teleproduction and other postproduction services","4","7","257","15",
"0400000US15","Hawaii",null,"2016","512199","Other motion picture and video industries","2","0","0","15",
"0400000US15","Hawaii",null,"2016","5122","Sound recording industries","15","43","2049","15",
"0400000US15","Hawaii",null,"2016","51221","Record production","3","2","147","15",
"0400000US15","Hawaii",null,"2016","512210","Record production","3","2","147","15",
"0400000US15","Hawaii",null,"2016","51222","Integrated record production\/distribution","2","0","0","15",
"0400000US15","Hawaii",null,"2016","512220","Integrated record production\/distribution","2","0","0","15",
"0400000US15","Hawaii",null,"2016","51223","Music publishers","4","10","202","15",
"0400000US15","Hawaii",null,"2016","512230","Music publishers","4","10","202","15",
"0400000US15","Hawaii",null,"2016","51224","Sound recording studios","5","15","641","15",
"0400000US15","Hawaii",null,"2016","512240","Sound recording studios","5","15","641","15",
"0400000US15","Hawaii",null,"2016","51229","Other sound recording industries","1","0","0","15",
"0400000US15","Hawaii",null,"2016","512290","Other sound recording industries","1","0","0","15",
"0400000US15","Hawaii",null,"2016","515","Broadcasting (except internet)","48","871","46640","15",
"0400000US15","Hawaii",null,"2016","532112","Passenger car leasing","1","0","0","15",
"0400000US15","Hawaii",null,"2016","51511","Radio broadcasting","31","450","19928","15",
"0400000US15","Hawaii",null,"2016","515111","Radio networks","4","0","0","15",
"0400000US15","Hawaii",null,"2016","515112","Radio stations","27","384","16977","15",
"0400000US15","Hawaii",null,"2016","51512","Television broadcasting","14","406","26074","15",
"0400000US15","Hawaii",null,"2016","515120","Television broadcasting","14","406","26074","15",
"0400000US15","Hawaii",null,"2016","5152","Cable and other subscription programming","3","0","0","15",
"0400000US15","Hawaii",null,"2016","51521","Cable and other subscription programming","3","0","0","15",
"0400000US15","Hawaii",null,"2016","515210","Cable and other subscription programming","3","0","0","15",
"0400000US15","Hawaii",null,"2016","517","Telecommunications","206","4203","310685","15",
"0400000US15","Hawaii",null,"2016","5171","Wired telecommunications carriers","105","3329","256254","15",
"0400000US15","Hawaii",null,"2016","51711","Wired telecommunications carriers","105","3329","256254","15",
"0400000US15","Hawaii",null,"2016","517110","Wired telecommunications carriers","105","3329","256254","15",
"0400000US15","Hawaii",null,"2016","5172","Wireless telecommunications carriers (except satellite)","88","820","50926","15",
"0400000US15","Hawaii",null,"2016","51721","Wireless telecommunications carriers (except satellite)","88","820","50926","15",
"0400000US15","Hawaii",null,"2016","517210","Wireless telecommunications carriers (except satellite)","88","820","50926","15",
"0400000US15","Hawaii",null,"2016","5174","Satellite telecommunications","5","27","1960","15",
"0400000US15","Hawaii",null,"2016","51741","Satellite telecommunications","5","27","1960","15",
"0400000US15","Hawaii",null,"2016","517410","Satellite telecommunications","5","27","1960","15",
"0400000US15","Hawaii",null,"2016","5179","Other telecommunications","8","27","1545","15",
"0400000US15","Hawaii",null,"2016","51791","Other telecommunications","8","27","1545","15",
"0400000US15","Hawaii",null,"2016","517911","Telecommunications resellers","4","10","333","15",
"0400000US15","Hawaii",null,"2016","517919","All other telecommunications","4","17","1212","15",
"0400000US15","Hawaii",null,"2016","518","Data processing, hosting, and related services","48","714","49883","15",
"0400000US15","Hawaii",null,"2016","5182","Data processing, hosting, and related services","48","714","49883","15",
"0400000US15","Hawaii",null,"2016","51821","Data processing, hosting, and related services","48","714","49883","15",
"0400000US15","Hawaii",null,"2016","518210","Data processing, hosting, and related services","48","714","49883","15",
"0400000US15","Hawaii",null,"2016","519","Other information services","22","84","4683","15",
"0400000US15","Hawaii",null,"2016","5191","Other information services","22","84","4683","15",
"0400000US15","Hawaii",null,"2016","51911","News syndicates","1","0","0","15",
"0400000US15","Hawaii",null,"2016","519110","News syndicates","1","0","0","15",
"0400000US15","Hawaii",null,"2016","51912","Libraries and archives","1","0","0","15",
"0400000US15","Hawaii",null,"2016","519120","Libraries and archives","1","0","0","15",
"0400000US15","Hawaii",null,"2016","51913","Internet publishing and broadcasting and web search portals","17","64","4029","15",
"0400000US15","Hawaii",null,"2016","519130","Internet publishing and broadcasting and web search portals","17","64","4029","15",
"0400000US15","Hawaii",null,"2016","51919","All other information services","3","14","186","15",
"0400000US15","Hawaii",null,"2016","519190","All other information services","3","14","186","15",
"0400000US15","Hawaii",null,"2016","52","Finance and insurance","1455","19060","1288943","15",
"0400000US15","Hawaii",null,"2016","522","Credit intermediation and related activities","671","9780","633971","15",
"0400000US15","Hawaii",null,"2016","5221","Depository credit intermediation","451","8785","558138","15",
"0400000US15","Hawaii",null,"2016","52211","Commercial banking","216","4970","339376","15",
"0400000US15","Hawaii",null,"2016","522110","Commercial banking","216","4970","339376","15",
"0400000US15","Hawaii",null,"2016","52212","Savings institutions","94","1646","108914","15",
"0400000US15","Hawaii",null,"2016","522120","Savings institutions","94","1646","108914","15",
"0400000US15","Hawaii",null,"2016","52213","Credit unions","141","2169","109848","15",
"0400000US15","Hawaii",null,"2016","522130","Credit unions","141","2169","109848","15",
"0400000US15","Hawaii",null,"2016","5222","Nondepository credit intermediation","110","589","53611","15",
"0400000US15","Hawaii",null,"2016","52221","Credit card issuing","1","0","0","15",
"0400000US15","Hawaii",null,"2016","522210","Credit card issuing","1","0","0","15",
"0400000US15","Hawaii",null,"2016","52222","Sales financing","4","17","1127","15",
