"GEO_ID","GEO_TTL","COUNTY","YEAR","NAICS2012","NAICS2012_TTL","ESTAB","EMP","PAYANN","state",
"0400000US39","Ohio",null,"2014","00","Total for all sectors","250535","4636844","203868114","39",
"0400000US39","Ohio",null,"2014","11","Agriculture, forestry, fishing and hunting","268","1193","40664","39",
"0400000US39","Ohio",null,"2014","113","Forestry and logging","81","382","12079","39",
"0400000US39","Ohio",null,"2014","238130","Framing contractors","279","1067","39412","39",
"0400000US39","Ohio",null,"2014","1131","Timber tract operations","2","0","0","39",
"0400000US39","Ohio",null,"2014","11311","Timber tract operations","2","0","0","39",
"0400000US39","Ohio",null,"2014","113110","Timber tract operations","2","0","0","39",
"0400000US39","Ohio",null,"2014","1132","Forest nurseries and gathering of forest products","4","0","0","39",
"0400000US39","Ohio",null,"2014","11321","Forest nurseries and gathering of forest products","4","0","0","39",
"0400000US39","Ohio",null,"2014","113210","Forest nurseries and gathering of forest products","4","0","0","39",
"0400000US39","Ohio",null,"2014","1133","Logging","75","356","11146","39",
"0400000US39","Ohio",null,"2014","11331","Logging","75","356","11146","39",
"0400000US39","Ohio",null,"2014","113310","Logging","75","356","11146","39",
"0400000US39","Ohio",null,"2014","114","Fishing, hunting and trapping","13","24","834","39",
"0400000US39","Ohio",null,"2014","1141","Fishing","6","4","296","39",
"0400000US39","Ohio",null,"2014","11411","Fishing","6","4","296","39",
"0400000US39","Ohio",null,"2014","114111","Finfish fishing","6","4","296","39",
"0400000US39","Ohio",null,"2014","1142","Hunting and trapping","7","0","538","39",
"0400000US39","Ohio",null,"2014","11421","Hunting and trapping","7","0","538","39",
"0400000US39","Ohio",null,"2014","114210","Hunting and trapping","7","0","538","39",
"0400000US39","Ohio",null,"2014","115","Support activities for agriculture and forestry","174","787","27751","39",
"0400000US39","Ohio",null,"2014","1151","Support activities for crop production","57","395","17652","39",
"0400000US39","Ohio",null,"2014","11511","Support activities for crop production","57","395","17652","39",
"0400000US39","Ohio",null,"2014","115112","Soil preparation, planting, and cultivating","33","140","5810","39",
"0400000US39","Ohio",null,"2014","115113","Crop harvesting, primarily by machine","5","0","814","39",
"0400000US39","Ohio",null,"2014","115114","Postharvest crop activities (except cotton ginning)","9","191","9555","39",
"0400000US39","Ohio",null,"2014","115115","Farm labor contractors and crew leaders","3","0","0","39",
"0400000US39","Ohio",null,"2014","115116","Farm management services","7","0","437","39",
"0400000US39","Ohio",null,"2014","1152","Support activities for animal production","109","376","9347","39",
"0400000US39","Ohio",null,"2014","11521","Support activities for animal production","109","376","9347","39",
"0400000US39","Ohio",null,"2014","115210","Support activities for animal production","109","376","9347","39",
"0400000US39","Ohio",null,"2014","1153","Support activities for forestry","8","0","752","39",
"0400000US39","Ohio",null,"2014","11531","Support activities for forestry","8","0","752","39",
"0400000US39","Ohio",null,"2014","115310","Support activities for forestry","8","0","752","39",
"0400000US39","Ohio",null,"2014","21","Mining, quarrying, and oil and gas extraction","738","11060","806814","39",
"0400000US39","Ohio",null,"2014","211","Oil and gas extraction","202","1691","108442","39",
"0400000US39","Ohio",null,"2014","2111","Oil and gas extraction","202","1691","108442","39",
"0400000US39","Ohio",null,"2014","21111","Oil and gas extraction","202","1691","108442","39",
"0400000US39","Ohio",null,"2014","211111","Crude petroleum and natural gas extraction","189","1505","86850","39",
"0400000US39","Ohio",null,"2014","211112","Natural gas liquid extraction","13","0","21592","39",
"0400000US39","Ohio",null,"2014","212","Mining (except oil and gas)","272","5747","419262","39",
"0400000US39","Ohio",null,"2014","2121","Coal mining","62","2897","240877","39",
"0400000US39","Ohio",null,"2014","21211","Coal mining","62","2897","240877","39",
"0400000US39","Ohio",null,"2014","212111","Bituminous coal and lignite surface mining","48","0","0","39",
"0400000US39","Ohio",null,"2014","212112","Bituminous coal underground mining","13","1979","187030","39",
"0400000US39","Ohio",null,"2014","212113","Anthracite mining","1","0","0","39",
"0400000US39","Ohio",null,"2014","2122","Metal ore mining","1","0","0","39",
"0400000US39","Ohio",null,"2014","21221","Iron ore mining","1","0","0","39",
"0400000US39","Ohio",null,"2014","212210","Iron ore mining","1","0","0","39",
"0400000US39","Ohio",null,"2014","2123","Nonmetallic mineral mining and quarrying","209","2841","176133","39",
"0400000US39","Ohio",null,"2014","21231","Stone mining and quarrying","92","1335","83716","39",
"0400000US39","Ohio",null,"2014","212311","Dimension stone mining and quarrying","2","0","0","39",
"0400000US39","Ohio",null,"2014","212312","Crushed and broken limestone mining and quarrying","80","1284","81638","39",
"0400000US39","Ohio",null,"2014","212313","Crushed and broken granite mining and quarrying","4","15","489","39",
"0400000US39","Ohio",null,"2014","212319","Other crushed and broken stone mining and quarrying","6","0","0","39",
"0400000US39","Ohio",null,"2014","21232","Sand, gravel, clay, and ceramic and refractory minerals mining and quarrying","109","1157","64112","39",
"0400000US39","Ohio",null,"2014","212321","Construction sand and gravel mining","99","1061","56206","39",
"0400000US39","Ohio",null,"2014","212322","Industrial sand mining","6","83","7134","39",
"0400000US39","Ohio",null,"2014","212324","Kaolin and ball clay mining","1","0","0","39",
"0400000US39","Ohio",null,"2014","212325","Clay and ceramic and refractory minerals mining","3","0","647","39",
"0400000US39","Ohio",null,"2014","21239","Other nonmetallic mineral mining and quarrying","8","349","28305","39",
"0400000US39","Ohio",null,"2014","212393","Other chemical and fertilizer mineral mining","3","0","0","39",
"0400000US39","Ohio",null,"2014","212399","All other nonmetallic mineral mining","5","18","1314","39",
"0400000US39","Ohio",null,"2014","213","Support activities for mining","264","3622","279110","39",
"0400000US39","Ohio",null,"2014","2131","Support activities for mining","264","3622","279110","39",
"0400000US39","Ohio",null,"2014","21311","Support activities for mining","264","3622","279110","39",
"0400000US39","Ohio",null,"2014","213111","Drilling oil and gas wells","68","895","57284","39",
"0400000US39","Ohio",null,"2014","213112","Support activities for oil and gas operations","176","2509","208286","39",
"0400000US39","Ohio",null,"2014","213113","Support activities for coal mining","11","156","9863","39",
"0400000US39","Ohio",null,"2014","213114","Support activities for metal mining","2","0","0","39",
"0400000US39","Ohio",null,"2014","213115","Support activities for nonmetallic minerals (except fuels) mining","7","0","0","39",
"0400000US39","Ohio",null,"2014","22","Utilities","630","24334","2331428","39",
"0400000US39","Ohio",null,"2014","221","Utilities","630","24334","2331428","39",
"0400000US39","Ohio",null,"2014","2211","Electric power generation, transmission and distribution","408","0","0","39",
"0400000US39","Ohio",null,"2014","22111","Electric power generation","86","6507","624134","39",
"0400000US39","Ohio",null,"2014","221111","Hydroelectric power generation","2","0","0","39",
"0400000US39","Ohio",null,"2014","221112","Fossil fuel electric power generation","65","4625","429183","39",
"0400000US39","Ohio",null,"2014","221113","Nuclear electric power generation","7","0","0","39",
"0400000US39","Ohio",null,"2014","221114","Solar electric power generation","1","0","0","39",
"0400000US39","Ohio",null,"2014","221115","Wind electric power generation","3","0","0","39",
"0400000US39","Ohio",null,"2014","221117","Biomass electric power generation","3","6","647","39",
"0400000US39","Ohio",null,"2014","221118","Other electric power generation","5","0","0","39",
"0400000US39","Ohio",null,"2014","22112","Electric power transmission, control, and distribution","322","0","0","39",
"0400000US39","Ohio",null,"2014","221121","Electric bulk power transmission and control","23","0","0","39",
"0400000US39","Ohio",null,"2014","221122","Electric power distribution","299","0","0","39",
"0400000US39","Ohio",null,"2014","2212","Natural gas distribution","121","3601","283453","39",
"0400000US39","Ohio",null,"2014","22121","Natural gas distribution","121","3601","283453","39",
"0400000US39","Ohio",null,"2014","221210","Natural gas distribution","121","3601","283453","39",
"0400000US39","Ohio",null,"2014","2213","Water, sewage and other systems","101","1116","59518","39",
"0400000US39","Ohio",null,"2014","22131","Water supply and irrigation systems","82","773","39886","39",
"0400000US39","Ohio",null,"2014","221310","Water supply and irrigation systems","82","773","39886","39",
"0400000US39","Ohio",null,"2014","22132","Sewage treatment facilities","13","0","0","39",
"0400000US39","Ohio",null,"2014","221320","Sewage treatment facilities","13","0","0","39",
"0400000US39","Ohio",null,"2014","22133","Steam and air-conditioning supply","6","127","8180","39",
"0400000US39","Ohio",null,"2014","221330","Steam and air-conditioning supply","6","127","8180","39",
"0400000US39","Ohio",null,"2014","23","Construction","19603","171719","10015161","39",
"0400000US39","Ohio",null,"2014","236","Construction of buildings","5405","36845","2036112","39",
"0400000US39","Ohio",null,"2014","2361","Residential building construction","4046","14934","650213","39",
"0400000US39","Ohio",null,"2014","23611","Residential building construction","4046","14934","650213","39",
"0400000US39","Ohio",null,"2014","236115","New single-family housing construction (except for-sale builders)","1137","3650","149065","39",
"0400000US39","Ohio",null,"2014","236116","New multifamily housing construction (except for-sale builders)","70","0","0","39",
"0400000US39","Ohio",null,"2014","236117","New housing for-sale builders","264","1889","121856","39",
"0400000US39","Ohio",null,"2014","236118","Residential remodelers","2575","8845","327869","39",
"0400000US39","Ohio",null,"2014","2362","Nonresidential building construction","1359","21911","1385899","39",
"0400000US39","Ohio",null,"2014","23621","Industrial building construction","106","3422","215756","39",
"0400000US39","Ohio",null,"2014","236210","Industrial building construction","106","3422","215756","39",
"0400000US39","Ohio",null,"2014","23622","Commercial and institutional building construction","1253","18489","1170143","39",
"0400000US39","Ohio",null,"2014","236220","Commercial and institutional building construction","1253","18489","1170143","39",
"0400000US39","Ohio",null,"2014","237","Heavy and civil engineering construction","1110","24570","1997375","39",
"0400000US39","Ohio",null,"2014","2371","Utility system construction","536","12840","959711","39",
"0400000US39","Ohio",null,"2014","23711","Water and sewer line and related structures construction","309","3610","248025","39",
"0400000US39","Ohio",null,"2014","237110","Water and sewer line and related structures construction","309","3610","248025","39",
"0400000US39","Ohio",null,"2014","23712","Oil and gas pipeline and related structures construction","77","4471","373318","39",
"0400000US39","Ohio",null,"2014","237120","Oil and gas pipeline and related structures construction","77","4471","373318","39",
"0400000US39","Ohio",null,"2014","23713","Power and communication line and related structures construction","150","4759","338368","39",
"0400000US39","Ohio",null,"2014","237130","Power and communication line and related structures construction","150","4759","338368","39",
"0400000US39","Ohio",null,"2014","2372","Land subdivision","126","456","24329","39",
"0400000US39","Ohio",null,"2014","23721","Land subdivision","126","456","24329","39",
"0400000US39","Ohio",null,"2014","237210","Land subdivision","126","456","24329","39",
"0400000US39","Ohio",null,"2014","2373","Highway, street, and bridge construction","336","8214","841565","39",
"0400000US39","Ohio",null,"2014","23731","Highway, street, and bridge construction","336","8214","841565","39",
"0400000US39","Ohio",null,"2014","237310","Highway, street, and bridge construction","336","8214","841565","39",
"0400000US39","Ohio",null,"2014","2379","Other heavy and civil engineering construction","112","3060","171770","39",
"0400000US39","Ohio",null,"2014","23799","Other heavy and civil engineering construction","112","3060","171770","39",
"0400000US39","Ohio",null,"2014","237990","Other heavy and civil engineering construction","112","3060","171770","39",
"0400000US39","Ohio",null,"2014","238","Specialty trade contractors","13088","110304","5981674","39",
"0400000US39","Ohio",null,"2014","2381","Foundation, structure, and building exterior contractors","3090","22486","1170701","39",
"0400000US39","Ohio",null,"2014","23811","Poured concrete foundation and structure contractors","762","7040","387973","39",
"0400000US39","Ohio",null,"2014","238110","Poured concrete foundation and structure contractors","762","7040","387973","39",
"0400000US39","Ohio",null,"2014","23812","Structural steel and precast concrete contractors","111","1851","109087","39",
"0400000US39","Ohio",null,"2014","238120","Structural steel and precast concrete contractors","111","1851","109087","39",
"0400000US39","Ohio",null,"2014","23813","Framing contractors","279","1067","39412","39",
"0400000US39","Ohio",null,"2014","31322","Narrow fabric mills and schiffli machine embroidery","5","0","0","39",
"0400000US39","Ohio",null,"2014","23814","Masonry contractors","726","3578","186416","39",
"0400000US39","Ohio",null,"2014","238140","Masonry contractors","726","3578","186416","39",
"0400000US39","Ohio",null,"2014","23815","Glass and glazing contractors","150","1316","64562","39",
"0400000US39","Ohio",null,"2014","238150","Glass and glazing contractors","150","1316","64562","39",
"0400000US39","Ohio",null,"2014","23816","Roofing contractors","712","5986","300424","39",
"0400000US39","Ohio",null,"2014","238160","Roofing contractors","712","5986","300424","39",
"0400000US39","Ohio",null,"2014","23817","Siding contractors","243","957","47852","39",
"0400000US39","Ohio",null,"2014","238170","Siding contractors","243","957","47852","39",
"0400000US39","Ohio",null,"2014","23819","Other foundation, structure, and building exterior contractors","107","691","34975","39",
"0400000US39","Ohio",null,"2014","238190","Other foundation, structure, and building exterior contractors","107","691","34975","39",
"0400000US39","Ohio",null,"2014","2382","Building equipment contractors","5017","57126","3185339","39",
"0400000US39","Ohio",null,"2014","23821","Electrical contractors and other wiring installation contractors","1865","22431","1259939","39",
"0400000US39","Ohio",null,"2014","238210","Electrical contractors and other wiring installation contractors","1865","22431","1259939","39",
"0400000US39","Ohio",null,"2014","23822","Plumbing, heating, and air-conditioning contractors","2898","30449","1658022","39",
"0400000US39","Ohio",null,"2014","238220","Plumbing, heating, and air-conditioning contractors","2898","30449","1658022","39",
"0400000US39","Ohio",null,"2014","23829","Other building equipment contractors","254","4246","267378","39",
"0400000US39","Ohio",null,"2014","238290","Other building equipment contractors","254","4246","267378","39",
"0400000US39","Ohio",null,"2014","2383","Building finishing contractors","2816","17496","809706","39",
"0400000US39","Ohio",null,"2014","23831","Drywall and insulation contractors","447","5129","238881","39",
"0400000US39","Ohio",null,"2014","238310","Drywall and insulation contractors","447","5129","238881","39",
"0400000US39","Ohio",null,"2014","23832","Painting and wall covering contractors","929","4253","220274","39",
"0400000US39","Ohio",null,"2014","238320","Painting and wall covering contractors","929","4253","220274","39",
"0400000US39","Ohio",null,"2014","23833","Flooring contractors","316","1669","75104","39",
"0400000US39","Ohio",null,"2014","238330","Flooring contractors","316","1669","75104","39",
"0400000US39","Ohio",null,"2014","23834","Tile and terrazzo contractors","141","932","46112","39",
"0400000US39","Ohio",null,"2014","238340","Tile and terrazzo contractors","141","932","46112","39",
"0400000US39","Ohio",null,"2014","23835","Finish carpentry contractors","741","3559","148720","39",
"0400000US39","Ohio",null,"2014","238350","Finish carpentry contractors","741","3559","148720","39",
"0400000US39","Ohio",null,"2014","23839","Other building finishing contractors","242","1954","80615","39",
"0400000US39","Ohio",null,"2014","238390","Other building finishing contractors","242","1954","80615","39",
"0400000US39","Ohio",null,"2014","2389","Other specialty trade contractors","2165","13196","815928","39",
"0400000US39","Ohio",null,"2014","23891","Site preparation contractors","1258","8610","498764","39",
"0400000US39","Ohio",null,"2014","238910","Site preparation contractors","1258","8610","498764","39",
"0400000US39","Ohio",null,"2014","23899","All other specialty trade contractors","907","4586","317164","39",
"0400000US39","Ohio",null,"2014","238990","All other specialty trade contractors","907","4586","317164","39",
"0400000US39","Ohio",null,"2014","31-33","Manufacturing","14208","642967","35295881","39",
"0400000US39","Ohio",null,"2014","311","Food manufacturing","919","53784","2308634","39",
"0400000US39","Ohio",null,"2014","3111","Animal food manufacturing","63","2140","122212","39",
"0400000US39","Ohio",null,"2014","31111","Animal food manufacturing","63","2140","122212","39",
"0400000US39","Ohio",null,"2014","311111","Dog and cat food manufacturing","11","950","57977","39",
"0400000US39","Ohio",null,"2014","311119","Other animal food manufacturing","52","1190","64235","39",
"0400000US39","Ohio",null,"2014","3112","Grain and oilseed milling","37","2265","146922","39",
"0400000US39","Ohio",null,"2014","31121","Flour milling and malt manufacturing","19","421","25374","39",
"0400000US39","Ohio",null,"2014","311211","Flour milling","19","421","25374","39",
"0400000US39","Ohio",null,"2014","31122","Starch and vegetable fats and oils manufacturing","14","1272","82313","39",
"0400000US39","Ohio",null,"2014","311221","Wet corn milling","1","0","0","39",
"0400000US39","Ohio",null,"2014","311224","Soybean and other oilseed processing","6","0","18912","39",
"0400000US39","Ohio",null,"2014","311225","Fats and oils refining and blending","7","0","0","39",
"0400000US39","Ohio",null,"2014","31123","Breakfast cereal manufacturing","4","0","0","39",
"0400000US39","Ohio",null,"2014","311230","Breakfast cereal manufacturing","4","0","0","39",
"0400000US39","Ohio",null,"2014","3113","Sugar and confectionery product manufacturing","84","3211","75405","39",
"0400000US39","Ohio",null,"2014","31131","Sugar manufacturing","3","0","0","39",
"0400000US39","Ohio",null,"2014","311313","Beet sugar manufacturing","1","0","0","39",
"0400000US39","Ohio",null,"2014","311314","Cane sugar manufacturing","2","0","0","39",
"0400000US39","Ohio",null,"2014","31134","Nonchocolate confectionery manufacturing","23","0","0","39",
"0400000US39","Ohio",null,"2014","311340","Nonchocolate confectionery manufacturing","23","0","0","39",
"0400000US39","Ohio",null,"2014","31135","Chocolate and chocolate confectionery manufacturing","58","2444","46510","39",
"0400000US39","Ohio",null,"2014","311351","Chocolate and confectionery manufacturing from cacao beans","7","0","0","39",
"0400000US39","Ohio",null,"2014","311352","Confectionery manufacturing from purchased chocolate","51","2252","40184","39",
"0400000US39","Ohio",null,"2014","3114","Fruit and vegetable preserving and specialty food manufacturing","64","10865","499756","39",
"0400000US39","Ohio",null,"2014","31141","Frozen food manufacturing","25","7097","289342","39",
"0400000US39","Ohio",null,"2014","311411","Frozen fruit, juice, and vegetable manufacturing","4","0","0","39",
"0400000US39","Ohio",null,"2014","311412","Frozen specialty food manufacturing","21","6947","284134","39",
"0400000US39","Ohio",null,"2014","31142","Fruit and vegetable canning, pickling, and drying","39","3768","210414","39",
"0400000US39","Ohio",null,"2014","311421","Fruit and vegetable canning","30","2060","104624","39",
"0400000US39","Ohio",null,"2014","311422","Specialty canning","6","0","0","39",
"0400000US39","Ohio",null,"2014","311423","Dried and dehydrated food manufacturing","3","0","0","39",
"0400000US39","Ohio",null,"2014","3115","Dairy product manufacturing","54","5124","242928","39",
"0400000US39","Ohio",null,"2014","31151","Dairy product (except frozen) manufacturing","44","4504","220648","39",
"0400000US39","Ohio",null,"2014","311511","Fluid milk manufacturing","16","2247","110829","39",
"0400000US39","Ohio",null,"2014","311512","Creamery butter manufacturing","2","0","0","39",
"0400000US39","Ohio",null,"2014","311513","Cheese manufacturing","22","1873","83464","39",
"0400000US39","Ohio",null,"2014","311514","Dry, condensed, and evaporated dairy product manufacturing","4","0","0","39",
"0400000US39","Ohio",null,"2014","31152","Ice cream and frozen dessert manufacturing","10","620","22280","39",
"0400000US39","Ohio",null,"2014","311520","Ice cream and frozen dessert manufacturing","10","620","22280","39",
"0400000US39","Ohio",null,"2014","3116","Animal slaughtering and processing","146","10223","362860","39",
"0400000US39","Ohio",null,"2014","31161","Animal slaughtering and processing","146","10223","362860","39",
"0400000US39","Ohio",null,"2014","311611","Animal (except poultry) slaughtering","62","1081","34794","39",
"0400000US39","Ohio",null,"2014","311612","Meat processed from carcasses","59","5251","203108","39",
"0400000US39","Ohio",null,"2014","311613","Rendering and meat byproduct processing","8","0","0","39",
"0400000US39","Ohio",null,"2014","311615","Poultry processing","17","3646","111180","39",
"0400000US39","Ohio",null,"2014","3117","Seafood product preparation and packaging","2","0","0","39",
"0400000US39","Ohio",null,"2014","31171","Seafood product preparation and packaging","2","0","0","39",
"0400000US39","Ohio",null,"2014","311710","Seafood product preparation and packaging","2","0","0","39",
"0400000US39","Ohio",null,"2014","3118","Bakeries and tortilla manufacturing","356","11341","440720","39",
"0400000US39","Ohio",null,"2014","31181","Bread and bakery product manufacturing","317","6724","211274","39",
"0400000US39","Ohio",null,"2014","311811","Retail bakeries","197","1634","24944","39",
"0400000US39","Ohio",null,"2014","311812","Commercial bakeries","115","4791","169820","39",
"0400000US39","Ohio",null,"2014","311813","Frozen cakes, pies, and other pastries manufacturing","5","299","16510","39",
"0400000US39","Ohio",null,"2014","31182","Cookie, cracker, and pasta manufacturing","36","4590","228985","39",
"0400000US39","Ohio",null,"2014","311821","Cookie and cracker manufacturing","17","3617","179864","39",
"0400000US39","Ohio",null,"2014","311824","Dry pasta, dough, and flour mixes manufacturing from purchased flour","19","973","49121","39",
"0400000US39","Ohio",null,"2014","31183","Tortilla manufacturing","3","27","461","39",
"0400000US39","Ohio",null,"2014","311830","Tortilla manufacturing","3","27","461","39",
"0400000US39","Ohio",null,"2014","3119","Other food manufacturing","113","8612","417821","39",
"0400000US39","Ohio",null,"2014","31191","Snack food manufacturing","26","3123","136002","39",
"0400000US39","Ohio",null,"2014","311911","Roasted nuts and peanut butter manufacturing","8","0","0","39",
"0400000US39","Ohio",null,"2014","311919","Other snack food manufacturing","18","2733","120075","39",
"0400000US39","Ohio",null,"2014","31192","Coffee and tea manufacturing","15","0","0","39",
"0400000US39","Ohio",null,"2014","311920","Coffee and tea manufacturing","15","0","0","39",
"0400000US39","Ohio",null,"2014","31193","Flavoring syrup and concentrate manufacturing","8","788","52522","39",
"0400000US39","Ohio",null,"2014","311930","Flavoring syrup and concentrate manufacturing","8","788","52522","39",
"0400000US39","Ohio",null,"2014","31194","Seasoning and dressing manufacturing","26","0","91158","39",
"0400000US39","Ohio",null,"2014","311941","Mayonnaise, dressing, and other prepared sauce manufacturing","12","0","55512","39",
"0400000US39","Ohio",null,"2014","311942","Spice and extract manufacturing","14","571","35646","39",
"0400000US39","Ohio",null,"2014","31199","All other food manufacturing","38","2936","130011","39",
"0400000US39","Ohio",null,"2014","311991","Perishable prepared food manufacturing","22","1486","67077","39",
"0400000US39","Ohio",null,"2014","311999","All other miscellaneous food manufacturing","16","1450","62934","39",
"0400000US39","Ohio",null,"2014","312","Beverage and tobacco product manufacturing","141","4743","233603","39",
"0400000US39","Ohio",null,"2014","3121","Beverage manufacturing","141","4743","233603","39",
"0400000US39","Ohio",null,"2014","31211","Soft drink and ice manufacturing","37","2495","111642","39",
"0400000US39","Ohio",null,"2014","312111","Soft drink manufacturing","16","2267","103461","39",
"0400000US39","Ohio",null,"2014","312112","Bottled water manufacturing","6","0","0","39",
"0400000US39","Ohio",null,"2014","312113","Ice manufacturing","15","0","6880","39",
"0400000US39","Ohio",null,"2014","31212","Breweries","37","1654","107809","39",
"0400000US39","Ohio",null,"2014","312120","Breweries","37","1654","107809","39",
"0400000US39","Ohio",null,"2014","31213","Wineries","60","513","11296","39",
"0400000US39","Ohio",null,"2014","312130","Wineries","60","513","11296","39",
"0400000US39","Ohio",null,"2014","31214","Distilleries","7","0","2856","39",
