"0400000US31","Nebraska",null,"2017","4533","Used merchandise stores","169","1540","24896","31",
"0400000US31","Nebraska",null,"2017","4841","General freight trucking","829","11072","522181","31",
"0400000US31","Nebraska",null,"2017","4869","Other pipeline transportation","15","58","6098","31",
"0400000US31","Nebraska",null,"2017","48691","Pipeline transportation of refined petroleum products","11","46","4901","31",
"0400000US31","Nebraska",null,"2017","486910","Pipeline transportation of refined petroleum products","11","46","4901","31",
"0400000US31","Nebraska",null,"2017","48699","All other pipeline transportation","4","0","0","31",
"0400000US31","Nebraska",null,"2017","486990","All other pipeline transportation","4","0","0","31",
"0400000US31","Nebraska",null,"2017","487","Scenic and sightseeing transportation","5","40","929","31",
"0400000US31","Nebraska",null,"2017","488","Support activities for transportation","268","3546","174799","31",
"0400000US31","Nebraska",null,"2017","5111","Newspaper, periodical, book, and directory publishers","175","3562","166755","31",
"0400000US31","Nebraska",null,"2017","517911","Telecommunications resellers","20","120","5976","31",
"0400000US31","Nebraska",null,"2017","517919","All other telecommunications","10","9","1766","31",
"0400000US31","Nebraska",null,"2017","518","Data processing, hosting, and related services","99","3975","342151","31",
"0400000US31","Nebraska",null,"2017","52231","Mortgage and nonmortgage loan brokers","19","52","3268","31",
"0400000US31","Nebraska",null,"2017","522310","Mortgage and nonmortgage loan brokers","19","52","3268","31",
"0400000US31","Nebraska",null,"2017","52232","Financial transactions processing, reserve, and clearinghouse activities","64","9446","801669","31",
"0400000US31","Nebraska",null,"2017","524126","Direct property and casualty insurance carriers","135","6467","492156","31",
"0400000US31","Nebraska",null,"2017","524127","Direct title insurance carriers","15","312","13840","31",
"0400000US31","Nebraska",null,"2017","42383","Industrial machinery and equipment merchant wholesalers","165","1737","96178","31",
"0400000US31","Nebraska",null,"2017","42391","Sporting and recreational goods and supplies merchant wholesalers","18","166","5459","31",
"0400000US31","Nebraska",null,"2017","423910","Sporting and recreational goods and supplies merchant wholesalers","18","166","5459","31",
"0400000US31","Nebraska",null,"2017","42392","Toy and hobby goods and supplies merchant wholesalers","12","164","9532","31",
"0400000US31","Nebraska",null,"2017","4241","Paper and paper product merchant wholesalers","48","632","34231","31",
"0400000US31","Nebraska",null,"2017","42411","Printing and writing paper merchant wholesalers","3","85","3128","31",
"0400000US31","Nebraska",null,"2017","424110","Printing and writing paper merchant wholesalers","3","85","3128","31",
"0400000US31","Nebraska",null,"2017","42412","Stationery and office supplies merchant wholesalers","28","339","16775","31",
"0400000US31","Nebraska",null,"2017","42441","General line grocery merchant wholesalers","11","1624","95568","31",
"0400000US31","Nebraska",null,"2017","424410","General line grocery merchant wholesalers","11","1624","95568","31",
"0400000US31","Nebraska",null,"2017","42442","Packaged frozen food merchant wholesalers","23","658","51399","31",
"0400000US31","Nebraska",null,"2017","42492","Book, periodical, and newspaper merchant wholesalers","4","334","6412","31",
"0400000US31","Nebraska",null,"2017","424920","Book, periodical, and newspaper merchant wholesalers","4","334","6412","31",
"0400000US31","Nebraska",null,"2017","42493","Flower, nursery stock, and florists' supplies merchant wholesalers","14","178","5244","31",
"0400000US31","Nebraska",null,"2017","424930","Flower, nursery stock, and florists' supplies merchant wholesalers","14","178","5244","31",
"0400000US31","Nebraska",null,"2017","42494","Tobacco and tobacco product merchant wholesalers","11","519","23744","31",
"0400000US31","Nebraska",null,"2017","424940","Tobacco and tobacco product merchant wholesalers","11","519","23744","31",
"0400000US31","Nebraska",null,"2017","42495","Paint, varnish, and supplies merchant wholesalers","14","77","3950","31",
"0400000US31","Nebraska",null,"2017","442","Furniture and home furnishings stores","257","3129","101174","31",
"0400000US31","Nebraska",null,"2017","4421","Furniture stores","106","1809","67277","31",
"0400000US31","Nebraska",null,"2017","445","Food and beverage stores","693","21034","397220","31",
"0400000US31","Nebraska",null,"2017","447","Gasoline stations","985","10378","224924","31",
"0400000US31","Nebraska",null,"2017","4511","Sporting goods, hobby, and musical instrument stores","256","3451","69685","31",
"0400000US31","Nebraska",null,"2017","45331","Used merchandise stores","169","1540","24896","31",
"0400000US31","Nebraska",null,"2017","453310","Used merchandise stores","169","1540","24896","31",
"0400000US31","Nebraska",null,"2017","48411","General freight trucking, local","270","1383","54218","31",
"0400000US31","Nebraska",null,"2017","4881","Support activities for air transportation","39","2018","101488","31",
"0400000US31","Nebraska",null,"2017","48811","Airport operations","14","716","16830","31",
"0400000US31","Nebraska",null,"2017","488119","Other airport operations","13","711","16552","31",
"0400000US31","Nebraska",null,"2017","48819","Other support activities for air transportation","25","1302","84658","31",
"0400000US31","Nebraska",null,"2017","51111","Newspaper publishers","122","2078","63267","31",
"0400000US31","Nebraska",null,"2017","5182","Data processing, hosting, and related services","99","3975","342151","31",
"0400000US31","Nebraska",null,"2017","51821","Data processing, hosting, and related services","99","3975","342151","31",
"0400000US31","Nebraska",null,"2017","522320","Financial transactions processing, reserve, and clearinghouse activities","64","9446","801669","31",
"0400000US31","Nebraska",null,"2017","52413","Reinsurance carriers","3","0","0","31",
"0400000US31","Nebraska",null,"2017","524130","Reinsurance carriers","3","0","0","31",
"0400000US31","Nebraska",null,"2017","5242","Agencies, brokerages, and other insurance related activities","1655","7995","465203","31",
"0400000US31","Nebraska",null,"2017","423830","Industrial machinery and equipment merchant wholesalers","165","1737","96178","31",
"0400000US31","Nebraska",null,"2017","423920","Toy and hobby goods and supplies merchant wholesalers","12","164","9532","31",
"0400000US31","Nebraska",null,"2017","42393","Recyclable material merchant wholesalers","62","461","23320","31",
"0400000US31","Nebraska",null,"2017","423930","Recyclable material merchant wholesalers","62","461","23320","31",
"0400000US31","Nebraska",null,"2017","424120","Stationery and office supplies merchant wholesalers","28","339","16775","31",
"0400000US31","Nebraska",null,"2017","42413","Industrial and personal service paper merchant wholesalers","17","208","14328","31",
"0400000US31","Nebraska",null,"2017","424130","Industrial and personal service paper merchant wholesalers","17","208","14328","31",
"0400000US31","Nebraska",null,"2017","424420","Packaged frozen food merchant wholesalers","23","658","51399","31",
"0400000US31","Nebraska",null,"2017","42443","Dairy product (except dried or canned) merchant wholesalers","6","0","0","31",
"0400000US31","Nebraska",null,"2017","424430","Dairy product (except dried or canned) merchant wholesalers","6","0","0","31",
"0400000US31","Nebraska",null,"2017","42445","Confectionery merchant wholesalers","13","93","3478","31",
"0400000US31","Nebraska",null,"2017","424450","Confectionery merchant wholesalers","13","93","3478","31",
"0400000US31","Nebraska",null,"2017","424950","Paint, varnish, and supplies merchant wholesalers","14","77","3950","31",
"0400000US31","Nebraska",null,"2017","42499","Other miscellaneous nondurable goods merchant wholesalers","52","298","9695","31",
"0400000US31","Nebraska",null,"2017","424990","Other miscellaneous nondurable goods merchant wholesalers","52","298","9695","31",
"0400000US31","Nebraska",null,"2017","44211","Furniture stores","106","1809","67277","31",
"0400000US31","Nebraska",null,"2017","442110","Furniture stores","106","1809","67277","31",
"0400000US31","Nebraska",null,"2017","4451","Grocery stores","449","19674","378127","31",
"0400000US31","Nebraska",null,"2017","4471","Gasoline stations","985","10378","224924","31",
"0400000US31","Nebraska",null,"2017","44711","Gasoline stations with convenience stores","802","7804","154037","31",
"0400000US31","Nebraska",null,"2017","45111","Sporting goods stores","124","2012","44091","31",
"0400000US31","Nebraska",null,"2017","451110","Sporting goods stores","124","2012","44091","31",
"0400000US31","Nebraska",null,"2017","4539","Other miscellaneous store retailers","260","1607","37532","31",
"0400000US31","Nebraska",null,"2017","484110","General freight trucking, local","270","1383","54218","31",
"0400000US31","Nebraska",null,"2017","48412","General freight trucking, long-distance","559","9689","467963","31",
"0400000US31","Nebraska",null,"2017","488190","Other support activities for air transportation","25","1302","84658","31",
"0400000US31","Nebraska",null,"2017","4882","Support activities for rail transportation","31","389","20521","31",
"0400000US31","Nebraska",null,"2017","48821","Support activities for rail transportation","31","389","20521","31",
"0400000US31","Nebraska",null,"2017","511110","Newspaper publishers","122","2078","63267","31",
"0400000US31","Nebraska",null,"2017","51112","Periodical publishers","22","1016","76316","31",
"0400000US31","Nebraska",null,"2017","54169","Other scientific and technical consulting services","186","610","37985","31",
"0400000US31","Nebraska",null,"2017","541690","Other scientific and technical consulting services","186","610","37985","31",
"0400000US31","Nebraska",null,"2017","54181","Advertising agencies","82","1834","116461","31",
"0400000US31","Nebraska",null,"2017","541810","Advertising agencies","82","1834","116461","31",
"0400000US31","Nebraska",null,"2017","54182","Public relations agencies","27","93","4690","31",
"0400000US31","Nebraska",null,"2017","54191","Marketing research and public opinion polling","23","1752","63803","31",
"0400000US31","Nebraska",null,"2017","541910","Marketing research and public opinion polling","23","1752","63803","31",
"0400000US31","Nebraska",null,"2017","54192","Photographic services","139","316","6851","31",
"0400000US31","Nebraska",null,"2017","55","Management of companies and enterprises","364","22233","1759956","31",
"0400000US31","Nebraska",null,"2017","551111","Offices of bank holding companies","27","219","21413","31",
"0400000US31","Nebraska",null,"2017","561","Administrative and support services","2583","62496","2358488","31",
"0400000US31","Nebraska",null,"2017","5612","Facilities support services","41","932","42296","31",
"0400000US31","Nebraska",null,"2017","56121","Facilities support services","41","932","42296","31",
"0400000US31","Nebraska",null,"2017","561210","Facilities support services","41","932","42296","31",
"0400000US31","Nebraska",null,"2017","561320","Temporary help services","211","19774","844392","31",
"0400000US31","Nebraska",null,"2017","561439","Other business service centers (including copy shops)","21","185","6838","31",
"0400000US31","Nebraska",null,"2017","56144","Collection agencies","37","1678","63315","31",
"0400000US31","Nebraska",null,"2017","561440","Collection agencies","37","1678","63315","31",
"0400000US31","Nebraska",null,"2017","56161","Investigation, guard, and armored car services","65","3030","79812","31",
"0400000US31","Nebraska",null,"2017","561710","Exterminating and pest control services","86","369","15447","31",
"0400000US31","Nebraska",null,"2017","56172","Janitorial services","473","6539","138226","31",
"0400000US31","Nebraska",null,"2017","56174","Carpet and upholstery cleaning services","68","254","6368","31",
"0400000US31","Nebraska",null,"2017","561740","Carpet and upholstery cleaning services","68","254","6368","31",
"0400000US31","Nebraska",null,"2017","5621","Waste collection","144","1582","67513","31",
"0400000US31","Nebraska",null,"2017","56299","All other waste management services","31","97","3631","31",
"0400000US31","Nebraska",null,"2017","562991","Septic tank and related services","29","88","3386","31",
"0400000US31","Nebraska",null,"2017","61","Educational services","563","19039","533427","31",
"0400000US31","Nebraska",null,"2017","6112","Junior colleges","4","390","7719","31",
"0400000US31","Nebraska",null,"2017","61121","Junior colleges","4","390","7719","31",
"0400000US31","Nebraska",null,"2017","611210","Junior colleges","4","390","7719","31",
"0400000US31","Nebraska",null,"2017","6113","Colleges, universities, and professional schools","29","11364","360097","31",
"0400000US31","Nebraska",null,"2017","6116","Other schools and instruction","263","2112","24449","31",
"0400000US31","Nebraska",null,"2017","61161","Fine arts schools","105","757","8058","31",
"0400000US31","Nebraska",null,"2017","5417","Scientific research and development services","66","1159","89553","31",
"0400000US31","Nebraska",null,"2017","54171","Research and development in the physical, engineering, and life sciences","63","1132","87031","31",
"0400000US31","Nebraska",null,"2017","541820","Public relations agencies","27","93","4690","31",
"0400000US31","Nebraska",null,"2017","54183","Media buying agencies","6","10","431","31",
"0400000US31","Nebraska",null,"2017","541830","Media buying agencies","6","10","431","31",
"0400000US31","Nebraska",null,"2017","54184","Media representatives","8","16","737","31",
"0400000US31","Nebraska",null,"2017","541840","Media representatives","8","16","737","31",
"0400000US31","Nebraska",null,"2017","54185","Outdoor advertising","15","72","3343","31",
"0400000US31","Nebraska",null,"2017","541850","Outdoor advertising","15","72","3343","31",
"0400000US31","Nebraska",null,"2017","541921","Photography studios, portrait","117","254","5149","31",
"0400000US31","Nebraska",null,"2017","541922","Commercial photography","22","62","1702","31",
"0400000US31","Nebraska",null,"2017","54193","Translation and interpretation services","8","19","517","31",
"0400000US31","Nebraska",null,"2017","541930","Translation and interpretation services","8","19","517","31",
"0400000US31","Nebraska",null,"2017","54194","Veterinary services","305","2658","91414","31",
"0400000US31","Nebraska",null,"2017","551","Management of companies and enterprises","364","22233","1759956","31",
"0400000US31","Nebraska",null,"2017","551112","Offices of other holding companies","52","711","93756","31",
"0400000US31","Nebraska",null,"2017","551114","Corporate, subsidiary, and regional managing offices","285","21303","1644787","31",
"0400000US31","Nebraska",null,"2017","5613","Employment services","289","32544","1372892","31",
"0400000US31","Nebraska",null,"2017","56133","Professional employer organizations","16","11695","493818","31",
"0400000US31","Nebraska",null,"2017","561330","Professional employer organizations","16","11695","493818","31",
"0400000US31","Nebraska",null,"2017","5614","Business support services","211","9062","273618","31",
"0400000US31","Nebraska",null,"2017","56145","Credit bureaus","4","128","17757","31",
"0400000US31","Nebraska",null,"2017","561450","Credit bureaus","4","128","17757","31",
"0400000US31","Nebraska",null,"2017","56149","Other business support services","57","496","32890","31",
"0400000US31","Nebraska",null,"2017","561492","Court reporting and stenotype services","20","36","1074","31",
"0400000US31","Nebraska",null,"2017","561499","All other business support services","35","453","31607","31",
"0400000US31","Nebraska",null,"2017","5615","Travel arrangement and reservation services","123","2283","89915","31",
"0400000US31","Nebraska",null,"2017","561611","Investigation services","14","65","2466","31",
"0400000US31","Nebraska",null,"2017","561612","Security guards and patrol services","42","2776","71684","31",
"0400000US31","Nebraska",null,"2017","561613","Armored car services","9","189","5662","31",
"0400000US31","Nebraska",null,"2017","56162","Security systems services","52","702","30760","31",
"0400000US31","Nebraska",null,"2017","561720","Janitorial services","473","6539","138226","31",
"0400000US31","Nebraska",null,"2017","56179","Other services to buildings and dwellings","44","202","8487","31",
"0400000US31","Nebraska",null,"2017","561790","Other services to buildings and dwellings","44","202","8487","31",
"0400000US31","Nebraska",null,"2017","5619","Other support services","123","891","32809","31",
"0400000US31","Nebraska",null,"2017","56211","Waste collection","144","1582","67513","31",
"0400000US31","Nebraska",null,"2017","562111","Solid waste collection","139","1554","65950","31",
"0400000US31","Nebraska",null,"2017","611","Educational services","563","19039","533427","31",
"0400000US31","Nebraska",null,"2017","61131","Colleges, universities, and professional schools","29","11364","360097","31",
"0400000US31","Nebraska",null,"2017","611310","Colleges, universities, and professional schools","29","11364","360097","31",
"0400000US31","Nebraska",null,"2017","6114","Business schools and computer and management training","26","95","5362","31",
"0400000US31","Nebraska",null,"2017","611610","Fine arts schools","105","757","8058","31",
"0400000US31","Nebraska",null,"2017","61162","Sports and recreation instruction","103","903","10591","31",
"0400000US31","Nebraska",null,"2017","621210","Offices of dentists","809","5418","269609","31",
"0400000US31","Nebraska",null,"2017","621492","Kidney dialysis centers","38","432","23509","31",
"0400000US31","Nebraska",null,"2017","621493","Freestanding ambulatory surgical and emergency centers","52","1020","42575","31",
"0400000US31","Nebraska",null,"2017","621498","All other outpatient care centers","98","1914","91267","31",
"0400000US31","Nebraska",null,"2017","62311","Nursing care facilities (skilled nursing facilities)","164","14157","384110","31",
"0400000US31","Nebraska",null,"2017","62412","Services for the elderly and persons with disabilities","177","4241","76633","31",
"0400000US31","Nebraska",null,"2017","624120","Services for the elderly and persons with disabilities","177","4241","76633","31",
"0400000US31","Nebraska",null,"2017","711110","Theater companies and dinner theaters","20","169","5196","31",
"0400000US31","Nebraska",null,"2017","71113","Musical groups and artists","14","269","4484","31",
"0400000US31","Nebraska",null,"2017","711130","Musical groups and artists","14","269","4484","31",
"0400000US31","Nebraska",null,"2017","7112","Spectator sports","20","648","9297","31",
"0400000US31","Nebraska",null,"2017","71121","Spectator sports","20","648","9297","31",
"0400000US31","Nebraska",null,"2017","711211","Sports teams and clubs","6","332","3573","31",
"0400000US31","Nebraska",null,"2017","711212","Racetracks","9","311","5589","31",
"0400000US31","Nebraska",null,"2017","713940","Fitness and recreational sports centers","276","6555","64524","31",
"0400000US31","Nebraska",null,"2017","72231","Food service contractors","173","2889","48887","31",
"0400000US31","Nebraska",null,"2017","722310","Food service contractors","173","2889","48887","31",
"0400000US31","Nebraska",null,"2017","8111","Automotive repair and maintenance","1397","6953","272523","31",
"0400000US31","Nebraska",null,"2017","811411","Home and garden equipment repair and maintenance","22","49","1164","31",
"0400000US31","Nebraska",null,"2017","811412","Appliance repair and maintenance","32","138","5385","31",
"0400000US31","Nebraska",null,"2017","81142","Reupholstery and furniture repair","20","56","1596","31",
"0400000US31","Nebraska",null,"2017","811420","Reupholstery and furniture repair","20","56","1596","31",
"0400000US31","Nebraska",null,"2017","8129","Other personal services","212","1387","25173","31",
"0400000US31","Nebraska",null,"2017","81291","Pet care (except veterinary) services","104","593","11021","31",
"0400000US31","Nebraska",null,"2017","813940","Political organizations","16","51","1358","31",
"0400000US31","Nebraska",null,"2017","81399","Other similar organizations (except business, professional, labor, and political organizations)","31","95","3412","31",
"0400000US31","Nebraska",null,"2017","813990","Other similar organizations (except business, professional, labor, and political organizations)","31","95","3412","31",
"0400000US31","Nebraska",null,"2017","99","Industries not classified","69","80","1204","31",
"0400000US31","Nebraska",null,"2017","611620","Sports and recreation instruction","103","903","10591","31",
"0400000US31","Nebraska",null,"2017","61169","All other schools and instruction","53","399","5149","31",
"0400000US31","Nebraska",null,"2017","6213","Offices of other health practitioners","1379","7746","313442","31",
"0400000US31","Nebraska",null,"2017","62131","Offices of chiropractors","425","1285","41045","31",
"0400000US31","Nebraska",null,"2017","6215","Medical and diagnostic laboratories","55","763","44978","31",
"0400000US31","Nebraska",null,"2017","623110","Nursing care facilities (skilled nursing facilities)","164","14157","384110","31",
"0400000US31","Nebraska",null,"2017","62419","Other individual and family services","287","3577","105004","31",
"0400000US31","Nebraska",null,"2017","711219","Other spectator sports","5","5","135","31",
"0400000US31","Nebraska",null,"2017","7113","Promoters of performing arts, sports, and similar events","65","909","21521","31",
"0400000US31","Nebraska",null,"2017","71131","Promoters of performing arts, sports, and similar events with facilities","38","804","16691","31",
"0400000US31","Nebraska",null,"2017","711310","Promoters of performing arts, sports, and similar events with facilities","38","804","16691","31",
"0400000US31","Nebraska",null,"2017","71395","Bowling centers","58","746","10353","31",
"0400000US31","Nebraska",null,"2017","72232","Caterers","64","654","10344","31",
"0400000US31","Nebraska",null,"2017","722320","Caterers","64","654","10344","31",
"0400000US31","Nebraska",null,"2017","81111","Automotive mechanical and electrical repair and maintenance","786","3508","152342","31",
"0400000US31","Nebraska",null,"2017","81149","Other personal and household goods repair and maintenance","44","131","3139","31",
"0400000US31","Nebraska",null,"2017","811490","Other personal and household goods repair and maintenance","44","131","3139","31",
"0400000US31","Nebraska",null,"2017","812","Personal and laundry services","1391","7885","180625","31",
"0400000US31","Nebraska",null,"2017","812910","Pet care (except veterinary) services","104","593","11021","31",
"0400000US31","Nebraska",null,"2017","81293","Parking lots and garages","32","471","7833","31",
"0400000US31","Nebraska",null,"2017","611691","Exam preparation and tutoring","26","246","2898","31",
"0400000US31","Nebraska",null,"2017","611692","Automobile driving schools","9","33","1025","31",
"0400000US31","Nebraska",null,"2017","611699","All other miscellaneous schools and instruction","18","120","1226","31",
"0400000US31","Nebraska",null,"2017","621310","Offices of chiropractors","425","1285","41045","31",
"0400000US31","Nebraska",null,"2017","62151","Medical and diagnostic laboratories","55","763","44978","31",
"0400000US31","Nebraska",null,"2017","621511","Medical laboratories","28","543","30086","31",
"0400000US31","Nebraska",null,"2017","621512","Diagnostic imaging centers","27","220","14892","31",
"0400000US31","Nebraska",null,"2017","6232","Residential intellectual and developmental disability, mental health, and substance abuse facilities","128","3843","112148","31",
"0400000US31","Nebraska",null,"2017","624190","Other individual and family services","287","3577","105004","31",
"0400000US31","Nebraska",null,"2017","71132","Promoters of performing arts, sports, and similar events without facilities","27","105","4830","31",
"0400000US31","Nebraska",null,"2017","711320","Promoters of performing arts, sports, and similar events without facilities","27","105","4830","31",
"0400000US31","Nebraska",null,"2017","7114","Agents and managers for artists, athletes, entertainers, and other public figures","7","10","156","31",
"0400000US31","Nebraska",null,"2017","713950","Bowling centers","58","746","10353","31",
"0400000US31","Nebraska",null,"2017","71399","All other amusement and recreation industries","125","658","12606","31",
"0400000US31","Nebraska",null,"2017","72233","Mobile food services","18","25","510","31",
"0400000US31","Nebraska",null,"2017","722330","Mobile food services","18","25","510","31",
"0400000US31","Nebraska",null,"2017","7224","Drinking places (alcoholic beverages)","547","3933","50987","31",
"0400000US31","Nebraska",null,"2017","811111","General automotive repair","710","3037","121010","31",
"0400000US31","Nebraska",null,"2017","811112","Automotive exhaust system repair","8","34","1015","31",
"0400000US31","Nebraska",null,"2017","811113","Automotive transmission repair","44","340","26618","31",
"0400000US31","Nebraska",null,"2017","8121","Personal care services","843","3847","79219","31",
"0400000US31","Nebraska",null,"2017","812930","Parking lots and garages","32","471","7833","31",
"0400000US31","Nebraska",null,"2017","81299","All other personal services","74","321","6225","31",
"0400000US31","Nebraska",null,"2017","812990","All other personal services","74","321","6225","31",
"0400000US31","Nebraska",null,"2017","6117","Educational support services","32","263","6142","31",
"0400000US31","Nebraska",null,"2017","61171","Educational support services","32","263","6142","31",
"0400000US31","Nebraska",null,"2017","611710","Educational support services","32","263","6142","31",
"0400000US31","Nebraska",null,"2017","62132","Offices of optometrists","187","1151","48677","31",
