"0400000US50","Vermont",null,"2019","326199","All other plastics product manufacturing","19","937","44777","50",
"0400000US50","Vermont",null,"2019","3262","Rubber product manufacturing","3","93","4702","50",
"0400000US50","Vermont",null,"2019","327","Nonmetallic mineral product manufacturing","100","1555","87576","50",
"0400000US50","Vermont",null,"2019","32721","Glass and glass product manufacturing","17","140","5635","50",
"0400000US50","Vermont",null,"2019","32711","Pottery, ceramics, and plumbing fixture manufacturing","10","206","11171","50",
"0400000US50","Vermont",null,"2019","327110","Pottery, ceramics, and plumbing fixture manufacturing","10","206","11171","50",
"0400000US50","Vermont",null,"2019","3272","Glass and glass product manufacturing","17","140","5635","50",
"0400000US50","Vermont",null,"2019","327212","Other pressed and blown glass and glassware manufacturing","12","80","2660","50",
"0400000US50","Vermont",null,"2019","327215","Glass product manufacturing made of purchased glass","5","60","2975","50",
"0400000US50","Vermont",null,"2019","3273","Cement and concrete product manufacturing","21","586","35362","50",
"0400000US50","Vermont",null,"2019","327390","Other concrete product manufacturing","9","388","23100","50",
"0400000US50","Vermont",null,"2019","32732","Ready-mix concrete manufacturing","12","198","12262","50",
"0400000US50","Vermont",null,"2019","327320","Ready-mix concrete manufacturing","12","198","12262","50",
"0400000US50","Vermont",null,"2019","32739","Other concrete product manufacturing","9","388","23100","50",
"0400000US50","Vermont",null,"2019","3279","Other nonmetallic mineral product manufacturing","50","604","34062","50",
"0400000US50","Vermont",null,"2019","332119","Metal crown, closure, and other metal stamping (except automotive)","4","122","6144","50",
"0400000US50","Vermont",null,"2019","32799","All other nonmetallic mineral product manufacturing","48","591","33095","50",
"0400000US50","Vermont",null,"2019","327991","Cut stone and stone product manufacturing","47","552","31156","50",
"0400000US50","Vermont",null,"2019","332","Fabricated metal product manufacturing","100","2354","131248","50",
"0400000US50","Vermont",null,"2019","3321","Forging and stamping","4","122","6144","50",
"0400000US50","Vermont",null,"2019","33211","Forging and stamping","4","122","6144","50",
"0400000US50","Vermont",null,"2019","3323","Architectural and structural metals manufacturing","24","266","13836","50",
"0400000US50","Vermont",null,"2019","33231","Plate work and fabricated structural product manufacturing","5","52","2922","50",
"0400000US50","Vermont",null,"2019","332312","Fabricated structural metal manufacturing","3","47","2645","50",
"0400000US50","Vermont",null,"2019","33232","Ornamental and architectural metal products manufacturing","19","214","10914","50",
"0400000US50","Vermont",null,"2019","33271","Machine shops","40","831","36851","50",
"0400000US50","Vermont",null,"2019","332322","Sheet metal work manufacturing","11","177","9145","50",
"0400000US50","Vermont",null,"2019","332323","Ornamental and architectural metal work manufacturing","7","36","1705","50",
"0400000US50","Vermont",null,"2019","3327","Machine shops; turned product; and screw, nut, and bolt manufacturing","47","1306","64111","50",
"0400000US50","Vermont",null,"2019","3328","Coating, engraving, heat treating, and allied activities","10","99","4661","50",
"0400000US50","Vermont",null,"2019","332710","Machine shops","40","831","36851","50",
"0400000US50","Vermont",null,"2019","33272","Turned product and screw, nut, and bolt manufacturing","7","475","27260","50",
"0400000US50","Vermont",null,"2019","332721","Precision turned product manufacturing","6","452","25007","50",
"0400000US50","Vermont",null,"2019","33281","Coating, engraving, heat treating, and allied activities","10","99","4661","50",
"0400000US50","Vermont",null,"2019","332812","Metal coating, engraving (except jewelry and silverware), and allied services to manufacturers","5","60","2584","50",
"0400000US50","Vermont",null,"2019","332813","Electroplating, plating, polishing, anodizing, and coloring","5","39","2077","50",
"0400000US50","Vermont",null,"2019","332999","All other miscellaneous fabricated metal product manufacturing","4","110","6324","50",
"0400000US50","Vermont",null,"2019","3329","Other fabricated metal product manufacturing","9","416","35795","50",
"0400000US50","Vermont",null,"2019","33299","All other fabricated metal product manufacturing","8","281","26283","50",
"0400000US50","Vermont",null,"2019","332994","Small arms, ordnance, and ordnance accessories manufacturing","4","171","19959","50",
"0400000US50","Vermont",null,"2019","333","Machinery manufacturing","61","3035","179190","50",
"0400000US50","Vermont",null,"2019","3332","Industrial machinery manufacturing","8","353","21136","50",
"0400000US50","Vermont",null,"2019","33324","Industrial machinery manufacturing","8","353","21136","50",
"0400000US50","Vermont",null,"2019","333249","Other industrial machinery manufacturing","6","293","17513","50",
"0400000US50","Vermont",null,"2019","3334","Ventilation, heating, air-conditioning, and commercial refrigeration equipment manufacturing","7","107","5392","50",
"0400000US50","Vermont",null,"2019","3333","Commercial and service industry machinery manufacturing","7","483","32087","50",
"0400000US50","Vermont",null,"2019","33331","Commercial and service industry machinery manufacturing","7","483","32087","50",
"0400000US50","Vermont",null,"2019","333314","Optical instrument and lens manufacturing","5","271","20778","50",
"0400000US50","Vermont",null,"2019","33341","Ventilation, heating, air-conditioning, and commercial refrigeration equipment manufacturing","7","107","5392","50",
"0400000US50","Vermont",null,"2019","333414","Heating equipment (except warm air furnaces) manufacturing","5","75","3899","50",
"0400000US50","Vermont",null,"2019","3335","Metalworking machinery manufacturing","21","1418","82362","50",
"0400000US50","Vermont",null,"2019","33351","Metalworking machinery manufacturing","21","1418","82362","50",
"0400000US50","Vermont",null,"2019","333511","Industrial mold manufacturing","3","264","13868","50",
"0400000US50","Vermont",null,"2019","333514","Special die and tool, die set, jig, and fixture manufacturing","8","615","45313","50",
"0400000US50","Vermont",null,"2019","333515","Cutting tool and machine tool accessory manufacturing","7","513","22018","50",
"0400000US50","Vermont",null,"2019","3339","Other general purpose machinery manufacturing","12","370","21142","50",
"0400000US50","Vermont",null,"2019","333517","Machine tool manufacturing","3","26","1163","50",
"0400000US50","Vermont",null,"2019","3336","Engine, turbine, and power transmission equipment manufacturing","4","215","14083","50",
"0400000US50","Vermont",null,"2019","33361","Engine, turbine, and power transmission equipment manufacturing","4","215","14083","50",
"0400000US50","Vermont",null,"2019","33392","Material handling equipment manufacturing","3","21","867","50",
"0400000US50","Vermont",null,"2019","33399","All other general purpose machinery manufacturing","7","215","9616","50",
"0400000US50","Vermont",null,"2019","333997","Scale and balance manufacturing","4","136","5444","50",
"0400000US50","Vermont",null,"2019","334","Computer and electronic product manufacturing","35","4247","357669","50",
"0400000US50","Vermont",null,"2019","3342","Communications equipment manufacturing","6","110","10001","50",
"0400000US50","Vermont",null,"2019","33429","Other communications equipment manufacturing","3","38","3071","50",
"0400000US50","Vermont",null,"2019","334290","Other communications equipment manufacturing","3","38","3071","50",
"0400000US50","Vermont",null,"2019","3344","Semiconductor and other electronic component manufacturing","7","2638","217676","50",
"0400000US50","Vermont",null,"2019","33441","Semiconductor and other electronic component manufacturing","7","2638","217676","50",
"0400000US50","Vermont",null,"2019","334510","Electromedical and electrotherapeutic apparatus manufacturing","6","94","4700","50",
"0400000US50","Vermont",null,"2019","334413","Semiconductor and related device manufacturing","3","2535","211573","50",
"0400000US50","Vermont",null,"2019","3345","Navigational, measuring, electromedical, and control instruments manufacturing","19","1490","129785","50",
"0400000US50","Vermont",null,"2019","33451","Navigational, measuring, electromedical, and control instruments manufacturing","19","1490","129785","50",
"0400000US50","Vermont",null,"2019","334513","Instruments and related products manufacturing for measuring, displaying, and controlling industrial process variables","3","20","780","50",
"0400000US50","Vermont",null,"2019","334515","Instrument manufacturing for measuring and testing electricity and electrical systems","3","23","2071","50",
"0400000US50","Vermont",null,"2019","334519","Other measuring and controlling device manufacturing","4","862","61131","50",
"0400000US50","Vermont",null,"2019","335","Electrical equipment, appliance, and component manufacturing","18","1110","67244","50",
"0400000US50","Vermont",null,"2019","3359","Other electrical equipment and component manufacturing","10","605","43703","50",
"0400000US50","Vermont",null,"2019","3351","Electric lighting equipment manufacturing","7","497","23093","50",
"0400000US50","Vermont",null,"2019","33512","Lighting fixture manufacturing","6","439","20125","50",
"0400000US50","Vermont",null,"2019","335121","Residential electric lighting fixture manufacturing","3","340","13436","50",
"0400000US50","Vermont",null,"2019","33592","Communication and energy wire and cable manufacturing","4","274","24053","50",
"0400000US50","Vermont",null,"2019","335929","Other communication and energy wire manufacturing","4","274","24053","50",
"0400000US50","Vermont",null,"2019","33599","All other electrical equipment and component manufacturing","4","218","14865","50",
"0400000US50","Vermont",null,"2019","335999","All other miscellaneous electrical equipment and component manufacturing","3","202","14365","50",
"0400000US50","Vermont",null,"2019","336","Transportation equipment manufacturing","19","1836","137978","50",
"0400000US50","Vermont",null,"2019","3361","Motor vehicle manufacturing","3","7","424","50",
"0400000US50","Vermont",null,"2019","3363","Motor vehicle parts manufacturing","6","408","17902","50",
"0400000US50","Vermont",null,"2019","3364","Aerospace product and parts manufacturing","5","1387","118869","50",
"0400000US50","Vermont",null,"2019","33641","Aerospace product and parts manufacturing","5","1387","118869","50",
"0400000US50","Vermont",null,"2019","337","Furniture and related product manufacturing","61","1098","42674","50",
"0400000US50","Vermont",null,"2019","3372","Office furniture (including fixtures) manufacturing","8","133","7444","50",
"0400000US50","Vermont",null,"2019","3371","Household and institutional furniture and kitchen cabinet manufacturing","51","889","32565","50",
"0400000US50","Vermont",null,"2019","33711","Wood kitchen cabinet and countertop manufacturing","18","83","4138","50",
"0400000US50","Vermont",null,"2019","337110","Wood kitchen cabinet and countertop manufacturing","18","83","4138","50",
"0400000US50","Vermont",null,"2019","33712","Household and institutional furniture manufacturing","33","806","28427","50",
"0400000US50","Vermont",null,"2019","337122","Nonupholstered wood household furniture manufacturing","28","787","27818","50",
"0400000US50","Vermont",null,"2019","33721","Office furniture (including fixtures) manufacturing","8","133","7444","50",
"0400000US50","Vermont",null,"2019","337212","Custom architectural woodwork and millwork manufacturing","6","76","5328","50",
"0400000US50","Vermont",null,"2019","339","Miscellaneous manufacturing","85","2215","134800","50",
"0400000US50","Vermont",null,"2019","339113","Surgical appliance and supplies manufacturing","4","254","10851","50",
"0400000US50","Vermont",null,"2019","3391","Medical equipment and supplies manufacturing","18","713","37964","50",
"0400000US50","Vermont",null,"2019","33911","Medical equipment and supplies manufacturing","18","713","37964","50",
"0400000US50","Vermont",null,"2019","339112","Surgical and medical instrument manufacturing","5","416","26002","50",
"0400000US50","Vermont",null,"2019","339116","Dental laboratories","8","40","869","50",
"0400000US50","Vermont",null,"2019","3399","Other miscellaneous manufacturing","67","1502","96836","50",
"0400000US50","Vermont",null,"2019","339920","Sporting and athletic goods manufacturing","13","915","67451","50",
"0400000US50","Vermont",null,"2019","33991","Jewelry and silverware manufacturing","13","183","5844","50",
"0400000US50","Vermont",null,"2019","339910","Jewelry and silverware manufacturing","13","183","5844","50",
"0400000US50","Vermont",null,"2019","33992","Sporting and athletic goods manufacturing","13","915","67451","50",
"0400000US50","Vermont",null,"2019","33993","Doll, toy, and game manufacturing","7","43","1991","50",
"0400000US50","Vermont",null,"2019","339930","Doll, toy, and game manufacturing","7","43","1991","50",
"0400000US50","Vermont",null,"2019","33995","Sign manufacturing","10","65","2465","50",
"0400000US50","Vermont",null,"2019","339950","Sign manufacturing","10","65","2465","50",
"0400000US50","Vermont",null,"2019","33999","All other miscellaneous manufacturing","23","295","19012","50",
"0400000US50","Vermont",null,"2019","339999","All other miscellaneous manufacturing","6","53","1921","50",
"0400000US50","Vermont",null,"2019","339991","Gasket, packing, and sealing device manufacturing","3","173","13968","50",
"0400000US50","Vermont",null,"2019","339992","Musical instrument manufacturing","8","26","747","50",
"0400000US50","Vermont",null,"2019","339994","Broom, brush, and mop manufacturing","3","22","1233","50",
"0400000US50","Vermont",null,"2019","42","Wholesale trade","752","10957","668029","50",
"0400000US50","Vermont",null,"2019","423130","Tire and tube merchant wholesalers","6","192","10824","50",
"0400000US50","Vermont",null,"2019","423","Merchant wholesalers, durable goods","444","4552","269559","50",
"0400000US50","Vermont",null,"2019","4231","Motor vehicle and motor vehicle parts and supplies merchant wholesalers","59","777","39089","50",
"0400000US50","Vermont",null,"2019","42311","Automobile and other motor vehicle merchant wholesalers","13","266","15298","50",
"0400000US50","Vermont",null,"2019","423110","Automobile and other motor vehicle merchant wholesalers","13","266","15298","50",
"0400000US50","Vermont",null,"2019","42312","Motor vehicle supplies and new parts merchant wholesalers","37","271","9883","50",
"0400000US50","Vermont",null,"2019","423120","Motor vehicle supplies and new parts merchant wholesalers","37","271","9883","50",
"0400000US50","Vermont",null,"2019","42313","Tire and tube merchant wholesalers","6","192","10824","50",
"0400000US50","Vermont",null,"2019","42314","Motor vehicle parts (used) merchant wholesalers","3","48","3084","50",
"0400000US50","Vermont",null,"2019","423140","Motor vehicle parts (used) merchant wholesalers","3","48","3084","50",
"0400000US50","Vermont",null,"2019","4232","Furniture and home furnishing merchant wholesalers","15","228","10833","50",
"0400000US50","Vermont",null,"2019","42321","Furniture merchant wholesalers","8","140","6963","50",
"0400000US50","Vermont",null,"2019","423210","Furniture merchant wholesalers","8","140","6963","50",
"0400000US50","Vermont",null,"2019","42322","Home furnishing merchant wholesalers","7","88","3870","50",
"0400000US50","Vermont",null,"2019","423310","Lumber, plywood, millwork, and wood panel merchant wholesalers","17","125","7328","50",
"0400000US50","Vermont",null,"2019","423220","Home furnishing merchant wholesalers","7","88","3870","50",
"0400000US50","Vermont",null,"2019","4233","Lumber and other construction materials merchant wholesalers","41","342","20104","50",
"0400000US50","Vermont",null,"2019","42331","Lumber, plywood, millwork, and wood panel merchant wholesalers","17","125","7328","50",
"0400000US50","Vermont",null,"2019","423330","Roofing, siding, and insulation material merchant wholesalers","11","99","5929","50",
"0400000US50","Vermont",null,"2019","42332","Brick, stone, and related construction material merchant wholesalers","11","81","5004","50",
"0400000US50","Vermont",null,"2019","423320","Brick, stone, and related construction material merchant wholesalers","11","81","5004","50",
"0400000US50","Vermont",null,"2019","42333","Roofing, siding, and insulation material merchant wholesalers","11","99","5929","50",
"0400000US50","Vermont",null,"2019","4234","Professional and commercial equipment and supplies merchant wholesalers","59","523","35540","50",
"0400000US50","Vermont",null,"2019","423430","Computer and computer peripheral equipment and software merchant wholesalers","14","166","14098","50",
"0400000US50","Vermont",null,"2019","42342","Office equipment merchant wholesalers","19","160","6351","50",
"0400000US50","Vermont",null,"2019","423420","Office equipment merchant wholesalers","19","160","6351","50",
"0400000US50","Vermont",null,"2019","42343","Computer and computer peripheral equipment and software merchant wholesalers","14","166","14098","50",
"0400000US50","Vermont",null,"2019","42344","Other commercial equipment merchant wholesalers","5","33","1603","50",
"0400000US50","Vermont",null,"2019","423440","Other commercial equipment merchant wholesalers","5","33","1603","50",
"0400000US50","Vermont",null,"2019","42345","Medical, dental, and hospital equipment and supplies merchant wholesalers","13","118","10809","50",
"0400000US50","Vermont",null,"2019","4235","Metal and mineral (except petroleum) merchant wholesalers","12","260","12517","50",
"0400000US50","Vermont",null,"2019","423450","Medical, dental, and hospital equipment and supplies merchant wholesalers","13","118","10809","50",
"0400000US50","Vermont",null,"2019","42349","Other professional equipment and supplies merchant wholesalers","6","19","831","50",
"0400000US50","Vermont",null,"2019","423490","Other professional equipment and supplies merchant wholesalers","6","19","831","50",
"0400000US50","Vermont",null,"2019","42351","Metal service centers and other metal merchant wholesalers","12","260","12517","50",
"0400000US50","Vermont",null,"2019","423510","Metal service centers and other metal merchant wholesalers","12","260","12517","50",
"0400000US50","Vermont",null,"2019","42369","Other electronic parts and equipment merchant wholesalers","9","36","7464","50",
"0400000US50","Vermont",null,"2019","4236","Household appliances and electrical and electronic goods merchant wholesalers","51","402","28636","50",
"0400000US50","Vermont",null,"2019","42361","Electrical apparatus and equipment, wiring supplies, and related equipment merchant wholesalers","37","342","19783","50",
"0400000US50","Vermont",null,"2019","423610","Electrical apparatus and equipment, wiring supplies, and related equipment merchant wholesalers","37","342","19783","50",
"0400000US50","Vermont",null,"2019","42362","Household appliances, electric housewares, and consumer electronics merchant wholesalers ","5","24","1389","50",
"0400000US50","Vermont",null,"2019","423620","Household appliances, electric housewares, and consumer electronics merchant wholesalers ","5","24","1389","50",
"0400000US50","Vermont",null,"2019","423690","Other electronic parts and equipment merchant wholesalers","9","36","7464","50",
"0400000US50","Vermont",null,"2019","4237","Hardware, plumbing and heating equipment and supplies merchant wholesalers","36","251","15114","50",
"0400000US50","Vermont",null,"2019","42371","Hardware merchant wholesalers","6","29","2180","50",
"0400000US50","Vermont",null,"2019","423710","Hardware merchant wholesalers","6","29","2180","50",
"0400000US50","Vermont",null,"2019","423730","Warm air heating and air-conditioning equipment and supplies merchant wholesalers","10","40","2316","50",
"0400000US50","Vermont",null,"2019","42372","Plumbing and heating equipment and supplies (hydronics) merchant wholesalers","20","182","10618","50",
"0400000US50","Vermont",null,"2019","423720","Plumbing and heating equipment and supplies (hydronics) merchant wholesalers","20","182","10618","50",
"0400000US50","Vermont",null,"2019","42373","Warm air heating and air-conditioning equipment and supplies merchant wholesalers","10","40","2316","50",
"0400000US50","Vermont",null,"2019","42383","Industrial machinery and equipment merchant wholesalers","38","365","26084","50",
"0400000US50","Vermont",null,"2019","4238","Machinery, equipment, and supplies merchant wholesalers","101","990","64101","50",
"0400000US50","Vermont",null,"2019","42381","Construction and mining (except oil well) machinery and equipment merchant wholesalers","12","153","10164","50",
"0400000US50","Vermont",null,"2019","423810","Construction and mining (except oil well) machinery and equipment merchant wholesalers","12","153","10164","50",
"0400000US50","Vermont",null,"2019","42382","Farm and garden machinery and equipment merchant wholesalers","29","259","13146","50",
"0400000US50","Vermont",null,"2019","423820","Farm and garden machinery and equipment merchant wholesalers","29","259","13146","50",
"0400000US50","Vermont",null,"2019","42385","Service establishment equipment and supplies merchant wholesalers","7","79","3963","50",
"0400000US50","Vermont",null,"2019","423830","Industrial machinery and equipment merchant wholesalers","38","365","26084","50",
"0400000US50","Vermont",null,"2019","42384","Industrial supplies merchant wholesalers","12","82","4340","50",
"0400000US50","Vermont",null,"2019","423840","Industrial supplies merchant wholesalers","12","82","4340","50",
"0400000US50","Vermont",null,"2019","423850","Service establishment equipment and supplies merchant wholesalers","7","79","3963","50",
"0400000US50","Vermont",null,"2019","42386","Transportation equipment and supplies (except motor vehicle) merchant wholesalers","3","52","6404","50",
"0400000US50","Vermont",null,"2019","423860","Transportation equipment and supplies (except motor vehicle) merchant wholesalers","3","52","6404","50",
"0400000US50","Vermont",null,"2019","4239","Miscellaneous durable goods merchant wholesalers","70","779","43625","50",
"0400000US50","Vermont",null,"2019","423930","Recyclable material merchant wholesalers","10","71","2764","50",
"0400000US50","Vermont",null,"2019","42391","Sporting and recreational goods and supplies merchant wholesalers","16","264","17980","50",
"0400000US50","Vermont",null,"2019","423910","Sporting and recreational goods and supplies merchant wholesalers","16","264","17980","50",
"0400000US50","Vermont",null,"2019","42392","Toy and hobby goods and supplies merchant wholesalers","8","97","4502","50",
"0400000US50","Vermont",null,"2019","423920","Toy and hobby goods and supplies merchant wholesalers","8","97","4502","50",
"0400000US50","Vermont",null,"2019","42393","Recyclable material merchant wholesalers","10","71","2764","50",
"0400000US50","Vermont",null,"2019","42394","Jewelry, watch, precious stone, and precious metal merchant wholesalers","7","24","684","50",
"0400000US50","Vermont",null,"2019","423940","Jewelry, watch, precious stone, and precious metal merchant wholesalers","7","24","684","50",
"0400000US50","Vermont",null,"2019","42399","Other miscellaneous durable goods merchant wholesalers","29","323","17695","50",
"0400000US50","Vermont",null,"2019","423990","Other miscellaneous durable goods merchant wholesalers","29","323","17695","50",
"0400000US50","Vermont",null,"2019","424130","Industrial and personal service paper merchant wholesalers","4","74","3260","50",
"0400000US50","Vermont",null,"2019","424","Merchant wholesalers, nondurable goods","250","6178","380269","50",
"0400000US50","Vermont",null,"2019","4241","Paper and paper product merchant wholesalers","12","196","10423","50",
"0400000US50","Vermont",null,"2019","42412","Stationery and office supplies merchant wholesalers","7","118","6980","50",
"0400000US50","Vermont",null,"2019","424120","Stationery and office supplies merchant wholesalers","7","118","6980","50",
"0400000US50","Vermont",null,"2019","42413","Industrial and personal service paper merchant wholesalers","4","74","3260","50",
"0400000US50","Vermont",null,"2019","4242","Drugs and druggists' sundries merchant wholesalers","23","712","74579","50",
"0400000US50","Vermont",null,"2019","42421","Drugs and druggists' sundries merchant wholesalers","23","712","74579","50",
"0400000US50","Vermont",null,"2019","424210","Drugs and druggists' sundries merchant wholesalers","23","712","74579","50",
"0400000US50","Vermont",null,"2019","42433","Women's, children's, and infants' clothing and accessories merchant wholesalers","14","305","17239","50",
"0400000US50","Vermont",null,"2019","4243","Apparel, piece goods, and notions merchant wholesalers","24","766","35912","50",
"0400000US50","Vermont",null,"2019","42432","Men's and boys' clothing and furnishings merchant wholesalers","8","436","18168","50",
"0400000US50","Vermont",null,"2019","424320","Men's and boys' clothing and furnishings merchant wholesalers","8","436","18168","50",
"0400000US50","Vermont",null,"2019","424330","Women's, children's, and infants' clothing and accessories merchant wholesalers","14","305","17239","50",
"0400000US50","Vermont",null,"2019","42442","Packaged frozen food merchant wholesalers","6","452","21694","50",
"0400000US50","Vermont",null,"2019","4244","Grocery and related product merchant wholesalers","83","2521","142651","50",
"0400000US50","Vermont",null,"2019","42441","General line grocery merchant wholesalers","10","197","13810","50",
"0400000US50","Vermont",null,"2019","424410","General line grocery merchant wholesalers","10","197","13810","50",
"0400000US50","Vermont",null,"2019","424420","Packaged frozen food merchant wholesalers","6","452","21694","50",
