"city","facebook","latitude","longitude","name","state","street","tags","twitter","type","website","zip"
"Chaseburg","","43.7134959","-91.1102715","Adoni Arces Family Farm LLC ","WI","S387 Korthals Ln. ","eggs fresh-fruits poultry fowl red-meat non-poultry-meat","","farm","","45621"
"Wisconsin Rapids","https://www.facebook.com/altenburgsfarm","44.419143","-89.738168","Altenburg's Country Gardens LLC","WI","7020 Plover Rd (Hwy. 54 E)","canned preserved fresh-fruits fresh-vegetables maple-products prepared-foods","","farm","http://www.altenburgsfarm.com/","54494"
"DePere","https://www.facebook.com/pages/Apple-Valley-Orchard/117313941615608","44.378637","-88.092893","Apple Valley Orchard LLC","WI","1670 Mar-El Road","baked-goods canned preserved crafts woodworking fresh-fruits juices ciders soap body-care","","farm","AppleValleyLLC.com","54115"
"Cross Plains","upickappleberryfarm.com","43.0421176","-89.6159386","Appleberry Farm LLC","WI","8079 Maurer Road","baked-goods canned preserved crafts woodworking cut-flowers eggs fresh-fruits fresh-vegetables honey juices ciders maple-products prepared-foods soap body-care","","farm","theappleberryfarm.com","53528"
"Campbellsport","https://www.facebook.com/pages/Armstrong-Apples-Orchard-and-Winery/103621803066115","43.707108","-88.199707","Armstrong Apples LLC","WI","W853 County Road B","baked-goods canned preserved dairy products fresh-fruits honey juices ciders soap body-care wine spirits beer hard-cider","","farm","Armstrongapples.com","53010"
"Shell Lake","","45.764247","-91.913566","Bashaw Valley Farm & Greenhouse","WI","W7402 Fox Trail Rd.","bedding plants canned preserved eggs fresh-fruits honey maple-products nursery-stock red-meat non-poultry-meat","","farm","bashawvalley@gmail.com","54871"
"lena ","https://www.facebook.com/Behnkes-Grass-Fed-Beef-And-Pasture-Pork-250614411763880/?fref=ts&ref=br_tf","44.999195","-87.980007","Behnkes Grass Fed Beef & Pasture Pork","WI","4420 Behnke rd","canned preserved fresh-vegetables poultry fowl red-meat non-poultry-meat wild-harvested forest-products","","farm","","54139"
"New Richmond","","45.1486124","-92.3841138","Blue Gentian Farm","WI","1990 Hwy 46","eggs red-meat non-poultry-meat","https://www.twitter.com/bgfarmboy","farm","","54017"
"River Falls","https://www.facebook.com/WIFarmFreshAtlas","44.895888","-92.709957","Blue Ridge Growers Orchard Nursery","WI","246 Carlson Lane","canned preserved crafts woodworking fresh-fruits soap body-care","","farm","www.facebook.com/WIFarmFreshAtlas","54022"
"Bear Creek","","44.5884040","-88.6909960","Blueberry Haven LLC","WI","W9967 County  Road XX","canned preserved fresh-fruits","","farm","BLUEBERRYHAVEN.NET","54922"
"Prescott ","Borner Farm Project","44.751793","-92.789672","Borner Farm Project","WI","1266 Walnut St","baked-goods bedding plants canned preserved cut-flowers eggs fresh-fruits maple-products prepared-foods","","farm","bornerfarmproject.com","54021"
"Clear Lake","http://www.facebook.com/BullBrookKeep","45.2822048","-92.3202280","Bull Brook Keep","WI","765 50th Avenue","","twitter.com/BronxToBarn","farm","http://www.bullbrookkeep.com","54005"
"Fort Atkinson","https://www.facebook.com/busybarnsfarm","42.968651","-88.912620","Busy Barns Adventure Farm LLC","WI","W7675 US Hwy 12","honey prepared-foods","https://twitter.com/busybarnsfarm","farm","https://www.busybarnsfarm.com","53538"
"Elk Mound","","44.872124","-91.677786","Chippewa Valley Produce","WI","E9321 395th Ave","fresh-fruits fresh-vegetables","","farm","","54739"
"Colgate","https://www.facebook.com/CopperKettleFarm","43.1930480","-88.3134342","Copper Kettle Farm LLC","WI","5576 County Road Q","","https://www.twitter.com/copperkfarm","farm","http://www.copperkfarm.com","53017"
"Cochrane","","44.328264","-91.683419","Cowsmo, Inc.","WI","S1843 County Road U","","","farm","www.cowsmocompost.com","54622"
"Westby","https://www.facebook.com/DeepRootedWestby","43.653914","-90.805682","Deep Rooted","WI","E8975 E. Ridge Road","bedding plants canned preserved herbs fresh-vegetables","","farm","http://www.deeprootedorganics.com/","54667"
"Blanchardville","","42.7899850","-89.7915410","Dorothy's Grange LLC","WI","W8707 Sawmill Rd","cut-flowers herbs fresh-vegetables red-meat non-poultry-meat","","farm","dorothysgrange.com","53516"
"Mukwonago","","42.841521","-88.3444","Elegant Farmer","WI","1545 Main Street","","","farm","","53149"
"Leopolis","https://www.facebook.com/elevenmranch","44.778915","-88.873415","ElevenM Ranch","WI","W12426 Paiser Ln","poultry fowl","","farm","elevenmranch.com","54948"
"Fall River","https://www.facebook.com/pages/Englewood-Grass-fed-Beef/102825246458689","43.428831","-89.068339","Englewood Grass-Fed Beef","WI","W1414 County Rd. Z","red-meat non-poultry-meat","","farm","","53932"
"Waukesha","https://www.facebook.com/pages/Field-To-Fork-Farms/444165995616374?ref=hl","43.0159300","-88.1850680","Field to Fork Farm and Market","WI","1500 S Springdale Road","cut-flowers eggs herbs fresh-vegetables poultry fowl red-meat non-poultry-meat","","farm","www.fieldtoforkfarms.com","53186"
"Gilman","Futility Farms","45.216076","-90.795837","Futility Farms LLC","WI","N5100 Webster Lane","poultry fowl red-meat non-poultry-meat","","farm","http://www.futilityfarms.com/","54433"
"Amery","https://www.facebook.com/pages/Glenna-Farms/52322147733?ref=hl","45.397467","-92.408597","Glenna Farms Country Store & Sugarhouse","WI","1333 - 120th Street","canned preserved coffee tea crafts woodworking dairy products fresh-vegetables honey maple-products wine spirits beer hard-cider","https://twitter.com/GlennaFarms1","farm","http://glennafarms.com/","54001"
"Kiel","Golden Bear Farm","43.914557","-87.981956","Golden Bear Farm","WI","15115 Lax Chapel Rd.","red-meat non-poultry-meat","","farm","www.goldenbearfarm.com","53042"
"Osseo","","44.4903959","-91.2514078","Golden Hills Buffalo Farm","WI","N44867 County Road E","poultry fowl","","farm","","54758"
"Milladore","https://www.facebook.com/pages/Good-Earth-Farms/176806359091394","44.6255150","-89.9088330","Good Earth Farms","WI","10431 Mayflower Road","poultry fowl","","farm","www.goodearthfarms.com","54454"
"Humbird","https://www.facebook.com/GrampaGlennsCertifiedOrganicStrawberries","44.528060","-90.884823","Grampa Glenns Organic Strawberries Glennenn Farm","WI","W11280 County Road B","honey","","farm","www.grampaglennsorganicstrawberries.com","54746"
"Edgerton","","42.861329","-89.140436","Harried U-Pick-Umm Farm LLC.","WI","173 County Road N","fresh-fruits poultry fowl","","farm","www.facebook.com/pages/Harried-U-Pick-Umm-Farm/142386852440308","53534"
"Chilton","","43.995193","-88.311825","Heritage Orchard LLC","WI","N 2963 Lakeshore Dr","baked-goods canned preserved crafts woodworking fresh-fruits fresh-vegetables honey juices ciders maple-products nuts prepared-foods soap body-care","","farm","www.heritageorchard.net","53014"
"Bayfield","https://www.facebook.com/pages/Highland-Valley-Farm/117845948235187","46.832896","-90.867633","Highland Valley Farm Inc.","WI","87080 Valley Rd","fresh-fruits honey maple-products","","farm","http://www.bayfieldblues.com/index.html","54814"
"St. Cloud","https://www.facebook.com/HolylandBerries","43.8853530","-88.2058260","Holyland Berries Farm","WI","N9488 Rte G","fresh-fruits fresh-vegetables","","farm","","53079"
"North Prairie","https://www.facebook.com/pages/Kipp-Farms-Country-Market-LLC/274280116083169?fref=ts","42.945864","-88.404992","Kipp Farms and Country Market LLC","WI","w329s5402 county rd E","bedding plants eggs fresh-vegetables honey red-meat non-poultry-meat soap body-care","","farm","www.kippfarms.com","53153"
"Nekoosa","https://www.facebook.com/lotisalpacas?ref=ts&fref=ts","44.2665210","-89.8530470","Lotis Alpacas","WI","704 Hillcrest Avenue","crafts woodworking","","farm","www.lotisalpacas.com","54457"
"Bloomer","https://www.facebook.com/pages/Macs-Berry-Farm-Bloomer-Wisconsin/128131573868102","45.025737","-91.462292","Macs Berry Farm","WI","10439 130th Avenue","fresh-fruits fresh-vegetables maple-products","","farm","","54724"
"Cashton","https://www.facebook.com/pages/Maple-Ridge-Orchard/346451842039608","43.7993250","-90.8597170","Maple Ridge Orchard","WI","6675 Maple Ave","baked-goods canned preserved crafts woodworking fresh-fruits maple-products","","farm","www.mapleridgeorchard.com","54619"
"Chilton","https://www.facebook.com/MeuerFarm,LLC","43.981162","-88.304602","Meuer Farm, LLC","WI","N2564  Highway 151","baked-goods canned preserved coffee tea eggs fresh-fruits fresh-vegetables grains flour honey juices ciders maple-products nuts poultry fowl prepared-foods soap body-care wine spirits beer hard-cider","","farm","www.meuerfarm.com","53014"
"Milton ","www.facebook.com/meyersfarmmarket","42.7604481","-89.0076937","Meyer's Farm Market","WI","1329 E M-H Townline Road","herbs fresh-fruits fresh-vegetables honey juices ciders","","farm","www.meyersfarmmarket.com","53563"
"Hayward","","45.983106","-91.467657","Northfork Ranch","WI","15455 W Kadlec Road","canned preserved herbs fresh-vegetables red-meat non-poultry-meat","","farm","","54843"
"Neenah","https://www.facebook.com/pages/Oakridge-Farms/80596262554","44.179237","-88.504904","Oakridge Farms","WI","125 County Road CB","fresh-fruits fresh-vegetables honey","https://twitter.com/oakridgeberries","farm","http://oakridgeberries.com/","54956"
"Belleville","","42.909700","-89.559045","Observatory Hill Farm LLC","WI","1017 Observatory Hill Rd.","red-meat non-poultry-meat","","farm","http://observatoryhillfarm.com/","53508"
"Cottage Grove","https://www.facebook.com/OffbeatAcresAlpacas","43.1471750","-89.1544170","Offbeat Acres","WI","5453 Pierceville Road","fresh-fruits fresh-vegetables","https://twitter.com/OffbeatAcres","farm","www.offbeatacres.com","53527"
"Franksville","https://www.facebook.com/orchardstore","42.828252","-88.070998","Old Homestead Orchard","WI","7814 Raynor Ave","canned preserved crafts woodworking cut-flowers eggs fresh-fruits fresh-vegetables honey juices ciders maple-products poultry fowl","","farm","","53126"
"Fall Creek","","44.690853","-91.261903","Out to Pasture Beef","WI","E13240 E Hillsdale Dr","maple-products red-meat non-poultry-meat","","farm","www.outtopasturebeef.com","54742"
"Amery","Brad Burke","45.259556","-92.427783","Pike Hole Family Farm","WI","359 130th Street","canned preserved herbs fresh-fruits fresh-vegetables","","farm","www.pikeholefarm.com","54001"
"Ripon","https://www.facebook.com/pinnacle.pastures?fref=ts","43.807534","-88.749112","Pinnacle Pastures","WI","W11780 County Road KK","red-meat non-poultry-meat","","farm","pinnaclepastures,com","54971"
"Pittsville","https://www.facebook.com/pittsvillefarmelk","44.4239469","-90.1252475","Pittsview Farm Elk","WI","4891 state hwy. 80","","","farm","http://pittsviewfarmelk.com/",""
"Bonduel","https://www.facebook.com/porterspatch.navarino?fref=ts","44.6115636","-88.4575537","Porter's Patch","WI","W4314 State Hwy 156","cut-flowers fresh-fruits fresh-vegetables","Porters Patch","farm","www.PortersPatch.com","54107"
"Dodgeville","","42.965061","-90.173814","Rockin Highlands","WI","3088 Survey Road","","","farm","https://RockinHighlands.com/","53533"
"Palmyra","","42.854952","-88.609618","Rushing Waters Fisheries, LLC","WI","N301 County Rd. H / PO Box H","canned preserved crafts woodworking dairy products fish seafood juices ciders maple-products pet-food prepared-foods red-meat non-poultry-meat wine spirits beer hard-cider","","farm","www.rushingwaters.net","53156"
"Columbus","https://www.facebook.com/pages/Sassy-Cow-Creamery/53518889031","43.282549","-89.211417","Sassy Cow Creamery","WI","W4192 Bristol Rd","baked-goods coffee tea dairy products grains flour honey maple-products nuts prepared-foods red-meat non-poultry-meat soap body-care","","farm","www.sassycowcreamery.com","53925"
"Viroqua","","43.5619804","-90.8784554","Schott Farm","WI","711 Railroad Avenue","red-meat non-poultry-meat","","farm","http://schottfarm.com/","54665"
"edgar","","44.920106","-89.949112","Scotch and Soda Acres","WI","4958 thomas hill rd","eggs honey poultry fowl","","farm","","54426"
"Bloomer","https://www.facebook.com/pages/Seibels-Organic-Meats-LLC/102229873169639","45.0691110","-91.4610330","Seibel's Organic Meats, LLC","WI","10494 157th ave","poultry fowl red-meat non-poultry-meat","","farm","https://sites.google.com/site/seibelsorganic/","54724"
"Janesville","www.facebook.com/skellysfarmmarket","42.641113","-89.080485","Skelly's Farm Market","WI","2713 Hayner Road","baked-goods canned preserved coffee tea fresh-fruits fresh-vegetables prepared-foods","http://twitter.com/skellysfarm","farm","www.skellysfarmmarket.com","53548"
"Jim Falls","https://m.facebook.com/SpringCreekMeats/?tsid=0.7024591669409054&source=result","45.135569","-91.253864","Spring Creek Meats","WI","21010 County Highway R","eggs fresh-vegetables poultry fowl red-meat non-poultry-meat","","farm","https://www.springcreekmeats.com/","54748"
"Kaukauna","http://www.facebook.com/starorchardllc","44.2494042","-88.1887477","Star Orchard, LLC","WI","253 County Road CE","canned preserved fresh-fruits honey","","farm","http://www.starorchard.com/","54130"
"Granton","https://www.facebook.com/pages/The-Maple-Dude/582639041784552","44.582582","-90.383979","Sternitzky Specialty Foods LLC / DBA The Maple Dude","WI","W1417 US HWY 10","dairy products honey maple-products prepared-foods red-meat non-poultry-meat","https://www.twitter.com/themapledude.com","farm","www.themapledude.com","54436"
"Wausau ","www.facebook.com/Sugarhillsugarbush","44.982007","-89.496442","Sugar Hill Sugar Bush LLC","WI","10108 Sugar Hill Lane","maple-products","","farm","www.sugarhillsugarbush.com","54403"
"Poynette","","43.426767","-89.402007","Sweet Wisconsin Honey Farm","WI","N4249 HWY 51","honey","","farm","","53955"
"East Troy","www.facebook.com/MichaelFieldsAgriculturalInstitute","42.7825894","-88.4248929","The Gardens @ Michael Fields","WI","W2493 Cty Rd ES","cut-flowers eggs herbs fresh-fruits fresh-vegetables","twitter.com/MichaelFieldsAg","farm","www.michaelfields.org","53120"
"Oconomowoc ","https://www.facebook.com/garlicug","43.1831070","-88.5051080","The Garlic Underground","WI","w383n9009 mill st","","","farm","http:/www.thegarlicunderground.com","53066"
"Westby","","43.707198","-90.870672","Timber Coulee Outfitters","WI","E7624 County Road P","pet-food","","farm","","54667"
"Prairie Du Sac","https://www.facebook.com/pages/Toms-Raspberries/597930213559027","43.307907","-89.680302","Toms Raspberries","WI","W13702 highway 60","fresh-fruits fresh-vegetables","","farm","sites.google.com/site/tomsraspberries/","53578"
"Waupaca","","44.352231","-89.184127","Turners Fresh Market & Greenhouse","WI","E208 State Highway 54","bedding plants canned preserved fresh-fruits fresh-vegetables soap body-care","","farm","www.turnersfreshmarket.com","54981"
"La Farge","https://www.facebook.com/UnderARockFarm","43.561362","-90.545937","Under A Rock Farm, LLC","WI","E14214 County Road D","bedding plants canned preserved crafts woodworking eggs herbs fresh-vegetables poultry fowl red-meat non-poultry-meat soap body-care wild-harvested forest-products","https://www.twitter.com/underarockfarm","farm","www.underarockfarm.com","54639"
"Blanchardville","","42.817160","-89.865292","Valhalla Hills LLC","WI","74 County Road F","canned preserved cut-flowers herbs fresh-fruits fresh-vegetables mushrooms soap body-care","","farm","","53516"
"Cottage Grove","https://www.facebook.com/pages/West-Star-Organics/77210898093?ref=hl","43.013389","-89.202571","West Star Organics","WI","2555 West Star Rd","bedding plants nursery-stock","https://twitter.com/WestStarFarm","farm","www.weststarfarm.com","53527"
"CALEDONIA","","42.8112760","-87.9729920","Wick Place Candles and Farm","WI","1907 43RD ST","canned preserved crafts woodworking eggs fresh-fruits fresh-vegetables honey maple-products poultry fowl","","farm","wickplacefarm.com","53108"
"Two Rivers","@WilfertFarms.WI","44.189762","-87.650674","Wilfert Farms, LLC","WI","7528 Manitou Dr","fresh-fruits fresh-vegetables","","farm","www.wilfertfarms.com","54241"
"Albany","www.facebook.com/windyfleecefarm","42.769865","-89.425043","Windy Fleece Farm","WI","W1237 Brooklyn Albany Rd","poultry fowl red-meat non-poultry-meat soap body-care","","farm","www.windyfleecefarm.com","53502"
"Rio","","43.3996300","-89.2718330","Yorkshire Rose Farm","WI","W5416 King Road","","","farm","","53960"
"Antigo","Antigo Farmers Market, Inc","45.138703","-89.149850","Antigo Farmers Market, Inc.","WI","420 Field Street","baked goods crafts flowers eggs herbs vegetables honey jams maple meat plants poultry soap beans fruits juices mushrooms wild","","market","http://www.antigomarket.com","54409"
"Appleton","www.facebook.com/downtownappletonfarmmarket","44.26201","-88.40703","Appleton Downtown Farm Market","WI","100 College Avenue","organic baked goods cheese crafts flowers eggs seafood herbs vegetables honey jams maple meat nuts plants poultry prepared-foods soap trees coffee fruits grains juices mushrooms pet food","","market","http://www.appletondowntown.org","54911"
"Baldwin","https://www.facebook.com/BaldwinsMainStFarmersMarket/","44.966999","-92.370763","Baldwin's Main St. Farmers Market","WI","Main St. and 6th Ave.","organic baked goods flowers eggs herbs vegetables honey jams maple meat plants poultry soap fruits mushrooms","","market","https://www.villageofbaldwin.com/community/page/main-st-farmers-market","54002"
"Bruce","Bruce Community Farmers Market","45.4551101","-91.2746971","Bruce Community Farmers Market","WI","Corner of Hwy 8 and N Alvey Street","baked goods cheese crafts flowers eggs herbs vegetables honey jams maple meat poultry prepared-foods soap coffee fruits mushrooms wild","","market","","54819"
"Caledonia","https://www.facebook.com/EatLocalRacine/","42.769605","-87.822883","Caledonia Outdoor Market","WI","3920 N Greenbay Rd","baked goods crafts flowers vegetables honey jams maple plants prepared-foods soap fruits","","market","","53404"
"Chippewa Falls","","44.934888","-91.389337","Chippewa Falls Farmers Market","WI","1 S. Bridge Street","baked goods cheese flowers eggs herbs vegetables honey jams maple meat poultry prepared-foods fruits","","market","http://www.chippewafallsmainst.org/Farmers_Market.html","54729"
"Barron","","45.443768","-91.828516","Country Lane Farmers Market","WI","1642 16th St","organic baked goods cheese crafts flowers eggs seafood herbs vegetables honey jams maple meat plants poultry prepared-foods soap trees coffee fruits grains mushrooms wild","","market","http://www.countrylanemarket.com/farmers-market","54812"
"Darlington ","","42.677666","-90.117445","Darlington Farmers Market","WI","Main Street","baked goods crafts flowers eggs vegetables honey jams maple plants soap","","market","","53530"
"DeForest","https://www.facebook.com/deforestmarket/","43.246672","-89.339846","DeForest Farmers' Market","WI","DeForest Street","organic baked goods cheese crafts flowers eggs herbs vegetables honey jams maple meat plants poultry prepared-foods soap trees fruits mushrooms","","market","http://www.vi.deforest.wi.us/index.asp?Type=B_BASIC&SEC={38A90127-1135-4F1B-99D2-5AC8EE5AF484}","53532"
"Dodgeville","https://www.facebook.com/dodgevillefarmersmarket","42.962345","-90.129944","Dodgeville Farmers Market","WI","327 N. Iowa Street","baked goods cheese crafts flowers eggs vegetables honey jams meat plants poultry soap coffee fruits","","market","","53533"
"Dousman","https://www.facebook.com/DousmanFarmersMarket","43.0131210","-88.4725142","Dousman Farmers Market","WI","118 S. Main St","baked goods crafts flowers herbs vegetables honey jams plants prepared-foods soap coffee fruits wild","","market","http://www.dousmanchamber.org/farmers_market.html","53118"
"Beloit","https://www.facebook.com/BeloitFarmersMarket?ref=hl","42.499698","-89.035555","Downtown Beloit Farmer's Market","WI","300 block of State Street, 400 block of East Grand Avenue, Gantry parking lot","organic baked goods cheese crafts flowers eggs seafood herbs vegetables honey jams maple meat nuts plants poultry prepared-foods soap trees wine coffee beans fruits grains juices mushrooms pet food wild","","market","http://www.downtownbeloit.com","53511"
"Fond du Lac","https://www.facebook.com/FondDuLacFarmersMarket/","43.775364","-88.446973","Downtown Fond du Lac Farmers Market - Saturday","WI","Main Street from Western Ave. to Sheboygan St.","baked goods cheese crafts flowers eggs seafood herbs vegetables honey jams maple meat plants poultry prepared-foods soap trees coffee beans fruits grains juices mushrooms pet food","","market","http://downtownfdl.com/farmers-market.html","54935"
"Fond du Lac","https://www.facebook.com/FondDuLacFarmersMarket/","43.777853","-88.447092","Downtown Fond du Lac Farmers Market - Wednesday","WI","Main Street Plaza ","baked goods crafts flowers eggs vegetables honey jams maple meat plants poultry prepared-foods coffee beans fruits grains","","market","http://downtownfdl.com/farmers-market.html","54935"
"Green Bay","facebook.com/downtowngreenbay","44.513118","-88.017128","Downtown Green Bay Saturday Farmers Market","WI","200 S. Washington Street","organic baked goods cheese crafts flowers eggs seafood herbs vegetables honey jams maple meat plants poultry prepared-foods soap coffee fruits juices mushrooms pet food","twitter.com/downtowngb","market","https://downtowngreenbay.com/explore/downtown-events/saturday-farmers-market","54301"
"Egg Harbor","https://www.facebook.com/pg/EggHarborDoorCounty/events/?ref=page_internal","45.049942","-87.280716","Egg Harbor Farmers Market","WI","7809 Highway 42","baked goods crafts herbs vegetables jams plants soap coffee fruits","","market","http://www.eggharbordoorcounty.org/events/farmers-market/","54209"
"Fish Creek","","45.113436","-87.245350","Fish Creek Settlement Shops Farm Market","WI","9116 Hwy 42","organic baked goods crafts flowers herbs vegetables honey jams plants soap trees fruits","","market","http://settlementshops.com","54212"
"Milwaukee","www.facebook.com/fondymarket/","43.061843","-87.939701","Fondy Farmers Market","WI","2200 W Fond du Lac Ave","baked goods crafts flowers eggs herbs vegetables honey jams plants poultry prepared-foods soap coffee fruits juices","www.twitter.com/fondymarket","market","http://www.fondymarket.org","53206"
"Barron","fb.me/generalstoremarket ","45.402192","-91.844351","General Store Market ","WI","1327 S. 18th Street","baked goods cheese crafts flowers eggs herbs vegetables honey jams maple prepared-foods soap coffee fruits juices mushrooms wild","","market","","54812"
"Black River Falls ","https://www.facebook.com/brf.wi/","44.291599","-90.862319","Jackson County Farmers Market","WI","Diploma Drive","organic baked goods cheese crafts flowers eggs herbs vegetables honey jams maple meat poultry soap fruits","","market","http://www.jcfarmmarket.org/","54615"
"Jackson","Lammscapes","43.309792","-88.171891","Jackson Food & Farm Market","WI","2708 Sherman Rd","baked goods cheese crafts flowers eggs herbs vegetables honey jams maple meat plants poultry prepared-foods soap trees fruits","Lammscapes","market","http://www.lammscape.com","53037"
"Janesville ","https://www.facebook.com/pages/Janesville-Farmers-Market-Inc/212710452079344","42.681669","-89.023298","Janesville Farmers Market, Inc.","WI","Town Square, Downtown Janesville","organic baked goods cheese crafts flowers eggs herbs vegetables honey jams maple meat plants poultry prepared-foods soap trees coffee fruits juices mushrooms","https://twitter.com/jnsvlfarmmkt","market","http://janesvillefarmersmarket.com/jfm/","53545"
"Kenosha","www.facebook.com/KenoshaPublicMarket","42.587189","-87.819902","Kenosha Public Market","WI","Outdoor Summer Market 625 52nd Street- Indoor Winter Market 625 57th Street","baked goods cheese crafts flowers eggs seafood herbs vegetables honey jams maple meat nuts poultry prepared-foods soap wine coffee fruits juices mushrooms pet food tofu wild","","market","https://www.KenoshaPublicMarket.com","53140"
"Kenosha","www.facebook.com/KenoshaPublicMarkets","42.587205","-87.819945","Kenosha Public Market - Summer Outdoor","WI","625 52nd Street","baked goods cheese crafts flowers eggs seafood herbs vegetables honey jams maple meat nuts plants poultry prepared-foods soap trees wine coffee fruits grains juices mushrooms pet food tofu wild","","market","http://www.KenoshaPublicMarkets.com","53140"
"Kenosha","www.facebook.com/KenoshaPublicMarkets","42.584009","-87.819183","Kenosha Public Market - Winter Indoor ","WI","625 57th Street","baked goods cheese crafts flowers eggs seafood herbs vegetables honey jams maple meat nuts poultry prepared-foods soap wine coffee fruits grains juices mushrooms pet food tofu wild","","market","http://www.KenoshaPublicMarkets.com","53140"
"Madison","www.facebook.com/MADWestFM","43.066326","-89.502026","MADWest Winter Farmers' Market","WI","55 South Gammon Road","organic baked goods cheese crafts eggs seafood vegetables honey jams maple meat poultry prepared-foods coffee beans fruits grains mushrooms","","market","","53717"
"Marinette ","https://www.facebook.com/MenomineeFarmersMarket","45.098174","-87.628231","Marinette Artisan & Farm Market","WI","1607 Main Street","organic baked goods crafts herbs vegetables honey fruits mushrooms","","market","http://www.menomineefarmersmarket.com/","54143"
"Oshkosh","Oshkosh Farmers Markets","44.0053166","-88.5575090","Market in the Park","WI","W South Park Ave & Georgia St","organic baked goods cheese crafts eggs herbs vegetables honey jams maple meat poultry prepared-foods coffee fruits mushrooms","","market","http://www.OSFMI.com","54901"
